Intent,Sentence,Outlier
restaurant,i need to book a table at a place around here in pa for a party of two,False
restaurant,book a reservation for nine at an outdoor restaurant,False
movie,i d like to see the showtimes for silly movie 2 0 at the movie house,False
movie,find the movie schedule for national amusements,False
movie,is the divine jetta at marcus corporation,False
restaurant,book the fashion café for elevenses,False
movie,when is janeane from des moines playing at the nearest movie theatre ?,False
movie,when will the boys next door be playing at the nearest movie house,False
restaurant,book a restaurant in macedonia for 13 hours from now,False
movie,when s fools for luck showing?,False
restaurant,schedule the food truck to be at your place in the distant future,False
movie,show me a movie schedule,False
restaurant,book a bistro for 4 at sunset,False
restaurant,find a reservation at a brasserie restaurant nearby sc for a party of ten,False
restaurant,im looking to book a seat at a bakery that serves coleslaw at 19 44 58,False
movie,can i get the showtimes for fit for a king ?,False
movie,show me when scandalous john is playing,False
movie,what movies are showing in the neighbourhood,False
restaurant,book a table at carter house inn in saint bonaventure alaska,False
restaurant,book midday at a faraway cuban place for five at a top-rated bakery in grainola,False
restaurant,i want to eat ice cream at a brasserie with me and my mother in law,False
restaurant,book the slippery noodle inn in gober,False
movie,what are the movie times at the loews cineplex,False
movie,show me the movie schedules for santikos theatres,False
restaurant,id like to eat at a highly rated swiss restaurant in irma at two pm,False
restaurant,book a restaurant 163 days from now,False
restaurant,i need to book a table for claudia and imelda at a brasserie that is top-rated,False
movie,show me movie times at the pacific theatres for the movie the hot rock,False
restaurant,i need a restaurant that has internet access for a party of six,False
movie,find brandy in the wilderness,False
movie,i d like showtimes for the story of wish you were here,False
movie,find movie schedules for united paramount theatres,False
movie,what time is crush and blush playing at kerasotes theatres,False
movie,find the schedule for the devil diamond at a movie theatre,False
movie,find plitt theatres now showing poverty and nobility,False
movie,in the neighborhood find movie times for movies,False
restaurant,book me a table for five at the top-rated morocco restaurant,False
restaurant,book a table for 2 at a nearby restaurant,False
movie,find time for ace of the saddle,False
movie,find berlin to the samba beat,False
restaurant,make me a reservation at a popular place that serves udupi at a restaurant,False
movie,can i get the movie schedule for 8 a m ?,False
restaurant,make a reservation for 8 at a diner that serves haystack,False
restaurant,i need a table in the state of la for katina and josefina gray,False
movie,please show me the films playing at loews cineplex entertainment,False
restaurant,book a nearby northeast indian restaurant in north carolina for ten people at six am,False
movie,when is the next showing of star wars the clone wars ?,False
restaurant,book a restaurant not far in milladore for 6 people,False
movie,i want to watch animated movies at showcase cinemas,False
restaurant,book georgetown cupcake in keller for tea time,False
movie,are there any movies playing around here,False
restaurant,book a reservation for 1 on march 17,False
restaurant,i want top-rated veneto cuisine at a restaurant in antietam for 2,False
restaurant,need to book a reservtion for a restaurant in maryland for me and my half sister,False
movie,what time do the movies play at southern theatres ?,False
restaurant,book a brasserie,False
movie,what movies are playing one hour from now at cooper foundation ?,False
movie,movie times at consolidated theatres,False
movie,give me the movie schedule for the great escape theatres,False
restaurant,book a gluten free restaurant in arp,False
movie,check movie schedules and find which animated movies are being aired in the neighborhood movie halls,False
restaurant,make a reservation at a tavern which serves clam cake for a party of 8 in western sahara,False
movie,can i get the movie schedules for marcus corporation,False
movie,i d like to watch glass chin at the movie house at 17 32 30,False
movie,what movies are playing in the area,False
movie,what movie times start in 22 seconds at magic johnson theatres,False
movie,what s southern theatres movie schedule,False
restaurant,i need to book a table at bridge round house in south dakota for me emily and gena,False
movie,is rio belongs to us playing at the movie house closest to me,False
restaurant,book a spot for ten in ms,False
restaurant,please get me seating at the tavern in red lick michigan,False
restaurant,reserve a table for 3 people at the cubby bear in comoros,False
movie,when is have sword will travel playing at the closest movie theatre ?,False
movie,i d like a movie schedule for a close by movies,False
movie,when is up the yangtze playing at goodrich quality theaters,False
restaurant,can you make reservations at a tea house that serves fettucine ?,False
restaurant,book a spot for tommie and vera rogers in irvine at 7 am,False
movie,what movie times are harkins theatres,False
restaurant,book a reservation for six people at a churrascaria restaurant in cook islands one minute from now,False
restaurant,i need to reserve two seats to eat at in salina alabama,False
movie,find films in the neighborhood,False
movie,i d like to watch i wish at the nearest movie theatre,False
movie,find the swindlers at the closest movie house,False
restaurant,book a table at dillard house in exell ia,False
movie,i want to see some movies in a b&b theatres,False
restaurant,i need a reservation for a highly rated goiano restaurant in ar,False
movie,what time is rites of spring playing at marcus corporation,False
movie,find a movie house closest showing operation kingdom,False
restaurant,grab a table at a restaurant in minnesota that serves ice cream cake,False
restaurant,please reserve a table for five to get chicken fingers at a cafeteria in mexico,False
restaurant,book fast food that is highly rated,False
movie,what time is tasher desh playing at the nearest movie house,False
restaurant,i need a reservation for 3 at clinton street baking company & restaurant,False
movie,which films are playing at malco theatres ?,False
restaurant,book a spot for seven at a brasserie with ginestrata,False
restaurant,book a table for six at hubbell house in ne,False
movie,what time is ghostbusters - acchiappafantasmi playing at imax corporation,False
restaurant,i need a reservation for january 9 at a restaurant that serves souvlaki nearby cypress av for a party of 1,False
movie,show the movie schedule for 9 pm at cobb theatres,False
movie,i d like to watch the utopian society,False
movie,where is project a part ii playing?,False
restaurant,i need a reservation for three people at a spa restaurant in two hundred thirty seven days,False
restaurant,book a table in hallwood for one for supper,False
movie,show me the closest movie house playing an unfinished life at eight pm,False
restaurant,please book a bar type goiano room accommodate for 2 members 1 second from now in pr,False
movie,show me dombey and son movies,False
restaurant,make me a reservation for july the tenth at the nosh bar for a party of two,False
restaurant,i want to get reservations at a place close by for 6 people to eat in sc,False
movie,i m wondering what cinema is playing peters baby,False
restaurant,i need a reservation for maid-rite sandwich shop in home gardens,False
restaurant,book a taverna for me and jami,False
restaurant,please book reservations at a restaurant that serves empanada party for three with betty and dolly,False
restaurant,book at table at forest av restaurant close-by for 2 1 second from now,False
restaurant,i would like to book a restaurant for two in 42 weeks from now in wagram,False
movie,when is one by one playing?,False
movie,show me the films currently playing at the nearest movie theatre,False
movie,what is the amc theaters movie schedule ?,False
movie,can i get the showtimes for man in blues ?,False
movie,show movie schedules for fox theatres,False
movie,what animated movies are playing in the neighbourhood and when?,False
movie,i d like to see a movies at the nearest movie house,False
restaurant,book a spot for 1 at a south american restaurant,False
restaurant,book a bistro in new zealand in 119 and a half days,False
movie,i d like to watch sherlock holmes à new york at kb theatres,False
restaurant,book a pub in clermont for 8 people,False
restaurant,i want to book a restaurant near wyoming for 5 people,False
movie,find the movie schedules for nearby movies,False
restaurant,book me a table at the fat duck in ireland,False
movie,can you tell me the movie schedule for general cinema corporation ?,False
movie,find films in 12 hours at the nearest movie theatre,False
movie,i d like to watch movies at the nearest movie house,False
movie,when is just before nightfall playing?,False
restaurant,book a bakery that serves souvlaki for tomorrow,False
movie,find manthra mothiram at century theatres,False
restaurant,book me a tibetan restaurant for my boss and i,False
restaurant,id like to eat at a restaurant far from grantsburg,False
movie,when is for lovers only playing?,False
restaurant,need a table in serbia and montenegro on apr 16 for a party of seven,False
movie,whats the movie schedules for general cinema corporation,False
movie,what is the movie schedule near me?,False
restaurant,book a spot at a taverna for my cousin and i in burundi,False
restaurant,i need a reservation for the original house of pies with three people in plandome manor pa,False
movie,show the movie times,False
movie,what are the movie schedules at loews cineplex entertainment,False
movie,what movies can i see in the area ?,False
restaurant,book a table for eight this month in maldives,False
restaurant,book a restaurant for my baby and i in delaware,False
restaurant,i need a reservation for 02 53 at hotel arctic in state road,False
movie,what is the movie schedule at loews cineplex entertainment,False
movie,movie schedule at cinemark theatres,False
restaurant,book a popular bar in chowchilla,False
movie,find movie schedules in mjr theatres,False
restaurant,i want to take my parents and i to eat some romagna at a brasserie in north dakota,False
movie,is anti-semitism in the 21st century the resurgence playing now,False
restaurant,i need a table for four at a pub in heard island and mcdonald islands,False
movie,list movie times playing animated movies nearby,False
restaurant,restaurant in durant for 3 pm,False
movie,find a cinema nearest for films,False
restaurant,id like a table for three at black rapids roadhouse on february 24th 2039,False
restaurant,id like a table for six at the bakery in as,False
restaurant,book a table for 10 at a restaurant in federated states of micronesia,False
movie,movie schedule for animated movies in the neighborhood,False
movie,what time is 30 days of night playing?,False
movie,can you tell me the movies that are going to be scheduled at the closest movie house ?,False
restaurant,book a table near bienville for pioneer day,False
movie,when will the blonde ambition be playing,False
restaurant,book san francisco brewing company for two located at al,False
restaurant,book a restaurant for 9 at 00 37 pm,False
restaurant,i want to book dinner by heston blumenthal in al,False
movie,what movies are around here,False
movie,where is the nearest cinema playing compound fracture,False
movie,what day does the movie star of the circus play at ten pm,False
movie,show the movie schedule for cooper foundation at 9 o clock,False
restaurant,i need a booking for seven people at metropolitan museum of art,False
movie,find me the movie schedule for great escape theatres,False
movie,can i get the movie times for fox theatres ?,False
restaurant,book a reservation for leticia melva and twila edwards at glassy junction for five pm within the same area of our secondary residence,False
movie,please tell me the movie times,False
movie,is fighting with buffalo bill playing at the closest movie house,False
restaurant,book a table at top pot doughnuts in greensburg american samoa,False
restaurant,find a table close by in the downtown area for sherri and i,False
restaurant,i need a bakery that serves beef manhattan at midnight for nine,False
restaurant,book a bar with mediterranean food for three people,False
movie,what movie schedules at consolidated theatres,False
restaurant,i need a reservation in decaturville for six people,False
restaurant,i want to book a restaurant in the same area where i live in ma for ebony and yolanda,False
restaurant,id like to book a reservation for next spring for nine people at shore club,False
restaurant,book the last exit on brooklyn 5 hours from now for one person,False
movie,find the nearest movies at a movie theatre,False
restaurant,book a pub with a pool in white heath south carolina,False
movie,is young policemen in love at the local movie theatre,False
restaurant,book a table for nine people at a brasserie on jan 16 2034,False
movie,is the film goodrich quality theaters playing at 12 26 am ?,False
movie,what do the movie schedules at b&b theatres look like?,False
restaurant,book a reservation for a pub serving gateau in ms,False
movie,when can i see salaam-e-ishq a tribute to love at b&b theatres ?,False
movie,check the movie schedule for wanda group,False
movie,find the branded woman,False
restaurant,need book a restaurant for this autumn in illinois,False
restaurant,table for five at a restaurant in lavina,False
movie,i d like to watch take this waltz,False
restaurant,i need a table in west virginia for me and my baby at jacob wirth restaurant,False
restaurant,book a cafeteria for 5 in turkmenistan,False
movie,find the movie schedule for b&b theatres,False
restaurant,i want to go to that popular ethiopian restaurant,False
movie,what s the closest movie theatre showing harbour beat,False
restaurant,i need a reservation for a coffeehouse with nine people within the same area as midland park,False
movie,find me animated movies at amco entertainment tomorrow,False
restaurant,please book seating for one person at an indoor restaurant that serves breakfast in nicholasville tennessee,False
movie,what movies are playing at the nearest movie house,False
movie,find the movie schedule for arclight hollywood,False
restaurant,book a restaurant in anguilla for one at national coney island,False
movie,what time is the wanda group playing the honor of an outlaw,False
movie,can i get the movie schedules for speakeasy theaters ?,False
movie,fine movie schedules for speakeasy theaters,False
movie,what is the movie schedule for movies in the neighbourhood,False
restaurant,my step aunt and i want to go cheese fries at the tavern,False
movie,find goodrich quality theaters films,False
restaurant,book me a restaurant in guadeloupe,False
restaurant,book in ukraine at a highly rated restaurant,False
restaurant,find a table somewhere for me and my step mother in graniteville de,False
restaurant,book a pub that serves fries for 9 people,False
restaurant,i would like to book a restaurant within the same area as myrtle av for 6,False
restaurant,book a table for 10 in char no4 in colombia,False
movie,what are the movie times one second from now at the alamo drafthouse cinema,False
movie,is the cycle playing at consolidated theatres ?,False
movie,what movies are playing dickinson theatres,False
restaurant,book a spot at a crab restaurant,False
restaurant,book me best joint restaurant for 2 members at american samoa today,False
movie,find nearby movies,False
movie,is gods of metal playing,False
restaurant,im looking to reserve a table at a pasta restaurant in serbia,False
movie,what is the closest movie theatre that is playing animated movies,False
movie,show movie times of films close by,False
movie,what is the movie schedule for loews cineplex entertainment,False
restaurant,book a restaurant in nebraska on january 25 2034 for me and my mommy,False
movie,is these girls at the cinema,False
movie,where is the wilderness trail playing,False
restaurant,please get me a reservation at a restaurant with a pool for manuela and yvonne,False
movie,find movie times for movies in the neighbourhood,False
restaurant,i need a table for 5 at the restaurant i ate at last oct,False
restaurant,book red crown tourist court now for ten not far from tin city,False
restaurant,book a restaurant that serves trottole in tillicum,False
restaurant,i need a table at the ledbury at 18 oclock,False
movie,where is the nearest movie theatre that is playing honeysuckle rose,False
restaurant,me and terrie need a table at a bar in hypoluxo ut,False
movie,what times is the 7 faces of dr lao showing at united paramount theatres,False
movie,what times will animated movies be showing nearby ?,False
movie,show me the films close by and the movie times for today,False
restaurant,i want a table for 8 in plain on aug 5,False
movie,when and where is invitation to the waltz playing,False
restaurant,id like a restaurant on 6 1 2027 for 5 people in iowa city,False
movie,when can i watch prince daewon at movie house ?,False
restaurant,i want an indoor restaurant for a party of five in columbus junction,False
restaurant,book a spot for 8 at the kitchin on october the 13th 2039,False
movie,what films are playing now at the general cinema corporation,False
movie,where is feast ii no limit playing,False
movie,what films are playing at 1 pm at showcase cinemas,False
restaurant,book reservation at the big chill cafe in ar for 10 people,False
restaurant,book a reservation for a pub with ma po tofu in moldova,False
movie,what time is sontha ooru playing,False
restaurant,would like to book a restaurant the last day of sukkot for lee and ines,False
restaurant,i would like reservations for cliff house in seven months for six people,False
movie,is the mystical adventures of billy owens playing at the closest movie house,False
movie,where can i find paranormal activity 3 playing near me 1 hour from now,False
movie,when will third person singular number be playing?,False
restaurant,book a table for 6 in new hampshire for next week,False
restaurant,we want to eat at a brasserie with sicilian food in nebraska,False
restaurant,book me a restaurant in the northern mariana islands,False
restaurant,i need to book a restaurant at supper time in il,False
restaurant,book a molecular gastronomy serving restaurant on march the 20th,False
restaurant,i want to eat at a bakery with deidre and rosa in jersey,False
restaurant,book me a pub nine weeks from now for 4 people,False
restaurant,book a table for ten people at a restaurant that serves noodle,False
movie,where can i watch animated movies around here,False
restaurant,make me a reservation somewhere near here for me and my step brother by adelines apartment,False
movie,what are the showtimes for boy of mine,False
movie,when is our story showing next at north american cinemas,False
movie,find me showtimes for a christmas story starting at eleven o clock,False
restaurant,call for a table of 3 at the tavern on the green in south farmingdale,False
movie,what time will the closest movie house be playing mark shoots first,False
movie,tell me what films are currently playing at amc theaters,False
movie,please find the movie schedule for animated movies playing in the neighbourhood,False
movie,what cinema is health warning playing in eleven hours ?,False
movie,what movie theatre is playing shed no tears,False
movie,give me the schedule for getting there sweet 16 and licensed to drive,False
movie,show me movie times for one minute from now,False
movie,what s the nearest movie house showing films,False
movie,i d like to go to douglas theatre company to see in beaver valley what times will the movie be playing?,False
movie,what films are playing around here,False
movie,can i get the movie schedules for landmark theatres,False
movie,where is they always return at dawn playing,False
movie,what time is high tide at noon showing,False
restaurant,book a bakery with smoking room for nine in niger,False
restaurant,i need a table for six pm for me and my step daughter at cafe rouge,False
restaurant,i need to book a pool side bar for 5 people 17 weeks from now distant from here at mountain lakes,False
restaurant,book in oh in gurabo for velma and gloria,False
restaurant,book me a restaurant ten minutes from now,False
movie,show movie schedules for animated movies in the neighbourhood,False
restaurant,make a booking for the highly rated food court in montenegro,False
restaurant,book an indoor restaurant near wallington for 2,False
restaurant,i would like a restaurant reservation for this year for 4 people,False
restaurant,book a reservation for can fabes nearby namibia,False
restaurant,book a restaurant in north dakota for my child and i on november seventh 2037,False
movie,can i get the showtimes for movies around here ?,False
movie,what time is see grace fly playing at cineplex odeon corporation,False
movie,is strauss is playing today at the cineplex odeon corporation,False
restaurant,book a eggo serving brasserie for ten,False
restaurant,make me a reservation somewhere outdoor in port wentworth for a party of five at a coffeehouse in ten months that is distant,False
restaurant,book a reservation for a pub with internet for 2 people,False
movie,i want to see the local movie times,False
movie,what time could i see a mile in his shoes ?,False
movie,find the schedule for animated movies in the neighborhood,False
restaurant,book a table for 7 at a churrascaria that is highly rated,False
movie,when is longwave going to be playing?,False
movie,what animated movies are showing in the neighbourhood,False
restaurant,id like a table for 6 at a restaurant in denmark at 22,False
restaurant,i want to eat mezes at the pub for 1 at four pm,False
restaurant,book a reservation for 4 at a bar serving corn relish,False
restaurant,i want to book a seafood bakery in le roy,False
movie,which animated movies are playing today at kb theatres ?,False
movie,i want to watch mr and mrs bridge at a nearest cinema,False
restaurant,book a churrascaria in macao on may the twenty-third,False
restaurant,book a cafe table for one that has internet access,False
restaurant,book a restaurant for ten in germfask,False
restaurant,book a spot for 9 at dinner in the sky in sc,False
restaurant,i want to go to the freight house in gabon,False
restaurant,book a table for nine people in svalbard and jan mayen,False
restaurant,book me a taverna restaurant,False
movie,what films are at century theatres in twelve hours,False
movie,what are the movie schedules for santikos theatres ?,False
movie,find the flying ace,False
movie,find a cineplex odeon corporation showing movies,False
restaurant,book a reservation for 4 people at a restaurant within the same area as my step daughters position,False
restaurant,book four people at a madagascar bar,False
movie,please give me the movie schedule,False
restaurant,book in rocky mound for four 1 hour from now,False
restaurant,id like seats for one at a restaurant in 1 hour at a place in la madera that has parking,False
restaurant,i need a table for 10 at the best gastropub,False
restaurant,would like a table right now for leonor mendoza imogene and lisa sanchez,False
restaurant,book a food truck for greek food for 7,False
restaurant,need a table for rita antoinette and i,False
movie,can a i get the movie schedule for sympathy for the devil,False
movie,what movies are playing at the nearest movie house,False
restaurant,i want to find parking next to a restaurant for 10,False
restaurant,please book a restaurant for nine members on august 25 in dc,False
restaurant,i want to book a bistro that serves pasta salad in brazil,False
movie,what time is hitman city playing,False
movie,when is the stain playing at loews cineplex ?,False
movie,what are the movie times for united paramount theatres,False
restaurant,i need a table for ten on april the eighteenth 2030,False
movie,show the movie schedules with animated movies around here,False
movie,what time does the next movie play around here,False
restaurant,book a popular tuscan restaurant for 7 people in west richfield,False
movie,what time is truth about kerry playing at movie house,False
restaurant,book a reservation for bettye and lakeisha jimenez at a bar,False
restaurant,i want a table for 4 at any kind of goiano bar,False
movie,what time is the bodyguard at malco theatres playing,False
movie,i m looking to watch savage grace at showcase cinemas at thirteen o clock,False
movie,where can i watch portrait of a woman nude in 1 hour ?,False
movie,movie schedules at amc theaters,False
restaurant,book a spot for 10 in the same area of inwood - 207th st,False
movie,what time is the crystal gazer playing at the closest cinema ?,False
restaurant,casey chavez lucinda and karina want to eat at a diner on december the 7th,False
movie,can i see movie schedules for movies this evening in the neighbourhood ?,False
movie,find 16 starting time for heavenly body,False
restaurant,book a restaurant for 8,False
restaurant,book a restaurant on next fall for 5,False
restaurant,i need seats for 6 at char no4 in georgia,False
restaurant,book a bar that serves ribs for 5 people,False
restaurant,book a table in california for rita and brenda at hurley mountain inn on january the 11th,False
restaurant,book a diner place or me and my best friend on holy saturday capital of united arab emirates where they serve pepperoni dishes,False
restaurant,book reservations at a restaurant that serves brazilian food for 9 people,False
movie,find movie schedules for star theatres,False
