Intent,Sentence,Outlier
search,where can i see the trailer for phineas redux ?,False
search,where can i watch the tv series breed the pain ?,False
search,look for the thorns saga,False
search,where can i stream a television show called safety ep ?,False
search,please find me glass cloud – single,False
search,find a video game called new york 911,False
search,search for tera the exiled realm of arborea,False
search,i d like to hear the song in a reverie,False
search,find the fields of sacrifice movie,False
search,find a soundtrack called the outpost,False
search,find a song called this champagne mojito is the last thing i own,False
search,find the mystery woman saga,False
search,find a book called screwed,False
search,show me heavenly sword,False
search,find a trailer called hellboy the troll witch and others,False
search,show creative work of through the back door,False
search,can you please look up the game the islanders ?,False
search,please find me the work instrumental directions,False
search,find a show called the paper route,False
search,where can i view the tv series of witch,False
search,pull up the trailer for 2000 years – the millennium concert,False
search,please find me the rear mirror saga,False
search,find the living room tapes a tv series,False
search,show me a picture of nokia football crazy,False
search,play a trailer for sencha touch,False
search,i m looking for the music of nashville season 3 saga,False
search,show tv show schedule archiveis,False
search,find the picture their finest hour,False
search,show me the album apache axis2,False
search,find a tv series called the golden hits of sandie shaw,False
search,find a trailer called sheriff of tombstone,False
search,what is the tv show this is halloween ?,False
search,play if you go,False
search,i d like to see confessions of an indian teenager,False
search,i m looking for a game called gateway,False
search,find as live as it gets,False
search,find a soundtrack called the spanish jade,False
search,show the collectors video game,False
search,i d like to see the game called god is in the tv,False
search,find me the lace and whiskey soundtrack,False
search,find a video game called a stroll in the pork,False
search,where can i locate leo the lion for purchase,False
search,look for the trailer for red stallion in the rockies,False
search,find black mirror iii final fear,False
search,find the movie shake your spirit,False
search,i want to find the video game masada anniversary edition vol 3 the unknown masada,False
search,find a tv show called randy scouse git,False
search,show the my world 20 photograph,False
search,show me the work titled the perfect gentleman which is a song,False
search,show creativity in the red saga,False
search,find the show the naked gun,False
search,what type of movie is houston press ?,False
search,find the show titled the most charming and attractive,False
search,find the album future of the past,False
search,find half a sixpence photograph,False
search,please help me find the short program saga,False
search,i want to watch the television show champion,False
search,find your personal touch,False
search,find a show called friday download,False
search,please get me stories from the english and scottish ballads show,False
search,find the video game the sims 3 generations,False
search,show the trailer of deadly skies,False
search,i want to listen to the song first time for everything,False
search,play me east side story,False
search,find the labyrinthe game,False
search,find a saga called set sail the prairie,False
search,where can i buy a photograph called feel the love ?,False
search,show me the movie black summer,False
search,find the tv show tribute to the troops,False
search,show the singles collection volume 4,False
search,find the photograph a little less sixteen candles,False
search,i m looking for a movie called salvage mice,False
search,i want to watch the movie godslayer,False
search,find a picture called neighbourhood,False
search,please help me search the banker television show,False
search,i want to listen to the soundtrack adobe digital editions,False
search,find the exile and the kingdom,False
search,find an album called thursday night baseball,False
search,show creativity of song a discord electric,False
search,i want to watch the tv show official detective,False
search,i want to find the show called fresh aire 7,False
search,i d like hear the song sit down and talk to me,False
search,play the home is where the music is tv series,False
search,show the put yourself in his place game,False
search,show creativity of home brew,False
search,find a video game called craters of the sac,False
search,i am looking for a creative work called something warm,False
search,find me the book called suffer,False
search,find boyish story,False
search,show video game name find the colour,False
search,show creativity of accident analysis & prevention,False
search,find the tv series shaun the sheep,False
search,play the album the outpost,False
search,please search for all the lovers trailer,False
search,where can i find thor meets captain america ?,False
search,find a movie called no more sadface,False
search,find the another ticket game,False
search,can you find me the real mccoy novel ?,False
search,play the song sf sound furniture,False
search,please search for sealed with a kiss movie,False
search,i need a painting called brubeck plays brubeck,False
search,find a tv show called shake hands with beef,False
search,i need journal of pediatric oncology nursing help me find,False
search,find me an echo in the darkness,False
search,i want the complete global albums collection,False
search,where can i see the show twentysomething,False
search,find me i am mariah… the elusive chanteuse,False
search,find the apple address book television show,False
search,play the video game the genesis machine,False
search,find half cut tea,False
search,what is the price for the album praise the lord and pass the ammunition ?,False
search,play video game manifesto of nevermore,False
search,how do i see the tv series to see the invisible man ?,False
search,where can i purchase wuthering heights,False
search,please look up the painting beyond iconic photographer dennis stock,False
search,show the chemdexcom photograph,False
search,show me the movie purple heart diary,False
search,find a tv series called dirty politics,False
search,i want to find the very best of chicago only the beginning,False
search,find the show how to meet the lucky stars,False
search,search for innocence from hell,False
search,find back for good a novel i want to read,False
search,please fine me ties that bind,False
search,find a novel called twins of evil,False
search,show me the edge of love photograph,False
search,find a saga called lovex discography,False
search,show the mickey mouse photograph,False
search,show me the landing at low tide painting,False
search,can i buy the book vacation of petrov and vasechkin online?,False
search,where can i find police story 3 supercop,False
search,find the angry birds movie,False
search,can you find a picture of the rambler,False
search,what is the cave canem demos photograph ?,False
search,search for the halfway home tv show,False
search,find the trailer for the spooky sisters,False
search,please search for the live in san juan capistrano picture,False
search,find a soundtrack called the alice cooper show,False
search,what is the release date for the dvd called wild is the wind ?,False
search,find a soundtrack called billboard hot r&b hits 1981,False
search,show schedule for cin cin,False
search,i m looking for the trailer to evil or divine - live in new york city,False
search,i d like to see the book the royal thousand,False
search,search for the painting hess a biography,False
search,find the garden of eden,False
search,please pull up nothing feels good,False
search,search for big ideas painting,False
search,i d like to see spyforce,False
search,show the soonchild painting,False
search,find the picture chorus line,False
search,what is the cheapest price for the saga called 2006 wikipedia cd selection ?,False
search,find a trailer called just say noël,False
search,show the invisible hook trailer,False
search,i d like to play the album clarke,False
search,can you search a song for mama book for me?,False
search,show me tears on my pillow,False
search,show the philosophy and phenomenological research saga,False
search,find a trailer called storm center,False
search,can you find me the work titled a little curious ?,False
search,play hell house song,False
search,i d like to see the picture the principle of hope,False
search,where can i purchase the twenty chickens for a saddle saga ?,False
search,find the app store,False
search,search for the dark side of the mind movie,False
search,show the best of minnie riperton saga,False
search,find the tv show starship titanic,False
search,play me the song just to see you smile,False
search,find a painting called songs from tsongas,False
search,find the tv series the farewell tour,False
search,find phalcon,False
search,i m looking to find suryavanshi,False
search,find the photograph the air is on fire soundscape,False
search,find all about aubrey,False
search,how do i find the soundtrack african development perspectives yearbook ?,False
search,find the little death a soundtrack,False
search,find the digital champ battle boxing,False
search,find a novel called nature reviews genetics,False
search,find the moldy peaches,False
search,shw the picture twin husbands,False
search,i m looking for circus world,False
search,show me a picture called heart like a hurricane,False
search,look for the saga called death in paradise,False
search,look for the album called the tale of mr jeremy fisher,False
search,find a video game called young,False
search,look up the hard to handle tv show,False
search,what is the picture called lest we forget the best of ?,False
search,find laserlight,False
search,look for the chu chu and the philly flash picture,False
search,find soundtrack titled the house of the yellow carpet,False
search,find a tv show called the extraordinary,False
search,where can i find the painting rss tracking,False
search,want to see the dungeons & dragons chronicles of mystara,False
search,find a game called albino blacksheep,False
search,find digimon next,False
search,i d like to play the album beloved rogues,False
search,find thunder in the east,False
search,find me a game called thesis eleven,False
search,find the innocent when you dream saga,False
search,play pirates of the caribbean online,False
search,look for the nightmare on providence street saga,False
search,find city of light,False
search,show creativity of what is dead may never die,False
search,where can i find the movie called cracking contraptions ?,False
search,show me the saga my darling,False
search,find a video game called peaches discography,False
search,find conker live and reloaded,False
search,show me the movie sonic triple trouble,False
search,search for the complots,False
search,i m looking for the tv series called unborn,False
search,find a photograph called shout it out,False
search,where is journal of geriatric psychiatry and neurology,False
search,can yo find me the game a silence that screams ?,False
search,show the drive of life album,False
search,can you help me find scholarmate ?,False
search,find the show manthan,False
search,find a picture called how much wood would a woodchuck chuck,False
search,find the most important people a television show,False
search,show creativity of night of the hunter,False
search,show me it might as well rain until september,False
search,show creativity of photograph of my wonderful day,False
search,where can i find on the marble cliffs,False
search,play me the tv show seal team,False
search,find check in,False
search,can you find the album simplescreenrecorder,False
search,please find the show kim hyun-joong discography,False
search,i d like to listen to the song the natural farmer,False
search,find starcross,False
search,find a photograph called accion newspaper,False
search,find loved ones for me,False
search,please find the infrared riding hood tv show,False
search,play baby workout,False
search,show creativity of painting of me too,False
search,search for the television show me and my guitar,False
search,show me the novel all i need to know,False
search,where is winterheart’s guild,False
search,i want to watch the television show new astronomy,False
search,is it possible to find the book live in europe online?,False
search,find politicsnation with al sharpton,False
search,find a video game called batman the return of bruce wayne,False
search,find an album called preminchi choodu,False
search,find book the music lovers,False
search,show creative book named pencil thin mustache,False
search,find me the novel titled fertile ground,False
search,where to buy book bright ambush,False
search,find trivial pursuit america plays,False
search,find once upon a time in the west,False
search,where to watch television show linger awhile live at newport and more,False
search,show me the heart specialist,False
search,when does fire and ice the winter war of finland and russia television show air?,False
search,show creativity of southtown,False
search,play tales from the organ trade,False
search,find she monkeys,False
search,i want to world of warcraft tides of darkness,False
search,show creativity of saga frontier marshal,False
search,i need to find the creative work wave,False
search,find a picture called battlefield network,False
search,find an album called just call me stupid,False
search,show creative game elements of life remixed,False
search,find stays in mexico,False
search,find amanda palmer goes down under,False
search,she me the game called knowledge and decisions,False
search,find thyme travel,False
search,play keep your right up song,False
search,buy cannabis painting,False
search,i want to listen to the album magical girl lyrical nanoha strikers,False
search,find terminator 3 the redemption a picture,False
search,show texas review of entertainment & sports law creative song,False
search,find the son of man show,False
search,i want to watch the original recordings,False
search,can you get me the trailer of the multiversity ?,False
search,go to the photograph the inflated tear,False
search,find jono and ben,False
search,show minutes to midnight photograph,False
search,show me the atrocity exhibition,False
search,find the trailer for seven year itch,False
search,show me half a life,False
search,help me find from time to time a tv show,False
search,search for the adventure of the blue carbuncle,False
search,find a tv series called cocktail kings,False
search,show me god bless the child photograph,False
search,what is the cheapest price i can pay for the dvd called the darkest cloud ?,False
search,find a painting called the wipers times,False
search,find me the karl hess toward liberty photograph,False
search,find the video game high hopes & heartbreak,False
search,find a photograph called the dickinsonian,False
search,i d like to see the trailer tony parker,False
search,i want to watch the television show naked ii,False
search,find the trailer for bill cosby presents the cosnarati state of emergency,False
search,show me ncaa college football 2k3,False
search,i want to read the novel alone at the microphone,False
search,find me the rise and fall of the great lakes saga,False
search,please look up the song twist of shadows,False
search,find the now we are six saga,False
search,find the game gormenghast,False
search,find word of mouth for me,False
search,find an album called burnout the ultimate drag race challenge,False
search,look for the trailer to hickory daily record,False
search,find a television show called happy trails,False
search,show me my princess,False
search,look up the fair warning saga,False
search,find me the novel of a dictionary of slang and unconventional english,False
search,find wild solutions a saga,False
search,find a painting called the other bank,False
search,search for a photograph of road hogs,False
search,find a photograph called the wish list,False
search,look up the gun soundtrack,False
search,find the creeper,False
search,find a painting called smash crusher,False
search,look up the act of valor tv show,False
search,what is the book sell your body ?,False
search,please look up the around the world in eighty days movie,False
search,please find me the book step into my groove,False
search,can you locate the novel ismol family,False
search,where can ifind you know me a saga,False
search,i m looking for the album called disorderly conduct video on patrol,False
search,show creative devils to some,False
search,find outback bound a trailer,False
search,show me the trailer for the glades,False
search,show creative video game the boat is full,False
search,i d like to see the album heroes of might and magic iv,False
search,show more questions than answers trailer,False
search,can you find me the stand proud book ?,False
search,find me the martin morning saga,False
search,i d like to see the movie edinburgh evening news,False
search,play the tv series heart of gold,False
search,i want to listen to keep the faith,False
search,i want to watch the tv show tales from space about a blob,False
search,please search thirayum theeravum video game,False
search,lets see the tv series 7even year itch,False
search,show me a novel by onnaam muhurtham,False
search,find a novel called under blackpool lights,False
search,please find brand new strings,False
search,find the american journal of sports medicine picture,False
search,show me the song 15 storeys high,False
search,find welcome to the el-palacio a movie,False
search,i m looking for the painting god must have spent a little more time on you,False
search,please look up the novel heroes of annihilated empires,False
search,get soundtrack of comprehensive knowledge archive network,False
search,i want to read the saga michael clayton,False
search,find le profil amina tv series,False
search,please get me the before crisis final fantasy vii television show,False
search,find cover her face,False
search,find the show titled hell on earth 2006,False
search,find the stone free game,False
search,show me then we came to the end,False
search,show me kurdishmediacom,False
search,find a painting called chettathi,False
search,help me search ufc on fox show,False
search,where can i buy the movie the teahouse fire ?,False
search,show me the trailer for live phish volume 12,False
search,find oman medical journal,False
search,i m looking for the song called standing for something,False
search,find a photograph called wild cats on the beach,False
search,i want to listen to the soundtrack the om years,False
search,get me a picture about sardonic wrath,False
search,show me the television show children in need rocks 2013,False
search,please look up the television show noel hill & tony linnane,False
search,please find me chance pe dance,False
search,can you get me the starcross saga ?,False
search,play the trailer for a lineage of grace,False
search,show me dangers of the canadian mounted,False
search,find a video game called no parking on the dance floor,False
search,look up applied linguistics,False
search,find the inspector for me,False
search,show me the album clarke,False
search,show me the out with my baby photograph,False
search,find me the princess battles song,False
search,search for the exiles of time book,False
search,can you find fire escape in the sky the godlike genius of scott walker,False
search,find the creative work brilliant! tragic !,False
search,show an actress for the newest album,False
search,show me the lord of the isles,False
search,show creativity in cross currents,False
search,show creative song ufo senshi dai apolon,False
search,show painting of waiting for snow in havana,False
search,find a movie called dorothy and the witches of oz,False
search,show saison 5 de game of thrones,False
search,where can i find the tv show metabolights,False
search,find episodi di south park a trailer,False
search,where can i watch the picture i’ll take care of you ?,False
search,find friendship way,False
search,find me the novel between the rivers,False
search,i m looking for dead at 21 the tv series,False
search,show song schedule of shoot for the moon,False
search,play everybody wins trailer,False
search,i want to read the book the lion sleeps tonight,False
search,show the bean and the boys painting,False
search,where can i buy a barometer clock,False
search,i want to see the tv series a state of mind,False
search,i want to play the video game miss castaway and the island girls,False
search,help me find the book called journal of neuroscience research,False
search,find the tv series truly fine citizen,False
search,help me find the work graphics animation system for professionals,False
search,can you find me the game super scription of data ?,False
search,find a show called chompa toung,False
search,i want to watch the tv series rat pack,False
search,play the video game the sparrow,False
search,can you find the tv show faithless street,False
search,please get me the british journal of dermatology game,False
search,show second generation album,False
search,bring up the book perfume the story of a murderer,False
search,find a tv series called live hearts,False
search,find do you wanna touch me a song,False
search,where can i find the show game of death ii,False
search,find me recorder and randsell,False
search,find the photographic journal,False
search,find five came back for me,False
search,play the cabin fever 2 spring fever saga,False
search,find a show called in fondo al buio,False
search,where can i watch the tv series polite people,False
search,find nhl on fox,False
search,where can i find sebastien grainger & the mountains,False
search,find a television show called merced sun-star,False
search,find a video game called merry andrew,False
search,find me the painting fallen sanctuary,False
search,find the album smoke and mirrors,False
search,search for polish assault,False
search,find wish you were here,False
search,please fine me worms clan wars,False
search,where can i find the trailer for sensations of 1945,False
search,i want to play the video game the coyote kings of the space-age bachelor pad,False
search,find the prince of temple street a picture,False
search,search for the show champagne showers,False
search,please search for the puppet on a string video game,False
search,find a television show called the passion of the betty,False
search,find a painting called beyond the neighbourhood,False
search,where to buy video game of think fast,False
search,show me born in america ?,False
search,show creative album heredity,False
search,play the news virginian song,False
search,i want to find night of the hunter,False
search,i d like to find scriptures of the golden eternity tv series,False
search,find the song titled the mole show live at the roxy,False
search,i m trying to find the show chant ii,False
search,find the song tholireyi gadichindi,False
search,where can i find the photograph of a christmas memory,False
search,find a television show called twisted,False
search,i need to find the work brotherly love,False
search,where can i see the show latin for lovers ?,False
search,go to bioruby,False
search,show me the movie called people and masks part 2,False
search,find a movie called bruce lee,False
search,what is the cheapest online price for the instincts saga ?,False
search,where is the creative work seven pillars of wisdom ?,False
search,tv series for the thirty nine steps ?,False
search,find a game called bump the show,False
search,show get it together on tv show,False
search,show me the game english freakbeat,False
search,i am looking for the creative work a wonderful life,False
search,find the radical history review saga,False
search,find the hopeless romantic photograph,False
search,look for the itvcom song,False
search,find a show called the crowd roars,False
search,look for the district 9 novel,False
search,show game alien breed ii - the horror continues,False
search,find the gamblers,False
search,need find the book called hollywood connection,False
search,want a work called walk the river,False
search,read the open ecology journal,False
search,find the gamble,False
search,find a novel called kiss me licia,False
search,show me the advocate,False
search,locate me the novel entitled isthmus,False
search,find the carrousel saga,False
search,please locate sad love story novel for me,False
search,play remains of the day,False
search,where can i see the movie across the line the exodus of charlie wright ?,False
search,find if these walls could talk,False
search,show me the movie operetta for the theatre organ,False
search,show the tv show the last samurai,False
search,play another time,False
search,show me a copy of the picture double deal,False
search,show me the picture unfinished monkey business,False
search,look for the american journal of sociology,False
search,find a soundtrack for dante’s peak,False
search,i want the movie perseo miranda and his theatre,False
search,i m looking for a job in inversion,False
search,find next of kin,False
search,show me a television show named a love to hide,False
search,where can i watch the trailer of the national treasures - the complete singles,False
search,i need the book titled lullaby of broadway,False
search,play me the soundtrack ready,False
search,can you find the tv show so what,False
search,find the show portrait of countess karoly,False
search,show creative song called holidays on the river yarra,False
search,who was the artist who did the painting called spyro 2 season of flame ?,False
search,help me find the work unite and win,False
search,i d like to watch the trailer for dungeons & dragons chronicles of mystara,False
search,find family feud novel,False
