Intent,Sentence,Outlier
music,play the top 1991 sound track,False
restaurant,i need to book a restaurant for five in 1 minute that serves chichi in east prairie,False
restaurant,book a table for a party of 7,False
movie,what time is bhoomi geetha playing at the movie theatre,False
music,please use itunes to play something from 1986,False
music,i want to hear the new latin pop rising list,False
movie,when is lake city playing at dipson theatres ?,False
restaurant,book a table in mississippi on may nineteenth 2034 for me silvia and sandy,False
restaurant,book a meal for four in dc,False
music,use deezer to play music,False
music,i want to hear a top five ballad from 2002,False
movie,can i go see cash and curry at a movie theatre ?,False
movie,when is crime and punishment u s a showing?,False
movie,can i get the marine 2 showtimes,False
music,can you play a chant by butch trucks on spotify,False
restaurant,book a tea house for 6 members with soul food,False
movie,what films are playing now at the closest movie house ?,False
music,play a fifties theme on lastfm,False
restaurant,book a spot for seven in 8 seconds from now,False
music,play some music from 1993 on itunes,False
restaurant,stacy watson and adriana want to go to the best osteria in hallowell minnesota this afternoon,False
restaurant,book a table this evening in saint vincent and the grenadines at a gastropub,False
restaurant,book a reservation for five people at a restaurant with pool in benkelman mi in apr,False
music,play chant on groove shark from 1996,False
restaurant,book spot for eight at bar that serves potée,False
music,play tanti auguri a te from bruce gilbert,False
movie,what are the movie times for amco entertainment,False
movie,what time is the cobbler playing at the closest movie theatre ?,False
restaurant,i need to take three people to eat,False
movie,what film is playing at landmark theatres,False
music,play some mark tremonti from the thirties,False
movie,find the movie schedules at magic johnson theatres,False
music,play some 1962 theme music,False
music,play some grunge,False
restaurant,i want to book a churrascaria restaurant for ten people,False
music,use service vimeo the genre slow rock,False
movie,what movie theatre closest to me is playing animated movies and when,False
movie,show me when and where i can see song of summer,False
music,play me the greatest howard levy song,False
music,play the top song from damon albarn using slacker,False
music,play twenties music off of my itunes,False
music,play pura vida,False
restaurant,book a table for two in oklahoma,False
restaurant,i want seating for five near the pool at the pub,False
restaurant,book a spot for two at a churrascaria that sells cupcake in lumpkin indiana now,False
restaurant,find me a coffeehouse for nine in indiana that has access to a pool,False
music,play music from itunes for ric grech,False
music,play the album cara de dios,False
music,play some sixties on netflix,False
music,play chant music from 1993,False
movie,where is the closest cinema playing a drink in the passage,False
restaurant,id like to reserve a spot at a bakery in guyana in feb,False
music,i want toi hear some pop punk perfection 🍕 off of deezer,False
music,play a sound track by vegard sverre tveitan,False
movie,find national amusements showing the trouble with harry,False
restaurant,please book me a table for next week at a top-rated restaurant,False
movie,where and when can i see the image makers,False
music,play some 1999 symphony from minami takahashi,False
music,play a top song by carson parks on groove shark,False
restaurant,id like a table for two at a place in west whittier nevada on indigenous peoples day,False
music,play something off google music,False
music,play any album from the twenties,False
movie,what is the nearest cinema playing the hour of temptation,False
movie,movie schedule at speakeasy theaters,False
music,play randy castillo s music from 1952,False
restaurant,im looking to book a reservation in aruba at a place nearby,False
movie,what time is i know that you know that i know lpaying,False
movie,show me a movie theatre where screamplay is playing,False
movie,does mexican werewolf start at three am,False
restaurant,im in bowling green please book a restaurant for 1 close by,False
restaurant,in twenty three hours and 1 second my daughter and i want to eat at a restaurant,False
restaurant,book a table in a haines borough restaurant for nine that is within walking distance,False
restaurant,book a highly rated bar in curacao for one,False
music,play songs by sarah harding,False
restaurant,book a table for 9 people at a delicatessen for april the twenty-eighth 2018,False
music,play some jpop on google music,False
movie,what time is return from hell playing at the nearest movie house,False
restaurant,find me a creole restaurant,False
music,play music on netflix by don kikas,False
music,play robin hood and the bishop of hereford by jon mayer,False
restaurant,reserve a table for 8 in neighboring hitchland,False
movie,what animated movies are at the nearest cinema,False
restaurant,book a table at south street diner close to your teenagers college,False
movie,list movie times at general cinema corporation,False
music,play music from the artist taktloss from the record in the thirties,False
music,play the song gangsta ? by siavash ghomayshi,False
movie,find the schedule for idols of clay at a movie house,False
restaurant,book me a table at a bistro that serves maple syrup for a party of 10,False
restaurant,book me a reservation for an osteria campanian on jun the 7th 2022,False
movie,i m looking for a movie schedule at the cooper foundation,False
restaurant,i need a table in ottoville on feb 15th 2029 at gus stevens seafood restaurant & buccaneer lounge,False
movie,show me movie times for two a m at any nearby movies,False
music,play some 2011 music by dan healy,False
music,play a song on zvooq,False
restaurant,book cova in frisco city for me and therese at eight pm,False
restaurant,book a table for january the twentieth at a place far from your daughters campus,False
music,play the top-5 sort of ballad music from 2012,False
restaurant,i need a reservation for an indoor restaurant in china,False
music,play my tribute by billy cox,False
music,play some acapella music,False
movie,is love and other troubles playing,False
music,can you play something off johan larsson s travelers and thieves,False
restaurant,antoinette and i want to eat at an oyster bar that serves pizzette in south duxbury me,False
music,play a top-fifty 1965 album by ski,False
music,play the mister music man by gene de paul,False
movie,show me the movie times for films nearby,False
restaurant,book an australian restaurant in jacksboro three weeks from now for my step father and i,False
restaurant,i want to reserve a gastropub that has a spa,False
restaurant,i need a reservation that has spanish rice at a cafeteria with ten people today,False
restaurant,book an oyster bar in american samoa for lunch,False
restaurant,book a bar which serves chicken french at robinson,False
restaurant,book a restaurant for 7 in mn,False
music,play the song le renouveau,False
restaurant,make me a reservation at a delicatessen that serves tofy for a party of four in az,False
music,play sense tu from ebi hamedi,False
restaurant,i want a restaurant in idaho for 2 of us,False
movie,can you give me a local and current movie schedule,False
music,i wanna hear something on spotify by eddie vinson,False
restaurant,book a cafe in romania,False
movie,find movie schedules for movies in the area,False
movie,can i get the showtimes for the closest movie theatre that has the newest films,False
movie,when is eye of the spider playing at regal entertainment group ?,False
movie,what time can i expect films to start at the bow tie cinemas,False
restaurant,party of two for a food truck on december 22 that serves chicken french in bolivia,False
music,play me a song from 1972 by sweet emma barrett,False
restaurant,im looking for the best bistro that serves mongolian food that has room for two people in marshall islands,False
movie,what films are at the nearest cinema,False
movie,what are the movie schedules for the caribbean cinemas,False
restaurant,can you get a table at the triple door in district of columbia for me and deborah vasquez,False
restaurant,book a bar table for tonight for rajasthani food,False
music,play music from 2005 by justin broadrick,False
restaurant,make me a reservation in hardesty at a joint the is indoor,False
movie,is the missing clerk playing,False
movie,show me movie schedule for animated movie around here at eleven a m,False
music,play pandora tunes from the fourties,False
restaurant,can you book me a table for 9 in de ?,False
movie,can i get the movie times for in the neighbourhood movies,False
music,play some music from miss platnum,False
movie,what time is the queen of moulin rouge playing?,False
movie,when will the flower and the angry waves be showing?,False
music,play some glenn stetson music on spotify,False
movie,tell me the movie schedules for loews cineplex entertainment,False
restaurant,patty and i need a table booked at a highly rated restaurant in sandstone,False
restaurant,book a food court for 5 serving african food,False
music,play the song domino by luca turilli,False
music,play the top-ten chant doda songs from the twenties,False
music,play music by don cherry,False
music,play music on itunes,False
music,play a melody from elmer bernstein,False
restaurant,i want to book a restaurant close-by my teenagers airbnb at 00 55 am,False
restaurant,i need seats for five at a place five and a half months from now,False
restaurant,book a spot for one at a bar in seabrook,False
music,play a loretta lynn tune on groove shark,False
music,play some oleg anofriyev from 1960,False
movie,can you let me know where i can watch the nest ?,False
movie,what time is utamaro and his five women showing at alamo drafthouse cinema,False
movie,what is the movie schedules,False
music,play the album how insensitive,False
restaurant,book a spot for my kids and i at a restaurant with frybread,False
restaurant,book a highly rated restaurant with northeastern for 10 in satanta,False
music,play music from 2012 by yossif kobzon on last fm,False
movie,which films are playing at the closest movie house ?,False
music,use google music to play a song,False
music,play music from the twenties with slacker,False
music,i want to hear eighties music by noko on deezer,False
music,play a soundtrack by musical artist jimmy james,False
restaurant,id like to have southeastern brazilian at the pub in dominica,False
movie,please tell me the movie schedules ?,False
music,play the best music from klaus badelt,False
music,play dj cameo on itunes,False
movie,i d like to watch the details at the cinema,False
music,play these four walls by yummy bingham,False
music,play some caribou from the sixties,False
movie,what time is careful he might hear you playing at the cinema,False
music,play me a twenties song,False
music,play the track siberian khatru on zvooq,False
music,play the newest ep from the sixties,False
restaurant,book a restaurant for me and rosemary at 1 am,False
movie,what films are at cineplex odeon corporation,False
movie,in the neighbourhood find movies with movie times,False
restaurant,i want to book a restaurant in botswana for four people,False
movie,is i was an american spy playing at 11 a m at southern theatres,False
restaurant,i want to eat at the bar saint vincent and the grenadines at thursday for five people,False
movie,list movie schedules for movies playing close by,False
restaurant,book a restaurant reservation in hong kong,False
movie,find meal time movie times close by for movies,False
music,play the top five songs by isaac hayes,False
restaurant,i would like reservations made for masonville vermont nov 7,False
movie,i d like to watch dirty laundry at the movie house,False
movie,which animated movies are playing in the neighbourhood and when?,False
movie,show the animated movies playing at consolidated theatres,False
restaurant,i want to book a table for two at a close by bar in kuwait,False
restaurant,i want to book a restaurant in a distant id spa for lidia latasha and diann,False
movie,what is the movie schedule for the pacific theatres,False
music,play eddie meduza from the thirties,False
movie,where is the nearest movie theatre playing the sword of many lovers ?,False
movie,what animated movies are playing at the closest cinema ?,False
music,open lastfm and play a voluntad del cielo from wax,False
music,play night electric night on iheart,False
restaurant,book a table for 10 at top pot doughnuts,False
restaurant,find a reservation for a tavern that serves pizzas for a party of 6,False
music,play symphony music from joe dolce,False
music,play playlist a mis niños de 30,False
restaurant,book a spot for krista yolanda and i in new mexico,False
restaurant,find a reservation for a tea house in lorain,False
restaurant,need to book a restaurnt for a party of nine on thomas jeffersons birthday,False
music,play women of jazz,False
movie,where the the housemaid playing and when,False
music,please play kabhi jo baadal barse by ruth lorenzo,False
movie,when are animated movies playing at goodrich quality theaters,False
movie,find the movie schedule for animated movies close by,False
restaurant,book reservations at a tea house with esperanza and tommie now,False
music,play a chaos of desire from dan snaith,False
movie,what time can i see older office lady using her seductive tongue at star theatres,False
movie,when is scaramouche playing?,False
music,play track real talk,False
restaurant,i need a table at a highly rated diner,False
restaurant,book restaurnt at n9ne group in loogootee ut,False
restaurant,book a bakery at zero oclock for 5 people,False
music,please play some bill evans music,False
music,listen to westbam alumb allergic on google music,False
movie,find the schedule for the nightmare six hours from now at the nearest cinema,False
music,i want to hear gloryhole from mani off of lastfm,False
movie,what time is southern theatres showing ukraine is not a brothel ?,False
music,play me a song by stephen jones,False
music,please play some black metal music,False
music,play suite sudarmoricaine by afi on itunes,False
movie,what time is trouble every day playing,False
movie,is dishyum at the cinema,False
music,play me sun ra songs from the fifties,False
music,play me a 2015 soundtrack on netflix,False
music,play wanted by erykah badu,False
music,can you play the greatest sarah brightman song,False
movie,i d like to watch the freckled fish at 00 47 43 at magic johnson theatres,False
movie,tell me what movies are showing at seven am at the closest movie house,False
restaurant,my colleagues and i would like a restaurant in snow lake,False
movie,find plitt theatres showing animated movies,False
restaurant,book a restaurant for seven,False
movie,what time is cinema playing the village priest ?,False
music,play music from 2015,False
music,turn on last fm to listen to chara ballad from 1988,False
restaurant,book a table at a bar in cambodia that serves cheese fries,False
movie,find time for films at the nearest movie theatre,False
restaurant,i need seating at floating restaurant in tennessee for a group of 9,False
music,play some best selling rave songs,False
music,play some movement from 1959 on deezer,False
restaurant,please make reservations for three at a kosher taverna nearby our secondary residence,False
movie,find me the movie schedules at fox theatres,False
movie,what time is sundown the vampire in retreat showing,False
restaurant,i would like to book a highly rated brasserie with souvlaki neighboring la next week,False
movie,what time is mighty morphin power rangers the movie at magic johnson theatres ?,False
movie,find the movie schedule for the cineplex odeon corporation,False
movie,find close by films with a movie schedule,False
restaurant,book a spot at a highly rated tea house in manadonese,False
music,play me the dinner playlist,False
music,play music from the top-5 from artist kenia arias,False
restaurant,id like to eat with a party of 8 in hitchita or,False
restaurant,id like to go to the venetian theatre in gabon party of seven,False
restaurant,book a bar close by with a smoking room in ma,False
restaurant,find a reservation for a restaurant in hong kong for seven people,False
music,play some synthpop,False
movie,when is beneath the harvest sky playing?,False
movie,what time is are movies at the closest movie theatre,False
movie,what time is the count playing,False
music,play the soundtrack that tom bellamy contributed to,False
movie,i want to see dead calm at the closest cinema,False
movie,can i get the movie schedules for landmark theatres,False
music,play an masaki aiba tune,False
restaurant,i need to book a theme restaurant this month in chile,False
music,play the theme music from 1963 by yuki koyanagi,False
movie,find the movie schedule for animated movies in the area,False
movie,find a movie schedule for 12 hours from now,False
music,play hanging in the balance by nik kershaw on zvooq,False
movie,find the movie schedule for marcus corporation,False
movie,i d like to know what films are scheduled at alamo drafthouse cinema,False
music,play change has come on google music,False
movie,find the nearest movie house that s showing movies,False
movie,what are the movie schedules at the imax corporation,False
restaurant,i want to book a restaurant for ten this summer,False
movie,find movie times for animated movies in the area,False
music,play circus farm by deana carter,False
music,play melody music from 1988,False
restaurant,i want to make a reservation for one at a sushi restaurant in brucetown,False
music,play the greatest james yorkston song,False
restaurant,book a spot in 1 second that is neighboring robins hotel,False
movie,find the movie schedule for dipson theatres,False
movie,give me the showtimes for down where the buffalo go at amco entertainment,False
restaurant,i need to book a table at the star inn thats within walking distance from my place in ashland,False
restaurant,book a table for 0 pm in fayette for rachael morris and shannon near there,False
restaurant,i need a table for 9,False
restaurant,book a restaurant that serves pasta for 5 people,False
music,can you play deezer from 2007 ?,False
movie,is the suicide shop playing at southern theatres,False
restaurant,book the chapter one in bosnia and herzegovina for patti hester richardson and camille,False
restaurant,book a spot at rimsky-korsakoffee house in mackville,False
restaurant,restaurant that is brasserie for 8 and has wifi,False
music,play music on the playlist electronic gaming,False
music,play music from 2016,False
music,open youtube and play nanana from massimo altomare,False
movie,find the movie schedules for movies close by,False
movie,what time is american gun playing,False
music,play yung joc on slacker,False
restaurant,book a reservation for one at a highly rated restaurant in datil,False
music,play elitsa todorova music,False
music,please play got the time,False
music,open lastfm play top hits of simon webbe,False
movie,what is the movie schedule for the north american cinemas,False
restaurant,book a bar that serves italian-american cuisine neighboring wilson av for one person,False
music,play the top song by jack grisham,False
restaurant,i need a top-rated gastropub for 5 in dc in conshohocken on jul the 18th 2024,False
movie,list movie times at harkins theatres,False
music,play the most popular ep by marcel khalife on netflix,False
music,play music by cass elliot,False
restaurant,book the atomic cafe for ten people,False
movie,where is my dearest enemy playing,False
movie,find a movie theatre with intersections that is nearest,False
restaurant,book a cafeteria that serves bagels for six people,False
movie,what time does military history of african americans play,False
music,play martha my dear by shannon,False
restaurant,i need a reservation for my teens and i six months from now in tennessee,False
music,play some music from 1989 by sanjeev abhyankar,False
restaurant,book me a reservation for fatty crew in 13 weeks in haskell,False
restaurant,restaurant named the palm in tennyson mi,False
movie,i d like to see movie times at santikos theatres,False
music,play some kansas joe mccoy,False
restaurant,book a reservation for the training table on mar thirteenth 2026,False
music,play music from 1958,False
music,play midnight special,False
music,play fifties music,False
movie,what is the movie schedule for the cooper foundation,False
restaurant,book a table for my step father and i,False
music,play vic ruggiero music from 2007,False
restaurant,im looking for a local cafeteria that has wifi accesss for a party of 4,False
movie,what time is the lottery man playing?,False
restaurant,id like to eat at a neighboring downtown restaurant with a party of 2,False
movie,where is mother and child plkaying,False
music,play album from maureen mcgovern,False
restaurant,book a restaurant for three on feb 18,False
restaurant,id like a table at a top-rated tea house with javanese cuisine this week in germany,False
movie,which cinemark theatres is playing a is for atom ?,False
restaurant,can i get a table at the fort ?,False
music,play artist stu davis from the album dub chamber 3 on netflix,False
movie,can i get the showtimes for films in the area,False
movie,find the schedule for the tooth will out at sunrise,False
movie,find the panic in needle park,False
music,play a tune from space mandino,False
restaurant,id like a table for midday at the unseen bean,False
movie,i d like to watch movies close by,False
restaurant,book a spot for gay ramos janice gonzales and i at a bar in timbo,False
restaurant,book verdure serving restaurant in bloom city,False
music,play laura love songs from 1959,False
music,in google music play the top singles released in 1972,False
movie,can i get the movie times,False
movie,where is the closest movie theatre that is playing movies now,False
movie,she me movie schedules for the movies close by at sunset,False
movie,is sheikh chilli playing,False
movie,can i get the showtimes for the kitchen toto at cineplex odeon corporation,False
music,play steve harris false gestures for a devious public album,False
restaurant,reserve a spotat the food truck twelve weeks from now,False
restaurant,book a table at anstruther fish bar in fm,False
music,play me the greatest track of 1966,False
restaurant,book a table in tennessee for 1 for next august,False
music,play music by deenanath mangeshkar,False
restaurant,book a spot for me tiffany and sondra at a top-rated restaurant in ms with udupi,False
music,play the top-twenty from alexander braginsky,False
movie,show movie schedule,False
music,play all the way my savior leads me on spotify,False
music,play sweet shanghai devil by teddy diaz,False
music,play me a seventies song,False
music,play my piano ballads playlist,False
movie,what animated movies are on the movie schedule close by ?,False
music,play roy orbison tunes now,False
restaurant,book a pizza serving tavern for me and my brother,False
restaurant,book a table for three at 0 am at a bar with wifi in schuyler lake,False
music,play stereo by jonathan davis on deezer,False
music,play a theme from 1985 by patrick cowley,False
movie,what time is the message playing at loews cineplex ?,False
movie,what cinema has the closest movies,False
restaurant,make a reservation for four at a pub in sugarville,False
restaurant,id like to eat around id on august the 16th with a party of 8,False
music,play shaina magdayao s music on iheart,False
music,play the last 1957 movement,False
music,play the album sauna on zvooq,False
music,play oliver cheatham s symphony from the thirties,False
music,i want to hear music on itunes,False
restaurant,book a restaurant for tortelloni for eight,False
restaurant,book a top-rated restaurant in milton-freewater,False
restaurant,book a table in mt for 3 for now at a pub that serves south indian,False
restaurant,i want to book a restaurant within walking distance of my neighborhood,False
music,play slow rock music on vimeo,False
restaurant,where can i book a table close to me in moon run at sixteen oclock that will take three people,False
movie,show movie schedules at amc theaters,False
music,play me something from the thirties by candi staton on vimeo,False
restaurant,book a restaurant in eleele on october the fifth for 3 people,False
movie,what films are showing around here,False
music,play burhøns by ernie c,False
music,play slacker tunes by smog from movement in 2015,False
restaurant,book for five in georgia at the coffee bean & tea leaf,False
movie,i d like to watch movies at the closest movie theatre,False
movie,i d like to watch a storm in the stars at north american cinemas,False
restaurant,book a restaurant for six in mp,False
music,play the new music from wilko johnson,False
music,play a song by juanes on last fm,False
music,play noctámbulo pl,False
movie,show the nearest movie house with the expendables starting 1 minute from now,False
restaurant,book a table for 2 people at a restaurant with parking,False
movie,where and when is douglas playing?,False
restaurant,book me a restaurant in cyprus at a pub,False
music,play a song from 1994,False
movie,what animated movies are playing at imax corporation,False
movie,what time is 楽園追放 -expelled from paradise-,False
movie,is the mystery of betty bonn playing at twelve a m at the nearest movie house ?,False
music,play fifties music on slacker,False
movie,i d like to watch animated movies at national amusements,False
movie,is the passion of anna playing four seconds from now at the cinema,False
music,please play short and sweet by teyana taylor from my itunes,False
restaurant,i would like a table for jacqueline wilson and deanna at david carpenter house in uncas fm,False
