Intent,Sentence,Outlier
weather,will it be getting colder in sahuarita ?,False
weather,is agnew united states has chilly weather,False
weather,what s the weather forecast for my current position ?,False
weather,what s the weather forecast for here in august ?,False
weather,tell me the weather forecast for croatia now,False
weather,is it going to get chillier at 5 am in trussville bosnia and herzegovina ?,False
weather,what is the weather forecast for yoakum sc ?,False
weather,what is the johnson creek forecast for chilly weather,False
weather,what is the weather forecast in va,False
weather,check the weather forecast in seven weeks for emida,False
weather,weather in radnor township wv,False
weather,what is the weather going to be like this evening in arkansas,False
weather,is it going to get hotter in my current position,False
weather,weather for oct 16 in mo,False
weather,forecast for laguna heights barbados,False
weather,what will the weather be for hooksett,False
weather,what will the weather be in grand coteau ut at six pm ?,False
weather,what s the weather going to be like around lewis and clark trail sixteen hours from now ?,False
weather,what s the weather in south hill,False
weather,is there snowstorm in la ?,False
weather,give me the weather forecast in zimbabwe,False
weather,will there be snowfall faraway from robinson forest,False
weather,what is the weather in mascotte,False
weather,what will the humidity be in beroun on aug 26,False
weather,will it be warmer at 15 o clock in deepwater bonaire,False
weather,what is the southern shops forecast for warm temps,False
weather,i d like to see weather conditions for ennis,False
weather,will there be a snowstorm in slick or four hours from now ?,False
weather,is it warm in sierra blanca now,False
weather,how much fog is there in tarpon springs ?,False
weather,will it be cloudy by five pm in gobler jersey,False
weather,what weather is predicted for loyalhanna ?,False
weather,weather for ma in the morning,False
weather,what is the humidity in serbia,False
weather,is there going to be a depression in my current location on nov the ninth,False
weather,show me weather forecast in clontarf ky from 4 hours from now,False
weather,will it be windy at 4 pm in ny ?,False
weather,what is the pw forecast for jul 9 in robert,False
weather,what will the weather be like in 16 weeks at the ivory coast,False
weather,will there be a snowfall here in the neighboring areas?,False
weather,what is the forecast for my current place at 23 o clock,False
weather,what is the weather forecast for strong city,False
weather,give me weather information for porcupine mountains,False
weather,what s the weather forecast for oman 2 months from now ?,False
weather,what is the forecast for petersville oh,False
weather,show cloud forcast in 1 hour in ia,False
weather,what will the weather be next apr in mt ?,False
weather,will it storm in charles pinckney national historic site,False
weather,will the wind die down at my current location by supper time?,False
weather,is there a snowstorm in the forecast for el cenizo,False
weather,what s the weather in hi,False
weather,is there weather going to get chilly when i get close to new york ?,False
weather,let me get the forecast in allardt canada,False
weather,what s the weather in paulette yemen,False
weather,what will the weather be a nine in willow river state park ?,False
weather,is the weather going to be colder in gu in 11 years,False
weather,show the forecast nearby in twenty two minutes in french polynesia,False
weather,is it freezing in offerman california ?,False
weather,will there be fog not far from mexico on apr 27,False
weather,can you tell me the weather forecast for six am in grenada,False
weather,is it going to be warmer 165 days from now at nairobi national park,False
weather,tell me if it ll be freezing 333 days from now in caplinger mills florida,False
weather,weather for noon in ca,False
weather,is it forecast to be hot in greenland this winter ?,False
weather,what is the weather forecast for ridge farm new york,False
weather,what will the weather be like 1 minute from now within the same area of my current location,False
weather,is it going to be windy faraway from the valley of fire,False
weather,will there be sun in the manassas national battlefield park ?,False
weather,what was the weather in my current position last october,False
weather,will it be warm in kipp rhode island one hour and 9 seconds from now ?,False
weather,what is the mississippi for the week,False
weather,is it going to be warm here for brunch,False
weather,what is the weather doing in south carolina right now ?,False
weather,how hot will be there in kanwar lake bird sanctuary tomorrow ?,False
weather,is there any fog warning in dauset trails nature center now,False
weather,ho warm is it in arcola ?,False
weather,can you send me the weather forecast for malcom,False
weather,how warm will it be in 10 minutes,False
weather,what is the predicted weather for wells in indiana ?,False
weather,what is the orlovista forecast for midday within walking distance,False
weather,what is the weather like in the city of frewen in the country of venezuela,False
weather,will it be warm in the current place next spring,False
weather,what s the weather here on 2 7 2021,False
weather,what weather is in saint vincent and the grenadines on thursday,False
weather,will it snow on apr eighteenth 2029 in myanmar ?,False
weather,what is the weather forecast for theodore roosevelt inaugural national historic site,False
weather,will it be stormy in saint pierre and miquelon in the city of wenham,False
weather,what will the weather by close by the current position at 02 02 30 ?,False
weather,what is the forcast now in kansas,False
weather,weather for five am in osyka bhutan,False
weather,what is the forecast for assumption of mary in in for the weather depression,False
weather,is it cloudy in cuba ?,False
weather,is it warm at seven am in greenland,False
weather,how s the weather looking in pheba,False
weather,will it hail in 1 minute in toms river,False
weather,what is the forecast for march the twelfth faraway from pine mountain state resort park,False
weather,tell me when it will be chilly in chicken united kingdom,False
weather,what does it feel like in connecticut,False
weather,what s the weather here in 52 and a half weeks,False
weather,will the weather be okay in northern luzon heroes hill national park 4 and a half months from now ?,False
weather,will there be a storm faraway from chapman ranch ?,False
weather,tell me the current forecast for switzerland,False
weather,what s the weather far from jarbidge,False
weather,will it be warm in hematite ?,False
weather,what will it be like feb the twentieth in colorado,False
weather,how will the weather be in bhutto family mausoleum next autumn ?,False
weather,weather here at two pm,False
weather,what is the forecast next year in mcgee,False
weather,what is the forecast for chandler,False
weather,what kind of weather will be in va 12 years from now ?,False
weather,is there forecast to be snow in gu this summer ?,False
weather,what is the weather forecast 131 days from now in atanassow-see,False
weather,what is the fiji forecast for warm temps,False
weather,will it be sunny in corcovado indonesia ?,False
weather,what s the weather forecast near to fern creek this winter ?,False
weather,what weather will it be in battlement mesa ?,False
weather,will it colder here on 11 18 2018,False
weather,weather for 9 3 2034 at bridle trails state park,False
weather,i need the weather in hubbardston will it be chillier ?,False
weather,will it be warmer in ct,False
weather,on april 2nd what will the weather be here,False
weather,what is the weather of new jersey palisades at three hundred three days from now,False
weather,what s the forecast for tonight far from east carpathian biosphere reserve ?,False
weather,when will the weather be temperate like it is now in stansbury park in tuvalu,False
weather,what s the snowfall at noon in in,False
weather,what is the weather prediction for acworth north korea in six years,False
weather,tell me if there will be hail at tea time in nordland,False
weather,what s the weather at eleven pm in craig mountain wildlife management area,False
weather,is it supposed to be sunny here ?,False
weather,i need to know the weather at the queen elizabeth national park,False
weather,is it going to get windy today in tunisia ?,False
weather,what is the bahamas forecast for stormy weather at 07 43 21,False
weather,what s the forecast for il around tea time?,False
weather,what is the forecast for farmerville in cape verde,False
weather,can you tell me the weather conditions for patricia,False
weather,will it get hotter in zenith ct ?,False
weather,is maalaea has chillier weather,False
weather,what will the weather be in the current spot on 12 14 2023,False
weather,will it be cloudy in guadeloupe next year,False
weather,what is the weather forecast for new mexico,False
weather,what is the forecast for swain,False
weather,please give me the forecast for branton,False
weather,what s the weather forecast for seychelles ?,False
weather,what will the weather be like in 1 minute in my current position,False
weather,will it be chilly in liberty city bhutan ?,False
weather,is the forecast stormy this afternoon in maryland ?,False
weather,is there fog in new york,False
weather,what is the predicted weather for my current spot next month ?,False
weather,will it be overcast in south dakota,False
weather,is it warm in fernley ?,False
weather,will it be stormy on 4 3 2027 in new rochelle wy,False
weather,forecast for 11 am in nauru,False
weather,what will the weather be like not far from alabama on may 9 2037 ?,False
weather,what s the humidity right now in aguila,False
weather,what will the weather be in lamar ?,False
weather,will it be windy at two pm in france ?,False
weather,what is the weather forecast in the country of chile fifteen hours from now,False
weather,what s the weather in la pine,False
weather,is it going to be chilly at nine am in doolittle,False
weather,will it be colder in vermont ?,False
weather,will it be hot in dongola cameroon,False
weather,is it overcast in brazil in within walking distance,False
weather,what will the weather be like in three weeks in gates michigan,False
weather,tell me the weather forecast for my current spot on dec fourth 2021,False
weather,what s the forecast for walker bay nature reserve for next year ?,False
weather,when it comes to dukes and the district of columbia what will the weather be in one hour,False
weather,what is the eugene t mahoney state park forecast for 2 days from now,False
weather,will there be sun ten minutes from now in uintah,False
weather,what is the weather in neighboring oh,False
weather,is there a blizzard coming to el verano,False
weather,what s the weather forecast for hooven lithuania on national grandparents day ?,False
weather,can you get the weather forecast for new baden,False
weather,in hawaii will it be warmer at 3 am,False
weather,tell me the weather forecast for my current spot,False
weather,weather for coaldale arkansas,False
weather,is it going to hail in mount san jacinto state park,False
weather,will it be nice now in norway,False
weather,what s the forecast in stobo ?,False
weather,is it forecast to be chillier around texas ?,False
weather,will it be hotter in md on apr 10th ?,False
weather,is it going to be hot on oct the 8th 2020 in the neighboring greenland area,False
weather,what s the weather forecast for walsenburg vermont for july 13th ?,False
weather,what s the weather in organ pipe cactus national monument,False
weather,what is the weather going to be like in klondike gold rush national historical park on february the 28th 2034 ?,False
weather,will there be wind in loyola ?,False
weather,is it going to be colder in queen anne on mon ?,False
weather,what s the weather like today in plankinton ?,False
weather,tell me the weather for next week at cathedral state park,False
weather,will there be a storm in palm city wv ?,False
weather,weather for south williamsport,False
weather,what s the forecast for wendell ?,False
weather,is it nice now in madawaska,False
weather,will it get chillier in las lomas british virgin islands on nov the 21st ?,False
weather,what is the forecast in mer rouge and palestine,False
weather,will there be snowfall in kitlope heritage conservancy,False
weather,shoe me the forecast for bonaire this fall,False
weather,what is the weather not far from upper klamath national wildlife refuge ?,False
weather,is there snow in jan in castle dale mayotte,False
weather,how much fog is there in hahnville ?,False
weather,tell me the forecast for rogers city ms,False
weather,will the weather be stormy in aurora ?,False
weather,is it going to be nice at 6 am at chippewa lake,False
weather,what s it like in bahrain right now ?,False
weather,what is mo forecast for hotter temps in kalkaska,False
weather,is it warmer in monson u sminor outlying islands,False
weather,tell me if it will hail in kyrgyzstan,False
weather,is it forecast to be warm in doi inthanon national park ?,False
weather,what will the weather be like in 15 and a half weeks in china,False
weather,what will the weather be at ten am in fourche nv,False
weather,what s the weather forecast for 8 hours from now in cape verde ?,False
weather,what s the weather forecast in humphrey ?,False
weather,weather in selinsgrove,False
weather,what will the weather be in worthington springs ?,False
weather,will it be freezing 5 seconds from now in patmos,False
weather,is it cold ever in farristown tanzania,False
weather,what is the weather for yemen,False
weather,will it be hot in the cayman islands on november 12th 2035,False
weather,is it chillier in mint hill fm,False
weather,how cold is it in my current position ?,False
weather,what s the weather in heritage hill state historical park,False
weather,will there be s snowstorm at my current location this week,False
weather,what s the weather in mountain center,False
weather,is there any hail in monterey bay national marine sanctuary,False
weather,forecase for ohio in twenty one hours and one second,False
weather,what is the forecast this month in kosovo,False
weather,what is the forecast for papua new guinea for lunch for rainfall,False
weather,will there be a blizzard in neighboring niobrara valley preserve,False
weather,is it going to be hot in chrisman,False
weather,will it be nice here and in the same area,False
weather,what is a weather of martinique a month from now,False
weather,will it be hotter today in holtwood,False
weather,what is the forecast for dec 15 in lake woodruff national wildlife refuge,False
weather,will it get hotter around elevenses in ks ?,False
weather,what s the forecast for harper me ?,False
weather,what is the nearby forecast for here at 15 26 11,False
weather,will there be cloud action in saint bernard virgin islands,False
weather,what is the weather forecast tomorrow in french ut ?,False
weather,what will the weather be here at 07 08 00 am,False
weather,wuill it be cloudy in dickson city illinois,False
weather,what is the forecast for orienta for hotter weather,False
weather,weather in cairngorms-nationalpark close from freezing,False
weather,will it be chillier in suwannee,False
weather,how s the weather in grisdale bangladesh ?,False
weather,what s the weather far away in estonia ?,False
weather,tell me when it ll be hot in melbourne nj,False
weather,is it going to be hot in lexington-fayette,False
weather,what will the weather be like in louisiana will it be colder then now,False
weather,what s the weather forecast for mansfield ?,False
weather,how much hotter will it be 40 weeks from now in blue island north dakota ?,False
weather,what will the weather be here ?,False
weather,tell me the weather forecast for ethridge maryland,False
weather,tell me the weather forecast for september 21 2030 in palau,False
weather,will it be chilly in fiji at ten pm,False
weather,is it going to be colder in bonnie,False
weather,what s the weather forecast for the area neighboring ks this autumn ?,False
weather,will there be a lot of wind far away from here on sep the twenty-third 2021,False
weather,is it warm in albania at noon,False
weather,how cold is it in cargray argentina ?,False
weather,is there rain in afghanistan,False
weather,show weather forecast in kenya,False
weather,is it going to be stormy close to australia,False
weather,will it be stormy in ma,False
weather,what is the weather looking like in prosser on feb the 18th ?,False
weather,what is the forecast in bearmouth in virgin islands in 3 months,False
weather,tell me if it will be hotter in seven hours in doyle united states,False
weather,will the sky be overcast around jan 28 in ok ?,False
weather,will it be overcast a month from now here,False
weather,will it be rainy faraway in charleston lake provincial park in 13 hours ?,False
weather,what s the forecast for the weather at eight am in oxford ?,False
weather,will there be a blizzard next friday close in tn ?,False
weather,what is the weather like in roeland park guadeloupe ?,False
weather,what is the forecast for 6 am in aruba,False
weather,is it going to storm in ne,False
weather,what will the weather be in double oak at 12 am,False
weather,what is the idledale forecast,False
weather,is it warm in new jersey in 23 minutes and fourteen seconds,False
weather,is it warm in the current spot ?,False
weather,will it be warmer at sunrise in jeffrey city ?,False
weather,is it going to get chillier in kuwait,False
weather,will it be colder in oaklawn zambia ?,False
weather,what s the weather this month in mozambique,False
weather,is it cold in north carolina,False
weather,check the weather for kenedy vanuatu for around nine am,False
weather,show weather forecast for lewis center,False
weather,will it get hotter next year in springside nature reserve ?,False
weather,what is the weather forecast for july 20 2020 in dachigam-nationalpark,False
weather,what will the weather be in virginia ?,False
weather,is the weather freezing in ak,False
weather,i want to know the temperate from january the twentieth in brazil,False
weather,is the weather hotter in old furnace state park,False
weather,what s the weather forecast for spain ?,False
weather,what is the pw forecast for stormy weather,False
weather,what will the weather be like in india at 02 55 25 am,False
weather,will it be warm at mountainair,False
weather,what s the weather like today in sierra blanca,False
weather,what is the weather forecast for winger,False
weather,what will the weather be doing at midnight in brazil ?,False
weather,what is the forecast for here at tea time,False
weather,what will the weather be on april 9 2037 in new brunswick botanical garden ?,False
weather,will it be chilly 17 hours from now in cold creek conservation area,False
weather,is it cloudy in the same area of lynn shore reservation,False
weather,what will the weather be in mattawan saint barthélemy ?,False
weather,will it be hot two seconds from now in neighboring west clear creek wilderness,False
weather,will there be fog tonight at beamer memorial conservation area,False
weather,what s the weather two months from now in arletta malawi,False
weather,weather in nationalpark nevado tres cruces on mar 4th 2020,False
weather,is it windy in telogia,False
weather,what is the me forecast for joanna,False
weather,is it going to be freezing in lolita ?,False
weather,will the sun be out close-by admiralty island national monument ?,False
weather,what will the weather be like in port clinton nebraska around midnight ?,False
weather,will it be warm neighboring here in whitehouse ?,False
weather,what is the current weather forecast for diamondville ?,False
weather,what is the weather forecast for kaaawa,False
weather,will there be a snowstorm in nc 6 years from now,False
weather,what is the forecast on 12 9 2039 at florida caverns state park,False
weather,what is the foggy forecast for nov 15 in france in brookland terrace,False
weather,what will be the weather like in turks and caicos islands around dec sixth 2032 ?,False
weather,tell me when it ll be chillier in cavalero corner id,False
weather,what s the weather in new beaver,False
weather,is it colder in paraguay this morning,False
weather,what s the weather in singapore,False
weather,what s the weather in pugu hills forest reserve,False
weather,what s the temperature today in griffin ne ?,False
weather,what will the weather be this month in wesley hills ?,False
weather,what s the weather forecast in guadeloupe eleven weeks from now ?,False
weather,what will it feel like on patriot s day on south georgia and the south sandwich islands,False
weather,how is the weather in indian creek village ?,False
weather,will it be colder in winnebago,False
weather,what will the weather be like nine years from now in eastport el salvador,False
weather,is it going to be cold today in wing ?,False
weather,what is the weather supposed to be like on sep 20 in maltby russia,False
weather,what s the weather in dazey,False
weather,what s the weather in springside nature reserve at four pm,False
weather,please give me the weather for federated states of micronesia,False
weather,check the forecast for zena arkansas on last day of passover,False
weather,can you give me a forecast for weather at night in my current position,False
weather,is it going to be windy here on nov 17,False
weather,will it be freezing in the city of sardis,False
weather,what is the weather in port vue,False
weather,what is the cameia national park forecast for in one minute and 1 second,False
weather,what will the weather be in bayside on sep 21 2034 ?,False
weather,what is the forecast for west virginia will it be snowy,False
weather,will it be windy at 7 am in dong phou vieng national protected area,False
weather,what s the weather like in groesbeck,False
weather,is it forecast to be chilly here on july 14 ?,False
weather,what is the weather forecast for waipio acres,False
weather,will there be a depression here on october 26,False
weather,what is the weather like in texas,False
weather,will it get warmer by 5 am in washington ?,False
weather,how is the weather going to be this week in roseau ia,False
weather,forecast for serbia,False
weather,what is the forecast for mar 8th in friesland tennessee,False
weather,what is the weather forecast for papua new guinea,False
weather,what is the weather forecast for israel,False
weather,give me the weather forecast for the city of archie,False
weather,will it get warmer in holy cross wilderness,False
weather,what is the current place forecast,False
weather,what s the weather forecast in the same area of me on apr 20 ?,False
weather,what will the weather be in nm in 1 minute,False
weather,what is the weather forecast for garrison,False
weather,what is the nine am weather forecast for nationalpark midongy du sud,False
weather,what is the sri lanka forecast for snow,False
weather,what will the rainfall be in 1 second at roy lake state park,False
weather,at 7 pm what will the weather be in iceland,False
weather,how temperate will it be here this week ?,False
weather,warren island state park distant weather forecast for 11 am,False
weather,i need a forecast for zachary,False
weather,what is the forecast for january twenty-eighth in kentmore park,False
weather,is it foggy in phinizy swamp nature park ?,False
weather,what is the weather forecast in country club heights,False
weather,will it be colder in connorville,False
weather,what is the expected weather forecast for beckley ?,False
weather,will it be cold at 1 am in boon ?,False
weather,will it be cloudy in tatamy ?,False
weather,what is the forecast for next may in zambia,False
weather,will it get warmer in czechia,False
weather,how much snow will we get this week in massachusetts ?,False
weather,will there be snowfall in pacific beach suriname,False
weather,what will the weather be this year in horseshoe lake state fish and wildlife area ?,False
weather,what is the blizzard forecast for 12 06 in ms,False
weather,book a restaurant 1 hour from now in dorchester shores reservation,False
weather,at thirteen hundred hours what will the weather be on ghana ?,False
weather,how will be the weather in cotopaxi national park at breakfast time?,False
weather,is it humid in my current spot,False
weather,what is the forecast for the distant future in sugar bush,False
weather,will it snow in mt on june 13 2038 ?,False
weather,will there be sun around here ?,False
weather,what will the weather be at thirteen in nj ?,False
weather,will it hail in rush valley denmark on 6 21 2035,False
weather,what is the forecast here for september 16,False
weather,is it humid in caddo mills ky ?,False
weather,is it going to be foggy in jewell cemetery state historic site 7 weeks from now,False
weather,what s the weather like in serbia,False
weather,what is the weather forecast for sep the 14th 2038 in north dakota,False
weather,what s the forecast for right here,False
weather,can you tell me the weather forecast for samoa,False
weather,how much sun will there be at 07 03 43 pm in jones chapel ?,False
weather,what will the weather be at mu ko phetra national park on administrative professionals day,False
weather,will there be fog in fairwood ?,False
weather,what is the weather forecast for east cleveland republic of the congo,False
weather,show cold weather forecast in five hours and 1 minute in hokendauqua mongolia,False
weather,will it get colder in cape fair,False
weather,how is the weather in birta ?,False
weather,what s the weather in oregon,False
weather,check the weather for around nine in south georgia and the south sandwich islands,False
weather,what is the forecast at four am in zambia,False
weather,is it hot in wind ridge guam,False
weather,show weather forecast in west crossett luxembourg in fourteen minutes,False
