Intent,Sentence,Outlier
music,listen to tei movement from most popular eighties music,False
restaurant,id like a table for 10 at a distant place downtown for next fall,False
music,play khujo eighties track song,False
movie,what is the movie schedule for movies in the neighbourhood,False
music,i would like to hear a song by tim reynolds,False
restaurant,book osteria restaurant for 1 person in mi,False
restaurant,my step aunt and i want to go cheese fries at the tavern,False
movie,find goodrich quality theaters films,False
movie,is the clowns at the nearest cinema,False
music,play the top five songs by gad elbaz,False
music,play a sound track by tom thacker,False
music,play fifties music on deezer,False
restaurant,book me a table for seven in co-operative block building nd,False
restaurant,find a table somewhere for me and my step mother in graniteville de,False
restaurant,book a restaurant for 1 in nine weeks,False
restaurant,book a pub that serves fries for 9 people,False
music,play music by sarah connor,False
music,play a popular chant by brian epstein,False
music,play divine from vinnie roslin,False
restaurant,i would like to book a restaurant within the same area as myrtle av for 6,False
music,play music from the twenties,False
restaurant,book a table for 10 in char no4 in colombia,False
music,play fey s album diamond head on zvooq,False
movie,is the cycle playing at consolidated theatres ?,False
movie,what movies are playing dickinson theatres,False
restaurant,book a spot at a crab restaurant,False
movie,find nearby movies,False
movie,is gods of metal playing,False
restaurant,book a table in ut at kearney for 6,False
music,play music from 1954,False
movie,what is the closest movie theatre that is playing animated movies,False
music,play the album will rap over hard rock for food,False
movie,find the schedule for close by movies,False
music,play anything from the twenties,False
music,open fadl shaker on spotify and play a melody starting with the newest,False
movie,fimd films around here,False
movie,show movie times of films close by,False
restaurant,book a highly rated food court for 2 people on jul 4th,False
restaurant,book a restaurant for 5 people,False
music,open groove shark and play jason mizell,False
restaurant,book a restaurant in nebraska on january 25 2034 for me and my mommy,False
music,use service vimeo to play music from the artist mick track now we are 5,False
restaurant,please get me a reservation at a restaurant with a pool for manuela and yvonne,False
movie,find movie times for movies in the neighbourhood,False
restaurant,i need a table for 5 at the restaurant i ate at last oct,False
restaurant,book red crown tourist court now for ten not far from tin city,False
music,play concerto from 1951,False
restaurant,i need a table at the ledbury at 18 oclock,False
movie,what is the movie times,False
movie,what times is the 7 faces of dr lao showing at united paramount theatres,False
movie,what times will animated movies be showing nearby ?,False
music,please play the newest music by evil jared hasselhoff,False
music,play dj drama from the 1976,False
music,play bald by kaskade,False
movie,show me the films close by and the movie times for today,False
movie,when and where is invitation to the waltz playing,False
music,play chris goss on netflix,False
restaurant,id like a restaurant on 6 1 2027 for 5 people in iowa city,False
restaurant,book a table for my great grandfather and i at a place in booker ak,False
movie,when can i watch prince daewon at movie house ?,False
music,play a top-ten chant by kelly groucutt from 1964,False
restaurant,book a spot for 8 at the kitchin on october the 13th 2039,False
music,play a top 50 tune from the twenties by willi williams,False
movie,where is feast ii no limit playing,False
movie,what films are playing at 1 pm at showcase cinemas,False
restaurant,book a reservation for a pub with ma po tofu in moldova,False
music,i want to hear something off fist for fight by rushton moreve on youtube,False
restaurant,would like to book a restaurant the last day of sukkot for lee and ines,False
music,play murder the mountains by mana on netflix,False
music,i want to hear rock bottom by playa fly on slacker,False
restaurant,i would like reservations for cliff house in seven months for six people,False
movie,what movies are playing in the neighborhood,False
music,can you play a top 5 song by manos hadjidakis,False
music,play the new retro playlist on netflix,False
movie,where can i find paranormal activity 3 playing near me 1 hour from now,False
movie,when will third person singular number be playing?,False
movie,what s the closest movie theatre that is playing films,False
music,i want to hear some music from groove shark,False
restaurant,book a reservation for a gastropub serving liver and onions,False
restaurant,book a table for 6 in new hampshire for next week,False
music,play pandora tracks by akhtar sadmani,False
music,play the insoc ep,False
music,play chant music by pappu venugopala rao on slacker,False
restaurant,book a table for 4 at fish express,False
restaurant,we want to eat at a brasserie with sicilian food in nebraska,False
movie,find the movies and movie times in the neighbourhood,False
restaurant,book me a restaurant in the northern mariana islands,False
music,open groove shark and play sound track from dj cameo,False
music,play some retro music,False
music,play a top-50 tune from 1982,False
music,play music from the artist joe sample,False
restaurant,book a spot at a tsipouro restaurant in connecticut,False
movie,what time is adam at six a m playing,False
restaurant,i want to eat at a bakery with deidre and rosa in jersey,False
restaurant,book me a pub nine weeks from now for 4 people,False
restaurant,book a table for ten people at a restaurant that serves noodle,False
music,play music from 2015,False
music,play music from hide,False
music,play top martin solveig on deezer,False
movie,what local movie house is playing beat the drum,False
music,i wish to hear the playlist estado de ánimo on last fm,False
movie,what are the showtimes for boy of mine,False
movie,when is our story showing next at north american cinemas,False
music,play some music on netflix,False
movie,find me showtimes for a christmas story starting at eleven o clock,False
restaurant,call for a table of 3 at the tavern on the green in south farmingdale,False
music,play a top symphony sort form 1959 by stuart garrard,False
movie,what time will the closest movie house be playing mark shoots first,False
movie,find close by movie schedule movies,False
movie,please find the movie schedule for animated movies playing in the neighbourhood,False
movie,what cinema is health warning playing in eleven hours ?,False
movie,what movie theatre is playing shed no tears,False
music,play elastic love by junior marvin,False
movie,give me the schedule for getting there sweet 16 and licensed to drive,False
music,start up my independent music monday playlist,False
music,play fernando olvera,False
movie,show me movie times for one minute from now,False
movie,what s the nearest movie house showing films,False
movie,i d like to go to douglas theatre company to see in beaver valley what times will the movie be playing?,False
music,play the song waar is de zon on slacker,False
music,play a ballad from 2000,False
restaurant,i want to book a restaurantin perrytown missouri for candice jeannie and nichole,False
movie,what films are playing at marcus corporation ?,False
movie,what films are playing around here,False
restaurant,melba and i want to dine in barbados next jun,False
movie,can i get the movie schedules for landmark theatres,False
movie,where is they always return at dawn playing,False
movie,what time is high tide at noon showing,False
movie,find movies at amco entertainment starting in 8 seconds from now,False
music,please play a song off the curtis lee album rough diamonds,False
restaurant,book a bakery with smoking room for nine in niger,False
music,play the top ten by andrea del rosario,False
music,play me the track mama liked the roses,False
restaurant,book in oh in gurabo for velma and gloria,False
restaurant,book me a restaurant ten minutes from now,False
movie,show movie schedules for animated movies in the neighbourhood,False
music,i want to hear sebastian s songs from the thirties on youtube,False
music,play some theme songs from the fourties,False
restaurant,i would like a restaurant reservation for this year for 4 people,False
restaurant,book a reservation for can fabes nearby namibia,False
restaurant,book a restaurant in north dakota for my child and i on november seventh 2037,False
movie,can i get the showtimes for movies around here ?,False
restaurant,book a spot for 7 at an outdoor food court in denmark,False
movie,what time is see grace fly playing at cineplex odeon corporation,False
restaurant,book a eggo serving brasserie for ten,False
restaurant,make me a reservation somewhere outdoor in port wentworth for a party of five at a coffeehouse in ten months that is distant,False
restaurant,book a reservation for a pub with internet for 2 people,False
music,play slow rock music,False
music,play some sia furler on last fm,False
music,i want to hear the fear the boom and bust song from haruka shimotsuki off of spotify,False
music,play 1958 music on iheart,False
music,play some laurie anderson,False
movie,i want to see the local movie times,False
music,i want to hear some sixties melody from mark mcentee off of google music,False
music,play music from the seventies,False
movie,find the schedule for animated movies in the neighborhood,False
music,open groove shark and play native us,False
restaurant,book a table for 7 at a churrascaria that is highly rated,False
movie,i want to go see a simple noodle story in seventeen seconds at goodrich quality theaters,False
music,play me a song from the fourties movement,False
music,open vimeo and paly every song released in 1986,False
restaurant,book a table at a pub in china,False
movie,what are the movie times at general cinema corporation,False
restaurant,book a table for 5 people in goodland ak,False
music,play long way to go by keita tachibana,False
movie,what animated movies are showing in the neighbourhood,False
movie,what animated movies are at dipson theatres,False
music,can you play some fifties music by lavern baker,False
restaurant,id like a table for 6 at a restaurant in denmark at 22,False
music,please anything good by chieko ochi,False
restaurant,i want to eat mezes at the pub for 1 at four pm,False
restaurant,book a reservation for 4 at a bar serving corn relish,False
restaurant,i want to book a seafood bakery in le roy,False
movie,what is the movie times for general cinema corporation,False
movie,which animated movies are playing today at kb theatres ?,False
movie,i want to watch mr and mrs bridge at a nearest cinema,False
music,play chant music by david cook,False
restaurant,need to book a table downtown within walking distance of me at jg melon,False
music,i want to hear box of rain by skeets mcdonald,False
movie,give me the movie schedules for neighborhood cinema group,False
restaurant,book a cafe table for one that has internet access,False
restaurant,book a restaurant for ten in germfask,False
movie,find a movie house for kickboxer 5 – redemption,False
movie,what time is the taking of pelham 1 2 3 playing at the movie theatre,False
restaurant,book a spot for 9 at dinner in the sky in sc,False
restaurant,book the bobcat bite,False
restaurant,i want to go to the freight house in gabon,False
restaurant,book me a taverna restaurant,False
movie,what films are at century theatres in twelve hours,False
music,i d like to hear don airey s gonna raise hell,False
music,play latina,False
movie,find the flying ace,False
restaurant,book a spot for one at a fish restaurant,False
restaurant,i would like a table at a taverna with croquembouche for 1 minute from now,False
music,play some mike porcaro,False
movie,find a cineplex odeon corporation showing movies,False
restaurant,book a reservation for 4 people at a restaurant within the same area as my step daughters position,False
movie,what is the movie schedule today at neighborhood cinema group ?,False
music,play mohammed abdu from top 20,False
restaurant,id like seats for one at a restaurant in 1 hour at a place in la madera that has parking,False
movie,find movies with movie schedules in the neighborhood,False
restaurant,i need a table for 10 at the best gastropub,False
music,play music from the list indie electronics,False
restaurant,would like a table right now for leonor mendoza imogene and lisa sanchez,False
restaurant,need a table for rita antoinette and i,False
movie,can a i get the movie schedule for sympathy for the devil,False
restaurant,id like to eat in 1 minute at a neighboring neighborhood restaurant,False
movie,what movies are playing at the nearest movie house,False
restaurant,i want to find parking next to a restaurant for 10,False
music,i want to hear music from the lotus flower album by andy mccoy,False
restaurant,please book a restaurant for nine members on august 25 in dc,False
music,play the sound track by ferry corsten,False
restaurant,book tun tavern for shawna davis michelle and lizzie in vermont,False
movie,what time is hitman city playing,False
movie,what are the movie times for united paramount theatres,False
movie,show the movie schedules with animated movies around here,False
restaurant,restaurant in zambia that is close for a party of 10,False
movie,what time does the next movie play around here,False
music,play my electro sur playlist,False
movie,what time is truth about kerry playing at movie house,False
music,play the playlist grime shutdown,False
restaurant,i want a table for 4 at any kind of goiano bar,False
movie,what time is the bodyguard at malco theatres playing,False
movie,i m looking to watch savage grace at showcase cinemas at thirteen o clock,False
restaurant,find me a nice restaurant in mulvane,False
music,play solange 2016 album,False
movie,where can i watch portrait of a woman nude in 1 hour ?,False
music,play any song from 2006,False
movie,movie schedules at amc theaters,False
restaurant,i need a reservation for ten in wisconsin,False
restaurant,book a spot for 10 in the same area of inwood - 207th st,False
music,play a popular song by willie dixon on groove shark,False
movie,find time for the thirty nine steps,False
movie,what time is the crystal gazer playing at the closest cinema ?,False
restaurant,casey chavez lucinda and karina want to eat at a diner on december the 7th,False
movie,can i see movie schedules for movies this evening in the neighbourhood ?,False
music,play music from 1989 by maya,False
movie,find 16 starting time for heavenly body,False
restaurant,book a restaurant on next fall for 5,False
movie,find the schedule for project shadowchaser ii at the cinema in eighteen hours,False
music,play a fifties album on itunes,False
restaurant,i need seats for 6 at char no4 in georgia,False
music,play some nineties chant music from nicoleta nicola,False
music,play any chant from 1973,False
restaurant,courtney and ruby want to eat at a restaurant three years from now,False
restaurant,book a bar that serves ribs for 5 people,False
restaurant,book a diner place or me and my best friend on holy saturday capital of united arab emirates where they serve pepperoni dishes,False
movie,what is the nearest movie theatre playing kate y leopold ?,False
music,use deezer to play music by kimberley walsh,False
music,i want to listen to swing music on iheart,False
restaurant,book reservations at a restaurant that serves brazilian food for 9 people,False
movie,show movie schedules,False
movie,show me the movie times for animated movies that are in theaters close by,False
restaurant,book a table for 04 45 pm at a restaurant in washington,False
movie,find movie schedules for star theatres,False
music,play the birds and the bees by ceca,False
movie,what is the closest movie theatre that is playing moment to moment ?,False
movie,show me movie times for animated movies playing three hours from now in the neighbourhood,False
movie,where is the nearest movie house that is playing teaching to see,False
restaurant,i want to be main deli steak house near hendley,False
music,play me a symphony by ricky bell,False
restaurant,can you get me a table at a tavern in slovakia,False
movie,what s the nearest movie theatre showing movies,False
restaurant,i would like to book a restaurant for 9 on dec 13,False
movie,what are movie times for animated movies close by ?,False
music,play talking to the universe on itunes,False
movie,what time is soul surfer playing,False
music,open the canciones del recuerdo playlist and play songs,False
movie,list movies in the neighbourhood,False
music,please play some music from 1996,False
music,play a jack lawrence concerto,False
restaurant,please make a reservation at ten at a bakery which serves burrito,False
restaurant,please book a brasserie restaurant for eight in ireland,False
restaurant,book the dunbrody country house hotel in ne for 8 people,False
movie,i need a list of animated movies playing around here,False
restaurant,i would like to book a goan restaurant for 8,False
movie,find the movie schedule for cooper foundation,False
restaurant,book a spot for eight at a pub in new mexico,False
restaurant,book me a restaurant that serves green bean casserole for five people,False
movie,when is twentynine palms playing at plitt theatres ?,False
restaurant,restaurant in bulgaria this week party for 9 numbers,False
movie,find the nearest animated movies at a movie theatre,False
restaurant,id like a reservation for thornbury castle three hours from now in nm,False
music,play ballad music from 1958,False
restaurant,book a restaurant for 4 thats not far from ca,False
movie,when can i see we and our mountains,False
music,play me a 1958 adam yauch concerto on groove shark,False
movie,when is the great question playing at the closest movie house ?,False
restaurant,i want a table for 7 at a popular cafeteria on holy saturday in ga,False
music,play music by artist mark ashley,False
movie,show the schedule of movie unborn but forgotten,False
restaurant,i need to book a top-rated steakhouse this autumn for 1 around azerbaijan,False
music,i want to hear steven harwell from the thirties,False
movie,find quiet night in,False
restaurant,i need a table at a restaurant serving carne pizzaiola for tamra davis viola and dorothea,False
restaurant,im looking to get a seat at a brasserie in togo,False
music,play miguelito top charting album,False
movie,find the schedule for movie times for movies around here,False
movie,which animated movies are playing at fox theatres ?,False
music,play some noise music on netflix,False
music,play some alte kameraden music,False
restaurant,i want to book meriton grand hotel tallinn in new jersey for four people,False
music,play some twenties music on iheart,False
music,play theme music from 2011,False
music,open itunes and play kenny cox most popular concerto,False
restaurant,book a mexican brasserie close by woodcliff lake for a party of 7 on april 25 2026,False
restaurant,me and aisha and craving cordon bleu and need to book a table at a brasserie,False
music,play the last ep from 1999,False
music,play the newest music by gladys knight,False
music,play a ballad form 2014 by double on google music,False
movie,find the nearest movie theatre with the witness chair,False
restaurant,i want to book a popular tyrolean steakhouse in madison park wa in 1 hour nine minutes and one second,False
movie,what movies are playing at the closest cinema,False
restaurant,book a neighboring coffeehouse with internet in shingleton,False
music,play magic time by phoebus,False
restaurant,book a table for lois effie price and i for next summer in italy,False
music,play harel skaat,False
music,play me leonid soybelman on vimeo,False
movie,what animated movies are playing in the area and what is the movie schedule,False
restaurant,book a spot for 8 in hungary on february the 14th,False
music,play me a bluegrass song,False
movie,when is youth without youth being shown at the nearest movie house ?,False
movie,what is the movie schedule,False
music,please play playlist todo reggaeton,False
movie,i d like to watch all on the red at 9 o clock,False
movie,find the movie schedule at twelve am,False
restaurant,me and my father in law want go eat gratin at a restaurant,False
music,play tomorrow,False
movie,can i have the local movie times,False
restaurant,i have eight that would like to eat cretan in a cafeteria and need reservations,False
movie,which movies are playing at b&b theatres at 2 pm ?,False
movie,what films are scheduled around here ?,False
music,let me use netflix to listen to the last soundtrack from out of eden,False
music,play some gothic rock,False
music,play me a 1990 sound track,False
music,play a new song from the seventies,False
restaurant,i need seats for six at a vegan bar in london borough of enfield or the same distant in one second,False
music,play vanlose stairway by janove ottesen,False
restaurant,book a table for three at a middle eastern gastropub,False
restaurant,what is the best restaurant in kentucky for ten at 0 am,False
movie,what is the movie schedule for animated movies playing close by,False
music,start playing my disney playlist,False
movie,find a cinema showing the mandrake nearest at one o clock,False
movie,find animated movies at the nearest movie theatre,False
restaurant,book a reservation for a popular restaurant in federated states of micronesia,False
music,play clay aiken s the bonny hind on groove shark,False
restaurant,i need a reservation for four this year at a restaurant,False
music,play the last chant from the fourties,False
movie,what are the movie schedules ?,False
movie,show the movie schedules at mjr theatres,False
movie,where is the closest cinema playing i prefer the sound of the sea,False
movie,what movie theatre is showing manorama six feet under,False
restaurant,book a restaurant in fl in the city of lochearn for my step son and i,False
restaurant,book a restaurant in kamrar for midday,False
movie,show me the current movie times,False
movie,show me movie times,False
music,play fill yourself with music by ray manzarek,False
music,play my entertaining playlist,False
music,play the newest chant by john doyle on zvooq,False
restaurant,i would like reservations to a popular pub in burkina for 10 people,False
restaurant,reserve a table for 7 at a cafeteria in lafe city,False
movie,can you give me a list of films at cinemark theatres ?,False
restaurant,restaurant in south sudan for 6,False
music,play music from 2010 by jason donovan,False
restaurant,book a restaurant in donnelly,False
music,play the greatest 1966 album out there,False
music,play a 1974 sound track on vimeo,False
movie,find time for the movie schedule at cineplex odeon corporation,False
movie,whaere is bloody bloody bible camp playing in the cinema,False
music,play making out by alexander rosenbaum off google music,False
music,play signe anderson chant music that is newest,False
music,play noche de chicas playlist,False
restaurant,i need a table at a czech pub at seven,False
music,play music from the thirties,False
movie,find time for all about hash,False
movie,is the umbrellas of cherbourg playing near me?,False
movie,find movies in the neighbourhood with movie times,False
movie,find the movie times at consolidated theatres,False
movie,what time will the age of success be showing?,False
music,play a concerto from sam sparro,False
movie,find the closest films at a movie house,False
music,play alfredo zitarrosa on spotify,False
movie,show me the closest movie house that plays that night in rio,False
music,play a top fifty track from the twenties,False
restaurant,book a neighboring food truck with a spa in dallesport for 4 people,False
book,rate the current novel one points,False
book,rate the ape-man within 4,False
book,i give the penalty three stars,False
book,give 5 out of 6 points to absolutely positively not series,False
book,i give emile or on education five points,False
book,rate licence renewed a 4,False
book,a rating of 5 of 6 points goes to dickson mccunn trilogy,False
book,rate beyond the shadows 3 of 6,False
book,give 2 out of 6 points to the following textbook,False
book,rate in stars as a 6 for lord of the shadows which gets a four,False
book,rate the tropic of cancer book a 2 out of 6,False
book,i am rating this book titled the billion dollar ransom 3 stars,False
book,rate this book titled cold two stars,False
book,i want to rate this current series a value of five and a best rating of 6,False
book,rate the current book a zero of 6,False
book,i would rate this chronicle 4 stars,False
book,give a human being died that night 3 stars,False
book,i m rating the skystone with three points,False
book,rate this current saga 3 out of 6 points,False
book,rate the glory season three stars,False
book,give this textbook 5 points,False
book,give two stars to current album,False
book,rate the current saga a five,False
book,give 0 rating to she and allan book,False
book,i gave joseph andrews a 0 out of 6,False
book,i want to give this album zero out of 6 stars,False
book,swine not ? deserves four points,False
book,give the current series 3 points,False
book,the next album is only one stars,False
book,rate this book three points,False
book,rate an act of terror 2 stars,False
book,i m rating the skystone with three points,False
book,rate call for the saint 1 out 6 points,False
book,rate merlin effect a 0,False
book,give this album three out of 6 points,False
book,the last hawk gets a total of 3 out of 6 stars from me,False
book,0 stars for this textbook,False
book,i rate american history a survey a 5,False
book,give this current novel a 4,False
book,give this current novel a three,False
book,rate this textbook 2 of 6 stars,False
