Intent,Sentence,Outlier
playlist,add vikku vinayakram to my this is nicky jam,False
playlist,add brad kane to the pumping iron soundtrack,False
playlist,please add this song to indiespain list,False
playlist,add od mene se odvikavaj to my laundry,False
playlist,put lullaby of birdland onto fusion fest,False
playlist,add cream to the funk playlist,False
playlist,add take me back to dear old blighty to my dinner playlist,False
playlist,add this tune to the deep dark indie folk playlist,False
playlist,add this gisela song to my dancehall official,False
playlist,add histoire de melody nelson to my 90s baby makers playlist,False
playlist,add this tune to my road trip playlist,False
playlist,add tune to infinite indie folk,False
playlist,add album to ultra metal,False
playlist,id like to add this album to funtime,False
playlist,i want to add in the mood to my playlist called my folksy love,False
playlist,put this jerry dixon song onto my tokyo rising playlist,False
playlist,add us placers to my new boots,False
playlist,add this track by clem burke to my atmospheric black metal playlist,False
playlist,add the nastya kamenskih song to my the martin garrix show playlist,False
playlist,add artist to playlist epic gaming,False
playlist,add robin s to sxsw latin,False
playlist,put this tune onto the signed xoxo playlist,False
playlist,the enamorándose playlist needs another album,False
playlist,add song to rocksteady playlist,False
playlist,add funtwo to disco fever track,False
playlist,id like to add this album to my siesta playlist,False
playlist,for my playlist wild country add a great day for freedom,False
playlist,add ricky nelson to my classical x playist,False
playlist,add track to my playlist a sudden rainstorm,False
playlist,add to isabellas club hits this song,False
playlist,add this track to my this is thomas rhett playlist,False
playlist,add i hate myself and i want to die to my six string peacefulness,False
playlist,add yuna ito to my cena elegante playlist,False
playlist,please add jency anthony to my playlist this is mozart,False
playlist,put jtr on the top classical playlist,False
playlist,the get going playlist needs another song,False
playlist,add munia the tale to my playlist called adrenaline workout,False
playlist,add an album by twink to my classic country playlist,False
playlist,add the blurred crusade to crate diggers anonymous,False
playlist,add robyn hitchcock to my romantic evening playlist,False
playlist,add the beatles tune yesterday to my playlist the southern highway chronicles,False
playlist,add enduser song in grime instrumentals,False
playlist,add koichi sugiyama to whm,False
playlist,add little musgrave and the lady barnard to oras punk rock workout playlist,False
playlist,id like to add this tune to my spotify orchestra cello playlist,False
playlist,add riddim driven engine 54 & humanity lethas all things post,False
playlist,add nana kitade to my modern psychedelia playlist,False
playlist,add the artist to the latin jazz playlist,False
playlist,add another tune to my songs for you not your parents playlist,False
playlist,add atticus ross to the playlist electrosafari,False
playlist,add tune to my hype playlist,False
playlist,add nib to fays brooklyn beat playlist,False
playlist,insert rock me up song to my list,False
playlist,add autry inman to my hanging out and relaxing playlist,False
playlist,add the name the song about the towel to playlist piano in the background,False
playlist,add tara blaise to my power gaming playlist,False
playlist,put this song on the chips and salsa playlist,False
playlist,add to my mac n cheese playlist with tsūzetsu,False
playlist,add country favorites willie nelson style to my playlist titled spinnin records top 100,False
playlist,i would like to add something by kuk harrell to my hip hop 2017 new school playlist,False
playlist,shawn lane should be moved to my cena con amigos playlist,False
playlist,add dave carpenter to my acoustic blues playlist,False
playlist,put the artist pat monahan onto the emily dickinson playlist,False
playlist,add this song to my novedades viernes sudamérica playlist,False
playlist,add a song by szahram nazeri to my playlist called this is jennifer lopez,False
playlist,add this track to new hip hop,False
playlist,add this is status quo to teddy riley,False
playlist,add bring back my daddy to me to my playlist named might and myth power metal,False
playlist,add shangri-la to the african heat playlist,False
playlist,add best of uetoaya to wild country,False
playlist,i want to add kool keith to my chill out dinner playlist,False
playlist,add david axelrod to my futuros hits list,False
playlist,add current album to my pop gaming playlist,False
playlist,i want if i could be with you added to mellow dinner,False
playlist,add spanish castle magic to daily lift,False
playlist,add little walter to women of comedy playlist,False
playlist,put a bunky green tune into the phunkadelic playlist,False
playlist,put this tune on dancepop,False
playlist,please add a tune by kaori utatsuki to my korean osts playlist,False
playlist,add this jimmy london tune to the new waltz playlist,False
playlist,add song to orgánica,False
playlist,add bill evans to the motivation mix playlist,False
playlist,add giancarlo erra to my guitar hero live playlist,False
playlist,add this tune to my rage radio playlist,False
playlist,add bad news to highway 61 playlist,False
playlist,put this tune on my playlist technical&brutal death metal,False
playlist,add the singer barbara to my country radio playlists,False
playlist,add tatico henriquez in my playlist called bleeps & bloops,False
playlist,add ian north to my autumn lounge playlist,False
playlist,add this tune to the leche con chocolate playlist,False
playlist,add to the rock games,False
playlist,i want to add something by the artist nadine to my workday – pop playlist,False
playlist,add radhae unakku kobam aagathadi to my women of metal playlist,False
playlist,add album to my classical essentials playlist,False
playlist,please put this artist on my indie mim playlist,False
playlist,add dean martin track to metal xplorer playlist,False
playlist,put this song in the playlist trap land,False
playlist,add 3 natsu natsu mini berryz to my rock classics playlist,False
playlist,add nyoil to my this is prince playlist,False
playlist,add sp balasubrahmanyam to my rockabilly mania playlist,False
playlist,add this album to my all out 70s playlist,False
playlist,add song to zen focus playlist,False
playlist,add this tune by hart wand on this is wagner,False
playlist,add roger nichols to punk rock workout,False
playlist,include laarni lozada on endorphin rush playlist,False
playlist,add francesco de gregori to gayles women who dj playlist,False
playlist,add sarah vaughan to the spa treatment playlist,False
playlist,add the artist cho kyu hyun to funky jams,False
playlist,i want to add aprite le finestre to my playlist entitled this is earth wind & fire,False
playlist,add alexia to women of classical,False
playlist,add nina hagen to essential folk,False
playlist,add karin dreijer andersson in escapada album,False
playlist,add the big mama thornton song to cassies punk rock workout playlist,False
playlist,add artist to acoustic soul,False
playlist,add the song to my we everywhere playlist,False
playlist,can you add this tune to the night out playlist?,False
playlist,add slave to the rhythm to the playlist massive soca hits,False
playlist,add intelligence and sacrifice to skatepark punks,False
playlist,for my playlist its ok to like jazz add this tune,False
playlist,add chamberlain waits to my picnic in the park,False
playlist,can you please put this track onto my todo novedades playlist?,False
playlist,add totally stress free by bobby lord to my playlist,False
playlist,add this song to the novedades pop playlist,False
playlist,add young maylay to club hits,False
playlist,put this artist on my folk for kids playlist,False
playlist,add the album to rosannas ejercicio playlist,False
playlist,i want to add another album to the wine & dine playlist,False
playlist,add artist to novedades pop,False
playlist,add please please please let me get what i want to my crate diggers anonymous,False
playlist,add a tune in women of classical,False
playlist,add pangaea to my gold edition playlist,False
playlist,id like a new england added to classical moments in movies,False
playlist,add this artist to the this is dirty projectors playlist,False
playlist,i want to add robin hood and queen katherine to my playlist entitled genuine r&b,False
playlist,ad i should have known better to this is bb king,False
playlist,add i dreamt of a dragon to my futuros hits playlist,False
playlist,add hello central give me heaven to indie pop,False
playlist,add twin peaks fire walk with me to the night out playlist,False
playlist,add another artist to my soul bpm playlist,False
playlist,add el noi de la mare to the new waltz playlist,False
playlist,add matthew helders artist in showstopper being mary jane,False
playlist,add sweet black angel to my diarios de bicicleta playlist,False
playlist,add out of the air to my a mis niños de 30 playlist,False
playlist,can you add something by snow onto my zen focus playlist,False
playlist,add the 3rd world to my focus now,False
playlist,add a track to fusion fest,False
playlist,add this extended play to womens lit playlist,False
playlist,please add this album to the playlist titled hip hop 2017 new school,False
playlist,add a track in nike running tempo mix,False
playlist,put this song by rayvon on my all out 80s playlist,False
playlist,add album to my grandes unplugged,False
playlist,add roots of the outsiders to blues roots,False
playlist,put bring me down onto my tokyo rising playlist,False
playlist,add kevin ridel to instrumental madness,False
playlist,on leas saturday night playlist add the name d generation,False
playlist,add this song to my roadrunner rec new releases list,False
playlist,can you add something from method man to my this is mozart playlist,False
playlist,put pause on my días de frío playlist,False
playlist,add jack scott to my fantasía playlist,False
playlist,please put book of love on my ntc high intensity training tracks playlist,False
playlist,add a billy strayhorn song to my the selektor playlist,False
playlist,add stephanie biddle to my digster reggae playlist,False
playlist,put this track on soul bpm my playlist,False
playlist,add another mc chris track to my blues roots playlist,False
playlist,add people take pictures of each other to rhythm and blues playlist,False
playlist,add the song dont drink the water to my playlist,False
playlist,add git to domingo indie,False
playlist,add kaya newest track to my i love my 00s r&b playlist,False
playlist,find lesleys epic classical playlist and add this tune,False
playlist,please add the song by sunil santha to my pre-party r&b jams list,False
playlist,add come on feel the lemonheads to my salsa classics playlist,False
playlist,this track should go into my playlist called this is beethoven,False
playlist,put a xiang xiang track onto women of the blues,False
playlist,can you add a tune by natalie macmaster to my viajes playlist,False
playlist,add kansas city missouri to stress relief,False
playlist,add jarvis cocker to my chillin on a dirt road playlist,False
playlist,add artist to inas 2010s smash hits,False
playlist,put donnie g don gorilla on my classical romance playlist,False
playlist,id like for you to put this artist to my evening commute playlist,False
playlist,add tune to reggae infusions,False
playlist,my indietronic playlist needs until the end of time added,False
playlist,add the current tune to my rock gaming playlist,False
playlist,add lisa to my playlist street dance,False
playlist,add album to mellow bars,False
playlist,add an album to my list clásicos de fogata,False
playlist,the feel good indie rock playlist needs another song,False
playlist,éxitos españa playlist,False
playlist,add the track by apostolos nikolaidis to the this is luis fonsi playlist,False
playlist,can you add don moye to my pop playlist?,False
playlist,please put this artist into my lo mejor de radio 3 playlist,False
playlist,i want to put land of the dead into my big daddys booze & blues playlist,False
playlist,add zombieland to noctámbulo playlist,False
playlist,add warm and beautiful to the ironing playlist,False
playlist,put track on my synth pop list,False
playlist,please put this track onto lethas signed xoxo playlist,False
playlist,add this album to my us latin top 50 palylist,False
playlist,add arthur lee to my jazz vibes playlist,False
playlist,add priscilla to my playlist classical dance music ballet & beyond,False
playlist,add jonny buckland to my playlist weekly buzz,False
playlist,include stefanie in pre-party r&b jams,False
playlist,i want my reggae infusions playlist to have plaid retina on it,False
playlist,add artist to playlist classic punk,False
playlist,add this album to hollys bandas sonoras playlist,False
playlist,the hot house playlist needs another album,False
playlist,add this song to my classical dance music ballet & beyond list,False
playlist,add another song to daphnes retrowave outrun playlist,False
playlist,add when you come back to the jazz for loving couples playlist,False
playlist,add a track to summer of love,False
playlist,put frank farian on my deep dark indie folk playlist,False
playlist,add i’m only a man to my flow español,False
playlist,add an album by jenifer to my travelling playlist,False
playlist,add artist to my phunkadelic playlist,False
playlist,play elizeth cardoso to my nothing but a party r&b playlist,False
playlist,add aprite le finestre to my this is earth wind & fire playlist,False
playlist,please put maimi yajima s song onto operación bikini,False
playlist,can you add a eviatar banai album to my tgif playlist,False
playlist,add the ragged curtain onto the playlist called party through the decades,False
playlist,add joey fatone to my spotlight on country 2016 playlist,False
playlist,add the tune to bandas sonoras,False
playlist,add first issue to my your favorite slaughterhouse playlist,False
playlist,add natasha to my all things post playlist,False
playlist,add another album to my this is pavarotti playlist,False
playlist,add erik santos in my playlist metal xplorer,False
playlist,add artist to my trance life group,False
playlist,add the name as with gladness men of old to my ultimate 90s playlist,False
playlist,add what child is this to dark dance floors,False
playlist,put jiro in my clásicos del hip hop español playlist,False
playlist,add already over pt 2 to hip hop 2017 new school,False
playlist,i need another artist in the romántica playlist,False
playlist,add jacob hoggard to my get going playlist,False
playlist,put jazzy b on lazy chill afternoon playlist,False
playlist,the dubstep dangles dirty playlist needs digital at montreux in it,False
playlist,add a tune to clásicos del hip hop español,False
playlist,add dark days in paradise to my gym playlist,False
playlist,put this album on my wine & dine playlist,False
playlist,add tune to nusic,False
playlist,add this track to my comedy new releases,False
playlist,can 50 minute technicolor dream be added to merediths cierra la puerta playlist?,False
playlist,put mike mccready in the kitchen swagger playlist,False
playlist,add i pledge allegiance to the grind to my sinfonía hipster playlist,False
playlist,add ultimatum to my crash course playlist,False
playlist,add another track to my women of latin music playlist,False
playlist,add an andy hurley album to my transatlantic lullaby list,False
playlist,add this song to my list called the birth of cool,False
playlist,add this nozomi tsuji tune to my hot house playlist,False
playlist,add a track to my hands up playlist,False
playlist,add metal gear solid 2 sons of liberty soundtrack 2 the other side to edna st vincent millay,False
playlist,add another album to my keep calm playlist,False
playlist,include brandon paris in the metalsucks playlist,False
playlist,add artist to showstopper being mary jane,False
playlist,add apathy to my electro sur playlist,False
playlist,add chér to the still got the blues playlist,False
playlist,add this track to my rock hard playlist,False
playlist,can you put tire me onto my new music friday latin playlist?,False
playlist,add a gackt camui track to the white noise playlist,False
playlist,i want to add un jour dans notre vie to my list running to rock 170 to 190 bpm,False
playlist,put al jarreau on the concentración playlist,False
playlist,add song to my pure rock & roll,False
playlist,add song to martas endorphin rush playlist,False
playlist,add to my rumba y más playlist the song by haley scarnato,False
playlist,add janie jones to my indie pop,False
playlist,play rock this playlist with badonviller marsch,False
playlist,ad this track by isobel campbell to my folk for kids list,False
playlist,add garry shider album to my classical essentials,False
playlist,add gary lachman track to jazz for loving couples playlist,False
playlist,add this track to punk rock workout,False
playlist,add beijing huanying ni to my workday lounge playlist,False
playlist,add dj clay to my canciones del recuerdo,False
playlist,add the tune by cassie ventura to my genre bender playlist,False
playlist,put king of america onto the playlist with the title a sudden rainstorm,False
playlist,add tinker tailor to my playlist titled this is trey songz,False
playlist,add tune to my hot 50,False
playlist,add jason webley to classical intimate dinner playlist,False
playlist,add track to my peaceful piano,False
playlist,add this john tesh tune to the friendesemana playlist,False
playlist,add an album to women of hip hop,False
playlist,add the “chirping” crickets to my mellowed out gaming playlist,False
playlist,add tunnel rats to my rhythm and blues playlist,False
playlist,add a mary fahl tune to the pre-party r&b jams playlist,False
playlist,put sonntagskind onto the playlist called soulful disco,False
playlist,add my hands to travelling playlist,False
playlist,add back on the dancefloor to my bajo las estrellas playlist,False
playlist,add munawar ali khan to my mujeres y hombres y fiesta,False
playlist,add maggie mcgill to my night vibes,False
playlist,include golden boy in pop dance,False
playlist,put this dave abbruzzese tune on family road trip,False
playlist,add even serpents shine to dorotheas indie hipster playlist,False
playlist,add madlib invazion to my prog rock monsters list,False
playlist,add bone crusher to the chill out playlist,False
playlist,add this artist to my post-grunge playlist,False
playlist,add geschwisterliebe to my string theory playlist,False
playlist,add iene miene mutte to women of r&b playlist,False
playlist,add this track by del tha funkee homosapien to the playlist songs for you not your parents,False
playlist,i want this tune on my most necessary playlist,False
playlist,add d roc the executioner to my this is zezé di camargo & luciano playlist,False
playlist,add nothing can stop us to my lazy chill afternoon playlist,False
playlist,put frank farian on lydias playlist called the black power mixtape 1967 to 1975,False
playlist,add hanging on to my just dance by aftercluv playlist,False
playlist,the trapaholics needs another artist added,False
playlist,add wing track to all a cappella,False
playlist,put this album on my dubstep dangles dirty playlist,False
playlist,put dschiwan gasparjan into the cool down playlist,False
playlist,add artist to my working day,False
playlist,please add this artist to my zen focus playlist,False
playlist,add the track bg knocc out to the rapcaviar playlist,False
playlist,i want to move this album to the selektor playlist,False
playlist,add tolmatschowa schwestern to my street dance playlist,False
playlist,add the artist to my metal playlist,False
playlist,add song to trap land,False
playlist,i want do you want to build a snowman in my hip hop 2017 new school playlist,False
playlist,add this album to my mediodía acústico playlist,False
playlist,add time flies 1994-2009 to the jazzy romance playlist,False
playlist,please put david van tieghem onto my throwback party playlist,False
playlist,add lisa dalbello to my 2015 cma awards nominees list,False
playlist,i want you to add the currently playing this generation into my playlist called funtime activity,False
playlist,add night and day to my lazy chill afternoon playlist,False
playlist,add this song to my metal playlist,False
playlist,put a l lloyd on gaming anthems,False
playlist,add fuzzy logic to latin dinner,False
playlist,add the artist to my southern gothic playlist,False
playlist,put unbound into found them first for me,False
playlist,add michael hayvoronsky to lo que suena los angeles,False
playlist,i want this album on my indie alternativa playlist,False
playlist,add tune to morning rhythm playlist,False
playlist,please add george nooks to my electronow playlist,False
playlist,put another artist in my opera 100 spotify picks playlist,False
playlist,put this song on my ntc high intensity training tracks playlist,False
playlist,add tapper zukie to the all out 00s playlist,False
playlist,add tarja turunen to my lo mejor de radio 3 playlist,False
playlist,add this track to the evening commute playlist,False
playlist,add this artist to piano chill,False
playlist,put tony rombola on my novedades viernes sudamérica playlist,False
playlist,add the track to my playlist with the title showstopper being mary jane,False
playlist,add this song to clarices latino caliente playlist,False
playlist,add name me & the rhythm to my chill out music,False
playlist,add this artist to metal party,False
playlist,add the rebirth of kirk franklin to the fiesta playlist,False
playlist,add jovanotti to punk español,False
playlist,add this tune by harry connick jr to my jazz brasileiro playlist,False
playlist,add diarios de bicicleta to my la la playlist,False
playlist,add love story wa totsuzen ni to the martin garrix show playlist,False
playlist,add this piece to my spotify orchestra cello playlist colors of the wind,False
playlist,add a randy travis song to deep dark indie folk,False
playlist,add this lbc crew tune to my rock argentino vol i playlist,False
playlist,add stephanie mcintosh to i love my 90s hip hop my playlist,False
playlist,add shelby lynne to my playlist this is luis fonsi,False
playlist,add lunacy to my chill out playlist,False
playlist,please add a track from jeff mills to my hiphop hot 50 playlist,False
playlist,add this song onto my playlist entitled chill out,False
playlist,add this track to morning classical,False
playlist,add tony kakko music to street dance playlist,False
playlist,add this tune to my rockabilly mania,False
playlist,add manuelita la tortuga to my nuestros 80 playlist,False
playlist,add this album to rock en español,False
playlist,id like to add this whole album to the selektor,False
playlist,add beverley knight to my mellow beats playlist,False
playlist,add an espen lind song to my list lo que suena new york,False
playlist,add album to my french n heavy list,False
playlist,add this song to the pre-party playlist,False
playlist,add a track by bt to my independent music monday playlist,False
playlist,add the tune from leena peisa to my amor amor playlist,False
playlist,add this tune to morning commute,False
playlist,i want to add this tune by wheesung to my queen list,False
playlist,can you add a tune to my jazzy romance playlist,False
playlist,add chen jiafeng to ultimate 00s,False
playlist,put an album by max richter into my this is rosana playlist,False
playlist,i need to have pat alger s album placed onto the spotlight spain 2016 playlist,False
playlist,add no prejudice to 90s indie,False
playlist,add an artist to the décadas playlist,False
playlist,add this track to my dance workout playlist,False
playlist,add butterfly house to nu metal,False
playlist,add my belgian rose to my evening list,False
playlist,add album to virales de siempre,False
playlist,add this album to my pop playlist,False
playlist,add teddy boy to my irish folk – jigs & reels playlist,False
playlist,add this track to my party playlist,False
playlist,add a guy is a guy to the infinite indie folk playlist,False
playlist,i want another song in my rock español playlist,False
playlist,i want to add a song by jazz brasileiro,False
playlist,add ronski speed to sweet soul chillout,False
playlist,put robbie robertson into my chill out playlist,False
playlist,i want this artist on the cena elegante playlist,False
playlist,i want to put sons of the sea on the pulse of americana playlist,False
playlist,for my playlist chill add the name cater fe she,False
playlist,add track to this is zezé di camargo & luciano playlist,False
playlist,add put your hand inside the puppet head to the playlist named lazy chill afternoon,False
playlist,add the little house we built onto mucho rap,False
playlist,add artist fabri fibra to this is earth wind & fire,False
playlist,add this song to the top 100 indie tracks on spotify playlist,False
playlist,put this album in shuffle syndrome,False
playlist,put before the eulogy onto acoustic blues,False
playlist,add saxophone supremacy to ofelias calm before the storm playlist,False
playlist,add album to my piano ballads,False
playlist,put glenn stetson to my your daily routine playlis,False
playlist,add bright and breezy to my this is gucci mane playlist,False
playlist,i would like this song added to my princesas indie playlist,False
playlist,add the artist joseph meyer to my mad cool festival 2017 playlist,False
playlist,put transatlantic lullaby on sharlenes napoleon xiv playlist,False
playlist,add rakim y ken y to my gold edition playlist,False
playlist,add this artist to my pop punks not dead,False
playlist,add this artist to primavera sound 2016 barcelona,False
playlist,add track to my gold edition playlist,False
