Intent,Sentence,Outlier
weather,is there a snowstorm coming in dana at 4 pm,False
weather,tell me if there s be a depression in brazil,False
weather,is it going to blizzard at my current position,False
weather,will it be hot in amenia wi ?,False
weather,tell me the weather forecast for wy,False
weather,does wildorado have a hot temperature,False
weather,what is the weather going to be at dinner time in the lake le-aqua-na state recreation area,False
weather,will it be foggy in 1 hour and 1 minute from now in ok,False
weather,what will the weather be like in twenty two minutes at san pasqual battlefield state historic park,False
weather,will it be sunny one hundred thirty five days from now in monterey bay national marine sanctuary,False
weather,will it be warmer 1 minute from now at farmington canal state park trail,False
weather,is there a snowstorm in the forecast for saint helena ?,False
weather,what will the weather be like in fourteen hours in eastville,False
weather,what s the weather forecast ten years from now in mount victory macao ?,False
weather,can you tell me the weather forecast for denmark,False
weather,is it going to be hot in luambe-nationalpark,False
weather,will the weather be warm in the nationaal park band-e amir at twelve am ?,False
weather,what s the forecast for belize around meal time?,False
weather,can we expect cold and freezing conditions in glacier-nationalpark,False
weather,show weather forecast nearby elk city state park,False
weather,what s the weather going to be like in mi on august twenty-eighth 2033,False
weather,check the forecast for fernwood mt,False
weather,what is the forecast now in duson,False
weather,tell me when it will be warmer in my current position,False
weather,tell me if there is wind in the forecast for roaring river state park,False
weather,what s the weather forecast for my current spot ?,False
weather,how will the weather be in bettles aruba on may the tenth 2026 ?,False
weather,is it windy in nauru ?,False
weather,is it going to be sunny at five pm in chatyrkul wildlife refuge,False
weather,will there be snowfall in ky ?,False
weather,will there be a cloud in the sky in 175 days from now in golconda in vt,False
weather,what s the weather close to harmar heights this afternoon,False
weather,what s the weather like in boca raton ia,False
weather,what s the weather going to be like in angola twenty minutes from now,False
weather,will it be cloudy on sep 16 in palau,False
weather,will it be chillier in la mesa ?,False
weather,what s the weather forecast for sweden on oct the fifth ?,False
weather,is it supposed to be chilly in boiling spring lakes ?,False
weather,what does it feel like in alloway,False
weather,what will the weather be like in new glarus,False
weather,will it be colder in tallgrass prairie national preserve ?,False
weather,check the forecast for the current spot in the future oct 19 2037,False
weather,forecast for conrad,False
weather,will it get chillier in furano-ashibetsu prefectural natural park ?,False
weather,what will the weather be here on dec 25th ?,False
weather,what is the warm forecast for newburyport new caledonia,False
weather,when will it be temperate in lansford,False
weather,what will the weather be like this tuesday in the area neighboring rendezvous mountain educational state forest ?,False
weather,what s the weather forecast in nationalpark banc d’arguin ?,False
weather,what is the weather in richardson tanzania,False
weather,tell me the weather forecast for roseburg iowa,False
weather,tell me if there will be wind in ne,False
weather,is it going to be warmer in 2 years and a half in deweese ?,False
weather,what will the weather be in four weeks around tsingy de bemaraha strict nature reserve ?,False
weather,will it be stormy in charleston,False
weather,is it supposed to be chillier in favoretta,False
weather,how is the forecast for ok ?,False
weather,will it be windy at medicine rocks state park on may 24,False
weather,want to know the hot weather situation in netherlands december 4,False
weather,what will the weather be like in farmington canal state park trail,False
weather,will it be colder at five o clock at the apolobamba integrated management natural area,False
weather,tell me the weather forecast for inniswold réunion,False
weather,what s the weather in ecola state park in three minutes,False
weather,what s the weather like in forty fort,False
weather,what s the weather going to be like here at ten am,False
weather,what s the weather for this year in oregon,False
weather,will there be snowfall this month in ut,False
weather,what will the weather be at nine am in hi ?,False
weather,what will the weather be in meeres-nationalpark insel bastimentos at twelve pm ?,False
weather,is it going to be warm today at saint martin in port orford ?,False
weather,what is the weather forecast for siler city russia,False
weather,whats the temperature not far from valley of fire,False
weather,weather for four weeks from now in oregon,False
weather,will it be overcast during meal time in nh ?,False
weather,is it humid in otsego réunion,False
weather,what is the weather forecast for here,False
weather,forecast for guatemala,False
weather,weather for september seventh 2039 in salinas river national wildlife refuge,False
weather,is it overcast in bermuda,False
weather,what are the weather conditions in noel ?,False
weather,what s the weather like in topock,False
weather,will it get hotter far away in afghanistan ?,False
weather,is there a snowstorm coming to ukraine,False
weather,what will the weather be 1 minute from now in garrochales,False
weather,what is the weather like in wallis and futuna ?,False
weather,will it be chillier in portugal in one hour ?,False
weather,weather at bystrzyca valley landscape park,False
weather,can you tell me if it ll be freezing in wrightstown in seven years ?,False
weather,i d like the weather forecast in gang mills four years from now,False
weather,what is the weather of east portal ks,False
weather,what will the weather be in east new market antarctica,False
weather,will the weather be stormy on january the 15th 2026 in the federated states of micronesia,False
weather,will it get cold in nationalpark mu ko phetra ?,False
weather,will it be overcast in luxembourg in fourteen seconds,False
weather,what s the weather forecast for crystal lake park ?,False
weather,what s the weather like in big delta,False
weather,is it supposed to be hotter today in il,False
weather,please let me know the weather forecast in louisiana state,False
weather,what is the weather like in ia in april,False
weather,at 0 am what will the weather be here,False
weather,will there be cloud coverage in verdery myanmar,False
weather,will it get warmer in centenary around the evening ?,False
weather,what will the weather be in waverly city brazil on purple heart day ?,False
weather,tell me the weather forecast for apr twenty-fourth 2028 in san diego,False
weather,is it due to rain in mh ?,False
weather,what is the weather forecast in spaulding morocco,False
weather,what s the weather in blackman jordan,False
weather,what is the weather like in cameroon,False
weather,is it forecast to be cold in wisconsin ?,False
weather,is it forecast to be freezing in benedict ?,False
weather,will it be warmer at 2 pm at the ak-suu complex nature reserve,False
weather,how is the weather right now at my current place ?,False
weather,weather for notasulga at elevenses,False
weather,will it be freezing on 4 20 2038 in american beach nc,False
weather,what are the weather conditions going to be like in manhasset vermont on dec the 6th 2036 ?,False
weather,what will the weather be in wakarusa,False
weather,what is it like on 7 10 2023 in the current place,False
weather,what is the cloud coverage in my current place,False
weather,will it be overcast at night in kenmore fl ?,False
weather,weather in grey eagle on feb fifteenth 2034,False
weather,is it cloudy in vermont on 06 30 26 pm,False
weather,i need the forecast for close by becharof national wildlife refuge in nine months,False
weather,what will the weather be like here on dec 8 2019,False
weather,will there be snowfall in coxs mills vatican ?,False
weather,what aree the weather conditions not far from poneto,False
weather,will it snow in granbury ?,False
weather,please let me know the weather forecast in louisiana state,False
weather,can you give me weather details for my current spot,False
weather,what is the weather like in montchanin nv,False
weather,what s the weather in piperton rwanda,False
weather,what is the weather forecast for nassau bay uzbekistan,False
weather,what will the the weather be like close to bailey s crossroads at 05 00 34 am ?,False
weather,tell me the weather forecast for carmichaels gambia at one am,False
weather,give me the forecast for here on february the sixteenth 2022,False
weather,when will it be chillier than now in south paris in ct,False
weather,what is the weather like now in ak,False
weather,what s the weather going tbe twenty three minutes from now in federico albert national reserve,False
weather,what will it be like in six pm at the current place,False
weather,is saint robert hotter than turkmenistan,False
weather,will it hail in 1 second on riceboro delaware,False
weather,will there be rainfall four weeks from now in tehama bahamas,False
weather,what is the weather forecast for wa on september 11 2021,False
weather,tell me if it ll be humid at eighteen o clock in my current spot,False
weather,will there be rain next year in new hampshire ?,False
weather,what is the forecast for lille in norway,False
weather,what is the weather forecast for wolin national park three seconds from now,False
weather,will the weather be cloudy at 0 pm at my current position,False
weather,how temperate is it in lopeno thailand ?,False
weather,what s the weather in my current spot the day after tomorrow,False
weather,what s it like in my current location,False
weather,what s the weather forecast for my current spot in eight hours ?,False
weather,is it going to be foggy at two am in barberville,False
weather,is it going to be sunny at 21 o clock close-by district of columbia ?,False
weather,will the weather be temperate on jan the thirteenth 2028 at christmas island ?,False
weather,give me slovakia s weather forecast for eight am,False
weather,what is the weather forecast in langdon,False
weather,what is the weather forecast for cistern,False
weather,will it be snowy at the current position by march 3 ?,False
weather,will there be rainfall at one pm in catahoula,False
weather,check the weather forecast for pineridge,False
weather,is it supposed to rain nearby my current location at 0 o clock ?,False
weather,will there be a blizzard in kettleman city today,False
weather,tell me the weather forecast for alexander sd,False
weather,what is the new caledonia forecast for bagnell on sep the 5th,False
weather,hows the weather looking for kendall green maryland,False
weather,will there be any snowfall in american samoa,False
weather,is there a lot of sun in qatar ?,False
weather,what s the weather in the u svirgin islands,False
weather,what will the weather be like at eight pm in bon air uruguay,False
weather,what s the weather in guatemala,False
weather,will there be rain today in greece,False
weather,what is the forecast for hot temps in ocean park,False
weather,is it hot in the current location ?,False
weather,on jan the twentieth what will it feel like in ct or the area not far from it,False
weather,is there snow in the district of columbia,False
weather,what is the forecast for in 1 second at monte sereno for freezing temps,False
weather,what s the weather next week in standard city,False
playlist,add another song to the cita romántica playlist,False
playlist,add clem burke in my playlist pre-party r&b jams,False
playlist,add live from aragon ballroom to trapeo,False
playlist,add unite and win to my night out,False
playlist,add track to my digster future hits,False
playlist,add the piano bar to my cindy wilson,False
playlist,add spanish harlem incident to cleaning the house,False
playlist,add the greyest of blue skies in indie español my playlist,False
playlist,add album radar latino,False
playlist,add tranquility to the latin pop rising playlist,False
playlist,add album to my fairy tales,False
playlist,i need another artist in the new indie mix playlist,False
playlist,add to playlist i love my neo soul the name national treasure book of secrets,False
playlist,add the fire and the wind to my digster future hits playlist,False
playlist,add children of telepathic experiences to the playlist named baladas románticas,False
playlist,add 9th inning to my bossa nova dinner playlist,False
playlist,add always to denas baroque 50 spotify picks playlist,False
playlist,add song to sleepytime,False
playlist,add an album to my list la mejor música dance 2017,False
playlist,add hey johnnie cope are ye waking yet to year in metal 2016 playlist,False
playlist,add the album to the psychedelic rock playlist,False
playlist,can you add esquivando charcos to my playlist entitled the piano bar,False
playlist,add wiktor coj to the sleep playlist,False
playlist,incorporate time warp into my fairy tales playlist,False
playlist,add tune to my playlist eletro br,False
playlist,add this tune to my dinnertime acoustics list,False
playlist,add monsters this is prince playlist,False
playlist,add a tune in chill vibes,False
playlist,can you add a track to my spain top 50 playlist,False
playlist,add ross the boss to lauries listas de éxitos list,False
playlist,add some beatmaster v to the this is nicky jam playlist,False
playlist,add eef barzelay to my country coffeehouse,False
playlist,add this artist to queen playlist,False
playlist,add olga souza to virginias femme fatale playlist,False
playlist,add an album by m g sreekumar to my laidback acoustic playlist,False
playlist,add this album to my spotify orchestra cello playlist,False
playlist,i want to put goldy mcjohn on my rock party playlist,False
playlist,add this song to noreens fresh finds six strings,False
playlist,a shawnna to the warm hearts feel good playlist,False
playlist,add this tune to rock save the queen,False
playlist,add this david cole track to my totally stress free,False
playlist,add progress to my clásica para todos playlist,False
playlist,add the artist to my this is mozart playlist,False
playlist,add this track to downtempo beats,False
playlist,add feel the passion to my this is kudai playlist,False
playlist,put this artist in pachangueo total,False
playlist,add vl mike to my dcode2016 playlist,False
playlist,add how to my week end playlist,False
playlist,add norma jean to my pure rock & roll playlist,False
playlist,add kirk hammett to calm down,False
playlist,add on with the show to my beast mode playlist,False
playlist,add kjetil vidar haraldstad to listas de éxitos,False
playlist,can you add xanadu to latin alternative music,False
playlist,can you put this track onto the playlist the selektor ?,False
playlist,add the album the martin garrix show to my playlist,False
playlist,add gina schock to workout twerkout,False
playlist,add this tune to cristinas endorphin rush playlist,False
playlist,add ik tara to laundry playlst,False
playlist,add this tune to this is nicky jam,False
playlist,can you add something by the artist paul cargnello to my chill tracks playlist,False
playlist,add runaljod gap var ginnunga to ashlees playlist titled forever country,False
playlist,put the orange and the green on los 40 radio Éxitos,False
playlist,add an album by liza oumarova to the steampunk playlist,False
playlist,please add a song to iness playlist called metal party,False
playlist,can you add blood on the face to the playlist called heartland country,False
playlist,the spring classical playlist needs partners in crime added to it,False
playlist,add written in red to my cleaning the house playlist,False
playlist,add album to feeling blue,False
playlist,i want to put another album into the a peaceful rush hour playlist,False
playlist,open my acoustic concentration playlist and play an entire album,False
playlist,add sonntag to my assassins creed,False
playlist,i want more francis healy in the rockin vibes playlist,False
playlist,add gareth gates to my autumn playlist,False
playlist,add tune to sxsw fresh playlist,False
playlist,add this tune to my playlist titled uncharted 4 nathan drake,False
playlist,add 100% te ljubam to the hit remix playlist,False
playlist,put this album on totally alternative,False
playlist,put this album into beckys infinite indie folk playlist,False
playlist,add the artist ruby to my digging now list,False
playlist,add this track to the classical music for smart kids playlist,False
playlist,add an album to corinnes beast mode playlist,False
playlist,include the album by arthur rhames in urban poet,False
playlist,i need to add to the all things post starting with my favorites from the silence,False
playlist,add nothing fancy to meditate to sounds of nature playlist,False
playlist,add ernie hawkins to the dubstep playlist,False
playlist,add the spine surfs alone to my playlist called the funny thing about football is,False
playlist,add ajoy chakrabarty to women of country playlist,False
playlist,can you add some disco to my playlist called genuine r&b,False
playlist,add as i was going to st ives to the fantasía playlist,False
playlist,put paula abdul on musica española 2017,False
playlist,add the entity por una cabeza to my playlist forever alone,False
playlist,add track to afternoon train ride,False
playlist,add silver apples to teh sin estrés playlist,False
playlist,please add this song to my llegando a casa palylist,False
playlist,add the song to the martin garrix show playlist,False
playlist,add more david wolfenberger to my duetos playlist,False
playlist,add gregg bissonette to my us latin top 50 playlist,False
playlist,add track 70s smash hits to my,False
playlist,add this album to my blues playlist,False
playlist,i want this song on the playlist called chill vibes,False
playlist,add this adam clayton tune to sxsw fresh playlist,False
playlist,add this teddy charles album to this is pavarotti my playlist,False
playlist,add an album to playlist emily dickinson,False
playlist,i want to add this song to my infantil playlist,False
playlist,add vera to my 80s jam session playlist,False
playlist,add this track to my epic wall of sound playlist,False
playlist,add michael lepond to electronic bliss,False
playlist,add angela au to the playlist radar latino,False
playlist,add artist abdel halim hafez to my conexiones playlist,False
playlist,add track to this is puccini,False
playlist,i need to add a song to my lo que suena new york playlist,False
playlist,add this artist to this is rosana,False
playlist,add joelia savitsjeva in 88 keys,False
playlist,add alain caron to my travelling playlist,False
playlist,add steve jordan to inezs tgif,False
playlist,add to my playlist all funked up this track,False
playlist,add this artist named prince to the playlist all new all now,False
playlist,add billy strayhorn to my highway 61 playlist,False
playlist,add ramble on to halloween teens,False
playlist,add this song to rock party,False
playlist,i want to add lady maisry to my playlist lo que suena new york,False
playlist,i want to add an album to noreens endorphin rush playlist,False
playlist,add famous to my playlist lo que suena new york,False
playlist,add shawn camp to my soulful disco playlist,False
playlist,add hold my liquor to electronow,False
playlist,add tobias sammet to my bring back the 90s list,False
playlist,add jack be nimble to my reggae bombastic list,False
playlist,add jan smit in endorphin rush,False
playlist,add rupee to my ultra metal playlist,False
playlist,please add liberty forever to the road trip playlist,False
playlist,add this jane olivor track to my the sleep machine waterscapes,False
playlist,i would like this artist on drum & breaks,False
playlist,include dschiwan gasparjan in beths rare groove playlist,False
playlist,id like to add the artist jesper kyd onto my fresh electronic playlist,False
playlist,add joplin in concert to my feel good dinner,False
playlist,add harry j to my dubstep dangles dirty,False
playlist,add this artist to my this is philip glass playlist,False
playlist,i want to put look to you on the playlist named 80s classic hits,False
playlist,add track to hit remix,False
playlist,add ali lohan songs in club hits,False
playlist,add a track from the edge to my funk soul disco playlist,False
playlist,add hold tight to my throwback party,False
playlist,add tune to atmospheric black metal playlist,False
playlist,add turk to the deep house playlist,False
playlist,add the artist to the 90s baby makers playlist,False
playlist,add darkest angels to my sos 48 2016,False
playlist,please put another tune into the laundry playlist,False
playlist,add global underground 006 sydney to my best metal of the new millennium,False
playlist,add bslade to women of k-pop playlist,False
playlist,add a bill deasy track to the conexiones playlist,False
playlist,add j j cale to my heavy gamer playlist,False
playlist,add country nights by a journal of the plague year to playlist,False
playlist,add ian gillan to my rock party,False
playlist,add paul young to my retrovisor,False
playlist,add viktor tsoi to my sweet soul chillout playlist,False
playlist,i want glam added to the ntc gym strong playlist,False
playlist,add this ricardo villalobos track to under the surface,False
playlist,i want to add a song by w c clark to my nerding around playlist,False
playlist,add connee boswell to the relaxing playlist,False
playlist,add nicole mitchell to my soul revived list,False
playlist,put frank portman in my playlist good music,False
playlist,put this track from the edge on my funk soul disco playlist,False
playlist,add a jang nara track to the hip hop gaming playlist,False
playlist,put this whole album on the playlist called old school metal,False
playlist,add de principii evangelikum to my domingo indie palylist,False
playlist,add back at the velvet lounge to my cleaning playlist,False
playlist,add hemanta kumar mukhopadhyay album in funky jams,False
playlist,add song to my pop brasil,False
playlist,please add ruud jolie to my playlist guest list polygon,False
playlist,put this agent m tune onto de cantautor español,False
playlist,add this tune by kurt james to the playlist latin pop classics,False
playlist,include when i paint my masterpiece in my acoustic spring playlist,False
playlist,add ths album to my pachangueo total,False
playlist,add repent replenish repeat to classical moments in movies,False
playlist,add this song to this is no te va gustar playlist,False
playlist,add 157 riverside avenue to leticias animal humor playlist,False
playlist,add tune to composer weekly pauline oliveros playlist,False
playlist,add stuck on nothing to my sax and the city playlist,False
playlist,add an album in my playlist in the name of blues,False
playlist,put united abominations onto my rare groove playlist,False
playlist,i want to add a song by w c clark to my nerding around playlist,False
playlist,add a shot at glory to calm before the storm,False
playlist,add this artist to the playlist called fusion fest,False
playlist,add song to my mellow beats list,False
playlist,add don and sherri to the electrosafari playlist,False
playlist,can you put a song by jessica mauboy on my playlist entitled a sudden rainstorm,False
playlist,add a song to in residence metal hammer episode 6,False
playlist,add the stars and stripes forever to the soulful disco playlist,False
playlist,add beijing huanying ni to my workday lounge playlist,False
playlist,i want to add a track to my evening groove playlist,False
playlist,add how to sos 48 2016 playlist,False
playlist,can you put dj kay slay onto the 2010 decade playlist?,False
playlist,add fabri fibra to evening acoustic,False
playlist,add the unraveling to marinas playlist its a southern thing,False
playlist,add paul franklin to my the bachelor party,False
playlist,please add a track by david freiberg to my workout playlist,False
playlist,add this artist to my feel good dinner playlist,False
playlist,add vintage 74 to my mothers primavera sound 2016 barcelona playlist,False
playlist,add an album by cowboy troy to my piano in the background playlist,False
playlist,add hatfield and the north to my hot house playlist,False
playlist,add tour generación rbd en vivo to the roadrunner rec new releases playlist,False
playlist,i want global top 50 to have marit bergman added to it,False
playlist,add the block brochure welcome to the soil 6 onto my café con leche list,False
playlist,add paul wright album to 90s smash hits playlist,False
playlist,add an artist to my playlist this is verdi,False
playlist,add a tune to the this is animal collective playlist,False
playlist,add the album by cham to my cloud rap playlist,False
playlist,add atticus ross to the electrosafari playlist,False
playlist,add this artist to spain top 50,False
playlist,put some frank ferrer into my edna st vincent millay playlist,False
playlist,add chas chandler to my aux cord privileges,False
playlist,put kan mikami on pre-party r&b jams,False
playlist,put any andrew hurley album onto timeless love songs,False
playlist,add be yourself tonight to i love my 90s hip hop,False
playlist,add track to my las canciones más lindas del mundo playlist,False
playlist,add this roy orbison song onto women of comedy,False
playlist,add artist to laundry,False
playlist,add track to my cloud rap,False
playlist,add this song to my playlist under funky jams,False
playlist,add mary wells sings my guy to the electro sur playlist,False
playlist,add tune to soft rock playlist,False
playlist,add d-day dodgers to my running power playlist,False
playlist,i want a song by john schlitt in the bajo las estrellas playlist,False
