Intent,Sentence,Outlier
movie,in the neighbourhood find movies with movie times,False
movie,is i was an american spy playing at 11 a m at southern theatres,False
music,play a song off ian stuart donaldson s nature nurture album on itunes,False
movie,list movie schedules for movies playing close by,False
movie,find meal time movie times close by for movies,False
music,i d like to play the top ten mickdeth on google music,False
movie,i d like to watch dirty laundry at the movie house,False
movie,which animated movies are playing in the neighbourhood and when?,False
movie,show the animated movies playing at consolidated theatres,False
movie,what is the movie schedule for the pacific theatres,False
movie,i d like to watch the wedding ring at the movie theatre,False
music,open lastfm and play a voluntad del cielo from wax,False
music,play symphony music from joe dolce,False
music,play playlist a mis niños de 30,False
movie,where the the housemaid playing and when,False
music,please play kabhi jo baadal barse by ruth lorenzo,False
movie,when are animated movies playing at goodrich quality theaters,False
movie,find the movie schedule for animated movies close by,False
music,play a chaos of desire from dan snaith,False
movie,what time can i see older office lady using her seductive tongue at star theatres,False
movie,when is scaramouche playing?,False
music,play track real talk,False
music,play me a 1974 tune on slacker,False
music,please play some bill evans music,False
music,listen to westbam alumb allergic on google music,False
movie,find the schedule for the nightmare six hours from now at the nearest cinema,False
music,i want to hear gloryhole from mani off of lastfm,False
movie,what time is southern theatres showing ukraine is not a brothel ?,False
music,play me a song by stephen jones,False
music,please play some black metal music,False
music,play suite sudarmoricaine by afi on itunes,False
movie,what time is trouble every day playing,False
movie,is dishyum at the cinema,False
music,play me sun ra songs from the fifties,False
music,play lastfm by steampunk,False
music,play wanted by erykah badu,False
music,can you play the greatest sarah brightman song,False
movie,i d like to watch the freckled fish at 00 47 43 at magic johnson theatres,False
movie,tell me what movies are showing at seven am at the closest movie house,False
movie,find plitt theatres showing animated movies,False
music,play rap album one by gene vincent,False
music,turn on last fm to listen to chara ballad from 1988,False
movie,can i get the movie schedules for southern theatres at around 15 02,False
music,play some best selling rave songs,False
music,play some movement from 1959 on deezer,False
movie,find me the movie schedules at fox theatres,False
movie,what time is sundown the vampire in retreat showing,False
movie,what time is mighty morphin power rangers the movie at magic johnson theatres ?,False
movie,find the movie schedule for the cineplex odeon corporation,False
movie,find close by films with a movie schedule,False
music,play me the dinner playlist,False
music,play music from the top-5 from artist kenia arias,False
music,use google music to play some songs by dr john,False
music,play some synthpop,False
music,play my madrugando playlist on groove shark,False
movie,list all the movies playing in the area now,False
movie,what time is are movies at the closest movie theatre,False
music,play the soundtrack that tom bellamy contributed to,False
movie,i want to see dead calm at the closest cinema,False
movie,can i get the movie schedules for landmark theatres,False
music,play an masaki aiba tune,False
movie,find the movie schedule for animated movies in the area,False
movie,find a movie schedule for 12 hours from now,False
music,play hanging in the balance by nik kershaw on zvooq,False
music,listen to pmd symphony,False
movie,find the movie schedule for marcus corporation,False
movie,i d like to know what films are scheduled at alamo drafthouse cinema,False
movie,find the nearest movie house that s showing movies,False
movie,what are the movie schedules at the imax corporation,False
movie,find movie times for animated movies in the area,False
movie,find the movie schedule for dipson theatres,False
movie,give me the showtimes for down where the buffalo go at amco entertainment,False
music,can you play deezer from 2007 ?,False
movie,is the suicide shop playing at southern theatres,False
music,play march of the soviet tankmen from gloria gaither,False
music,play music from 2016,False
music,open youtube and play nanana from massimo altomare,False
movie,what time is american gun playing,False
music,play yung joc on slacker,False
music,please play got the time,False
music,wish to hear music from the year 1996,False
music,open lastfm play top hits of simon webbe,False
movie,what is the movie schedule for the north american cinemas,False
music,play the top song by jack grisham,False
movie,find me the movie times,False
movie,find a consolidated theatres showing the good old naughty days,False
movie,what are the movie schedules at arclight hollywood,False
movie,where can i watch chaos and desire ?,False
music,play the most popular ep by marcel khalife on netflix,False
movie,what is the movie schedule at mjr theatres ?,False
music,play music by cass elliot,False
movie,where is my dearest enemy playing,False
movie,find a movie theatre with intersections that is nearest,False
movie,what time does military history of african americans play,False
music,play martha my dear by shannon,False
music,play some music from 1989 by sanjeev abhyankar,False
music,play the last track by shavo odadjian,False
music,play some music from the thirties,False
movie,i d like to see movie times at santikos theatres,False
music,play some kansas joe mccoy,False
music,play music from 1958,False
music,play midnight special,False
music,play a 1983 ballad on groove shark,False
music,play vic ruggiero music from 2007,False
music,play lukasz gottwald album on zvooq,False
movie,show me the movie schedule,False
movie,where is mother and child plkaying,False
music,play album from maureen mcgovern,False
movie,which cinemark theatres is playing a is for atom ?,False
music,play the best songs by jes brieden,False
music,play artist stu davis from the album dub chamber 3 on netflix,False
movie,find belle of the yukon,False
movie,can i get the showtimes for films in the area,False
movie,find the schedule for the tooth will out at sunrise,False
music,play a song off the best of siouxsie & the banshees by faustino oramas,False
movie,find the panic in needle park,False
movie,i d like to watch movies close by,False
movie,where can i watch willy wonka & the chocolate factory,False
music,play tuomas holopainen s the 21 project,False
music,play laura love songs from 1959,False
movie,can i get the movie times,False
movie,show me the schedule of movie times in dipson theatres,False
movie,is happy ghost iii at caribbean cinemas,False
movie,i d like to watch monk comes down the mountain,False
movie,is sheikh chilli playing,False
movie,can i get the showtimes for the kitchen toto at cineplex odeon corporation,False
music,play steve harris false gestures for a devious public album,False
music,play me the greatest track of 1966,False
movie,showings for animated movies in the area,False
music,play music by deenanath mangeshkar,False
music,play the top-twenty from alexander braginsky,False
music,play all the way my savior leads me on spotify,False
music,play some soul music,False
music,play me a seventies song,False
music,play my piano ballads playlist,False
music,play roy orbison tunes now,False
music,play a soundtrack by mike hindert on spotify,False
music,play stereo by jonathan davis on deezer,False
movie,what time is the message playing at loews cineplex ?,False
movie,find the movie schedule for animated movies in the neighbourhood,False
music,play the last 1957 movement,False
music,play the album sauna on zvooq,False
music,play red barchetta by blind lemon jefferson,False
music,play oliver cheatham s symphony from the thirties,False
music,i want to hear music on itunes,False
movie,show me the schedule of movie the duchess of langeais in cinema,False
music,play slow rock music on vimeo,False
music,play me something from the thirties by candi staton on vimeo,False
movie,what are the movie schedule for the movies in the neighborhood,False
music,play slacker tunes by smog from movement in 2015,False
movie,i d like to watch movies at the closest movie theatre,False
movie,what movies are playing at regal entertainment group,False
music,play the new music from wilko johnson,False
music,play noctámbulo pl,False
movie,show the nearest movie house with the expendables starting 1 minute from now,False
movie,where and when is douglas playing?,False
music,play itunes album mondovisione,False
movie,what animated movies are playing at imax corporation,False
music,play fifties music on slacker,False
music,play the last 1954 ep by povel ramel,False
music,please play short and sweet by teyana taylor from my itunes,False
music,play some music from 1995,False
music,play the album have another ball,False
movie,find the closest cinema for films,False
music,play me a song from 2016,False
movie,what cinema is playing the white stadium ?,False
music,play some seventies dj colette,False
movie,find animated movies nearby,False
movie,please check whether any animated movies will be running in the area around 04 34 15 pm,False
movie,show movies in the neighborhood,False
music,play 1966 theme music on slacker,False
music,play some rap on pandora,False
music,play sixties on spotify,False
movie,when is good will evil playing at loews cineplex entertainment,False
music,play twenties on groove shark,False
music,play the top twenty movement songs from roberto valverde,False
music,play a scott lafaro soundtrack,False
movie,where is the country bears playing,False
music,play some dream music,False
movie,is the right to strike playing at star theatres,False
music,play some sister rosetta tharpe songs from the eighties,False
movie,is the start eim 23 hours twenty one minutes and one second from now for morgan – a suitable case for treatment at santikos theatres,False
movie,where is the man with a cross playing,False
movie,find the schedule for nearby animated movies,False
movie,find regal entertainment group animated movies,False
music,can you pull up a track on zvooq by graham mcpherson,False
music,play a sixties track by noam pikelny on iheart,False
movie,show me the schedule of films close by,False
movie,i d like to watch films at the nearest cinema at 8 am,False
movie,what are the movie schedules for animated movies close by,False
movie,what cinema is playing the edge,False
movie,movie times at cooper foundation for sunset,False
movie,can i get the the showtimes for the jade faced assassin cinema ?,False
movie,what s the closest movie house that s showing animated movies ?,False
movie,find a movie schedule in the neighborhood for animated movies,False
music,play turbulence wild streetdanz from jeff buckley,False
movie,can i get the showtimes for films at malco theatres,False
music,on deezer play fourties tunes by jona bechtolt and a ballad,False
music,listen to acapella,False
movie,find secret command,False
music,play drum & bass music,False
movie,what is the movie schedule of animated movies nearby,False
music,play miami 2017 by rodney whitaker,False
movie,is the little irish girl playing,False
movie,what animated movies are playing at dipson theatres ?,False
music,play the greatest soundtrack by nhat son on last fm,False
music,play music by paul mccartney,False
music,play music from the year 1979,False
movie,give me the showtime for bobby yeah playing at the cinema,False
music,do you have something like impossible is nothing by abderrahmane abdelli ?,False
movie,can you pull up a movie schedule for me?,False
music,play shoo on iheart from greatest record,False
movie,what is the nearest movie house playing black scorpion,False
movie,look up the movie schedule,False
music,play adieu by al arsenault,False
music,play the tune by adam yauch,False
movie,where can i watch key to the city,False
movie,what films are showing nearby,False
music,play some john oates on youtube,False
music,play some rumba africana,False
music,play my masters of metal playlist on spotify,False
movie,whats the closest movie house showing medal of honor,False
music,play short walk on a long pier on slacker,False
music,play the greatest nicholaus arson concerto from around 2000,False
movie,find the movie schedule at malco theatres,False
music,play me a 1986 jim root,False
movie,find the schedule for to shoot an elephant at the nearest movie theatre,False
music,play the music of aphex twin s good album,False
movie,give me a list of films that play in the neighbourhood,False
music,use groove shark to play the today and tomorrow album,False
movie,which movies are playing at the closest cinema ?,False
music,play a track by yui on vimeo,False
music,play some movement by dj spinna,False
music,play music from 2012 on google music,False
music,i want to hear a full album on youtube by jem godfrey,False
music,i d like to listen to tom cochrane s 1990 ep on zvooq,False
music,play some happy gabber,False
music,play a melody by adassa from the twenties,False
music,play the album pressure cracks with netflix,False
music,use iheart to listen to retro,False
movie,what is the closest cinema today playing animated movies ?,False
movie,where can i find the movie schedules ?,False
music,play a top fifty ballad by linda strawberry on google music,False
movie,is thenaruvi playing at the douglas theatre company in one hour ?,False
music,play me some folklore music,False
movie,what theater is showing from paris with love and when?,False
movie,find the schedule for the cup winner at the closest movie house,False
music,play music from 2000 on spotify,False
movie,what time is tom y jerry showing at alamo drafthouse cinema,False
movie,show movie schedules close by movies,False
movie,what movies are playing at cobb theatres,False
movie,what time is company men showing,False
movie,what time is dive bomber playing,False
music,play fifties music by ahmed abdul malik,False
movie,find warren theatres films,False
movie,which animated movies are playing at the nearest movie house ?,False
music,play some prabha atre,False
music,play rob mills album the golden archipelago,False
movie,can you let me know when talk of the devil is playing at the movie theatre ?,False
movie,find the schedule for evening clothes in 1 second,False
movie,what is the nearest movie theatre playing the collaborators,False
movie,find the movie schedules for animated movies in the neighbourhood,False
movie,what is the movie schedule for the b&b theatres,False
music,i want to hear a symphony from kano,False
music,play elysium from ryan cayabyab,False
movie,what time is twin peaks fire walk with me showing,False
music,play a seventies tom thacker ballad,False
music,play something by daisy voisin on google music,False
music,play music by damien rice,False
movie,what are the movie schedules for movies showing in the neighbourhood ?,False
movie,find time for movie times now,False
music,can you play some synthpop music on youtube,False
movie,i want to watch fist of the north star 1 minute from now,False
music,play a 2006 chant,False
movie,find time for the movie schedule,False
music,play the red room sessions from chris cunningham,False
movie,what s the movie schedules for magic johnson theatres,False
music,play any song from the eighties,False
music,play some music by mutlu,False
movie,what time is unholy women playing?,False
music,play a seventies ballad by annunzio paolo mantovani on groove shark,False
movie,what time are movies showing at megaplex theatres,False
music,play the view from the afternoon by malese jow on last fm,False
movie,are any animated movies playing at magic johnson theatres ?,False
movie,find the nearest movie theatre for animated movies,False
music,play me a song from the fourties,False
music,play instrumental pop,False
movie,i need to see some movie schedules,False
movie,what time are the animated movies playing at mann theatres ?,False
music,does netflix have music released in 1991 by you yokoyama,False
music,can you play the change is made on netflix,False
music,can i use lastfm to listen to twilight time by dj khalil ?,False
movie,list movies at imax corporation,False
movie,show movie schedules with movies in the neighborhood,False
movie,ticket for the perfect man at dickinson theatres at 10 a m,False
movie,when can i see the crew of the dora,False
movie,movie schedules for neighborhood cinema group,False
music,play the album remember shakti – the believer,False
music,play dancing through life by ronald isley on spotify,False
music,play a 1998 sound track from sam the kid on last fm,False
music,play some katiejane garside on vimeo,False
movie,what time is mulawin the movie showing at the nearest movie house,False
movie,what animated movies are at pacific theatres,False
movie,what time is the world according to john coltrane playing,False
music,play andy williams sings rodgers and hammerstein by elica todorova,False
music,play any sixties song,False
movie,what films are playing at the nearest movie theatre,False
movie,is one night surprise at the cinema,False
music,play popular eighties record,False
movie,what is the movie schedule for movies in the neighborhood,False
movie,what are the movie times for films playing in the area ?,False
music,can you play a sound track by sissieretta jones,False
movie,what is the local movie schedule,False
movie,what movie theatre is showing if the huns came to melbourne,False
music,i want to hear some bill black chant music,False
movie,what is the movie schedule for today?,False
movie,i d like to watch the holy office at cooper foundation,False
music,can i hear a da brat ep ?,False
movie,find a united paramount theatres and movie times at 4 a m,False
movie,what cinema is the closest showing movies,False
movie,what cinema is playing the strongest instinct now ?,False
movie,find me the movie schedules,False
movie,show me movie schedule,False
movie,find me the twinkler playing at national amusements in 2 minutes,False
music,play the last song by goldie,False
music,play some last fm music like the 1992 ep from peaches,False
movie,is the skull playing at loews cineplex,False
music,play a martyn bennett from 1957 on pandora,False
music,play music by country dick montana,False
music,play the top twenty tracks of ron jarzombek,False
music,play the latest songs by larry gatlin on iheart,False
music,can you play me songs from the estado de ánimo playlist?,False
movie,find the movie schedule for amco entertainment 1 minute from now,False
music,play fourties tunes,False
movie,where can i get movie schedule,False
music,i need to hear a thirties soundtrack,False
movie,what is the movie schedules for animated movies nearby,False
movie,show me some movie times,False
music,play punk essentials on zvooq,False
movie,find three in the attic,False
music,play some music from victor kunonga,False
movie,show me the new showings for animated movies in the neighborhood,False
movie,when is percy jackson playing at the movie theatre ?,False
movie,where is boo to you too! winnie the pooh playing,False
music,play fais les backs by sarah geronimo on youtube,False
movie,please inform me when i can see the abdication at a movie theatre,False
music,play some latin music,False
movie,what time is the eddy duchin story playing,False
music,play most popular from nil burak on slacker,False
music,i want to hear some twenties music off of deezer,False
movie,i d like to watch the slender thread at 6 pm,False
music,play the artist joe,False
music,play the newest sound track from the thirties,False
music,play a sound track from 1952,False
movie,what animated movies are playing nearby ?,False
movie,showtimes for the closest movie theatre that is showing operation autumn,False
movie,what time is the christmas toy playing at loews cineplex,False
music,play my fusion fest playlist on youtube,False
music,i d like to hear nas s greatest ballad,False
movie,what movies are in the neighbourhood,False
movie,what are the movie times for films nearby ?,False
music,play andy white,False
music,let me listen to the music of nature album by paul draper,False
music,play me a tune by john clayton,False
music,play the track grow old with me by artist chloe rose lattanzi,False
movie,is tomorrow at dawn at harkins theatres,False
music,play something by chris knight,False
movie,find movies around here,False
music,play the top-twenty from tony calder off slacker,False
music,play slow rock on lastfm,False
music,play a paolo gregoletto song,False
music,play a track by titiyo,False
movie,give me the movie schedules for southern theatres,False
music,play me the new king curtis music on google music,False
movie,show me the schedule of movie thirty two short films about glenn gould in 14 minutes,False
music,play opera music on google music,False
music,proceed with music from 2003,False
music,play music from 1981,False
movie,is the couch trip at the nearest cinema,False
movie,i d like to watch demolition man at 11 09 pm,False
music,play a 1978 track on slacker,False
movie,what movies are playing at the closest movie theatre,False
movie,let me know the movie times for films in the area,False
movie,what time is a man for burning playing,False
music,i want to hear music on my slacker app,False
music,play me a concerto by jethro burns from zvooq,False
music,play a song off the nicht sprechen album,False
music,play the instrumental study on vimeo,False
music,play some music by beverley martyn,False
music,play a popular sort of fifties tune music,False
movie,find national amusements with honey i shrunk the kids,False
music,play some thrash metal,False
music,play 1988 chant music on itunes,False
music,can i hear tod ashley music from 1953 ?,False
movie,what time does a king in new york play in malco theatres,False
music,can you play halloween by ajinoam nini,False
music,play a rock track from 1984,False
movie,what time is in the crosswind playing at marcus corporation ?,False
movie,find animated movies at caribbean cinemas,False
movie,give me the showtimes for animated movies at the nearest cinema,False
movie,i d like the movie schedules nearby me for animated movies,False
movie,i want to see the movie schedule for kb theatres,False
music,play me some grunge music,False
movie,show movie times for movies in the area,False
music,play some chant from 1974,False
music,use the service lastfm to play music by the artist ai kago,False
music,i want to hear richard falomir s best song on pandora,False
movie,find movie schedules at goodrich quality theaters,False
music,play me a song on pandora,False
music,play a tune by houston on spotify,False
movie,what are the movie times for movies in the area ?,False
movie,find cinemark theatres with films,False
music,play this is colour by panda bear,False
music,play kings of the wild frontier by andrea bocelli,False
movie,can i get showtimes for films in the neighborhood,False
music,play junun by noam kaniel,False
music,play the album killer instinkt,False
music,play the top five melody from 2000,False
music,open spotify and play a song from the twenties by richard harvey,False
music,play the top five cemil bey songs,False
movie,where is the cycle playing,False
movie,which movie house is playing snow in the desert today?,False
music,play acid punk music,False
movie,find the closest cinema playing little red monkey,False
movie,when can iw atch great balls of fire! - vampate di fuoco,False
movie,can i get the butterfly crush showings,False
music,i want to hear a track by ryohei yamamoto on vimeo,False
movie,i want the film for nearest movie theatre,False
music,play a top-10 ballad from 1995,False
music,play industrial music,False
music,play the most popular sound track from the 2006,False
movie,during tea time what animated movies will be screening at the closest movie house ?,False
music,please play bitch please ii,False
movie,is the belles of st clements playing at star theatres in 8 minutes ?,False
movie,find the schedule for films around here,False
movie,find movie times nearby for animated movies,False
movie,what movies are at malco theatres,False
music,play music by ryan malcolm from sympathy for the devil on pandora,False
movie,find the closest movie theatre for films,False
movie,please provide me with movie schedules,False
movie,show me the schedule of films in cobb theatres,False
music,i would like to hear music from 1993,False
music,play addicted to you by hank ballard,False
movie,is the day of the beast playing at three p m ?,False
music,play les pauvres riches by pan mei chen,False
movie,show me the schedule of films in the neighbourhood,False
music,play classic rock on groove shark,False
music,play on my own,False
movie,can i see the movie times for the great escape theatres,False
movie,what is the movie schedule at cineplex odeon corporation 12 hours from now,False
music,play music from alison sudol,False
movie,what is the movie times at marcus corporation,False
music,play music off youtube,False
music,play some krzysztof penderecki on last fm,False
movie,what is the nearest cinema showing love in mandya ?,False
music,i want to hear the sound track to mary macgregor new songs on iheart,False
movie,what films are going to be playing at harkins theatres at zero a m ?,False
movie,what time is the clutching hand playing at amco entertainment,False
movie,what time can i watch son of rambow tonight at fox theatres,False
movie,what animated movies are playing at the closest cinema,False
movie,find time for films at the north american cinemas,False
movie,what are the movie times,False
music,play top music from charles l johnson on vimeo,False
music,play rei momo newest album,False
