Intent,Sentence,Outlier
search,i d like to watch episodes from the tv series the secret of queen anne or musketeers thirty years after,False
search,find the earth is a sinful song,False
search,i want to watch supernatural the unseen powers of animals,False
search,find the trailer for hit the ice,False
search,find a pet of the cairo zoo,False
search,what is the painting forever malcolm young ?,False
search,i want to view the picture in old monterey,False
search,show creativity of all for one,False
search,can you get me the television show called start it up ?,False
search,find the video game called turnin me on,False
search,find a novel called testing anywhere,False
search,show me the television show called south california purples,False
search,can you help me find a picture called olympia 1974 ?,False
search,find the movie take another picture,False
search,can you find me the naked city – justice with a bullet album ?,False
search,search for tv show live at apollo,False
search,find wxhexeditor,False
search,find the magical world of roger whittaker,False
search,where can i purchase the book scales of justice,False
search,i m looking to find the trailer for brought by the sea,False
search,show creative picture of wonderful town,False
search,help me locate a game called the master of ballantrae,False
search,what does for all the wrong reasons look like,False
search,find the album just for laughs,False
search,where can i buy the lying game,False
search,please find me the picture of the getaway black monday,False
search,find me the picture called bugs bunny nips the nips,False
search,find the photograph hearts burst into fire,False
search,find pat garrett y billy the kid,False
search,play trailer of do whatever turns you on,False
search,find war & peace vol 1,False
search,find the collision in black painting,False
search,find a book called tron legacy reconfigured,False
search,can you pull up queen of the organ,False
search,i d like to see jacksonville daily progress saga,False
search,play tv show way of the samurai 2,False
search,search for to heart 2,False
search,show investigating sex album,False
search,read the book journal of the bombay natural history society,False
search,can you find the soundtrack for fast food nation,False
search,find the album until the whole world hears,False
search,please look up the falls church news-press album,False
search,show me the i can hear the sea movie,False
search,show schedule for loved by thousands,False
search,play 30 greatest hits,False
search,find me the television show a city sleeps,False
search,find me the novel the argumentative indian,False
search,find a television show called swing high,False
search,i want to watch strange brother,False
search,find a game called the life and loves of tschaikovsky,False
search,please find me the work earth intruders,False
search,can you find me the movie the countess ?,False
search,find a tv show called the ambient collection,False
search,find home fires,False
search,find bullet and a target a television show,False
search,find me the picture live in paris 1975,False
search,i m looking for the saga the hardest part,False
search,where can i listen to the song the imposter ?,False
search,find playstation官方杂志 a song,False
search,how can i view the show corpus a home movie about selena ?,False
search,find the covered wagon a game,False
search,find merry arizona 97 desert stars shine at christmas,False
search,find the painting retro active,False
search,show creativity of novel lock,False
search,when was the soundtrack for those were the days – the best of leningrad cowboys published?,False
search,please search the abby saga,False
search,pull up sweeney todd - il diabolico barbiere di fleet street,False
search,find the from the hut tv series,False
search,where can i find the tv show a step away,False
search,can you find the photograph titled so long self,False
search,find the family jams saga,False
search,search for the world is a game,False
search,please look up the immortals television show,False
search,can you find the novel stoneage romeos,False
search,find me the show girl soundtrack,False
search,i want the photograph of walt before mickey,False
search,i d like to see hannah montana and miley cyrus best of both worlds concert,False
search,show creative video game name foros timis ston greco,False
search,show air cuan dubh drilseach,False
search,show video game and the quality of life,False
search,is there a program about the last flight ?,False
search,find a new machine,False
search,where can i buy a copy of the picture called turn against this land ?,False
search,would like to find the trailer for an experiment with time,False
search,find a show called american journal of play,False
search,show book of pokémon the mastermind of mirage pokémon,False
search,where can i find the picture another happy ending,False
search,please search for the work all the wrong reasons,False
search,find the quest of iranon,False
search,show the second civil war saga,False
search,search for the abel sánchez the history of a passion novel,False
search,please help me search the tv series a mouse divided,False
search,show creativity of the oxford companion to beer tv show,False
search,find me the show krypto the superdog,False
search,can i see the album swat force ?,False
search,i want to play the game the celestial hawk,False
search,find a photograph called cope park,False
search,show the innocent when you dream saga,False
search,show the blue meaning television show,False
search,find journal of the european economic association a movie i want to see,False
search,show me the photograph of king charles,False
search,show me the saga st elsewhere,False
search,please search a new machine tv series,False
search,can you please get me come away with me show ?,False
search,search for man in a garage,False
search,play the putrefactive infestation trailer,False
search,show movie crossgenesis,False
search,search for the trailer the thieving magpie,False
search,find doggy day school an album,False
search,i m looking for the show sex and candy,False
search,find the show we chase the waves,False
search,looking for novel build engine,False
search,find the tv series the parent trap iv hawaiian honeymoon,False
search,i need to see cristo in india,False
search,show song schedule come into the world,False
search,search for the painting smart money,False
search,i m looking for a novel called the adventures of lolo ii,False
search,look for the game find another way,False
search,find a photograph called greatest hits volume one,False
search,i m looking for the show pulse 2 afterlife,False
search,find the show the best of the township idols,False
search,play the catholic sun album,False
search,find me the book with the title of the rainwater lp,False
search,find the game saturday review,False
search,find drowning with land in sight,False
search,can you help me find tears from a willow ?,False
search,find the new legend of shaolin video game,False
search,where can i get the video game faith in chaos ?,False
search,find the so this is goodbye saga,False
search,find me the river of love saga,False
search,i want to see the trailer for the entity,False
search,find the saison 7 de how i met your mother show,False
search,please find me the youth against fascism television show,False
search,find the crucible of man something wicked part 2,False
search,get me the soundtrack from sensation comics,False
search,i d like to watch miss congeniality,False
search,find the game just dance greatest hits,False
search,find a photograph of adventure time the secret of the nameless kingdom,False
search,find a tv show called union,False
search,find the game a russian beauty and other stories,False
search,find the mcgill law journal movie,False
search,show me the book it might as well be spring,False
search,i want to see the television show called cuts both ways,False
search,please look up amrithavaahini,False
search,please get me the crime and punishment in suburbia trailer,False
search,find the love and war soundtrack,False
search,find the picture vertically challenged,False
search,find a painting called break down,False
search,find a song called you cross my path,False
search,need to find the tv series called administrative behavior,False
search,find the novel a hat in time,False
search,i m looking for a photograph called merry christmas,False
search,find a soundtrack called top gear australia,False
search,look for summer with monika,False
search,find a painting called pulsions,False
search,play the last mile album,False
search,find a book called environment and behavior,False
search,play the song aura ii the sacred rings,False
search,where to watch show extremely live,False
search,please get me the work shirley aviatrice,False
search,i d like to see the photograph the light,False
search,please pull up the album the last war,False
search,i need work of father dearest,False
search,look up the searchlights painting,False
search,find a tv series called armageddon summer,False
search,find cascading waterfall,False
search,please get me the aion show,False
search,find a tv show called zen the music of fred katz,False
search,find the three little pigs television show,False
search,i am looking for the work nikki,False
search,find a soundtrack called the christmas shoes,False
search,i want to find the show from where to eternity,False
search,look for the no bigger than a minute soundtrack,False
search,show the matrix revolutions,False
search,i want to listen to the soundtrack bed of roses,False
search,what is the michael moore is a big fat stupid white man video game ?,False
search,download the red eagle tv show,False
search,i want to watch the television show little things,False
search,find me the when harry tries to marry photograph,False
search,find taskcracker for outlook a game,False
search,where can i find appalachian journey,False
search,play the food uncut soundtrack,False
search,i m looking for the novel from a scream to a whisper,False
search,find a picture called blink of an eye,False
search,play the game piety street,False
search,find the cartel vol 2 novel,False
search,search for the picture foghat ?,False
search,look for the girl in mirror movie,False
search,can you find the song bleach hell chapter,False
search,help me the find the thug lordz trilogy book,False
search,i d looking for the saga playcanvas,False
search,find drumline a new beat a picture,False
search,find the picture ultima vi the false prophet,False
search,i d like to see jack,False
search,find a book called kiss symphony - alive iv,False
search,i d like to hear the song impractical jokers uk,False
search,find the video game tenacious d in the pick of destiny,False
search,show creativity of sacred fire live in south america,False
search,find the killing fields,False
search,find me the young doctors in love tv show,False
search,where can i find information on brats in battalions ?,False
search,find a television show called servidor apache,False
search,show me the live in whitby album,False
search,find a photograph called midnight mystery,False
search,what is the trailer for feel the passion,False
search,i d like to see apartment hunting,False
search,wish to fins a television show called whole again,False
search,wish to hear the album since i saw you last,False
search,please find the work titled talking to heaven,False
search,show me the trailer for american education the national experience,False
search,look for the nypd - new york police department saga,False
search,find the picture nur mit dir – a walk to remember,False
search,can i get the game list of mew singles ?,False
search,show me the work not a little girl anymore,False
search,find the novel the last of sheila,False
search,play the soundtrack for the lord of the rings conquest,False
search,i am looking for the tv show titled catchphrase,False
search,find i love you too a saga,False
search,play me the song aap to aise na the,False
search,find pursuit of radical rhapsody,False
search,i want to see the trailer for no one,False
search,look up the this is halloween trailer,False
search,find the novel peace arch news,False
search,play the tv series bet awards 2013,False
search,wish to find the work the immortals that is a show,False
search,find seduced by madness a trailer,False
search,play me memoirs of modern love curious age,False
search,i d like to find the days of glory saga,False
search,show me the album three songs about lenin,False
search,show creativity of comeback season,False
search,find a trailer called no reservations,False
search,play the tv show wicked city,False
search,search for another cinderella story,False
search,show the show the son of tarzan,False
search,find the ghost of tom joad,False
search,search for movie turn back the clock,False
search,find the mary van note show,False
search,find some of my best friends arethe piano players,False
search,show me the show live at the fillmore east,False
search,find carry me in your dreams,False
search,can you find the painting the crow original motion picture soundtrack,False
search,can you please search ellington at newport ?,False
search,find wintersong game,False
search,i m looking for the video game called the supernatural events on campus,False
search,go to the devil in the deal 50 secrets to successful dealmaking,False
search,find a photograph called sleeping with the enemy,False
search,can you find the info wars saga,False
search,find time squared,False
search,show the information a history picture,False
search,find a movie called living in america,False
search,can you locate the work warlock 2 the exiled ?,False
search,find the book metallica through the never,False
search,play the graduate faculty philosophy journal album,False
search,find the soundtrack titled this side of paradise,False
search,find the photograph move any mountain,False
search,find a television show called structured fax file,False
search,find the cerebellum book,False
search,please find the movie dancing girl,False
search,show me the tivington nott,False
search,find the tv series the almighty johnsons,False
search,where can i purchase the tv show time for heroes,False
search,looking for video game for those who would walk with the gods,False
search,i want to see the maximum trance picture,False
search,can you find the novel journal of social work,False
search,please search the ironbound picture,False
search,when is spyforce playing?,False
search,i d like to see walk on the wild side the best of lou reed,False
search,help me find the saga titled the eternal return,False
search,find the way west show,False
search,show me the tv series prescription for death,False
search,find a book called follow me,False
search,find a picture of a breed apart,False
search,find the tv show hot air,False
search,i m looking for sherlock holmes contre arsène lupin,False
search,find the trailer for live at hull,False
search,find a painting called the book of folly,False
search,find the tv show titled the three leaps of wang lun,False
search,what is marty stuart discography,False
search,i d like to see the movie the ooze,False
search,find show-ya 20th anniversary the best,False
search,find a soundtrack called tied to a star,False
search,can you please look up the tv series an experiment with time ?,False
search,i want to play the game the carny,False
search,show me the best of volume 1 tv series,False
search,look for conducting from the grave,False
search,find valley of the dolls,False
search,i want to play the game guitar heaven the greatest guitar classics of all time,False
search,where is picture everybody wants you,False
search,i m looking for the television show titled the lonergan review,False
search,find the novel playlist the very best of brad paisley,False
search,find book called dreams and all that stuff,False
search,find a book called the magic christmas tree,False
search,find a television show called milagros girl from away,False
search,can you help me find the we no who u r game ?,False
search,show me the book pokémon the johto journeys,False
search,find spirit of the bush,False
search,what is fantasy zone ii the tears of opa-opa,False
search,i d like to see completely well,False
search,i d like to see the picture chrome dreams,False
search,i m looking for the saga why men leave home,False
search,search for video game the sky is crying,False
search,where can i view the photograph of johnny cool,False
search,show me skyfall original motion picture soundtrack,False
search,show me the television show the angry mob,False
search,please look up the painting modern times,False
search,what can i watch watch the television show catch,False
search,where can i find the photograph of mr blobby,False
search,look up the baltic times picture,False
search,find changes a love story,False
search,find dyskografia nick cave and the bad seeds,False
search,where can i see the television show falling away from me,False
search,find a novel called on the case with paula zahn,False
search,find karol the pope,False
search,where can i find the tv show earth defense force 2025 ?,False
search,look up the tv series operace silver a,False
search,show me the video game the stillest hour,False
search,where can i listen to willy and the poor boys,False
search,find a trailer called eurythmics discography,False
search,show angels of iron television show,False
search,find the novel meg and seron,False
search,go to the movie welcome to tokyo,False
search,show creativity of mind chaos,False
search,where can i find the picture the japanese lovesong near me?,False
search,find a soundtrack called fast as you,False
search,find trailer for iraq for sale the war profiteers,False
search,i want to see far cry vengeance,False
search,find the game selling blue elephants,False
search,show the last tightrope dancer in armenia television show,False
search,show creativity of pocket full of kryptonite,False
search,can you find my island home tv series ?,False
search,can you help me search the album titled playmaker football ?,False
search,look for little computer people,False
search,can you look up the galsoft linux tv series ?,False
search,find a book called the mad magician,False
search,show me the television show operation thunderbolt,False
search,i d like to watch the trailer for as tears go by,False
search,find me the spartan total warrior painting,False
search,show creativity of construction project information committee,False
search,what channel does the television show the roxbox play on?,False
search,can you find me the schooltool picture ?,False
search,find a tv show called engaged to the unidentified,False
search,where can i buy the movie totality,False
search,look for hail satanas we are the black legions,False
search,i want to see the novel the green,False
search,can you find me the work frisbee the life and death of a hippie preacher ?,False
search,show the tv series the merry sisters of fate,False
search,can you tell me the actors of the saga awards/,False
search,find a saga called night life,False
search,look up three fantastic dances,False
search,find by title champagne showers,False
search,find me the soundtrack called enter the chicken,False
search,where can i locate the game legion of mary the jerry garcia collection,False
search,show creativity of the game everything at once,False
search,find the painting sleeping in your hand,False
search,look for all that matters,False
search,what is love in a mist ?,False
search,find love will tear us apart a photograph,False
search,find the american journal of economics and sociology,False
search,find me the picture the id,False
search,show me the picture gas wars,False
search,what is a romance of the halifax disaster,False
search,i am looking for the tv series strays,False
search,i need a photograph of the oregon desert,False
search,please look up two more years soundtrack,False
search,look for the tv series all around performance horse weekly,False
search,show me the live~legend 1999 & 1997 apocalypse tv show,False
search,show the creativity of the attic,False
search,find reproductions songs of the human league,False
search,look for the book titled iranian journal of fuzzy systems,False
search,find me the photograph the late music,False
search,find the tv series i build the tower,False
search,play a trailer for give it all,False
search,where did the painting highs in the mid-sixties go?,False
search,i want to see the trailer for australian economic history review,False
search,i m trying to find annunciation,False
search,where to buy unarchigal,False
search,find me nights in harlem,False
search,play off the ground,False
search,find book in the valley,False
search,find the album the peace-maker,False
search,find a soundtrack called the woman warrior,False
search,get me kiss the crystal flake,False
search,find the movie everywhere but home,False
search,pull up the tv show 40 seasons the best of skid row,False
search,look for the high noon tv show,False
search,can you find me a trailer for phineas redux ?,False
search,show crafty hands saga,False
search,what is the current selling price of the novel the sims 3 island paradise ?,False
search,show the day the earth caught fire movie,False
search,find the real story with gretchen carlson,False
search,find me the tv show ask a woman who knows,False
search,can you find me the assassination of jesse james by the coward robert ford saga ?,False
search,find the case of the frightened lady,False
search,find reverence for me,False
search,show me the tv show have a nice day,False
search,i m looking for you to get me jack of shadows,False
search,find long hello and short goodbye a movie,False
search,find a tv show called the soultaker,False
search,i m looking to find kiss me goodbye,False
search,find the great hydration a tv series,False
search,i need to episodes for the tv series fast food nation,False
search,find bal ganesh 2 a video game,False
search,when is city of angels playing?,False
search,show me the caribbean blue television show,False
search,find the loving spirit,False
search,find bells break their towers a video game,False
search,how do i watch the tv show nba access with ahmad rashad,False
search,show panic in the streets,False
search,find a painting called voices in my head,False
search,show the legend of jesse james novel,False
search,i d like to listen to the soundtrack in the air,False
search,i d like to play the song in a reverie,False
search,find a tv show called studies in logic,False
search,search for the hills have eyes the beginning tv show,False
search,i want to watch the trailer to worms 2 armageddon,False
search,show transformers the game,False
search,find a tv series called when harry tries to marry,False
search,play me the soundtrack for nothing personal,False
search,what is the paranormal activity ghost dimension album ?,False
search,show me the lowest price for the game sinatra reprise the very good years,False
search,show chocolate rain creativity,False
search,find the saint in new york a show,False
search,where can i find the creative works the very best of simply red,False
search,search for the long dark,False
search,can i hear the song visual audio sensory theater ?,False
search,i am looking for shoot me down,False
search,show me the painting live – very live in concert,False
search,show the blackberry bush show,False
search,i d like to see the saga tamagotchi 64 minna de tamagotchi world,False
search,find a game called dynamite warrior,False
search,find face the truth a tv show,False
search,show me the when your heart stops beating photograph,False
search,find arcims a picture,False
search,i want to listen to the soundtrack and then there was light,False
search,find the cold dead hand video game for me,False
search,find painting big ideas,False
search,show me cut the rope video game,False
search,looking for liberalism and the limits of justice,False
search,show the ancient art of war picture,False
search,find me a saga by reproductions,False
search,i d like to see a tv series called countdown the savoy sessions,False
search,search for comedy underground with dave attell,False
search,find a painting called thunder in the sky,False
search,please get me rough and ready saga,False
search,show the caveman television show,False
search,show creative work or miami vice theme,False
search,buy novel brokeback mountain,False
search,can you find me the movie the girl and the general ?,False
search,where can i purchase the game dancing in the dark 10 years of dancing ferret,False
search,find the they came from somewhere else saga,False
search,show me the game music bank,False
search,where can i find richard the lionheart rebellion ?,False
search,is the television show kamen rider ooo wonderful the shogun and the 21 core medals streaming anywhere?,False
search,find me the video game for your love,False
search,find projections an album,False
search,look for the creative work called white sugar,False
search,find a picture called nuclear blast all stars out of the dark,False
search,find chant down babylon the island anthology,False
search,search for the song banquet for the damned,False
search,are there any painting of the 1st concert oh yeah! 1999 ?,False
search,find me the seven-ups,False
search,can you pull up the sanford herald,False
search,play the album journeyman,False
search,play cry baby lane,False
search,when is the next episode of the tv series crossing lines showing?,False
search,find the album follow that camel,False
search,find the rewind the film tv show,False
search,find a book called the echo chamber,False
search,find me the book my people were fair and had sky in their hair… but now they’re content to wear stars on their brows,False
search,show book name straight no chase,False
search,find the show trancers,False
search,go to after dusk they come,False
search,find an album called the aboriginal port folio,False
