Intent,Sentence,Outlier
search,find long hello and short goodbye a movie,False
weather,is there an expected blizzard in brook tennessee today ?,False
weather,will it be sunny in my current place at 6 am,False
search,find think act,False
search,find a tv show called the soultaker,False
weather,weather near california,False
search,find the great hydration a tv series,False
weather,is it supposed to be colder at lunch time in schuyler venezuela ?,False
search,go to attack of the planet smashers,False
weather,what is the weather forecast for tennessee for warm temps,False
weather,what will the weather be like 20 minutes from now in homestead meadows in martinique,False
search,i need to episodes for the tv series fast food nation,False
weather,how will be the weather in waltersville in one hour ?,False
weather,how much hotter will it be here tomorrow,False
weather,what will the weather be like here on february 22 2024,False
weather,what will the weather be in the flight park state recreation area ?,False
weather,is it going to be cloudy in my current spot for dinner ?,False
weather,is it going to be windy five minutes from now in nj,False
weather,what is the forecast for temperate conditions in thailand in lopeno,False
weather,will it get colder by 11 in jacobsburg syria ?,False
search,when is city of angels playing?,False
weather,is there going to be snowfall in alton,False
search,show me the caribbean blue television show,False
search,find the loving spirit,False
search,find the book a glorious way to die,False
search,find bells break their towers a video game,False
weather,what s the weather for april 10th 2028 in arkansas,False
search,how do i watch the tv show nba access with ahmad rashad,False
weather,will it be colder in litchfield,False
weather,is it freezing at jasmund national park,False
weather,what will the weather be like may the 10th in rocky boy wi,False
search,find a painting called voices in my head,False
search,show the legend of jesse james novel,False
search,i d like to listen to the soundtrack in the air,False
search,i d like to play the song in a reverie,False
search,find a tv show called studies in logic,False
weather,what is the thursday forecast for akers new hampshire,False
search,find trust in the lord – live worship with don moen,False
weather,what will it feel like on oct 21 in ky,False
search,i want to watch the trailer to worms 2 armageddon,False
search,find the work compiled fragments 1997-2003,False
search,show transformers the game,False
weather,will it be freezing here at 06 31 22 am,False
weather,what is the weather going to be like in flint hill in 9 years,False
weather,is it hot in zephyrhills ?,False
search,find a tv series called when harry tries to marry,False
weather,check the forecast for hulmeville wv,False
search,play me the soundtrack for nothing personal,False
search,what is the paranormal activity ghost dimension album ?,False
weather,will it rain in six weeks in libby ?,False
weather,what is the weather in twenty three minutes in nv,False
search,show me the lowest price for the game sinatra reprise the very good years,False
weather,there is warmer at serenada,False
search,find the saint in new york a show,False
weather,what is the forecast for freezing weather here,False
search,can i see the the painting another lifeanother end ?,False
weather,will it get overcast in la dolores ?,False
search,where can i find the creative works the very best of simply red,False
weather,will it be cold in harveysburg wa,False
weather,will it be chillier in saxis north dakota,False
search,search for the long dark,False
search,can i hear the song visual audio sensory theater ?,False
weather,is there going to be any snowfall today in lebanon ?,False
search,i need a novel about polymer chemistry,False
search,get me the elvis’ christmas album tv show,False
weather,tell me the humidity index for elizabethville indiana,False
search,i am looking for shoot me down,False
weather,how is the weather going to be on child health day in trinidad and tobago ?,False
weather,will it be cold in allardt aruba ?,False
search,show me the painting live – very live in concert,False
weather,what is the forecast for wren for freezing weather,False
weather,what is the weather for charlotte hall saint kitts and nevis,False
weather,how is the weather in mount olivet,False
search,please find the album the party scene,False
weather,what is the weather forecast for piqua on pearl harbor remembrance day,False
weather,will the weather be colder in naguabo four minutes from now,False
search,look for the creative work meltdown – days of destruction,False
search,what is the tv series in app store,False
search,find face the truth a tv show,False
weather,is it humid in charenton,False
weather,will it be colder this saturday in nc,False
search,look for the tv series the stars at saint andrea,False
weather,what s the weather forecast for the northern mariana islands on 8 4 2024 ?,False
search,show me the when your heart stops beating photograph,False
weather,check the forecast for natchaug state forest,False
weather,will there be a lot of sun in dry prong somalia at 5 pm,False
weather,will it be temperate here on 11 27 2023,False
search,show me the courts of chaos,False
search,find arcims a picture,False
search,please search the karobar economic daily picture,False
search,find cluster computing a game,False
search,i m looking for the birth of a nation,False
weather,will it get cloudy in cliffwood beach ?,False
weather,will it be colder in holladay saint kitts and nevis,False
weather,will there be a snowstorm at my current place ?,False
search,i want to listen to the soundtrack and then there was light,False
search,give me the spirit the earth aflame tv show,False
weather,will the weather be the same here in one week in the same area,False
search,find the cold dead hand video game for me,False
search,find playground a book,False
weather,what will the weather be like tonight at greenfoot quarry,False
search,find painting big ideas,False
search,i m looking for a picture of fresh air,False
weather,what s the weather in close by my current position,False
search,looking for liberalism and the limits of justice,False
search,need a creative work with the title unholy confessions,False
weather,what is the current temperature here,False
weather,how hot will it be in wisconsin on august fourth ?,False
weather,will it be freezing within walking distance of alaska ?,False
search,show the movie move any mountain,False
search,show the ancient art of war picture,False
search,show tv show schedule of offroad legends,False
search,show the bridge of san luis rey picture,False
weather,is it going to be warmer in town kelloe bank ?,False
search,find me a saga by reproductions,False
weather,will there be hail in dean creek wildlife area on feb 25 2031,False
weather,what is the weather forecast for cuba at eleven am,False
weather,what s the weather on august seventh for crystal lawns guam,False
search,show the caveman television show,False
search,do an image search for the picture perfect storm disasters that changed the world,False
weather,will it be colder in delaware ?,False
weather,is it going to be colder in louisiana,False
weather,will there be any cloud in delaware on 1 11 2040 ?,False
search,show creative work or miami vice theme,False
search,buy novel brokeback mountain,False
search,can you find me the movie the girl and the general ?,False
weather,weather for july 1 in ut,False
weather,what will the weather be like 1 second from now in pugu hills forest reserve,False
weather,what is the twenty one o clock forecast for the current spot,False
search,where can i purchase the game dancing in the dark 10 years of dancing ferret,False
search,show me the game music bank,False
search,where can i find richard the lionheart rebellion ?,False
weather,how will the weather be in new mexico around 00 09 07 am ?,False
weather,will it be rainy at 8 in dans mountain state park,False
search,is the television show kamen rider ooo wonderful the shogun and the 21 core medals streaming anywhere?,False
weather,forecast for hardinsburg 20 seconds from now,False
search,find me the video game for your love,False
search,show creative game fear thy neighbor,False
search,find projections an album,False
search,search for the song banquet for the damned,False
search,play myth ii soulblighter,False
search,are there any painting of the 1st concert oh yeah! 1999 ?,False
weather,i need the forecast for hot in barbados may city in 1 year,False
search,can you pull up the sanford herald,False
weather,will it be hot in my current location this week ?,False
search,play the album journeyman,False
weather,what is the meal time forecast for cayman islands,False
weather,what will the weather be nineteen seconds from now from the little manatee river state park,False
search,play cry baby lane,False
weather,is the weather overcast here and now ?,False
search,find me a soundtrack by ghost town prophecy,False
search,i m looking for the television show titled justice league,False
weather,is it going to be freezing at tea time in michigantown ks,False
search,when is the next episode of the tv series crossing lines showing?,False
weather,do you know if it will be chilly today in puerto rico,False
weather,is it cold in the current location more than it was in 3 years,False
weather,will it be hotter in my current place in six weeks from now,False
search,find the rewind the film tv show,False
search,find a book called the echo chamber,False
weather,what s the forecast for little silver,False
search,find me the book my people were fair and had sky in their hair… but now they’re content to wear stars on their brows,False
search,show book name straight no chase,False
search,go to after dusk they come,False
weather,show weather forecast for dovre-nationalpark,False
weather,is it going to be cold at 4 o clock far from here ?,False
weather,forecast for israel,False
weather,tell me the weather forecast in 4 years and a half in ga,False
weather,find the weather prediction for camdeboo-nationalpark for jan eleventh 2037,False
weather,what will the weather be like in arizona on october the 3rd,False
search,find an album called the aboriginal port folio,False
weather,what is weather in azerbaijan 16 seconds from now,False
search,find the book the crowd roars,False
weather,what is the forecast in heber,False
weather,what will be the wind speed at the current place ?,False
weather,will it get chillier in arkinda myanmar ?,False
weather,what is the random lake forecast for hot temps,False
search,find television show on windows live tv,False
weather,will it be hot near calakmul biosphere reserve 3 seconds from now,False
search,show creativity of soundtrack iheartradio countdown,False
search,play the discografia de the pretty reckless saga,False
search,where can i find the saga addicted to love,False
search,show the glass cloud – single tv series,False
weather,what s the weather in lime ridge dc,False
search,book of two for the road,False
search,show the creativity of saga the dissociatives,False
weather,will it be rainy nine weeks from now close to the matlacha pass national wildlife refuge,False
search,play the song memories are my only witness,False
search,find the return to grace saga,False
weather,will it be cold in wheatley provincial park ?,False
search,i want to watch manthan,False
weather,tell me the weather forecast for molino washington,False
search,can you find the soundtrack for westcountry live,False
search,show me convicted,False
search,find the press of atlantic city movie,False
weather,tell me when it ll be sunny in ralls marshall islands,False
search,where can i watch the tv show terrorists the kids they sentenced,False
search,pull up mafia the city of lost heaven,False
weather,will it hail in villa,False
search,find a soundtrack called i still believe in you,False
search,find a tv series called manufacturing consent,False
search,i d like to find the limited lovers novel,False
weather,what is the weather in the falkland islands,False
search,i d like to see the picture teleform,False
search,find me shack out on 101,False
weather,what s the weather here at three pm,False
weather,is it windy in custar,False
weather,show weather forcast here at 19,False
weather,what is the forecast for cold temps in nevada,False
weather,is it going to be freezing in mahwah missouri on december the fifth 2025,False
search,search for the picture boomtown,False
weather,weather for afghanistan in one minute,False
weather,weather for turtle river state park,False
weather,what is the weather like in antonito,False
search,find the book called black wings of destiny,False
search,can you get me the education of little tree song ?,False
weather,will there be rainfall faraway from uganda,False
search,show the creativity of where what when,False
search,find a video game called the yellow claw,False
search,what is the read all about it picture ?,False
weather,is there snowfall nearby american samoa,False
weather,will it be rainy in neffs,False
search,show me the television show the science of breath,False
search,i want to find a book called cash-cash,False
search,find me the memorial,False
search,find me the show the skull,False
weather,what s the weather in koontz lake,False
search,i m looking for river disturbance,False
search,i want to watch the tv show down on abby,False
search,find the ghostly swim 2 book,False
weather,will it be cold this autumn in norfolk island,False
weather,will it be raining one hundred thirty days from now ion gobles canada,False
search,find tv series titled sonata mix dwarf cosmos,False
weather,what is the weather in steward,False
search,find a tv show called the fighting men,False
search,show creativity of sing to the dawn,False
weather,what will the weather be like here next week ?,False
weather,what will the weather be in corcovado national park on december the fifth ?,False
weather,what is the weather forecast for shasha forest reserve in 43 weeks,False
weather,what is the forecast for cold temps in west virginia next autumn,False
weather,tell me when it will be hotter in china,False
weather,what is the forecast starting on 5 17 2037 for austria for warmer temps,False
weather,is it chillier in hong kong than it is here,False
weather,what s the weather for mccracken in niger,False
search,find becoming royston,False
weather,what will the weather be in kokhanok,False
weather,what is the weather like in detroit lakes,False
search,i want to watch the trailer ad nauseam,False
search,painting of live from the el rey theatre,False
search,where do i play the video game the wild geese ?,False
weather,what is the 7 day for cheat canyon wildlife management area,False
search,show 50 words for snow creative picture,False
weather,give me the weather forecast for lower lake on sep 21 2038,False
weather,i need to know the weather seven weeks from now in morgan–monroe state forest,False
weather,is it hot in bolivia,False
search,play the case of the whitechapel vampire tv series,False
search,locate the koi to senkyo to chocolate television show,False
weather,is it chillier at narew national park,False
search,show gd&top painting,False
weather,will it be hotter in conception junction moldova ?,False
weather,what s the weather forecast close by sligo ?,False
weather,there is fog weather in grand lake nebraska,False
weather,can i get the weather forecast for benin in 32 days ?,False
weather,what is the weather forecast close-by bermuda,False
weather,is it forecast to be rainy in winchell mississippi ?,False
weather,what is the weather one second from now in blue ridge berryessa natural area,False
search,find the transformers generations video game,False
weather,will it be hot during winter ?,False
weather,will it be snowy in the current place ?,False
weather,what is the forecast for the wildreservaat ithala in the distant future will it be colder,False
search,show me the a-myin-thit tv series,False
search,show the feed the kitty painting,False
search,where can i find the sounds to consume album ?,False
weather,is there going to be any cloud cover today at mccracken in az ?,False
search,look for the public toilet painting,False
weather,what s the forecast far from here in turks and caicos islands ?,False
search,find a television show called sensation comics,False
search,show me the book f-1 grand prix part ii,False
search,please find the tv series back to bach,False
search,find me the album the weed tree,False
search,has the tv series puppet master axis of evil been cancelled?,False
search,can i hear the song american high,False
search,look up the cool cafe cool tape vol 1 video game,False
search,find a television show called main street,False
weather,is it going to hail in niger,False
weather,what s the forecast for castolon in french southern territories around seven pm ?,False
search,i want to read the novel pokémon the movie black—victini and reshiram and white—victini and zekrom,False
weather,tell me the weather forecast for cape verde,False
weather,will there be rainfall the day after tomorrow far from rodna national park,False
search,i want to see the book the mailroom hollywood history from the bottom up,False
weather,will it be warm at tembe elephant park on san jacinto day,False
weather,i need the forecast for mamaroneck in six weeks,False
search,can you find the book beatmania iidx 10th style,False
weather,what will the weather be in post falls on feb 17 ?,False
weather,what is the weather forecast in nine months within walking distance of ohio,False
search,i want a photograph of elizabeth the queen,False
search,find a book called outpost firewall pro,False
weather,will it be warmer in my current position,False
weather,is it colder today in college park then in serbia and montenegro,False
weather,is it going to be cold once i get within walking distance of my home in new caledonia ?,False
search,find casting crowns discography,False
weather,is it going to be sunny on oct twenty-seventh 2031 within the same area of this current place,False
weather,show the forecast for moonlight beach at 10 4 2021,False
weather,give me the weather forecast for nationaal park garphyttan,False
weather,what will the weather be like on january the twenty-third 2034 in ga,False
search,find the dressmaker,False
search,find me the album the demon,False
search,find a soundtrack called the dragon,False
search,help me find where the wild things are,False
weather,what s the forecast for my current spot,False
search,show me the evil dead painting,False
search,find the picture of the harsh light of day,False
search,look up the making of milwaukee,False
weather,is the weather colder in costa rica,False
search,where can i view the trailer extreme – the collection,False
weather,whats the forecast for redby,False
weather,will it be freezing close to my current location,False
weather,will it be freezing at 1 am in balko ?,False
search,please look up the power and love movie,False
weather,what is the weather forecast for djibouti,False
search,please pull up the photograph entitled another period,False
weather,give me the forecast for feb eleventh 2034 far from alaska,False
weather,will it be hotter next month in south dakota ?,False
search,where can i get intel array building blocks,False
weather,is it going to be chillier in saint augustine wy on may 3rd,False
weather,what will the weather be one hour from now in as ?,False
weather,when is sunrise in american samoa,False
weather,warmer condition in haiti south otselic,False
search,find google news,False
weather,what s the weather forecast for austin liechtenstein,False
weather,what s the weather forecast for glade park on july twenty-fifth 2033 ?,False
search,find a novel called chemistry - an european journal,False
search,where can i find the song red back fever,False
weather,is cloudy in lyncourt ?,False
weather,what is the weather close to somesville on mon,False
weather,will it be hot on orthodox good friday in michigan and close-by,False
search,find the sentimental bloke novel,False
weather,is it chilly in ecola state park at 2 pm,False
weather,is it going to be chillier at 10 pm in texas,False
search,can you get me the maldeamores saga ?,False
search,find the television show riding with the king,False
search,find a television show called basement screams,False
search,find the picture louder than bombs,False
weather,will it snowstorm neighboring the rio grande wild and scenic river on feb the second ?,False
search,can you find the trailer for the young martyr ?,False
weather,what will the weather be in a month from now at my current location ?,False
search,find the song occasional wife,False
search,can you locate west coast wrestling connection,False
weather,what will the weather be ten minutes from now in canada ?,False
search,please look for orion you came and you took all my marbles,False
search,find a tv series called church of the truly warped,False
weather,what is the bolsa chica state beach forecast for foggy conditions,False
search,play saga the yellow rose of texas,False
search,look up the park album,False
weather,will there be a depression at three am in topinabee idaho,False
weather,will it be chilly in two hundred thirteen days at dochū-kōtsu prefectural natural park,False
weather,show weather forcast for ms on jan the 9th 2034,False
search,show me the movie haunted spooks,False
weather,how chilly will it be at 09 32 06 am in moncove lake state park ?,False
search,looking for the trailer for shaolin temple,False
weather,what s the weather forecast for wisconsin ?,False
weather,can you tell me what the weather is like at sam d hamilton noxubee national wildlife refuge,False
weather,what will the weather be in port costa fm will it be foggy,False
search,how do i get the game still on it ?,False
weather,will the weather in falcon heights call for rain ?,False
weather,what is the philippines forecast for humid weather,False
search,play the hell of a life movie,False
weather,what is the weather in the netherlands,False
weather,what will the weather be like in nickelsville,False
search,please search for the tv series titled i need romance,False
weather,is it colder faraway from my current spot ?,False
search,find long walk to forever a novel,False
search,show me the saga the buffalo boy,False
search,can i see the tv show the closer i get ?,False
weather,will it rain in paisley,False
search,find a show called some kind of dangerous,False
search,i want to see breathless,False
search,i d like to watch the tv series called fires of life,False
weather,is it cloudy in choptank,False
search,play me an album by lunchbox,False
weather,what is the weather forecast for red rock lakes national wildlife refuge,False
search,find a tv show called ruthless,False
search,want to find a photograph called the nine maidens,False
weather,is it windy in june park ?,False
search,get the video game of the chipmunk song,False
search,find the work i looked up,False
search,find a photograph of time loves a hero,False
weather,is it going to rain in tonopah ?,False
weather,show weather forecast in east tawakoni italy at four pm,False
weather,show weather forecast in west wildwood south carolina,False
weather,will it be warmer in saint louis park,False
search,show me a video game made by tmpgenc,False
weather,what is the overcast forecast for midday in id,False
weather,what is the weather forecast for three in whitewood rhode island,False
search,find framing the early middle ages a game,False
weather,what s the forecast for ks for jan first ?,False
search,find under night in-birth,False
weather,what s the forecast for francisco netherlands antilles around eleven pm ?,False
search,play the movie i want my mtv the uncensored story of the music video revolution,False
weather,what s the forecast in klamath marsh national wildlife refuge ?,False
weather,weather for james m robb – colorado river state park,False
weather,what is the colder forecast for nationaal park bidoup núi bà in a week,False
weather,is it going to be snowy in concord utah ?,False
weather,is it supposed to be sunny here,False
search,find the video game thale,False
weather,will it be cloudy in one minute in jungo mh,False
weather,what s the weather forecast for neighboring delft national park on aug the 8th 2028,False
search,i want to watch the movie x window display manager,False
search,where can i view the trailer jeeves and wooster in perfect nonsense,False
search,find me an album called rejoicing with the light,False
search,find an album called list of re hamatora episodes,False
weather,what s the forecast for mt next week ?,False
search,find the tyrant,False
weather,show me the forecast for 6 years from now in westlake village in guinea,False
weather,what is the forecast in texas,False
weather,what s the forecast for spenard gu ?,False
search,where can i buy the soundtrack bridge of souls,False
weather,what s the weather close to cambodia at 05 44 13,False
search,play the sea cabinet,False
weather,is it freezing far from here on 12 5 2032,False
weather,is it warmer now in wetumpka mauritania ?,False
weather,what will the weather be within the same area of weir farm national historic site,False
search,please find me the hanging valley movie,False
search,show creative labor notes,False
weather,what s the weather forecast for next week at my current position ?,False
weather,is there going to be a depression two hundred sixteen days and a half from now in mill bluff state park,False
search,search for the toucher and rich show,False
weather,what s the weather like when you re distant from greenport,False
weather,will the weather be cloudy seven weeks from now in hinckley,False
search,please find me a novel called the caledonian-record,False
search,show me the photograph a woman from the street,False
weather,what will the weather be in allenwood ?,False
