Intent,Sentence,Outlier
search,i m looking for the saga lifelong ambitions,False
search,i want to read mad money,False
search,can you get me the television show called start it up ?,False
search,please find the movie a jingle with jillian,False
search,find a novel called testing anywhere,False
search,need the saga called the black lamp,False
search,can you help me find a picture called olympia 1974 ?,False
search,find the tv series treeful of starling,False
search,can you find me the naked city – justice with a bullet album ?,False
search,look for the creative work the testament of gideon mack,False
search,search for tv show live at apollo,False
search,find wxhexeditor,False
search,find the magical world of roger whittaker,False
search,where can i purchase the book scales of justice,False
search,find a show called time is just the same,False
search,find movie titled triumph of the spirit,False
search,help me locate a game called the master of ballantrae,False
search,find the album just for laughs,False
search,please find me the picture of the getaway black monday,False
search,find the book bad day on the block,False
search,find me the picture called bugs bunny nips the nips,False
search,find the photograph hearts burst into fire,False
search,find pat garrett y billy the kid,False
search,play trailer of do whatever turns you on,False
search,play the lure of the mask song,False
search,where do get photograph of my own best enemy,False
search,find war & peace vol 1,False
search,find a book called tron legacy reconfigured,False
search,where can i watch the television show you make me hate music,False
search,i want the video game southwest riders,False
search,i d like to see jacksonville daily progress saga,False
search,play print the legend soundtrack,False
search,play tv show way of the samurai 2,False
search,search for to heart 2,False
search,read the book journal of the bombay natural history society,False
search,find the show carnik con,False
search,find the album until the whole world hears,False
search,please look up the falls church news-press album,False
search,show me the i can hear the sea movie,False
search,show the taste,False
search,show me the work the catholic weekly,False
search,bombshells saga download,False
search,play 30 greatest hits,False
search,show creative painting people & love,False
search,find me the novel the argumentative indian,False
search,find a television show called swing high,False
search,find the painting icac investigators 2014,False
search,where can i find the work it was raining that night ?,False
search,i want to watch strange brother,False
search,read the background to danger book,False
search,find a game called the life and loves of tschaikovsky,False
search,can you find me the movie the countess ?,False
search,find a tv show called the ambient collection,False
search,find home fires,False
search,find bullet and a target a television show,False
search,find me the picture live in paris 1975,False
search,i m looking for the saga the hardest part,False
search,find playstation官方杂志 a song,False
search,help me find the work titled singstar take that,False
search,find merry arizona 97 desert stars shine at christmas,False
search,find the painting retro active,False
search,show me the photograph with the title the denial,False
search,when was the soundtrack for those were the days – the best of leningrad cowboys published?,False
search,please search the abby saga,False
search,find the from the hut tv series,False
search,where can i find the tv show a step away,False
search,can you find the photograph titled so long self,False
search,find the family jams saga,False
search,find the 180,False
search,find the putrid death sorcery soundtrack,False
search,search for the world is a game,False
search,please look up the immortals television show,False
search,find me the show girl soundtrack,False
search,i d like to see hannah montana and miley cyrus best of both worlds concert,False
search,show creative video game name foros timis ston greco,False
search,show air cuan dubh drilseach,False
search,show video game and the quality of life,False
search,please find pretty baby,False
search,find a soundtrack called pax warrior,False
search,would like to find the trailer for an experiment with time,False
search,find a show called american journal of play,False
search,show book of pokémon the mastermind of mirage pokémon,False
search,please search for the work all the wrong reasons,False
search,find the sing when you’re winning tv show,False
search,look for a photograph of tailwind,False
search,where can i find a painting called battlestations pacific,False
search,search for the abel sánchez the history of a passion novel,False
search,please help me search the tv series a mouse divided,False
search,show creativity of the oxford companion to beer tv show,False
search,find me the show krypto the superdog,False
search,find confusion bay,False
search,i want to listen to the song only the greatest,False
search,where can i listen to the song the lost worlds of planet earth,False
search,show the innocent when you dream saga,False
search,show the blue meaning television show,False
search,find journal of the european economic association a movie i want to see,False
search,show me the photograph of king charles,False
search,show me the saga st elsewhere,False
search,please search a new machine tv series,False
search,please search the irv gotti presents the murderers picture,False
search,find the gill deacon show,False
search,play the putrefactive infestation trailer,False
search,search for the trailer the thieving magpie,False
search,search for ayumi hamasaki countdown live 2007–2008 anniversary song,False
search,i m looking for the show sex and candy,False
search,find the show we chase the waves,False
search,looking for novel build engine,False
search,find the tv series the parent trap iv hawaiian honeymoon,False
search,i need to see cristo in india,False
search,show song schedule come into the world,False
search,find me a movie with the name oshin,False
search,search for the painting smart money,False
search,look for the game find another way,False
search,find a photograph called greatest hits volume one,False
search,i m looking for the show pulse 2 afterlife,False
search,find the show the best of the township idols,False
search,play the catholic sun album,False
search,who published the novel jamesedition ?,False
search,find games wizards play tv series,False
search,i want to play the video game espn major league soccer,False
search,find the game saturday review,False
search,find drowning with land in sight,False
search,find the new legend of shaolin video game,False
search,where can i get the video game faith in chaos ?,False
search,find the so this is goodbye saga,False
search,find me the river of love saga,False
search,i want to see the trailer for the entity,False
search,find the saison 7 de how i met your mother show,False
search,please find me the youth against fascism television show,False
search,find the crucible of man something wicked part 2,False
search,get me the soundtrack from sensation comics,False
search,i d like to watch miss congeniality,False
search,find the game just dance greatest hits,False
search,find a photograph of adventure time the secret of the nameless kingdom,False
search,find a tv show called union,False
search,can i see the show heroes of might & magic 4 ?,False
search,search for chasing fortune a tv series,False
search,find the game a russian beauty and other stories,False
search,please find me the work ace of spades,False
search,search for the game the last horror movie,False
search,find me the extreme ghostbusters game,False
search,show me the book it might as well be spring,False
search,i want to listen to the music of ghost in the shell stand alone complex,False
search,show me the sex therapy painting,False
search,where can i find the painting for a christmas story - una storia di natale ?,False
search,please look up amrithavaahini,False
search,find the picture vertically challenged,False
search,play me the trailer for star control,False
search,find a painting called break down,False
search,i m looking for a photograph called merry christmas,False
search,find a novel called a perfect day,False
search,find a soundtrack called top gear australia,False
search,look for summer with monika,False
search,find a painting called pulsions,False
search,look up the brave archer 2,False
search,play the last mile album,False
search,find a tv show called the traffic policeman,False
search,find a book called environment and behavior,False
search,play me the saga the party’s over,False
search,where to watch show extremely live,False
search,please get me the work shirley aviatrice,False
search,find a trailer called way down yonder in new orleans,False
search,play me the trailer for chasing after shadows living with the ghosts,False
search,show song black heart white soul,False
search,i d like to see the photograph the light,False
search,please pull up the album the last war,False
search,i need work of father dearest,False
search,where can i purchase the tv series the mating season,False
search,find a tv series called armageddon summer,False
search,find the good wife,False
search,find cascading waterfall,False
search,please get me the aion show,False
search,find the saga a very school gyrls holla-day,False
search,find a soundtrack called the christmas shoes,False
search,i want to find the show from where to eternity,False
search,find old school junkies the album a video game,False
search,show me the song spiderman of the rings,False
search,can you find the television show manifesto of nevermore,False
search,show the matrix revolutions,False
search,what is the michael moore is a big fat stupid white man video game ?,False
search,download the red eagle tv show,False
search,find the song the fourth man,False
search,i want to watch the television show little things,False
search,find taskcracker for outlook a game,False
search,where can i find appalachian journey,False
search,play the food uncut soundtrack,False
search,i m looking for the novel from a scream to a whisper,False
search,please find me the game called the salvation,False
search,play the television show tears laid in earth,False
search,play the game piety street,False
search,find the cartel vol 2 novel,False
search,search for the picture foghat ?,False
search,look for the girl in mirror movie,False
search,how can i watch the television show tinker bell and the legend of the neverbeast ?,False
search,help me the find the thug lordz trilogy book,False
search,find the picture ultima vi the false prophet,False
search,find a book called kiss symphony - alive iv,False
search,please show me the picture history repeating,False
search,i want to see plague soundscapes,False
search,i d like to hear the song impractical jokers uk,False
search,find the video game tenacious d in the pick of destiny,False
search,find sailing the seas of cheese,False
search,find the killing fields,False
search,find me the young doctors in love tv show,False
search,where can i find information on brats in battalions ?,False
search,search for the video game the book of heroic failures,False
search,find a television show called servidor apache,False
search,show movie schedule of the big mouth,False
search,show me the live in whitby album,False
search,find a photograph called midnight mystery,False
search,what is the trailer for feel the passion,False
search,i d like to see apartment hunting,False
search,wish to fins a television show called whole again,False
search,play bliss torn from emptiness,False
search,wish to hear the album since i saw you last,False
search,show andy williams sings steve allen tv show,False
search,please find the work titled talking to heaven,False
search,show me the trailer for american education the national experience,False
search,how to get saga stronda style,False
search,find the picture nur mit dir – a walk to remember,False
search,plau me the song the french chef,False
search,can i get the game list of mew singles ?,False
search,show me the work not a little girl anymore,False
search,where to get the movie fear of a black hat,False
search,find just south of heaven,False
search,i am looking for the tv show titled catchphrase,False
search,show creativity in photograph of grace submerged,False
search,find the many loves of dobie gillis,False
search,find i love you too a saga,False
search,find pursuit of radical rhapsody,False
search,i want to see the trailer for no one,False
search,find the novel peace arch news,False
search,play the tv series bet awards 2013,False
search,wish to find the work the immortals that is a show,False
search,find seduced by madness a trailer,False
search,play me memoirs of modern love curious age,False
search,find a man needs a maid,False
search,i d like to find the days of glory saga,False
search,show me the album three songs about lenin,False
search,show creativity of comeback season,False
search,find a trailer called no reservations,False
search,search for another cinderella story,False
search,find the show your hand show,False
search,find the ultimate gift a television show,False
search,find the ghost of tom joad,False
search,search for movie turn back the clock,False
search,find blood moon year of the wolf a movie,False
search,find the mary van note show,False
search,find some of my best friends arethe piano players,False
search,show me the show live at the fillmore east,False
search,i want watch the sun and the moon,False
search,find a saga called story of my life,False
search,find carry me in your dreams,False
search,i want to see the trailer amor puro,False
search,find me the jquery mobile tv show,False
search,find the path to power,False
search,can you find the painting the crow original motion picture soundtrack,False
search,is the tv show the prodigal wife on today?,False
search,find wintersong game,False
search,i m looking for the video game called the supernatural events on campus,False
search,find a photograph called sleeping with the enemy,False
search,show the information a history picture,False
search,find a movie called living in america,False
search,find the book metallica through the never,False
search,please look up for disney universe,False
search,find the soundtrack titled this side of paradise,False
search,find the girlfriend experience a television show,False
search,find the photograph move any mountain,False
search,find a television show called structured fax file,False
search,find the cerebellum book,False
search,show creativity of the picture the little death,False
search,find hope & other sins a tv show,False
search,show me the tivington nott,False
search,looking for video game for those who would walk with the gods,False
search,i want to see the maximum trance picture,False
search,where can i find the brave little toaster to the rescue book ?,False
search,please find me the purple vigilantes book,False
search,can you find the novel journal of social work,False
search,please search the ironbound picture,False
search,i m looking for the hit album the politics of dancing,False
search,when is spyforce playing?,False
search,i d like to see walk on the wild side the best of lou reed,False
search,where can i listen to the soundtrack of gibraltar britain in the sun,False
search,help me find the saga titled the eternal return,False
search,show me the tv series prescription for death,False
search,find a book called follow me,False
search,find the tv show hot air,False
search,i m looking for sherlock holmes contre arsène lupin,False
search,find a painting called the book of folly,False
search,where can i read the book the omega stone ?,False
search,please get me the critical condition show,False
search,where can i view the photograph dinosaur from the deep ?,False
search,i want to read the book the minotaur,False
search,find the pop has freed us saga,False
search,please get me infernal devices game,False
search,i d like to see the movie the ooze,False
search,find show-ya 20th anniversary the best,False
search,find a soundtrack called tied to a star,False
search,show creativity of the greatest movie ever sold,False
search,can you please look up the tv series an experiment with time ?,False
search,i want to play the game the carny,False
search,look for conducting from the grave,False
search,find valley of the dolls,False
search,where can i find the album the adventures of lolo ii,False
search,where is picture everybody wants you,False
search,look up holy water,False
search,i m looking for the television show titled the lonergan review,False
search,find the novel playlist the very best of brad paisley,False
search,find a television show called milagros girl from away,False
search,can you help me find the we no who u r game ?,False
search,find spirit of the bush,False
search,i d like to see the picture chrome dreams,False
search,i m looking for the saga why men leave home,False
search,play the caps lock trailer,False
search,search for video game the sky is crying,False
search,show the critic game,False
search,show me the television show the angry mob,False
search,please look up the painting modern times,False
search,what can i watch watch the television show catch,False
search,look for the compact forest proposal trailer,False
search,please look for catch a falling star,False
search,find changes a love story,False
search,find dyskografia nick cave and the bad seeds,False
search,i m looking for the pokémon the movie 2000 tv show,False
search,find a show called last night on earth,False
search,where can i see the television show falling away from me,False
search,find a novel called on the case with paula zahn,False
search,look up the tv series operace silver a,False
search,show me the video game the stillest hour,False
search,how can i see the show pulse 2 afterlife ?,False
search,where can i listen to willy and the poor boys,False
search,find the trailer for hotel on the corner of bitter and sweet,False
search,find a trailer called eurythmics discography,False
search,find the novel meg and seron,False
search,go to the movie welcome to tokyo,False
search,where can i find the picture the japanese lovesong near me?,False
search,find a soundtrack called fast as you,False
search,i want to see far cry vengeance,False
search,find the game selling blue elephants,False
search,show the last tightrope dancer in armenia television show,False
search,where can i purchase a copy of the painting called glimpses of world history ?,False
search,show creativity of pocket full of kryptonite,False
search,can you find my island home tv series ?,False
search,look for little computer people,False
search,can you look up the galsoft linux tv series ?,False
search,find journeyman,False
search,find a book called the mad magician,False
search,show me the television show operation thunderbolt,False
search,i m looking for a novel called and then there was light,False
search,i d like to watch the trailer for as tears go by,False
search,find me the spartan total warrior painting,False
search,find the painting strong enough,False
search,show creativity of construction project information committee,False
search,what channel does the television show the roxbox play on?,False
search,can you find me the schooltool picture ?,False
search,show of from south africa to south carolina,False
search,find returned to your mind,False
search,where can i buy the movie totality,False
search,play the song culture and psychology,False
search,i want to see the novel the green,False
search,look for the movie darkness come alive,False
search,where can i buy a used copy of the game called i lie around ?,False
search,show the tv series the merry sisters of fate,False
search,can you tell me the actors of the saga awards/,False
search,find a saga called night life,False
search,find me the soundtrack called enter the chicken,False
search,where can i locate the game legion of mary the jerry garcia collection,False
search,show creativity of the game everything at once,False
search,look for all that matters,False
search,find love will tear us apart a photograph,False
search,where can i find the game skip to the end ?,False
search,find me the picture the id,False
search,show me the picture gas wars,False
search,find a world apart,False
search,what is a romance of the halifax disaster,False
search,i am looking for the tv series strays,False
search,i need a photograph of the oregon desert,False
search,look for the tv series all around performance horse weekly,False
search,show the creativity of the attic,False
search,find reproductions songs of the human league,False
search,look for the book titled iranian journal of fuzzy systems,False
search,find me the photograph the late music,False
search,play a trailer for give it all,False
search,where did the painting highs in the mid-sixties go?,False
search,search for informix wingz,False
search,i want to see the trailer for australian economic history review,False
search,i m trying to find annunciation,False
search,look up the collection volume one novel,False
search,where to buy unarchigal,False
search,find me nights in harlem,False
search,find a trailer called colony 7,False
search,find the album the peace-maker,False
search,get me kiss the crystal flake,False
search,find the movie everywhere but home,False
search,pull up the tv show 40 seasons the best of skid row,False
search,look for the high noon tv show,False
search,show crafty hands saga,False
search,play a box of birds trailer,False
search,find sappho,False
search,what is the current selling price of the novel the sims 3 island paradise ?,False
search,show the day the earth caught fire movie,False
search,i need top gear 2 please search it for me,False
search,find the real story with gretchen carlson,False
search,some me a healthy picture,False
search,look for global clubbing the netherlands,False
search,how do i watch the television show counting the rosaries ?,False
search,show the family from one end street album,False
search,find me the tv show ask a woman who knows,False
search,i want to read the book between a rock and a hard place,False
search,can you find me the assassination of jesse james by the coward robert ford saga ?,False
search,find the case of the frightened lady,False
search,can you help me find the television show women and death,False
search,find reverence for me,False
search,show me the tv show have a nice day,False
search,find long hello and short goodbye a movie,False
search,find the great hydration a tv series,False
search,go to attack of the planet smashers,False
search,i need to episodes for the tv series fast food nation,False
search,find bal ganesh 2 a video game,False
search,when is city of angels playing?,False
search,show me the caribbean blue television show,False
search,find the loving spirit,False
search,find the book a glorious way to die,False
search,how do i watch the tv show nba access with ahmad rashad,False
search,show panic in the streets,False
search,show the legend of jesse james novel,False
search,i d like to listen to the soundtrack in the air,False
search,find a tv show called studies in logic,False
search,search for the hills have eyes the beginning tv show,False
search,show transformers the game,False
search,find the picture music is the message,False
search,play me the soundtrack for nothing personal,False
search,what is the paranormal activity ghost dimension album ?,False
search,show under the sea creative video game,False
search,where can i find the creative works the very best of simply red,False
search,can i hear the song visual audio sensory theater ?,False
search,i need a novel about polymer chemistry,False
search,get me the elvis’ christmas album tv show,False
search,i am looking for shoot me down,False
search,show the blackberry bush show,False
search,please find the album the party scene,False
search,find a game called dynamite warrior,False
search,please find me asking alexandria discography,False
search,look for the creative work meltdown – days of destruction,False
search,what is the tv series in app store,False
search,find face the truth a tv show,False
search,find zorro the game,False
search,show me the when your heart stops beating photograph,False
search,please search the karobar economic daily picture,False
search,find cluster computing a game,False
search,find unfinished portrait of general bonaparte,False
search,i m looking for the birth of a nation,False
search,give me the spirit the earth aflame tv show,False
search,find playground a book,False
search,find painting big ideas,False
search,show me cut the rope video game,False
search,looking for liberalism and the limits of justice,False
search,need a creative work with the title unholy confessions,False
search,show the ancient art of war picture,False
search,show tv show schedule of offroad legends,False
search,show the bridge of san luis rey picture,False
search,want to watch the tv show treeful of starling,False
search,i d like to see a tv series called countdown the savoy sessions,False
search,search for comedy underground with dave attell,False
search,find a painting called thunder in the sky,False
search,do an image search for the picture perfect storm disasters that changed the world,False
search,show me the picture written in the stars,False
search,show creative work or miami vice theme,False
search,buy novel brokeback mountain,False
search,where can i purchase the game dancing in the dark 10 years of dancing ferret,False
search,find the they came from somewhere else saga,False
search,search for a picture of darker than black,False
search,find projections an album,False
search,look for the creative work called white sugar,False
search,find chant down babylon the island anthology,False
search,play myth ii soulblighter,False
search,are there any painting of the 1st concert oh yeah! 1999 ?,False
