Intent,Sentence,Outlier
movie,what is the wanda group movie schedules,False
movie,i d like to watch abbott and costello meet captain kidd at the nearest cinema,False
music,play satire,False
movie,find movie times at national amusements,False
music,play no more sorrow,False
music,play the top-twenty tune by masaharu fukuyama on slacker,False
music,play contigo en la distancia,False
music,play hughie graham by vidyadhar vyas,False
music,please play me some satire music,False
movie,give me some info on when hands across the border will be laying at the cinema,False
movie,give me showtimes for the tenth woman at the movie house,False
music,open pandora and play the top five melody by hanna sjedokowa,False
music,play the top-20 best chicane songs on deezer,False
music,play the top 5 by akira the don,False
music,i want to hear major harris s songs from the fifties,False
music,play some 1993 concerto off of slacker,False
movie,is the butcher boy playing anywhere at supper time?,False
music,play anything from hiromitsu agatsuma off iheart,False
movie,is proudly she marches playing anywhere?,False
music,play some bertine zetlitz record,False
movie,what time is the bride’s journey playing at star theatres ?,False
movie,can i watch flower and snake at movie house in one hour from now ?,False
music,play some music on pandora,False
music,play movement by duane allman,False
movie,find start time in 12 seconds for national bomb,False
movie,is a master of craft playing at wanda group,False
movie,what time is death nurse showing,False
music,play the most popular chant song by hossein alizadeh from around 2009,False
movie,i m looking for movie times search movies close by that start at 11 12,False
music,play nick hexum latest album,False
music,play ebony bones on itunes,False
music,i want to hear sarban s greatest hits,False
movie,what is the movie schedule at caribbean cinemas,False
movie,what time is socrates playing at the cinema ?,False
movie,where the sky meets the land time playing,False
movie,when is girls just want to have fun playing at the movie house ?,False
movie,find kerasotes theatres with movie times,False
music,play good pure soul on netflix,False
music,play andrew lloyd webber s good tune on zvooq,False
movie,is convoy busters playing,False
music,play music on lastfm,False
music,can you play a sammy fain ep,False
movie,i need a movie schedule for any films playing close by,False
music,play some sam moore,False
music,open deezer and play top 40 hits,False
movie,find movie times for great escape theatres,False
movie,i m wondering when i can see beating heart at the nearest cinema,False
music,play some eddie vinson on deezer,False
music,i want to hear vegetables by pharrell williams,False
movie,show me the movie schedule in the area near my home at seven am for animated movies,False
music,play the top 20 ep from the fifties by john bundrick,False
music,play the cross and the crucible by angela au man sze on google music,False
movie,what movies are playing at mann theatres,False
music,i want to hear some of david gilmour s music from 1973,False
music,play sugar baby by frank beard,False
music,play the song vodka by kunal ganjawala on itunes,False
movie,what s the movie schedule for b&b theatres ?,False
movie,can i get the listings for the film at the nearest movie theatre ?,False
movie,find invisible child at southern theatres,False
music,play an ep by uncle jimmy thompson,False
music,play iheart tunes by neil finn,False
movie,list movie times at megaplex theatres,False
music,play chant music by big dee irwin,False
movie,find the movie schedules for consolidated theatres,False
music,i want to hear a top-20 chant from the twenties,False
music,play the 1991 soundtrack from ian mcdonald,False
music,play the top twenty chant by wise,False
music,play an eighties track,False
music,can i hear a symphony from the seventies on youtube ?,False
movie,what films are going to be shown at the nearest movie house ?,False
movie,find movie schedules in the neighborhood for movies,False
movie,find movie schedules for movies around here at nineteen o clock,False
movie,find mary kom starting in one hour,False
movie,what movie schedules are animated movies close by,False
music,play shake your head,False
movie,is the slut playing at 07 27 a m at harkins theatres,False
music,play music by keren woodward,False
music,play netflix ballad by mike shinoda that is popular,False
movie,where can i see the somme starting at 16 01 04 ?,False
music,play music from youtube,False
movie,what time is a ball at the anjo house playing,False
music,play dansevise by ebi on groove shark,False
movie,i need current movie schedules,False
movie,what movie theatre is playing sherlock holmes and dr watson fifteen hours and one minute from now,False
movie,find the schedule for the kentuckians,False
movie,find the closest starting now movie house with animated movies,False
movie,where can i find the movie schedule ?,False
music,play that new song from 1970,False
movie,is the johnstown flood playing,False
music,play the greatest soundtrack by jesse harms,False
music,play a 2013 song on groove shark,False
movie,what movie times are around here playing animated movies,False
movie,what movie theatre has a matter of wife and death,False
movie,where can i find movie schedules,False
music,play eighties music on groove shark,False
music,play the album shooting silvio by dave sabo,False
music,play some annie herring beat street on itunes,False
movie,when and where is nefertiti queen of the nile playing?,False
music,play pop goes the 80s,False
music,listen to music from 1975,False
movie,what are the movie schedules for the loews cineplex,False
music,i want to hear something eclectic,False
movie,find movie schedule for animated movies in the area,False
movie,is the singing nun at regal entertainment group,False
music,play on spotify ms scandalous,False
movie,is transcending fear at malco theatres,False
music,play crucifixion on deezer,False
music,play the most popular song by espen lind,False
music,can you play a 1967 soundtrack on slacker,False
music,play moondog s chupacabra,False
music,play a new ballad by valy on iheart,False
movie,find the schedule for screen souvenirs at cinemark theatres,False
movie,what is the local movie schedule,False
music,listen to ballad songs from the twenties,False
music,play some acapella music on iheart,False
music,i want to hear dave seaman s ep,False
music,play blues on vimeo,False
movie,find me the showtimes for how to commit marriage,False
movie,can i get the showtimes for films in the neighbourhood,False
music,play the 2014 album from la lupe,False
movie,find the schedule for the closest films at a cinema at meal time,False
movie,find me showtimes for how i unleashed world war ii,False
music,play the greatest music by phoebe snow,False
music,play a new song form the eighties,False
movie,what animated movies are playing in thirteen hours at the closest movie theatre,False
music,play me against the world from glukoza,False
movie,when is you walk so softly playing at kerasotes theatres,False
music,play the greatest 1972 album by wes dakus,False
music,play some matthew sweet music from around 1996 on spotify,False
music,play the album dance hall at louse point,False
movie,show the movie schedules and films in the area,False
music,play 2gether by jade puget,False
movie,what is the nearest cinema playing patiala house,False
movie,what films are playing at the closest movie house,False
music,can you play some music by andrew diamond,False
movie,where is the penthouse playing,False
music,play the latest melody from cliff edwards on deezer,False
music,play fereydoun farrokhzad best track,False
music,play a popular sound track by joe pass on itunes,False
music,play a track from the thirties,False
music,play music from 1964,False
music,play some sabah from the eighties,False
movie,she me that movie schedule,False
movie,find a nearby movie schedules for movies,False
music,play deezer tunes are & be,False
music,play movement music from sheryfa luna,False
music,will you play a ballad from mahalaxmi iyer,False
music,play a popular ballad by amanda,False
music,play me a song from 1976 by bennie moten,False
music,play a ballad by bob johnston,False
music,play tooh by eric bazilian on google music,False
music,play brotherhood by ock joo-hyun,False
movie,i need movie times at fox theatres around zero pm,False
movie,showtimes for animated movies in malco theatres ?,False
music,play them the greatest music by chris frantz,False
music,i want to listen to a popular melody by david bazan,False
music,play 2007 tunes by bunny berigan,False
music,play some drum & bass,False
movie,what are the movie times at goodrich quality theaters ?,False
music,play some chant music from 2008,False
movie,can i see the movie schedules ?,False
music,open the playlist from sergei chatschatrjan,False
movie,does amc theatres have movie schedules out?,False
music,play music from the seventies,False
music,play yuauea by rick ross,False
movie,which movies are playing at amc theaters 1 second from now ?,False
music,please play me a top nineties theme song,False
movie,tell me the movie schedules for mann theatres,False
movie,can you bring up the movie schedule for arclight hollywood ?,False
music,please play jag vill leva i europa by porta,False
movie,what films are playing in the neighbourhood,False
music,play piano 100,False
music,play music from the eighties on slacker,False
movie,find the schedule for movies at star theatres,False
movie,where is my song goes forth playing,False
movie,what films are showing at three o clock at the neighborhood cinema group ?,False
movie,show the latest animated movies movie times for the nearest movie house,False
music,play a movement fromthe eighties by nobuo uematsu,False
music,play the most popular sort by ep by brooke fraser,False
music,play music by christian bautista,False
movie,show me the movie schedule in the neighbourhood movies,False
movie,i d like to watch films in 23 hours in the neighborhood,False
music,i want to hear choice on last fm from the twenties,False
music,can you play something from the fourties preferably a symphony ?,False
music,please play the most popular ep from 1998 by mc frontalot,False
movie,show me the schedule of movie warning from space closest to movie house,False
movie,whats the closest movie house showing home room,False
music,play music on my itunes,False
music,play playlist funtime,False
music,play isaac hayes on pandora from love sweat and beer ep,False
music,play greatest chant music from beni arashiro,False
music,i want to hear sia furler s popular songs on last fm,False
movie,i m wondering when i can see hurry sundown,False
movie,what time is the daring dobermans playing,False
movie,show me movie times at my local theater,False
movie,what is the movie schedule for films nearby,False
music,play 1977 good track tunes,False
movie,what time is 26 years diary showing in the movie house ?,False
movie,when can i see dinosaur from the deep,False
movie,what is the movie schedule for general cinema corporation ?,False
music,play some ven a mi,False
music,open youtube and play iron mountain depot from john lomax,False
movie,find the schedule for kingsman the secret service at a movie theatre,False
music,play pop 2017 picks,False
movie,is mentioned in confidence at the cinema,False
movie,what time is children of divorce playing,False
movie,where is road to the stage playing,False
movie,what are the mann theatres showtimes for secret sunshine,False
music,play some theme songs from 1974,False
music,i want to hear something from the top-fifty by jose pasillas,False
music,play angela winbush ep that is popular,False
movie,where is the nearest movie theatre showing movies,False
music,please play jim martin on vimeo,False
movie,i want to go see a troll in central park,False
movie,where and when is unleashed – entfesselt playing,False
music,please play me jerry lee lewis s if you say so track,False
movie,i d like to watch three word brand at the cinema,False
movie,i want to see the movie schedule for north american cinemas,False
movie,what is the movie schedule 1 second from now,False
music,play llegando a casa playlist,False
movie,what is the local movie schedule,False
movie,is covered wagon days playing at b&b theatres in 1 second ?,False
movie,what movie theatre is playing the missing picture,False
music,play kaori mochida s most popular music on google music,False
music,play a sixties song,False
music,play me a song from 1968 on spotify,False
movie,find films available at cooper foundation,False
music,play post garage wave revival playlist,False
music,play some eighties movement music,False
music,play some iris dement s theme based 2015 music on lastfm,False
movie,i m wondering what movies will be laying around here,False
movie,what time is chandranath playing mjr theatres,False
movie,is a charming man playing at lunch time?,False
movie,show me the schedule of american primitive in santikos theatres,False
movie,list films at the nearest movie house,False
movie,what s the nearest movie house showing their last love affair,False
movie,when is one sunday morning scheduled to be played?,False
music,play music on spotify,False
movie,what is the closest cinema with animated movies,False
movie,tell me what films are playing at plitt theatres,False
movie,find the movie schedule for the douglas theatre company,False
movie,can i see the upcoming movie schedule ?,False
movie,is terminal station at cinemark theatres,False
movie,find plitt theatres movie schedules,False
movie,what time is murph the surf playing,False
movie,when is the blood stain playing at the movie house ?,False
music,use deezer to play top five moya brennan,False
movie,find the movie schedule for close by films,False
music,play some fifties tunes by mike mccready,False
movie,what amc theaters is the red dance playing at?,False
music,play some seventies songs from joseph genaro on google music,False
music,play a song of i myself and me on youtube,False
movie,can i get the movie schedule for loews cineplex entertainment ?,False
music,play bebob on iheart,False
movie,what time is in old new mexico showing today?,False
music,play darude,False
music,play a music theme by anna nikolajewna jessipowa,False
movie,can i know what animated movies are scheduled in the neighbourhood ?,False
movie,list movie schedules,False
music,play me the most popular peja song on slacker,False
music,play the top-5 songs from paddy reilly on zvooq,False
movie,what time is the grey zone playing?,False
music,use groove shark to play krizz kaliko,False
movie,find the schedule for movies at the nearest cinema,False
music,can you play some weird music from the noise genre,False
music,play the most popular stuff by tina dico,False
movie,please show me the movies playing at amco entertainment,False
movie,find a feather in her hat at magic johnson theatres,False
music,play some deezer oldies music,False
movie,tell me the movie schedule,False
movie,is the young guard playing at the closest cinema,False
movie,find on dress parade,False
music,play furusato on google music,False
movie,give me the movie schedules for warren theatres,False
music,play the greatest from win stracke on groove shark,False
movie,find the dead matter at speakeasy theaters,False
movie,find movie times for nine pm,False
music,can you play me some pop-folk music,False
music,play songs by sammy fain,False
movie,can i see the movie schedules ?,False
music,play music from the album evolution of a man by joey ramone,False
music,play a top-twenty tune by noor jehan,False
movie,i need a schedule for the cinema that is showing the shiralee,False
movie,is green grass widows playing at the cinema,False
movie,find the movie times for nearby films,False
music,play classical x,False
music,play some the lady is a tramp from timour moutsouraev,False
movie,is amco entertainment showing cień caseya today?,False
music,play me a xuefei yang symphony on groove shark,False
music,play the album making evening and night by cevin key,False
movie,what movie house is showing sherlock holmes and the secret weapon,False
music,will you play my nuestros 80 playlist,False
music,please play different slanguages by fred labour,False
music,play 25 to life by paul riley on deezer,False
movie,what is the schedule for the fox and the child in cinema,False
music,please play a song from the thirties by peter murphy on last fm,False
movie,i want to see a list of local movie times,False
movie,what movies are playing at the closest movie house ?,False
music,play sivamani,False
movie,whats the nearest movie house showing animated movies,False
movie,show me the schedule of outlaw of gor at nearest movie house at 5 a m,False
music,play some music from roberto carlos,False
movie,what films are on the movie schedule for ten at a close by theater,False
movie,when is the third eye showing at dickinson theatres ?,False
movie,find hear me good,False
movie,find a cinema nearest showing twilight of shadows at breakfast time,False
movie,what s the closest movie house showing the legend of ben hall,False
movie,what animated movies are playing at fox theatres,False
music,play me an eighties song by wes dakus,False
music,play the best 1981 sound track from ric fierabracci,False
music,play chad i ginsburg,False
music,play eighties music by kaira kwong on google music,False
music,play songs on itunes,False
music,play the song long live love,False
music,play masashi hamauzu s newest symphony on itunes,False
movie,show me movie time for i am sorry at my movie house,False
movie,what movies are showing nearby,False
music,play bitch please ii from julee cruise on iheart,False
music,play some chanson style music,False
music,play music using groove shark,False
movie,find movie times for b&b theatres,False
music,play the greatest ballad from the seventies,False
movie,where can i watch mabel’s dramatic career at twenty two o clock,False
music,i want to hear the jody williams sound track,False
music,play some tango on iheart,False
music,play me an ep from 2005,False
movie,find films at alamo drafthouse cinema,False
movie,find fox theatres with the caretaker,False
movie,show movie times of regal entertainment group,False
music,play the latest ballad by september,False
movie,what time does the maze start at cineplex odeon corporation,False
movie,give me a list of films at amc theatres,False
music,play the last song from the thirties by airto moreira,False
movie,what are the animated movies in the neighbourhood for the recent movie times,False
music,play a song from 1973,False
music,play the newest 2016 ep from boaz mauda,False
music,play melody and sort the newest in dj format,False
movie,what are the movies scheduled to play at general cinema corporation,False
music,play some gangsta music,False
movie,is flow for love of water playing at southern theatres at 2 am,False
movie,find the schedule for wenn lucy springt now at a movie theatre,False
movie,i want to see king of the river in the nearest movie theatre,False
movie,what are the time for movies playing at star theatres ?,False
movie,i need movie times in the area for any type of movies,False
music,play me a song by avispa music from 1965,False
music,play music in the genre soundtrack,False
music,play movement music by monk boudreaux on youtube,False
movie,when is man in outer space playing at megaplex theatres,False
movie,what movies are playing at warren theatres ?,False
movie,find a movie house for 07 52 showing ganges river to heaven,False
movie,when is beyond my reach scheduled at the nearest cinema ?,False
music,play movement music from 1954,False
movie,find the schedule for for the unnaturals at 13,False
music,i d like to listen to opera on youtube,False
music,play my hardstyle baby playlist on netflix,False
music,play the thirties soundtrack by ghader abdollahzadeh on youtube,False
music,play a song from 2013,False
movie,where is the incite mill playing,False
music,can you play a song from the newest movement by prince on lastfm,False
movie,show me the nearest movie house showing he won a ranch,False
movie,find andreas hofer at elevenses,False
music,play a concerto that was most popular in 1958 by mickey hart,False
music,play some good amber gristak on lastfm,False
movie,what films are showing in the neighborhood,False
music,play me some goa,False
movie,find a movie house with ulterior motive that is closest,False
music,i d like to hear ami suzuki s latest record,False
music,play some instrumental music on the service lastfm,False
movie,what films are playing at 11 a m at dickinson theatres,False
movie,find the nearest movie house showing good morning babylon,False
music,play a tune or two from kansas city missouri,False
music,play melody music from the thirties,False
movie,i d like to see the showtimes for silly movie 2 0 at the movie house,False
movie,what time is high spirits playing?,False
movie,find the movie schedule for national amusements,False
movie,is the divine jetta at marcus corporation,False
music,play teri meri by josh white,False
movie,when is janeane from des moines playing at the nearest movie theatre ?,False
movie,when will the boys next door be playing at the nearest movie house,False
music,can you play that last ep from the twenties,False
movie,show me a movie schedule,False
music,please play me a popular track from 1984,False
movie,can i get the showtimes for fit for a king ?,False
movie,show me the movie schedule,False
movie,show me when scandalous john is playing,False
movie,what movies are showing in the neighbourhood,False
music,play within you without you by distance on zvooq,False
music,can i hear a movement by rookantha gunathilake on the vimeo service?,False
music,play a melody by colin blunstone,False
movie,show me the movie schedules for santikos theatres,False
music,please play a song for me from 1959,False
movie,i d like showtimes for the story of wish you were here,False
movie,find movie schedules for united paramount theatres,False
movie,what time is crush and blush playing at kerasotes theatres,False
music,play magic sam from the thirties,False
music,play newest soundtrack from 2008,False
movie,find berlin to the samba beat,False
movie,is las aventuras de zachary beaver at harkins theatres,False
movie,please show me the films playing at loews cineplex entertainment,False
movie,when is the next showing of star wars the clone wars ?,False
music,play a popular melody by lindsay lohan on youtube,False
movie,i want to watch animated movies at showcase cinemas,False
music,play calico skies by john feinstein with netflix,False
music,play music on last fm,False
music,i d like to hear cry baby cry by ally kerr,False
movie,is the kiss playing,False
music,play a record from 2005 by ruslana lyschytschko,False
music,i want to hear aki nawaz play the song fair annie,False
movie,what movies are playing one hour from now at cooper foundation ?,False
movie,movie times at consolidated theatres,False
movie,show me the animated movies starting at 10 56 18 a m at the nearest movie house,False
movie,give me the movie schedule for the great escape theatres,False
movie,show movie schedule of films in the area,False
music,can you play under the anheuser bush by pete doherty,False
music,play the music hands up,False
music,play the wizard and i on zvooq,False
music,play the best vanessa peters songs,False
movie,check movie schedules and find which animated movies are being aired in the neighborhood movie halls,False
music,play johnny gimble,False
music,play some mike burney on google music,False
music,play angelo amorevoli,False
movie,can i get the movie schedules for marcus corporation,False
movie,i m looking for movie schedule for films playing in the neighborhood,False
movie,show me movie times at mjr theatres at 02 39 23 pm,False
movie,which cinema is currently showing the youngest profession ?,False
music,play some ivy anderson from around 1967,False
movie,i d like to watch glass chin at the movie house at 17 32 30,False
movie,is dummy playing at two a m ?,False
movie,what movie times start in 22 seconds at magic johnson theatres,False
movie,give me the movie times at goodrich quality theaters,False
music,play a movement from 1974,False
music,i want to hear a gucci mane song from last fm from 2002,False
movie,when is have sword will travel playing at the closest movie theatre ?,False
music,play me a jill scott sound track on deezer,False
movie,i d like a movie schedule for a close by movies,False
music,play a top twenty symphony by bumble bee slim,False
music,play the cherry-tree carol by edwin mccain,False
music,let me hear the live from the ghetto album by beau jocque,False
movie,what movie times are harkins theatres,False
music,i need some ambient music,False
music,play the new timer by augustus pablo with itunes,False
music,play my hot 50 playlist,False
music,play a song by nash the slash,False
movie,i d like to watch i wish at the nearest movie theatre,False
movie,find the swindlers at the closest movie house,False
movie,i want to see some movies in a b&b theatres,False
music,play 1990 tunes on groove shark,False
movie,what time is rites of spring playing at marcus corporation,False
movie,find a movie house closest showing operation kingdom,False
music,play my playlist tgif on itunes,False
music,use lastfm to play attack of the planet smashers,False
movie,let me know what animated movies are playing around here,False
movie,where is project a part ii playing?,False
movie,show me dombey and son movies,False
music,play ngola ritmos top-ten songs,False
movie,i m wondering what cinema is playing peters baby,False
music,play are & be,False
music,i want to listen to a concerto from timour moutsouraev,False
music,play the most popular soundtrack by elena paparizou on youtube,False
music,play a top five jonny buckland symphony from around 1989,False
music,play a tune from 1973,False
