Intent,Sentence,Outlier
playlist,add the tune to my jazz vibes playlist,False
playlist,add el valle del jarama to my working day playlist,False
playlist,add share the well to my epic wall of sound,False
playlist,add another tune to kristines laundry playlist,False
playlist,add the rough guide to the music of eastern europe to my this is philip glass playlist,False
playlist,add als het om de liefde gaat to my this is handel playlist,False
playlist,can you put this tune onto latin dance cardio ?,False
playlist,i need to add an artist to one of my playlists classical new releases spotify picks,False
playlist,add this matt bachand tune to pure rock & roll,False
playlist,add east grand blues to the this is nicky jam playlist,False
playlist,add my old kentucky home to fresh finds fire emoji,False
playlist,add daigo to indietronic,False
playlist,put joseph utsler on all out 70s,False
playlist,can i put indocumentado onto my folk music at the gaslight café playlist?,False
playlist,add armand van helden to my black sabbath the ozzy years playlist,False
playlist,i want the turbonegro album to go on the playlist called genuine r&b,False
playlist,incorporate moribund the burgermeister into the 50 shades of love playlist,False
playlist,can you put the little grey mother who waits all alone into uncharted 4 nathan drake,False
playlist,add paula abdul to classic acoustic playlist,False
playlist,add tune this is puccini to my playlist,False
playlist,add this artist to fifa 17 soundtrack,False
playlist,include badmeaningood volume4 in jaimes animal stories playlist,False
playlist,add this infernus tune do marshas de camino a clase,False
playlist,add song in my playlist dance workout,False
playlist,add this raffaele riefoli tune to deathcore,False
playlist,add this track to my road trip playlist,False
playlist,please add to my playlist hype the name introducing a r rahman,False
playlist,put this kes song on the feel good indie rock playlist,False
playlist,add the track by paul gray to my 2010s smash hits playlist,False
playlist,add a-hunting we will go to the emily dickinson playlist,False
playlist,add a song to playlist chill hits,False
playlist,put new page onto my latin jazz playlist,False
playlist,add the tune to my women of latin music playlist,False
playlist,add welcome to the cruel world to my reggae classics playlist,False
playlist,add this song to my playlist named britpop etc,False
playlist,add htoo ein thin to my brooklyn beat playlist,False
playlist,add kd lang to my deep focus playlist,False
playlist,add artist to my broken heart,False
playlist,add pimp c to my workout remix,False
playlist,add a track to my playlist classic acoustic,False
playlist,add a tune to my sleep sounds list,False
playlist,add track to indie electronics playlist,False
playlist,add undressed to my country icon playlist,False
playlist,add steel guitar rag in acoustic covers the mash ups,False
playlist,add the tune to my house afterwork playlist,False
playlist,put coming back to life onto winter music,False
playlist,add the crowd to corinnes acoustic soul playlist,False
playlist,add this artist to the laugh list,False
playlist,put this kan mikami tune on fresh finds cyclone,False
playlist,add song to my eletro br playlist,False
playlist,i would like to add to my plalist visjoner onto the old school metal one,False
playlist,put the artist michael todd in my afternoon train ride list,False
playlist,add mr j medeiros to my women of country playlist,False
playlist,put this tune onto my party through the decades playlist,False
playlist,add this song to my crossroad blues playlist,False
playlist,add robin trower to the medieval 50 spotify picks playlist,False
playlist,add this song to my fairy tales,False
playlist,put this tune playing into my la mejor música dance 2017 playlist,False
playlist,add halfway between here and there to my canadian country playlist,False
playlist,add this song to my love hurts playlist,False
playlist,add welcome to the cruel world to my reggae classics,False
playlist,add moby grape live to enamorándose,False
playlist,add elkie brooks to happy birthday playlist,False
playlist,add jalal zolfonun to my nature noise,False
playlist,add this song to indie hipster,False
playlist,add this tune to my guest list gamesradar playlist,False
playlist,i want you to add a george chisholm tune to my 40 hits playlist,False
playlist,add salil chowdhury to my 35 soul classics 1970 to 1975 playlsit,False
playlist,add o b mcclinton to my playlist called women of electronic,False
playlist,i would like you to add now the hits of winter 2008 onto my ntc studio sounds playlist,False
playlist,add por una cabeza to my playlist called this is new edition,False
playlist,put wreck of the tennessee gravy train in the kids workout playlist,False
playlist,add the singer ivan roudyk to my fairy tales playlists,False
playlist,add fabrice morvan to folk for kids,False
playlist,add artist john william boone to my lifes short; play fast playlist,False
playlist,for the classic road trip songs add the entity unwelcome,False
playlist,include hohenfriedberger marsch to my novedades pop list,False
playlist,go ahead and add blowfly to my this is schubert list,False
playlist,add michael balzary to mujeres y hombres y fiesta,False
playlist,add this artist to my 80s party,False
playlist,put this album on my playlist titled dance hits,False
playlist,add toi to my timeless love songs playlist,False
playlist,i want new steps to go on the leche con chocolate list,False
playlist,add classic punk by chab,False
playlist,add potje met vet to my electronic gaming playlis,False
playlist,add artist post metal to playlist,False
playlist,put artist harry burleigh on classical new releases spotify picks,False
playlist,include sean yseult in kaitlins metal overload playlist,False
playlist,add this tune by hal patino to my ambiente rnb playlist,False
playlist,put kim kibum in my the martin garrix show playlist,False
playlist,add harlow wilcox to hip hop club bangers,False
playlist,add dear hearts and gentle people to he tokyo rising playlist,False
playlist,add eef barzelay to the trad folk playlist,False
playlist,incorporate a russel walder track onto gays funk rock playlist,False
playlist,add a kiley dean tune to my jazz for loving couples playlist,False
playlist,add artist to todo edm,False
playlist,add megon mcdonough indie songs for slackers to my playlist artist,False
playlist,can you add a song by bill frisell to my top latin alternative playlist,False
playlist,add an album to my week end playlist,False
playlist,add song to women of sxsw,False
playlist,put this track on operación bikini,False
playlist,add this artist to my the road to punk rock playlist,False
playlist,can you add through the darkness they march to my once upon a time playlist,False
playlist,for my té para tres list add cut the world,False
playlist,can you put falling upstairs on my playlist entitled this is thomas rhett,False
playlist,add a tune to my playlist guest list polygon,False
playlist,add amir khan to my playlist acoustic blues,False
playlist,add the artist choclair to la mejor música de bso,False
playlist,rate tune to 90s baby makers,False
playlist,love in paris needs some frank farian in the playlist,False
playlist,the zen focus playlist needs david franj in it,False
playlist,add 21 at 33 to the playlist called wake up everybody,False
playlist,add 2012 zwanzig zwölf to my miami 2017 guest list,False
playlist,id like johnny nash to be put into my playlist always pop punk,False
playlist,add this song to blues roots,False
playlist,add yameen to the uncharted 4 nathan drake playlist,False
playlist,add strong to the metal monday playlist,False
playlist,i want you to put this track onto the playlist called throwback party,False
playlist,add a tune to rare groove,False
playlist,add el choclo to my women of classical list,False
playlist,add the spirit of life to nação reggae,False
playlist,add kjetil vidar haraldstad to my para entrenar playlist,False
playlist,add teriazume to the nação reggae playlist,False
playlist,put a molly mcguire album in my metal talks kreator playlist,False
playlist,add artist to my playlist primavera sound 2016 barcelona,False
playlist,add this tune by jim white to my playlist rumba y más,False
playlist,add track nature noise to my playlist,False
playlist,to johnnies funtime activity playlist add the name the best of guitar shorty,False
playlist,add this song to my lo que suena new york playlist,False
playlist,matt monro newest album add to my chill out music,False
playlist,add house afterwork to my the cave canem demos,False
playlist,put johnny wakelin on my té para tres lis,False
playlist,put this album on r&b movement,False
playlist,add the name the magnificent tree to playlist this is rosana,False
playlist,add hanging on to my just dance by aftercluv playlist,False
playlist,add my track to old school metal playlist,False
playlist,add this tune to my dance playlist,False
playlist,put anna grigorjewna semenowitsch in all out 00s list,False
playlist,put limey onto my this is astor piazzolla list,False
playlist,add something by paul whiteman to my sweet soul chillout playlist please,False
playlist,add chong nee to my spread the gospel,False
playlist,add artist brenda k starr to frescura indie,False
playlist,add welcome to the cruel world to my reggae classics,False
playlist,add godmusic to my latin dance cardio playlist,False
playlist,add track by klute to winifreds de camino a clase playlist,False
playlist,i want to add digital line to my playlist called infantil,False
playlist,add when ice met cream to this is alejandro fernández playlist,False
playlist,i want to add the tim smith album to my best of 2010s playlist,False
playlist,add from the ashes to my rock gaming playlist,False
playlist,i would like ignacio figueredo s tune added to electronow,False
playlist,put ik tara onto pure seduction playlist,False
playlist,add ilse delange to my journey playlist,False
playlist,add vertexguy to beach vibes,False
playlist,add the secret wars into the digging now playlist,False
playlist,add of rivers and religion to my sexy as folk playlist,False
playlist,please include danni bassan in my perfect concentration,False
playlist,add this album by bruce dickinson onto top entrevistas my playlist,False
playlist,add the name cry like a baby to my a mis niños de 30 playlist,False
playlist,add no more sorrow to ultra metal,False
playlist,add artist rob dougan to electronow,False
playlist,add album to bajo las estrellas,False
playlist,add this album to my just dance by aftercluv playlist,False
playlist,add ace hood to the this is aretha franklin playlist,False
playlist,go to my all out 00s and add brian wilson,False
playlist,add another song to the country playlist,False
playlist,add chris walla to trabajo relax,False
playlist,add the album to the fantasía playlist,False
playlist,add robert nighthawk to novedades pop,False
playlist,add tune by leonard cohen to road trip,False
playlist,add this album to trotamundos,False
playlist,place this tune in workout remix,False
playlist,add this song to cleaning,False
playlist,add the crabfish to my playlist called the sleep machine rainforest,False
playlist,add this tune to the refugee playlist,False
playlist,add this artist to gretchens soul revived playlist,False
playlist,add this tune to my party ¡fiesta,False
playlist,add como un tatuaje to my hits of the 70s playlist,False
playlist,put this tune on my nothing but a party r&b playlist,False
playlist,add dwele to marguerites eurovision 2016 playlist,False
playlist,please put the artist matt mckenna in my this is shakira playlist,False
playlist,add a song to my playlist a peaceful rush hour,False
playlist,add song in playlist metal monday,False
playlist,can you put live in detroit on the playlist peaceful piano,False
playlist,put artist serenata onto my massive soca hits list,False
playlist,the road trip playlist needs justin utley in it,False
playlist,add this album to tgif,False
playlist,add inconfundible to the piano in the background playlist,False
playlist,add julian taylor to my latin dance cardio list,False
playlist,add dimitri fampas s song to my focus now,False
playlist,add daniel zueras to lush vibes,False
playlist,add this album to my adrenaline workout,False
playlist,add joe mcphee to my picnic in the park play list,False
playlist,add another tune to my verano playlist,False
playlist,input this album onto my all things post list,False
playlist,add this song to my indie acoustic playlist,False
playlist,add the artist to my indietronic playlist,False
playlist,put jim fairchild onto spotlight spain 2016,False
playlist,add robin trower to feminist friday playlist,False
playlist,can this song get added to lunchtime ?,False
playlist,add black ribbons to the autumn playlis,False
playlist,i want to add michelle heaton to this is chopin,False
playlist,add banana republic to my this is puccini playlist,False
playlist,please put linzi stoppard into my sxsw fresh playlist,False
playlist,put the broken wave on lo más dance,False
playlist,add track to my global top 50,False
playlist,add david cole to an instrumental sunday,False
playlist,put edwyn collins onto my trabajo relax playlist,False
playlist,please add moon river to my metalcore playlist,False
playlist,add kylie minogue to my novedades viernes sudamérica playlist,False
playlist,add some jim diamond to peace,False
playlist,add this song to my cleaning the house playlist,False
playlist,add armen movsessian to this is skepta playlist,False
playlist,put this artist on instrumental study playlist,False
playlist,add showcase in a suitcase to the chill out playlist,False
playlist,add yma sumac to this is animal collective,False
playlist,add an album to the días de frío playlist,False
playlist,add the tune by misato watanabe to the trapeo playlist,False
playlist,please add carmel to my lunchtime playlist,False
playlist,add licorice mckechnie to just dance by aftercluv,False
playlist,napoleon xiv should be added to sharlenes playlist transatlantic lullaby,False
playlist,add artist to my playlist i love my 80s rollerdisco,False
playlist,add this tune to my top 100 rock tracks on spotify,False
playlist,estelle should be on my spring playlist,False
playlist,put the frl menke song in my comedy top tracks,False
playlist,i need to add another track to my cleaning playlist,False
playlist,add this track to my love hurts playlist,False
playlist,put this lidell townsell track on esenciales,False
playlist,add ian stuart donaldson to canadian country,False
playlist,add igor talkow to my women of k-pop list,False
playlist,add this album to my playlist named café libros,False
playlist,add space cowboy to my the funny thing about football is playlist,False
playlist,put this artist onto the chillin on a dirt road playlist,False
playlist,please add the singer valery kipelov to the perfect concentration list,False
playlist,add the album to my heavy gamer playlist,False
playlist,add keltech to my 70s road trip playlist,False
playlist,i want to add anna semenovich to the dinner with friends playlist,False
playlist,move el viaje de copperpot into my emily dickinson playlist,False
playlist,add track by monster bobby to peace playlist,False
playlist,please put this tune into the all a cappella playlist,False
playlist,add zos kia cultus to the this is philip glass playlist,False
playlist,put this track on alok house party playlist,False
playlist,my té para tres needs brave and crazy added on,False
playlist,add exorcising ghosts to joys thrash attack playlist,False
playlist,add curse song to my playlist guest list engadget,False
playlist,can you put musiri subramania iyer s song onto the lo-fi love soundtrack?,False
playlist,add you put a move on my heart to the martin garrix show,False
playlist,add to my playlist lazy chill afternoon nothing can stop us,False
playlist,i want 4813 added to my rhythm and blues playlist,False
playlist,i want these are the days added to my spotlight spain 2016 playlist,False
playlist,add the patty patty sound to my metal talks kreator playlist,False
playlist,i want to add black ribbons to the i love my neo soul playlist,False
playlist,add i messed up to hit rewind,False
playlist,add rise of the infidels to my bring back the 90s playlist,False
playlist,add song to kids workout,False
playlist,i want to add this bon scott song to my post-grunge list,False
playlist,add the artist todd snider to my electro latino playlist,False
playlist,put this album on my wild country playlist,False
playlist,can you put a song from tom jones on my electronica & dance playlist,False
playlist,add this artist to romántica,False
playlist,want to add pacific ocean blues to the playlist named lunch,False
playlist,add artist to my texas red dirt playlist,False
playlist,can you put freddie freeloader on the playlist instrumental madness,False
playlist,add come on a cone to power walk playlist,False
playlist,add this album to jenifers mellow dinner playlist,False
playlist,add joe gibbs to my the bachelor party playlist,False
playlist,add a tune to my elrow guest list,False
playlist,add song to instrumental study,False
playlist,id like to put qriii onto songs to sing in the car,False
playlist,i want to add a tune to my spanish metalblood playlist,False
playlist,add wastedagain to the wild & free workout playlist,False
playlist,add the trey gunn tune to my french n heavy playlist,False
playlist,add hello i must be going to the power ballads playlist,False
playlist,add la woman to my soul lounge playlist,False
playlist,i want to add this so chan whee tune to latin alternative music,False
playlist,add song to my el mejor pop en español,False
playlist,add the track to the metal talks metallica playlist,False
playlist,put the song playing on lavernes rapcaviar playlist,False
playlist,add a kanon wakeshima track to the feeling blue playlist,False
playlist,add entre um coco e um adeus to taylors this is john williams playlist,False
playlist,add party with friends by constructs of the state to julianas playlist,False
playlist,add appreciation day to my folksy love,False
playlist,add however much i booze to my playlist called atmospheric black metal,False
playlist,this artist should go onto my playlist called the piano bar,False
playlist,add a track to the emo forever playlist,False
playlist,add inca roads to my weekend,False
playlist,put this album in my fiesta section,False
playlist,add this song to enids romántica playlist,False
playlist,add this artist to my throwback dance party playlist,False
playlist,add animal stories to maryannes by per yngve ohlin,False
playlist,add vyechnyy strannik to lo que suena new york,False
playlist,please add chris frantz to pop rising list,False
playlist,add tune to my playist the piano bar,False
playlist,can you add something by wynter gordon to my soul lounge playlist,False
playlist,put artist hridaynath mangeshkar onto my night out playlist,False
playlist,add album to acoustic spring,False
playlist,add contact to my nu metal playlist,False
playlist,add the artist beardyman to my classical x playlist,False
playlist,add falling stars to my intense studying,False
playlist,please add this track to my de camino playlist,False
playlist,add karusellen to jazz brasileiro,False
playlist,add artist danny carey to my classic jazz singers playlist,False
playlist,add por tu maldito amor to my orgullo gay,False
playlist,i want another song in the women of latin music playlist,False
playlist,add happy holidays to my playlist called its ok to like jazz,False
playlist,add genocide to electronic bliss,False
playlist,add my favorite track to baroque 50 spotify picks,False
playlist,for my playlist latin pop rising add aira yuhki,False
playlist,ad artist to sxsw latin my playlist,False
playlist,add keke wyatt to my evening commute playlist,False
playlist,add hot house to have you met miss jones,False
playlist,add album to my country hits,False
playlist,add the wee wee man to pamelas stress relief playlist,False
playlist,put k maro track on my soul lounge list,False
playlist,please add emanuel kiriakou to my playlist llegando a casa,False
playlist,add hound dog taylor to the miami 2017 guest list playlist,False
playlist,add ihsahn to hip hop 2017 new school,False
playlist,add this album the the playlist canciones que lo van a petar,False
playlist,add the open door to autumn music,False
playlist,add this artist named trevor mcnevan to the playlist top gaming tracks,False
playlist,add jim martin to deathcore,False
playlist,my timeless love songs playlist should include viderunt omnes,False
playlist,add the album to my top 100 indie tracks on spotify playlist,False
playlist,add rosemary clooney to pura vida playlist,False
playlist,add a song by mark schultz to my ultimate indie playlist,False
playlist,for the playlist wild & free workout add tsidii le loka,False
playlist,put the bill berry track on elrow guest list,False
playlist,put take up thy stethoscope and walk onto my verano playlist,False
playlist,add a song to my playlist independent music monday,False
playlist,put kurt cobain onto korean osts,False
playlist,add the avispa track to my bass gaming playlist,False
playlist,add don and sherri to my meditate to sounds of nature playlist,False
playlist,add this track to anochecer urbano,False
playlist,add another artist to the spotlight on country 2016 playlist,False
playlist,please add this track to my weekend list,False
playlist,add paper doll to the power walk playlist,False
playlist,put michael cretu onto my beach vibes playlist,False
playlist,add top 100 indie tracks on spotify to my track,False
playlist,add this clint mansell song to latin pop classics,False
playlist,add fair charlotte to the we everywhere playlist,False
playlist,add track to orgullo gay,False
playlist,add this song to my playlist named wild country,False
playlist,add michael wittig to the party playlist,False
playlist,put the airi suzuki album into my nuclear blast novelties playlist,False
playlist,add scott putesky to concentración indie rock playlist,False
playlist,add the song to my r&b movement playlist,False
playlist,i want maximilian mutzke added to acoustic concentration,False
playlist,put this song on legendary guitar solos,False
playlist,add great grape to my playlist named novedades pop,False
playlist,please place tim wright s track onto the queen playlist,False
playlist,add this song to tanias new boots,False
playlist,add reggaeton classics in playlist jennie jennie,False
playlist,put the mike oldfield album onto my la mejor música para tus fiestas playlist,False
playlist,i want a matt garrison tune in my fresh finds fire emoji playlist,False
playlist,add this track to tamekas dance playlist,False
playlist,add this wayne raney tune to my this is kudai,False
playlist,add maschi e altri to my this is john williams,False
playlist,i want to add a song to the sunshine reggae playlist,False
playlist,add décadas to my list neo da matrix,False
playlist,add split the difference to my womens lit playlist,False
playlist,add some fujimoto yae to my women of rock list,False
playlist,add bien acompañado to all out 60s,False
playlist,i want lay down your arms in the indie español playlist,False
playlist,put framed onto my ntc studio sounds playlist,False
playlist,add the darkest red to this is jennifer lopez,False
playlist,add in the heart of the world to the epic gaming playlist,False
playlist,add this artist to lo más dance playlist,False
playlist,add this artist to my garage jams,False
playlist,add this track to llegando a casa,False
playlist,i want to add broken hearted melody to the playlist post garage wave revival,False
playlist,add some patrick stump to maritzas disco fever list,False
playlist,add cleo laine to psychedelic rock,False
playlist,put another track in the keep calm playlist,False
playlist,add a track to my dinner playlist,False
playlist,put perfecting loneliness onto primavera sound 2016 barcelona,False
playlist,can super turnt up get added to my emotron playlist?,False
playlist,add song to evening playlist,False
playlist,add villotta to the metalsucks playlist playlist,False
playlist,add anti ep to esenciales,False
playlist,edit top 100 indie tracks on spotify playlist by adding smokefree rockquest 2005,False
playlist,add the go find to sólo para dos,False
playlist,put this tune on all a cappella,False
playlist,add this tune by rafet el roman to my latin pop rising playlist,False
playlist,add this artist to my morning rhythm playlist,False
playlist,add omnipresent to verano,False
playlist,put this tune by mark norman on my keep calm list,False
playlist,add the time warp to wild & free workout,False
playlist,i want cocco added to my post metal playlist,False
playlist,please add this this tune to the playlist this is selena,False
playlist,add the artist kamil rustam to my relaxing playlist,False
playlist,add another album to my friendesemana playlist,False
playlist,add this tune to my in the arms of a woman,False
playlist,add chris de burgh in my playlist melancholia,False
playlist,add 9am in dallas to my classical music for smart kids,False
playlist,in my playlist rock gaming add mariem hassan con leyoad,False
playlist,add the singer damon johnson album to my african heat playlists,False
playlist,can you put consequences on my sos 48 2016 playlist,False
playlist,will you add pat kirtley to my covered in punk playlist,False
playlist,incorporate a roberto parra sandoval track into the cena elegante playlist,False
playlist,can my electro sur have this song added to it?,False
playlist,add track to this is zezé di camargo & luciano,False
playlist,for my playlist post garage wave revival add the name eternal prisoner,False
playlist,add picasso baby to digster reggae playlist,False
playlist,will you put this song onto women of electronic,False
playlist,i need to add a tune by amanda stern to the playlist cloud rap,False
