Intent,Sentence,Outlier
search,where can i see the trailer for phineas redux ?,False
search,look for the thorns saga,False
search,where can i stream a television show called safety ep ?,False
search,please find me glass cloud – single,False
search,find a video game called new york 911,False
search,i d like to hear the song in a reverie,False
search,what is party all night,False
search,find the fields of sacrifice movie,False
search,where can i purchase the saga the second life of samuel tyne,False
search,find a soundtrack called the outpost,False
search,find a book called screwed,False
search,show me heavenly sword,False
search,find a trailer called hellboy the troll witch and others,False
search,show creative work of through the back door,False
search,play the what i need to do soundtrack,False
search,can you find me the restless natives ?,False
search,find a show called the paper route,False
search,show acta mathematicae applicatae sinica tv show,False
search,where can i locate the show the return of mr moto,False
search,pull up the trailer for 2000 years – the millennium concert,False
search,please find me the rear mirror saga,False
search,show creative last light,False
search,find the living room tapes a tv series,False
search,i m looking for the music of nashville season 3 saga,False
search,please search the work eve-olution,False
search,find the picture their finest hour,False
search,show me the album apache axis2,False
search,show creativity of book future of the past,False
search,find the television show titled spatial query server,False
search,find a trailer called sheriff of tombstone,False
search,play keep their heads ringin’,False
search,what is the tv show this is halloween ?,False
search,i m looking for a game called gateway,False
search,find as live as it gets,False
search,find a soundtrack called the spanish jade,False
search,play the knockabout soundtrack,False
search,show the collectors video game,False
search,i d like to see the game called god is in the tv,False
search,please search for the work wholehearted,False
search,find a video game called a stroll in the pork,False
search,where can i locate leo the lion for purchase,False
search,find to each his own cinema an album,False
search,look for the trailer for red stallion in the rockies,False
search,find black mirror iii final fear,False
search,find a tv show called randy scouse git,False
search,show thousand miles movie,False
search,show the my world 20 photograph,False
search,show me the work titled the perfect gentleman which is a song,False
search,show creativity in the red saga,False
search,please find me the platinum box ii song ?,False
search,find the show the naked gun,False
search,what type of movie is houston press ?,False
search,could i download chavez inside the coup ?,False
search,find half a sixpence photograph,False
search,show the immortal grand prix,False
search,find your personal touch,False
search,find a show called friday download,False
search,where can i find conduct unbecoming ?,False
search,i want to watch the show food force,False
search,find the video game the sims 3 generations,False
search,i want to listen to the song first time for everything,False
search,play me east side story,False
search,find clash of the codes,False
search,find the labyrinthe game,False
search,find a saga called set sail the prairie,False
search,want to find a creative work called the prayer,False
search,where can i buy a photograph called feel the love ?,False
search,show me the movie black summer,False
search,find the tv show tribute to the troops,False
search,show the singles collection volume 4,False
search,i want the song phrazes for the young,False
search,find a picture called neighbourhood,False
search,please help me search the banker television show,False
search,i want to listen to the soundtrack adobe digital editions,False
search,find a show called big broadcast of 1938,False
search,find the exile and the kingdom,False
search,find an album called thursday night baseball,False
search,find join the dots b-sides and rarities,False
search,show creativity of song a discord electric,False
search,show creativity in call me joe,False
search,i d like hear the song sit down and talk to me,False
search,play the home is where the music is tv series,False
search,show the put yourself in his place game,False
search,show creativity of home brew,False
search,play the baldur’s gate ii throne of bhaal saga,False
search,find a video game called craters of the sac,False
search,i am looking for a creative work called something warm,False
search,find me the book called suffer,False
search,can you please find me dream ?,False
search,show video game name find the colour,False
search,find the tv series shaun the sheep,False
search,play the album the outpost,False
search,please search for all the lovers trailer,False
search,find the movie chaos is me,False
search,find a trailer called peggy sue,False
search,find the another ticket game,False
search,play the song sf sound furniture,False
search,find a painting called screen souvenirs,False
search,play the great adventures of slick rick game,False
search,i need a painting called brubeck plays brubeck,False
search,find the novel what we did on our holiday,False
search,find a tv show called shake hands with beef,False
search,i need journal of pediatric oncology nursing help me find,False
search,i want the complete global albums collection,False
search,i want to watch the show frank sinatra sings the select sammy cahn,False
search,where can i see the show twentysomething,False
search,find me i am mariah… the elusive chanteuse,False
search,find the apple address book television show,False
search,where can i download the game miss robin hood,False
search,find half cut tea,False
search,what is the price for the album praise the lord and pass the ammunition ?,False
search,how do i see the tv series to see the invisible man ?,False
search,where can i purchase wuthering heights,False
search,please look up the painting beyond iconic photographer dennis stock,False
search,show family plot,False
search,i m trying to find the game called give me my remote,False
search,find darker than black,False
search,i want television show come again smith,False
search,show me the movie purple heart diary,False
search,find a tv series called dirty politics,False
search,i want to find the very best of chicago only the beginning,False
search,i m looking for the video game masterful mystery tour,False
search,find the youth against christ saga,False
search,find back for good a novel i want to read,False
search,please fine me ties that bind,False
search,find a novel called twins of evil,False
search,show me the edge of love photograph,False
search,find a saga called lovex discography,False
search,show the mickey mouse photograph,False
search,show me horton and the kwuggerbug and more lost stories,False
search,can i buy the book vacation of petrov and vasechkin online?,False
search,find waiting for touchdown a book,False
search,where can i find police story 3 supercop,False
search,find the angry birds movie,False
search,can you find a picture of the rambler,False
search,what is the cave canem demos photograph ?,False
search,show tv series schedule of gears of war,False
search,search for the halfway home tv show,False
search,find the trailer for the spooky sisters,False
search,find a photograph called between the days,False
search,please search for the live in san juan capistrano picture,False
search,where to get painting of channel 4 news,False
search,find a soundtrack called the alice cooper show,False
search,what is the release date for the dvd called wild is the wind ?,False
search,find a soundtrack called billboard hot r&b hits 1981,False
search,show schedule for cin cin,False
search,i m looking for the trailer to evil or divine - live in new york city,False
search,i d like to see the book the royal thousand,False
search,search for the painting hess a biography,False
search,find the garden of eden,False
search,i d like to see spyforce,False
search,look up the dock of the bay show,False
search,show the soonchild painting,False
search,find the picture chorus line,False
search,find a trailer called just say noël,False
search,show the invisible hook trailer,False
search,find a novel called best hits live save the children speed live 2003,False
search,find a novel called downward to the earth,False
search,find a picture of music hole,False
search,i m looking for the movie white unicorn,False
search,show the philosophy and phenomenological research saga,False
search,find a trailer called storm center,False
search,search for the album frog and the birdsong,False
search,can you find me the work titled a little curious ?,False
search,i d like to see the picture the principle of hope,False
search,where can i purchase the twenty chickens for a saddle saga ?,False
search,find the app store,False
search,i m looking for an album called the orchestrion project,False
search,show the best of minnie riperton saga,False
search,find the tv show starship titanic,False
search,find the tv series the farewell tour,False
search,find phalcon,False
search,find information about the album flipper city,False
search,find all about aubrey,False
search,how do i find the soundtrack african development perspectives yearbook ?,False
search,find the little death a soundtrack,False
search,play the song red lanta,False
search,need to find a creative work with the title sometimes the blues is just a passing bird,False
search,find an album called stumblestoprepeat,False
search,find the digital champ battle boxing,False
search,find a novel called nature reviews genetics,False
search,where can i find the picture of house foundation,False
search,find the moldy peaches,False
search,shw the picture twin husbands,False
search,i m looking for circus world,False
search,show me a picture called heart like a hurricane,False
search,find the burn the sky down album,False
search,look for the saga called death in paradise,False
search,look for the album called the tale of mr jeremy fisher,False
search,look up the hard to handle tv show,False
search,i need info on the video game iron fist,False
search,look for the chu chu and the philly flash picture,False
search,i want the show the sense apparatus,False
search,find soundtrack titled the house of the yellow carpet,False
search,find a tv show called the extraordinary,False
search,where can i find the painting rss tracking,False
search,want to see the dungeons & dragons chronicles of mystara,False
search,find digimon next,False
search,i d like to play the album beloved rogues,False
search,find me haunted castle,False
search,find the blood red sandman,False
search,where can i watch the latest episode of the tv show chu chu and the philly flash ?,False
search,find me a game called thesis eleven,False
search,find the innocent when you dream saga,False
search,play pirates of the caribbean online,False
search,look for the nightmare on providence street saga,False
search,where can i get lahore,False
search,i am looking for the complete fillmore east concerts,False
search,find a tv show called perfect chemistry,False
search,find city of light,False
search,find a song called in your eyes,False
search,show creativity of what is dead may never die,False
search,where can i find the movie called cracking contraptions ?,False
search,show me the saga my darling,False
search,find conker live and reloaded,False
search,find a photograph called shout it out,False
search,can yo find me the game a silence that screams ?,False
search,show the drive of life album,False
search,find heroquest ii legacy of sorasil,False
search,find the show manthan,False
search,find a picture called how much wood would a woodchuck chuck,False
search,find the most important people a television show,False
search,show me it might as well rain until september,False
search,show creativity of photograph of my wonderful day,False
search,where can i find on the marble cliffs,False
search,can you find the album simplescreenrecorder,False
search,please find the show kim hyun-joong discography,False
search,i d like to listen to the song the natural farmer,False
search,find starcross,False
search,find a photograph called accion newspaper,False
search,please find the infrared riding hood tv show,False
search,play baby workout,False
search,show creativity of painting of me too,False
search,i want to watch the television show new astronomy,False
search,find politicsnation with al sharpton,False
search,find an album called preminchi choodu,False
search,i d like to see the show onion sportsdome,False
search,find book the music lovers,False
search,find me the novel titled fertile ground,False
search,find once upon a time in the west,False
search,find me the movie with the title of twitches,False
search,where to watch television show linger awhile live at newport and more,False
search,when does fire and ice the winter war of finland and russia television show air?,False
search,show creativity of southtown,False
search,play tales from the organ trade,False
search,find the video game journal of criminal law & criminology,False
search,find she monkeys,False
search,i need to find the creative work wave,False
search,find a picture called battlefield network,False
search,find an album called just call me stupid,False
search,find stays in mexico,False
search,find thyme travel,False
search,i want to listen to the album magical girl lyrical nanoha strikers,False
search,find terminator 3 the redemption a picture,False
search,show texas review of entertainment & sports law creative song,False
search,find the son of man show,False
search,i want to watch the original recordings,False
search,find jono and ben,False
search,show me the atrocity exhibition,False
search,i d like to find the book called the years,False
search,search for the adventure of the blue carbuncle,False
search,find a tv series called cocktail kings,False
search,find bump off lover,False
search,show me god bless the child photograph,False
search,can you find me the my father my king game ?,False
search,what is the cheapest price i can pay for the dvd called the darkest cloud ?,False
search,find a painting called the wipers times,False
search,find me the karl hess toward liberty photograph,False
search,search for a painting of the wannadies,False
search,find the video game high hopes & heartbreak,False
search,find a photograph called the dickinsonian,False
search,i d like to see the trailer tony parker,False
search,i want to watch the television show naked ii,False
search,look up the show cissy houston,False
search,can you look for the creative work called no gravity,False
search,i want to read the novel alone at the microphone,False
search,find me the rise and fall of the great lakes saga,False
search,find the now we are six saga,False
search,find the game gormenghast,False
search,find an album called burnout the ultimate drag race challenge,False
search,look for the trailer to hickory daily record,False
search,find a television show called happy trails,False
search,show me my princess,False
search,play show of cissy houston,False
search,find me the novel of a dictionary of slang and unconventional english,False
search,find wild solutions a saga,False
search,show me firepower,False
search,find a painting called smash crusher,False
search,look up the act of valor tv show,False
search,what is the book sell your body ?,False
search,show creative video game in my own backyard,False
search,go to the saga the quantum thief,False
search,please look up the around the world in eighty days movie,False
search,can you find me the magic hour song ?,False
search,find 300 march to glory a song,False
search,please find me the book step into my groove,False
search,show the monkey soundtrack,False
search,find the sarah the teen princess game,False
search,can you locate the novel ismol family,False
search,i m looking for the album called disorderly conduct video on patrol,False
search,show creative devils to some,False
search,find a painting called mr scarface is back,False
search,find outback bound a trailer,False
search,show me the trailer for the glades,False
search,show creative video game the boat is full,False
search,i d like to see the album heroes of might and magic iv,False
search,find innocent world,False
search,show more questions than answers trailer,False
search,can you find me the stand proud book ?,False
search,find a soundtrack called the book of folly,False
search,find me the martin morning saga,False
search,i d like to see the movie edinburgh evening news,False
search,play the tv series heart of gold,False
search,i want to listen to keep the faith,False
search,play me the trailer for gainesville daily register,False
search,i want to watch the tv show tales from space about a blob,False
search,please search thirayum theeravum video game,False
search,lets see the tv series 7even year itch,False
search,show me a novel by onnaam muhurtham,False
search,find a novel called under blackpool lights,False
search,please find brand new strings,False
search,find live at bearsville theater,False
search,find welcome to the el-palacio a movie,False
search,i m looking for the painting god must have spent a little more time on you,False
search,play live at leeds,False
search,please look up the novel heroes of annihilated empires,False
search,search for the nations,False
search,get soundtrack of comprehensive knowledge archive network,False
search,i want to read the saga michael clayton,False
search,find le profil amina tv series,False
search,please get me the before crisis final fantasy vii television show,False
search,find cover her face,False
search,find the stone free game,False
search,i d like to watch the tv show hola mary lou prom night ii,False
search,show me then we came to the end,False
search,please search cardin in australia saga,False
search,please get me the welcome to the rileys game,False
search,show me kurdishmediacom,False
search,find a painting called chettathi,False
search,help me search ufc on fox show,False
search,show creativity of doomsday comfort,False
search,show the phish live in vegas tv series,False
search,find young miss holmes,False
search,show me the trailer for live phish volume 12,False
search,look up the stars are indifferent to astronomy,False
search,find oman medical journal,False
search,i m looking for the song called standing for something,False
search,get me a picture about sardonic wrath,False
search,please find me chance pe dance,False
search,find the news at seven-thirty photograph,False
search,play the trailer for a lineage of grace,False
search,show me dangers of the canadian mounted,False
search,play the movie post inferno soundtrack,False
search,please search for the microsoft safety scanner television show,False
search,find a video game called no parking on the dance floor,False
search,look up applied linguistics,False
search,show me the album clarke,False
search,show creativity of diamonds in the rough,False
search,play the ashley tisdale discography tv show,False
search,find me the princess battles song,False
search,search for the exiles of time book,False
search,can you find fire escape in the sky the godlike genius of scott walker,False
search,show me the photograph rock you baby,False
search,find trauma center new blood an album,False
search,show an actress for the newest album,False
search,show painting of waiting for snow in havana,False
search,show saison 5 de game of thrones,False
search,where can i find the tv show metabolights,False
search,pull up the video game apothecary rx,False
search,find episodi di south park a trailer,False
search,where can i watch the picture i’ll take care of you ?,False
search,find friendship way,False
search,find me the novel between the rivers,False
search,show song schedule of shoot for the moon,False
search,play everybody wins trailer,False
search,i want to read the book the lion sleeps tonight,False
search,show famous classic tales television show,False
search,please help me find the selections from the arista years video game,False
search,where can i buy a barometer clock,False
search,i want to play the video game miss castaway and the island girls,False
search,show creativity of the album saga,False
search,help me find the book called journal of neuroscience research,False
search,find the tv series truly fine citizen,False
search,help me find the work graphics animation system for professionals,False
search,can you locate the saga for the ringo sheena discography,False
search,looking for the painting last flight to abuja,False
search,can you find me the game super scription of data ?,False
search,find a show called chompa toung,False
search,find me the song called the budapest beacon,False
search,i want to watch the tv series rat pack,False
search,can you find the tv show faithless street,False
search,please get me the british journal of dermatology game,False
search,show second generation album,False
search,find a photograph called the lighthouse by the sea,False
search,find a tv series called live hearts,False
search,find do you wanna touch me a song,False
search,please look up the 4-hour workweek saga,False
search,where can i purchase a copy of the photograph on the front page of today s jacksonville daily progress ?,False
search,find the tv series from the top,False
search,find the envoy of lucifer show,False
search,where can i watch the tv series polite people,False
search,find nhl on fox,False
search,where can i find sebastien grainger & the mountains,False
search,find a television show called merced sun-star,False
search,find a video game called merry andrew,False
search,find me the painting fallen sanctuary,False
search,find the album biology today an issues approach,False
search,find wish you were here,False
search,find the show the sword of the lictor,False
search,where can i find the trailer for sensations of 1945,False
search,search for the show champagne showers,False
search,find the flying scotsman,False
search,find the photograph jboss enterprise soa platform,False
search,please search for the puppet on a string video game,False
search,find a television show called the passion of the betty,False
search,show me born in america ?,False
search,show creative album heredity,False
search,i want to find night of the hunter,False
search,find the novel wwe legends of wrestlemania,False
search,i m trying to find the show chant ii,False
search,find the song tholireyi gadichindi,False
search,where can i find the photograph of a christmas memory,False
search,find the steady as she goes saga,False
search,find a television show called twisted,False
search,find me the fruit of life television show,False
search,where can i see the show latin for lovers ?,False
search,go to bioruby,False
search,show me the movie called people and masks part 2,False
search,find a movie called bruce lee,False
search,what is the cheapest online price for the instincts saga ?,False
search,find the trailer for real men cry,False
search,is there any creative work for heterocycles ?,False
search,find a game called bump the show,False
search,show me the game english freakbeat,False
search,i am looking for the creative work a wonderful life,False
search,where can i find lonely hearts,False
search,show me the book playlist the very best of dolly parton,False
search,can you help me locate the game coast ?,False
search,find the radical history review saga,False
search,find the hopeless romantic photograph,False
search,look for the itvcom song,False
search,find the novel the thunder rolls,False
search,find a show called the crowd roars,False
search,look for the district 9 novel,False
search,read the black-body theory and the quantum discontinuity novel,False
search,need find the book called hollywood connection,False
search,read the open ecology journal,False
search,find the gamble,False
search,find a novel called kiss me licia,False
search,locate me the novel entitled isthmus,False
search,find the carrousel saga,False
search,please locate sad love story novel for me,False
search,play remains of the day,False
search,find the boys in the band,False
search,where can i see the movie across the line the exodus of charlie wright ?,False
search,show me the picture unfinished monkey business,False
search,show me bâton rouge,False
search,look for the american journal of sociology,False
search,find a soundtrack for dante’s peak,False
search,fimd glory,False
search,i m looking for a job in inversion,False
search,find next of kin,False
search,show me a television show named a love to hide,False
search,where can i watch the trailer of the national treasures - the complete singles,False
search,look up the game called the long morrow,False
search,i need the book titled lullaby of broadway,False
search,can you find the tv show so what,False
search,find the show portrait of countess karoly,False
search,i d like to see the picture the collection – the collector 2,False
search,show creative song called holidays on the river yarra,False
search,who was the artist who did the painting called spyro 2 season of flame ?,False
search,i want to hear the soundtrack to the platinum rule,False
search,help me find the work unite and win,False
search,i d like to watch the trailer for dungeons & dragons chronicles of mystara,False
search,find family feud novel,False
search,find the game blogbridge,False
search,i d like to watch episodes from the tv series the secret of queen anne or musketeers thirty years after,False
search,find the earth is a sinful song,False
search,i want to watch supernatural the unseen powers of animals,False
search,find the trailer for hit the ice,False
search,find a pet of the cairo zoo,False
search,what is the painting forever malcolm young ?,False
search,i want to view the picture in old monterey,False
search,show creativity of all for one,False
