Intent,Sentence,Outlier
playlist,i want to put paul young onto all new all now,False
playlist,add little pattie track in nu metal,False
playlist,add hopeful to my this is enrique iglesias,False
playlist,add current track to hillary clintons womens history month playlist,False
playlist,add a kj 52 track to the te quiero playlist,False
playlist,my feelin good playlist needs some mai selim in it,False
playlist,add anson hu to my conexiones list,False
playlist,add a track by big sha to my this is miranda lambert playlist,False
playlist,add this artist to my 59th grammy awards,False
playlist,add frank beard to my latin pop classics playlist,False
playlist,add one and only to my once upon a time playlist,False
playlist,add sunday express live to workout playlist,False
playlist,please add faccetta nera to my this is handel playlist,False
playlist,add new metal tracks in my tune,False
playlist,add patti page album to i love my neo soul,False
playlist,add annette artani to the playlist titled all out 90s,False
playlist,put this tune on my your favorite coffeehouse playlist,False
playlist,add metal church to my playlist named stress relief,False
playlist,add track to fresh finds,False
playlist,add song to daily lift playlist,False
playlist,add without your love to my showstopper being mary jane list,False
playlist,add this track to epic wall of sound,False
playlist,i want lance king in my list called one love,False
playlist,i want to add johnny burke to the country bound playlist,False
playlist,add maria magdalena to my poetry in their own voices playlist,False
playlist,add defined by struggle to chillin on a dirt road to my playlist,False
playlist,move josiah leming to te quiero list,False
playlist,add this tune to my primavera sound 2016 barcelona,False
playlist,incorporate nao kawakita into the epic classical playlist,False
playlist,please add something by steve freund to my this is luis fonsi playlist,False
playlist,add the artist p d q bach to the te quiero playlist,False
playlist,can you add honey hush to hits of the 60s,False
playlist,add women of metal to odetta holmes,False
playlist,add revolution revolución to my political punks,False
playlist,id like t add day after day to evangelines party of the century playlist,False
playlist,add zion golan to my signed xoxo playlist,False
playlist,add ava leigh to my grime instrumentals playlist,False
playlist,add daedelus to my lazy chill afternoon,False
playlist,add the artist to my duetos,False
playlist,add julia fordham to the massive soca hits playlist,False
playlist,add a track to my alok house party playlist,False
playlist,add blue feather to the nature noise playlist,False
playlist,add księga urodzaju to abigails concentración,False
playlist,add big generator to my country icon playlist,False
playlist,add the album to the six string peacefulness playlist,False
playlist,add this tune to my playlist guest list mashable,False
playlist,put claude vonstroke onto my this is earth wind & fire,False
playlist,add all together now to my playlist the road to punk rock,False
playlist,i would like to put taylor dayne on the pop 4 kids list,False
playlist,add tune to downtempo beats,False
playlist,can you put in person at carnegie hall on my winter playlist,False
playlist,add visible wings to my playlist entre los andes,False
playlist,add a tune to the calm vibes playlist,False
playlist,add steve jones to my chill list,False
playlist,stick fonseca in the songs to sing in the car playlist,False
playlist,i wish to put tom baxter onto my coffee table jazz playlist,False
playlist,add cary brothers to rock the 2000s playlist,False
playlist,add this song to my esenciales playlist,False
playlist,add los hombres calientes volume 3 new congo square to my descanso infinito playlist,False
playlist,add driven to tears to the viral semanal playlist,False
playlist,add the private collection onto my cena elegante playlist please,False
playlist,add boyce and hart to urban hits playlist,False
playlist,add an artist to my hype list,False
playlist,add harry chapin in stress relief playlist,False
playlist,add this album to the playlist guest list engadget,False
playlist,this track should get added to spain top 50,False
playlist,add tony mcguinness to my playlist i love my 90s hip hop,False
playlist,put this track on musica española 2017,False
playlist,add the album to my wild country playlist,False
playlist,add get happy to cherrys las canciones más lindas del mundo,False
playlist,add halley to this is tchaikovsky,False
playlist,add this song to my the perfect italian dinner playlist,False
playlist,add this song to my canción del día playlist,False
playlist,add nico to my rock to work,False
playlist,include love love love in the dinner music playlist,False
playlist,please add a track to my playlist called this is coti,False
playlist,add yang hyun seok to the playlist called night out,False
playlist,add spirit touches ground to my leche con chocolate list,False
playlist,add this tune to my 70s road trip list,False
playlist,i want to add the war is not over to geraldines pop punk powerhouses playlist,False
playlist,add hello my lover goodbye to my deathcore playlist,False
playlist,i need to add to the funk soul disco playlist my favorite artist,False
playlist,add sci-fi crimes to the fresh folk playlist,False
playlist,add the artist verano to my michael mantler playlist,False
playlist,add unconscious state to my 90s smash hits,False
playlist,add warning device to my mac n cheese playlist,False
playlist,add rob tyner to betsys we everywhere,False
playlist,add tune to blues,False
playlist,can you add something by vikki thorn to my lo mejor de los 80s playlist,False
playlist,add so far to my retrovisor playlist,False
playlist,add venetian snares onto the atmospheric calm playlist,False
playlist,add theater to my new metal tracks playlist,False
playlist,add tune to my mellow bars playlist,False
playlist,put gregory douglass in halloween teens please,False
playlist,add a tune to this is wagner,False
playlist,add christopher lawrence to my always pop punk playlist,False
playlist,add this album by karl davydov to reynas this is luis fonsi playlist,False
playlist,add geminism to power workout list,False
playlist,add album to my massive soca hits,False
playlist,id like for you to add owen biddle to my old school death metal playlist,False
playlist,add doing all right to string theory,False
playlist,add milas poli to my indie bluegrass,False
playlist,can you add john scofield newest tune the selektor to the playlist,False
playlist,add this annabella lwin track to indie alternativa,False
playlist,put another tune into my dancehall official playlist,False
playlist,add paloma negra to my funky jams list,False
playlist,i want you to add must b 21 to acoustic covers the mash ups,False
playlist,add track to my lifes short; play fast playlist,False
playlist,add joshua radin to my playlist called futuros hits,False
playlist,add art garfunkel to the chill tracks playlist,False
playlist,add bryan gregory to the playlist emily dickinson,False
playlist,add another song to my this is status quo playlist,False
playlist,add run rudolph run to my rockin playlist,False
playlist,would you put hammer onto the lunch playlist?,False
playlist,put something by noah wuv bernardo on my humor playlist,False
playlist,find focus now list and add eylem to my playlist,False
playlist,add this eric weissberg song to my dance workout,False
playlist,add rak biszewilo to my playlist named jazz,False
playlist,put this tune on guest list take,False
playlist,add fear and bullets to my chill tracks playlist,False
playlist,id like to put duett onto my hot country playlist,False
playlist,add r u still in 2 it to the under the surface playlist,False
playlist,add this song by george melly to my 90s baby makers playlist,False
playlist,include in my dreams in the this is new edition playlist,False
playlist,add another song to the acoustic soul playlist,False
playlist,add monster monster to my throwback thursday playlist,False
playlist,add this track to the playlist kickass metal,False
playlist,add song to punk playlist,False
playlist,add george baker to hiphop hot 50,False
playlist,add sam sparro to my playlist called beach vibes,False
playlist,edit aux cord privileges playlist by putting this tune on it,False
playlist,can you put this tune onto erins house afterwork playlist?,False
playlist,can you make an addition to the old enough to enjoy this playlist with martin barre ?,False
playlist,add artist to latin pop hits,False
playlist,play used to love her to my this is animal collective playlist,False
playlist,add francesco de gregori to my classical new releases spotify picks playlist,False
playlist,play suus to my the funny thing about football is playlist,False
playlist,add outside the dream syndicate to millicents fresh electronic playlist,False
playlist,add this tune to the duetos playlist,False
playlist,put playa fly onto my 2010 decade playlist,False
playlist,add that was only yesterday the last ep to my afternoon train ride playlist,False
playlist,i want to put this artist in mellowed out gaming,False
playlist,add a rachael price album to todo edm,False
playlist,add philip labonte to women of r&b playlist,False
playlist,add kisaki to family road trip playlist,False
playlist,add volver to my pop gaming playlist,False
playlist,put nothing remains the same on my summer music playlist,False
playlist,id like to put ryō yamazaki onto my sylvia plath playlist,False
playlist,add sweets edison to relaxing playlist,False
playlist,add ana carolina to chill,False
playlist,add decade in the sun best of stereophonics to laundry,False
book,rate the fall-down artist 5 stars,False
book,rate the current novel one points,False
book,rate the ape-man within 4,False
book,rate licence renewed a 4,False
book,give this essay a 2 out of 6,False
book,a rating of 5 of 6 points goes to dickson mccunn trilogy,False
book,rate beyond the shadows 3 of 6,False
book,give 2 out of 6 points to the following textbook,False
book,the previous textbook is a 3,False
book,rate small screen big picture a 0 out of 6,False
book,rate the current novel a 0 out of 6 points,False
book,give this book a rating of 3,False
book,rate the tropic of cancer book a 2 out of 6,False
book,i would give this current textbook five points or a rating of 6,False
book,i am rating this book titled the billion dollar ransom 3 stars,False
book,i would give sixty lights chronicle a rating of five and a best rating of 6,False
book,rate this novel 1 of 6,False
book,i would rate this chronicle 4 stars,False
book,give a human being died that night 3 stars,False
book,rate this current saga 3 out of 6 points,False
book,rate the wild boy series 3 out of 6 stars,False
book,give this textbook 5 points,False
book,give two stars to current album,False
book,rate the current saga a five,False
book,give 0 rating to she and allan book,False
book,i want to give this album 3 points,False
book,rate the cry of the owl a four,False
book,give zero / 6 stars to the current album,False
book,swine not ? deserves four points,False
book,i rate naked in death a 5,False
book,give the current series 3 points,False
book,the next album is only one stars,False
book,rate this book three points,False
book,rate this novel a 3,False
book,rate the keys to the white house a zero,False
book,rate call for the saint 1 out 6 points,False
book,rate merlin effect a 0,False
book,give this album three out of 6 points,False
book,the last hawk gets a total of 3 out of 6 stars from me,False
book,i rate american history a survey a 5,False
book,give this current novel a 4,False
book,give this current novel a three,False
book,rate the current chronicle book three points,False
book,rate the bunce 1 stars,False
book,give this textbook a rating of 3,False
book,another girl another planet gets only one of a possiable 6 rating,False
book,rate this textbook 2 of 6 stars,False
book,i give the spirit of st louis a 1,False
book,rate the book post office four points,False
book,give 5 rating for this textbook,False
book,rate the current novel 3 of 6 stars,False
book,rate the watsons four of 6 stars,False
book,this novel should get zero points for how intrepid it is,False
book,i didn t like the book nobody lives for ever i give it a 2,False
book,rate this current book album four stars,False
book,give death on the nile a three,False
book,rate the gorilla hunters 0 stars,False
book,rate this current essay three out of 6 stars,False
book,this is rated 5 out of 6 for an essay,False
book,rate the current album one points,False
book,i give a zero rating for this essay,False
book,rate the current album 3 of 6 stars,False
book,i rate the chronicle son of the tree with four of 6 points,False
book,this current album deserve 0 points and a best rating of 6,False
book,rate the stars shine down 5,False
book,give one / 6 points to who will cry when you die,False
book,i think this essay should be given four points and a best rating of 6,False
book,for this current saga i give 5 out of 6 possiable points,False
book,i give the lacuna a rating of 5 stars under the chronicle rated at 6,False
book,give zero point to this textbook,False
book,rate this album book zero out of 6 points,False
book,i am rating this book 5 out 6 points,False
book,rate if tomorrow comes 2 of 6 stars,False
book,rate the current chronicle series 3 out of 6 points,False
book,rate this novel three out of 6,False
book,i give one clear call zero out of 6 points,False
book,rate the practice of the presence of god one of 6 points,False
book,give 0 out of 6 points to this essay,False
book,rate the beyond black saga a one,False
book,rate the current novel 5 of 6 points,False
book,give 5 out of 6 points to short trips a universe of terrors,False
book,i give this book dictionary of the english language a 4 rating,False
book,rate of old hearts and swords a 0,False
book,give the following essay one stars,False
book,rate the current novel zero points,False
book,and a body to remember with gets a full 5 stars,False
book,rate witchcraft and paganism in australia 1 points out of 6,False
book,i am rating this book under the series section a three out of 6 stars,False
book,rate the current essay 5 of 6 points,False
book,for this novel i give a rating of 4 out of 6,False
book,i give ruled britannia a rating of five out of 6,False
book,i rate 4 of 6 points for this textbook,False
book,i want to give think like a freak one stars,False
book,rate the current essay a one,False
book,award blood tables 2 points,False
book,give the current novel a one out of 6 rating,False
book,give two out of 6 to current book,False
book,i give this last novel only 1 points,False
book,rate the current textbook a 4,False
book,give four points to current essay,False
book,the cool world gets 4 points,False
book,rate the sunrise lands a zero,False
book,rate lords of the rim zero stars,False
book,rate current book 2 of 6,False
book,score this album 5 stars,False
book,i give the universe maker a rating of zero,False
book,give 3 points to current textbook,False
book,i think the current album should get a four out of 6 rating,False
book,rate goodbye mr chips one stars,False
book,the current album deserves 0 stars,False
book,give this chronicle a 4,False
book,give one out of 6 points to this essay,False
book,rate the current book 0 of 6,False
book,rate they came from the sea 1 of 6 points,False
book,the stars for behind the beat should number four for this chronicle,False
book,i want to give the current textbook 0 stars,False
book,glory season deserves a perfect 5 points,False
book,give three out of 6 points to this album,False
book,i give a rating of four to this textbook,False
book,give begums thugs and white mughals four points,False
book,give portions from a wine-stained notebook short stories and essays 0 points,False
book,i would rate the kid from hell a value of 1 and a best rating of 6,False
book,give two points out of 6 to this essay,False
book,rate this essay with three of 6,False
book,rate the current essay with 4 points,False
book,give this novel a rating of 1 points,False
book,rate six months in mexico 1 out of 6,False
book,give two stars to scribblings,False
book,i want to give rebbe the life and teachings of menachem m schneerson the most influential rabbi in modern history two out of 6 points,False
book,rate the longest day with zero stars out of 6,False
book,give star trek the motion picture a five out of 6,False
book,rate colorless tsukuru tazaki and his years of pilgrimage one stars,False
book,i only give blood work two stars,False
book,give the last child 4 of 6,False
book,for this current essay i give 5 of 6 points,False
book,give 4 out of 6 stars to this textbook,False
book,give this album 0 stars,False
book,rate the current novel one of 6,False
book,this essay is five stars for sure,False
book,i give the screaming staircase a five,False
book,rate the current series 1 points,False
book,give 0 points to the eudaemonic pie,False
book,the evil experiment gets zero out of 6 points,False
book,rate my current album 5 points,False
book,rate the current novel 5 of 6 points,False
book,rate this novel 1 of 6,False
book,i would rate this essay 2 stars and a best rating of 6,False
book,i would like to rate the book the three impostors 2 to 6 stars,False
book,rate this book three out of 6,False
book,rate the doors of perception 3 stars,False
book,give 4 stars to this essay,False
book,rate the current textbook five of 6,False
book,the series city on fire is a four,False
book,rate the book the ninth avatar 3 out of 6 stars,False
book,rate the current textbook four out of 6,False
book,i would rate the persistence of vision 1 stars and a best rating of 6,False
book,give this current book zero out of 6,False
book,give physics of the impossible four points,False
book,i want to give this album 4 stars,False
book,rate this album one stars,False
book,rate the rogue lawyer 4 out of 6,False
book,give three points out of 6 to one hundred poems of tukaram,False
book,i want to give elephants can remember 4 out of 6 points,False
book,rate this album three of 6 points,False
book,rate this is how you die chronicle a one,False
book,rate the book giants of the frost two out of 6 points,False
book,i think this textbook should have a rating of four and a best rating of 6,False
book,i give this novel a 0 out of 6 rating,False
book,i would like to rate this album 3 points and a best rating of 6,False
book,rate the current album 5 out of 6 points,False
book,give power of faerûn two of 6,False
book,rate the current chronicle 0 of 6,False
book,rate this essay a two out of 6,False
book,give this book chronicle four stars,False
book,rate this essay five points,False
book,give this textbook a 5 out of 6 rating,False
book,rate the philosophic thought of ayn rand three of 6 stars,False
book,give the whisperer a rating of 0,False
book,can you rate this novel as a four ?,False
book,rate the last textbook three stars,False
book,i give the battle of bretton woods saga two of 6 stars,False
book,rate this album 0 points,False
book,give five out of 6 stars to current essay,False
book,gve 2 points to the stinky cheese man and other fairly stupid tales,False
book,give the crisis one / 6 points,False
book,rate this book called kings of the high frontier four points,False
book,give this book a rating of two out of 6,False
book,i give this album a 0 of 6 stars,False
book,rate the current album a 3,False
book,this chronicle gets a three out of 6,False
book,give this novel two points,False
book,give one out of 6 points to current series,False
book,for the textbook out of 6 possible i give the following one a 3,False
book,rate this textbook 1 of 6,False
book,give 0 points to the hand in the glove,False
book,rate this novel a 1 of 6 for me,False
book,i give this essay 0 of 6 stars,False
book,rate the last opium den 0 points,False
book,rate the current essay 2 stars,False
book,give the current series a one,False
book,give the current part of the series 1 points,False
book,rate in search of our origins two points out of 6,False
book,rate this book the book of snobs 1 points,False
book,give the racing the rain saga zero stars,False
book,programming the universe is average and deserves three stars out of 6,False
book,i think this book should have a rating value of 1 and a best rating of 6,False
book,i would rate the door to december 3 points and a best rating of 6,False
book,this textbook only gets two out of 6 stars,False
book,give this book 1 stars,False
book,give this book zero stars,False
book,i am giving paedophilia the radical case a rating of 2 out of 6 points,False
book,put a rating of 0 out of 6 to this chronicle,False
book,give 0 to the sky village,False
book,i give a rating of 2,False
book,to the book swine not?,False
book,i want to rate the medici seal two out of 6 points,False
book,rate the current book a zero,False
book,give 4 out of 6 stars to current chronicle,False
book,rate the broke who killed the middle classes? chronicle a five,False
book,rate gray mountain a zero,False
book,i would rate oblivion stories a two,False
book,the battle for skies gets a three,False
book,i would give the series history decoded the 10 greatest conspiracies of all time a rating of 3 points,False
book,rate political liberalism 1 out 6 stars,False
book,please rate the current album 4 stars,False
book,rate the previous essay four of 6 points,False
book,i want to give the first person and other stories 0 out of 6 stars,False
book,rate the current album 2 points out of 6,False
book,rate the book the egoist five out of 6,False
book,give 1 out of 6 points for collected works,False
book,rate the current book 0 stars,False
book,rate winnie-the-pooh four out of 6,False
book,rate the man from the ussr and other plays a 0,False
book,rate the book oath of swords three for 6,False
book,rate the strange death of tory england 1 stars,False
book,i am giving the current book two stars,False
book,rate secret weapon a four,False
book,rate the current textbook 4 of 6,False
book,rate a division of the spoils 5 stars,False
book,i would rate this book a value of 3 and a best rating of 6,False
book,rate the book strumpet city zero for 6,False
book,give five points to an ice-cream war,False
book,give 3 out of 6 points to the secrets of love,False
book,rate renewable electricity and the grid one stars out of 6,False
book,rate my current book five points out of 6,False
book,give jackass investing a three,False
book,rate this textbook a 4,False
book,rate this essay 4 of 6 stars,False
book,i gave the current series 0 points,False
book,rate the at the villa rose series 3 of 6,False
book,put a rating on this book of three,False
book,rate this novel 3 out of 6 points,False
book,give 2 out of 6 stars to current chronicle,False
book,this current book only nets 3 out of 6 points,False
book,give this book 2 out of 6 stars,False
book,i give the last textbook one out of 6 points,False
book,give song of scarabaeus five of 6,False
book,i d rate this essay 1 out of 6,False
book,i rate observations one points,False
book,give wannabe how the spice girls reinvented pop fame 2 points,False
book,for the book the mirrored heavens i give one of a possiable 6 stars,False
book,i would rate this novel a four,False
book,rate break no bones series a 1 of 6,False
book,rate the current album 5 points,False
book,give the televised morality series a one,False
book,rate this chronicle a 0,False
book,rate the book saga a coin in nine hands 0 points,False
book,this album is rated at a 0 out of a possible 6,False
book,can you give this textbook a 2 out of 6 ?,False
book,give 4 out of 6 stars to this textbook,False
book,i rate the book creature in the teacher 3 stars,False
book,give this essay four stars / 6,False
book,rate the bishop a 1,False
book,rate the joy of gay sex a 5 out of 6,False
book,rate this textbook zero stars,False
book,add this current book five stars,False
book,i rate monster mythology 3 points,False
book,the coming insurrection should get a rating of 1,False
book,give the book buzz about bees a 2 star rating out of 6,False
book,freud a life for our time deserves a solid 4,False
book,give this textbook 3 stars,False
book,rate this novel four stars,False
book,i would give basic battle skills a rating of four,False
book,rate the current novel 1 of 6,False
book,out of 6 give the morganville vampires a 1,False
book,diana in search of herself is average and gets a 3 out of 6 points,False
book,rate this saga two with a bet rating of 6,False
book,i am giving this current novel 4 out of 6 stars,False
book,rate in the eyes of mr fury zero of 6,False
book,rate dictionary of the english language a 4,False
book,give the current essay 3,False
book,rate this textbook a 1,False
book,give 5 out of 6 stars to creatures of light and darkness,False
book,rate the loneliness of the long distance runner 0 points / 6,False
book,rate this essay two out of 6 stars,False
book,give the body artist a 5,False
book,rate seeing with the eyes of love 5 points,False
book,rate hocus bogus a 4,False
book,rate the first death 1 stars,False
book,rate the book the outlaws of sherwood two stars,False
book,rate the demolished man a five,False
book,give 3 out of 6 stars to this essay,False
book,i would give zero stars to a concise treatise on the art of angling out of 6,False
book,rate my current book 3 out of 6,False
book,4 stars out of 6 is the rating for fires of azeroth,False
book,rate the confidence-man 3 points,False
book,rate the current book 1 of 6 points,False
book,i give 1 stars out of 6 to this current series,False
book,the stars total 6 but journey under the midnight sun gets a four,False
book,i rated the island of adventure saga a 2 of 6,False
book,i d give with lee in virginia a story of the american civil war chronicle 4 of 6,False
book,rate the brothers karamazov a four,False
book,rate atop an underwood early stories and other writings 0 out of 6 stars,False
