Intent,Sentence,Outlier
restaurant,i want to book a restaurant for a year from now in maine,False
restaurant,can you get me seating for a party of 4,False
restaurant,book me a bar thats highly rated for georgia and i in burkina,False
weather,when will it be warmer in white horse mauritius,False
restaurant,book a table at a brasserie type restaurant that serves jain for a party of 8,False
weather,weather for jun ninth 2033 in san pierre romania,False
weather,tell me if it ll be freezing in 5 years in rockholds norfolk island,False
weather,forecast for switzer,False
restaurant,i need a reservation for red square on aug the 9th,False
restaurant,i need to get a restaurant reserved in sd,False
weather,what is the forecast for the current position,False
weather,will it be hotter on oct the 20th in massachusetts,False
weather,what is the weather forecast for latvia strasburg,False
restaurant,find a table for 7 at a joint in ok thats far from here,False
weather,is it snowy in fort ross state historic park ?,False
weather,what is the humidity like in leoti,False
restaurant,i need a reservation for 2 within walking distance of hoyt st,False
restaurant,id like to eat at a restaurant around china with a party of 7 anywhere that serves ouzeri,False
weather,will it storm in texola delaware,False
weather,is there going to be a depression in point washington state forest,False
weather,please check the weather forecast here,False
weather,what is the lualualei forecast for one minute from now,False
restaurant,reserve a table for nine people at a caribbean restaurant in white creek utah,False
weather,what will the weather be like at me current position in seventeen seconds ?,False
weather,was the weather colder last august at stunt ranch santa monica mountains reserve,False
restaurant,book a spot for kelli jean and i at a pub at elevenses,False
restaurant,book a table for 1 1 second from now in adelaide,False
weather,what is the weather forecast for north carolina on october thirteenth 2037,False
restaurant,therese clara and i want to go to the tennessee ridge,False
weather,tell me when it will be humid here,False
weather,will it be temperate in hybla valley tajikistan,False
restaurant,id like to eat at the best southeastern brazilian restaurant with five people,False
restaurant,book the best joint for 3 people,False
restaurant,i want to find a restaurant to eat at in westernport,False
weather,what s the weather in timbo ?,False
weather,tell me the weather forecast for northern mariana islands one second from now,False
restaurant,book reservations at james d conrey house at 1 pm for a party of nine,False
restaurant,i would like to book an american samoa restaurant for 8,False
restaurant,i want to eat at a bar in saudi arabia that serves cannelloni,False
weather,what will it be like in the current place at midnight,False
restaurant,can you make a reservation for next year in modesto for joanna and ella,False
weather,is it snowy in demotte ms,False
weather,what is the weather forecast in delaware,False
weather,is there rain now in maine,False
weather,book me a restaurant in aransas pass in seventeen hours,False
weather,tell me the weather forecast for missouri,False
restaurant,book an outdoor restaurant,False
weather,what is the weather supposed to be like at sunset in cosby kansas,False
weather,what s the weather like in mountainair,False
restaurant,need a table at a restaurant serving foie gras on halloween for two at northern mariana islands,False
weather,what s the weather in pennsylvania,False
weather,what is the forecast for iceland and danville for rain for nine months from now,False
restaurant,i need a table in neighboring carencro at the bridge round house,False
restaurant,book a popular food truck in kentucky,False
weather,will it rain 17 weeks from now in teide national park ?,False
restaurant,nancy elma ruiz and molly want to eat at a restaurant in gibraltar,False
weather,will it be warmer in flag ?,False
weather,what s the weather forecast for anniston ?,False
restaurant,book a co table at windows on the world,False
weather,will it be stormy in wildorado,False
weather,what will the weather be in deer river ?,False
weather,what is the weather forecast for my current place ?,False
restaurant,i need a table in iron gates in one minute at the weathervane restaurant,False
restaurant,table for 1 please,False
restaurant,book a restaurant with wifi for nine people,False
weather,can you tell me the forecast for east falmouth hungary,False
weather,will it be cold in carnot or,False
restaurant,please book me a table for 1 person at a brasserie,False
weather,is there going to be any rainfall close to windber in 365 days,False
weather,give me the weather forecast for here,False
weather,what is the forecast this evening for the calipuy national reservation,False
weather,tell me the forecast for elderton indiana in 19 hours,False
restaurant,book a reservation for nine at an outdoor restaurant,False
weather,is it warm in califon tunisia,False
weather,will it be colder in az than tx today,False
restaurant,book the crown at whitebrook in ri for 2 people,False
weather,i need a weather forecast for tallahassee-st marks historic railroad state trail,False
restaurant,i need to book a table at brasserie for 10 that is highly rated in kentucky,False
weather,is it going to get colder in parc national marin mahatma gandhi,False
weather,what is the weather forecast for nicaragua,False
restaurant,book the fashion café for elevenses,False
restaurant,id like to eat at a bar that serves corn relish with a party of five,False
weather,will it be warm 1 week from now in dc,False
weather,how is the humidity near my current place,False
weather,will it snow in my current location,False
restaurant,schedule the food truck to be at your place in the distant future,False
restaurant,i want to eat in 19 hours at nm,False
weather,will there be a snowstorm in william b ide adobe state historic park,False
restaurant,get me a table at prospect of whitby in blaine hill id,False
restaurant,i want a table for seven at twenty three oclock in angola,False
weather,tell me if there s a snowstorm in the forecast twenty seconds from now in holtville,False
restaurant,book a bistro for 4 at sunset,False
weather,what s the weather forecast for winnfield georgia ?,False
weather,what s the cloud forecast now for sierra leone ?,False
weather,will there be sun at four pm at runkaus strict nature reserve,False
restaurant,find a reservation at a brasserie restaurant nearby sc for a party of ten,False
restaurant,im looking to book a seat at a bakery that serves coleslaw at 19 44 58,False
weather,weather for east peru bolivia 3 years and a half from now,False
weather,how is the weather going to be in gambia in a week and a half ?,False
weather,what is the 10 pm forecast for sweet springs wyoming,False
weather,what is the forecast for here and now,False
restaurant,i want to eat ice cream at a brasserie with me and my mother in law,False
weather,what is the storm forecast for now in jordan,False
restaurant,book the slippery noodle inn in gober,False
restaurant,book a restaurant 163 days from now,False
weather,will it be warm here in one hour,False
restaurant,i need a restaurant that has internet access for a party of six,False
restaurant,asiate restaurant in sturgeon for 7,False
restaurant,book a table at 04 36 28 at the northeast indian restaurant,False
weather,is the forecast chillier in 1 hour in mali,False
weather,what will the weather be like in lambertville india at ten pm,False
weather,how cold is it in princeton junction,False
weather,will there be a blizzard in egypt ?,False
weather,what is the forecast for niger,False
weather,what is the pennsylvania forecast for three forks for midnight,False
weather,what s the weather on bird island burkina at shavuot,False
restaurant,book me a table for five at the top-rated morocco restaurant,False
restaurant,book a table for 2 at a nearby restaurant,False
restaurant,book trentino serving bar for 4,False
weather,what is the weather going to be like in twenty three minutes in parksdale in,False
weather,is it overcast in south carolina,False
restaurant,make a reservation for 8 at a diner that serves haystack,False
restaurant,book a spot at a highly rated pub in woodston,False
restaurant,i need a table in the state of la for katina and josefina gray,False
weather,is it freezing in kelso,False
restaurant,book a restaurant not far in milladore for 6 people,False
weather,what will the weather be in rutherfordton rhode island on september 22nd 2017 ?,False
weather,what is the forecast for here at 8 am,False
restaurant,book georgetown cupcake in keller for tea time,False
weather,will it be nice in reager mp,False
weather,what is the weather in forêt nationale davy crockett today,False
weather,what is the weather in taiwan,False
weather,is there a snowstorm in russia,False
restaurant,i want top-rated veneto cuisine at a restaurant in antietam for 2,False
weather,will it get chillier within walking distance of pw,False
restaurant,need to book a reservtion for a restaurant in maryland for me and my half sister,False
weather,how warm is it in darnestown,False
weather,is it freezing in colorado,False
weather,what will the weather be like this week close-by saudi arabia,False
restaurant,lets eat at newport creamery in carnot,False
weather,what is the weather forecast for close-by gu 3 years from now,False
weather,what s the weather forecast for mi for august 20th ?,False
weather,what is the weather like within walking distance of the bothwell lodge state historic site,False
restaurant,make a reservation at a tavern which serves clam cake for a party of 8 in western sahara,False
weather,tell me what the weather will look like here at 01 50,False
weather,what is the weather forecast for friona ?,False
restaurant,reserve a table for two for jun 13th in a neighboring bistro which serves mongolian food in northway,False
weather,what is the poland forecast for next january,False
restaurant,i need to book a table at bridge round house in south dakota for me emily and gena,False
weather,what s the forecast for my current location,False
restaurant,book a restaurant in ms that can seat ten at 01 51 47 pm,False
restaurant,book a spot for ten in ms,False
weather,what will the weather be in albania at 11 56,False
restaurant,please get me seating at the tavern in red lick michigan,False
restaurant,can you make reservations at a tea house that serves fettucine ?,False
restaurant,book a spot for tommie and vera rogers in irvine at 7 am,False
weather,what s the weather going to be like in a week at big walnut creek nature preserve ?,False
weather,whats the forecast for january 21 2035 in dubach,False
restaurant,book a reservation for six people at a churrascaria restaurant in cook islands one minute from now,False
restaurant,i need to reserve two seats to eat at in salina alabama,False
restaurant,book a table at dillard house in exell ia,False
weather,is it going to be hotter in d lo,False
weather,tell me the predicted weather once i travel faraway to crimson lake provincial park,False
weather,is it forecast to be stormy close to nimule-nationalpark 1 hour from now ?,False
weather,will there be a blizzard in egypt on jul 3 ?,False
restaurant,grab a table at a restaurant in minnesota that serves ice cream cake,False
restaurant,please reserve a table for five to get chicken fingers at a cafeteria in mexico,False
restaurant,book fast food that is highly rated,False
restaurant,i need a reservation for 3 at clinton street baking company & restaurant,False
weather,what is the weather like in north salt lake and afghanistan ?,False
weather,is it going to be chilly on 12 13 2025 in haugan pakistan,False
weather,will it be cloudy not far from allenton,False
restaurant,i want to book a highly rated fast food restaurant now,False
restaurant,book a spot for seven at a brasserie with ginestrata,False
weather,what s the forecast for emily florida for aug 17th 2020 ?,False
restaurant,i need a reservation for january 9 at a restaurant that serves souvlaki nearby cypress av for a party of 1,False
weather,will it snow this week in parc national de petrified forest ?,False
restaurant,i need a reservation for three people at a spa restaurant in two hundred thirty seven days,False
restaurant,book a table in hallwood for one for supper,False
restaurant,i want to eat at a scandinavian restaurant that is highly rated in bonita texas,False
weather,what s the weather in the marshall islands in sixteen hours,False
restaurant,i want to get reservations at a place close by for 6 people to eat in sc,False
weather,i need a time of 21 minutes from now for here,False
restaurant,i need a reservation for maid-rite sandwich shop in home gardens,False
restaurant,book a spot for 4 at a restaurant in shambaugh md,False
restaurant,please book reservations at a restaurant that serves empanada party for three with betty and dolly,False
weather,what will it feel like in the current place in july,False
weather,weather for here right now,False
restaurant,book at table at forest av restaurant close-by for 2 1 second from now,False
weather,forecast for 02 22 pm maldives,False
restaurant,i would like to book a restaurant for two in 42 weeks from now in wagram,False
weather,show fog conditions at 7 am in nh,False
restaurant,i want to book a doughnut bar in american samoa,False
weather,what is the weather like in midfield iowa today,False
weather,will it be snowy here soon,False
weather,give me the weather forecast for here,False
weather,what s the weather forecast for connecticut,False
weather,will it be hot in west union malaysia,False
weather,tell me when it ll be hotter here,False
weather,weather for knierim kansas in twelve weeks and a half from now,False
restaurant,book a spot for 1 at a south american restaurant,False
restaurant,book a pub in clermont for 8 people,False
restaurant,book me a table at the fat duck in ireland,False
weather,tell me if there s be a depression in brazil,False
weather,what s the weather in totowa wy one minute from now,False
weather,what s the weather like nearby in rhode island ?,False
weather,will it be hot in amenia wi ?,False
weather,does wildorado have a hot temperature,False
restaurant,book me a tibetan restaurant for my boss and i,False
restaurant,i want jean-georges for a party of 2,False
weather,tell me the weather forecast thirteen seconds from now in ukraine,False
restaurant,book a reservation for four at the best brasserie in venezuela,False
restaurant,need a table in serbia and montenegro on apr 16 for a party of seven,False
restaurant,i need reservations in nd in the city of briarwood for me and my colleagues,False
restaurant,book a spot at a taverna for my cousin and i in burundi,False
restaurant,i need a reservation for the original house of pies with three people in plandome manor pa,False
weather,will it be foggy in 1 hour and 1 minute from now in ok,False
weather,will it be cloudy one hour from now in my current position,False
weather,is there a snowstorm in the forecast for saint helena ?,False
restaurant,book a table for eight this month in maldives,False
restaurant,book a restaurant for my baby and i in delaware,False
restaurant,i need a reservation for 02 53 at hotel arctic in state road,False
weather,congress has warmer weather,False
restaurant,book a popular bar in chowchilla,False
weather,what will the weather be like in fourteen hours in eastville,False
weather,what is the forecast in lono,False
restaurant,book a table today at a steakhouse for eight that serves sashimi,False
weather,what s the weather forecast ten years from now in mount victory macao ?,False
weather,can you tell me the weather forecast for denmark,False
restaurant,i need a table for four at a pub in heard island and mcdonald islands,False
weather,is it going to be hot in luambe-nationalpark,False
restaurant,restaurant in durant for 3 pm,False
restaurant,id like a table for three at black rapids roadhouse on february 24th 2039,False
weather,will the weather be warm in the nationaal park band-e amir at twelve am ?,False
weather,what s the forecast for belize around meal time?,False
weather,can we expect cold and freezing conditions in glacier-nationalpark,False
weather,what is the weather here,False
restaurant,book a restaurant for four people in wylliesburg,False
restaurant,book a table near bienville for pioneer day,False
weather,check the forecast for fernwood mt,False
weather,weather on september 14 in crofton ukraine,False
weather,what is the forecast now in duson,False
restaurant,id like to eat at ten pm anywhere neighboring to our house,False
restaurant,book san francisco brewing company for two located at al,False
restaurant,book a churrascaria restaurant for 2 which serves mezes,False
restaurant,i want to book dinner by heston blumenthal in al,False
weather,tell me if there is wind in the forecast for roaring river state park,False
weather,what s the weather forecast for my current spot ?,False
restaurant,book a fried fish serving restaurant for one at 20 hours from now,False
restaurant,i need a booking for seven people at metropolitan museum of art,False
restaurant,book a reservation for leticia melva and twila edwards at glassy junction for five pm within the same area of our secondary residence,False
weather,is it windy in nauru ?,False
weather,is it going to be sunny at five pm in chatyrkul wildlife refuge,False
weather,what is the temperature in western sahara or within the same area three seconds from now,False
weather,check the weather forecast for sappho,False
weather,will there be snowfall in ky ?,False
restaurant,book a table at top pot doughnuts in greensburg american samoa,False
weather,will be it cloudy close by azerbaijan in 55 weeks ?,False
restaurant,i need a bakery that serves beef manhattan at midnight for nine,False
weather,will there be a cloud in the sky in 175 days from now in golconda in vt,False
restaurant,book a bar with mediterranean food for three people,False
weather,what is the oct 10 forecast for cuyabeno wildlife reserve,False
weather,what s the weather close to harmar heights this afternoon,False
restaurant,i want to book a restaurant in the same area where i live in ma for ebony and yolanda,False
weather,what s the weather like in boca raton ia,False
restaurant,book the last exit on brooklyn 5 hours from now for one person,False
weather,will it be cloudy on sep 16 in palau,False
restaurant,table for one somewhere in palco,False
weather,will it be chillier in la mesa ?,False
weather,what s the weather forecast for sweden on oct the fifth ?,False
weather,book a restaurant on june the fifth in cavour,False
weather,is it supposed to be chilly in boiling spring lakes ?,False
weather,what does it feel like in alloway,False
weather,is it sunny 1 second from now in the pitcairn islands,False
restaurant,book a reservation for a pub serving gateau in ms,False
restaurant,book a table for my granddaughter and i at the highly rated restaurant that is close by in tuvalu,False
weather,what will the weather be like in new glarus,False
restaurant,need book a restaurant for this autumn in illinois,False
weather,check the forecast for the current spot in the future oct 19 2037,False
restaurant,book close-by for 1 in south dakota,False
restaurant,table for five at a restaurant in lavina,False
weather,is it warmer in lothian island wildlife sanctuary,False
restaurant,book me a reservation at a bar around juliff for three people that serves bucatini for now,False
restaurant,i need a table in west virginia for me and my baby at jacob wirth restaurant,False
restaurant,book a food truck in nisswa for 4 at 5 pm,False
weather,at meal time while i m here will it be hot ?,False
restaurant,book a cafeteria for 5 in turkmenistan,False
weather,what s the weather in waretown lebanon,False
weather,forecast for conrad,False
weather,can you give me the forecast for keytesville for 12 minutes from now,False
weather,will it get chillier in furano-ashibetsu prefectural natural park ?,False
restaurant,i want to go to that popular ethiopian restaurant,False
restaurant,please book seating for one person at an indoor restaurant that serves breakfast in nicholasville tennessee,False
weather,what is the weather in pendleton center,False
weather,when will it be temperate in lansford,False
weather,what will the weather be like this tuesday in the area neighboring rendezvous mountain educational state forest ?,False
weather,tell me the weather forecast for roseburg iowa,False
weather,tell me if there will be wind in ne,False
restaurant,id like a table for 10 at a distant place downtown for next fall,False
weather,what s the weather in the current place ?,False
restaurant,book osteria restaurant for 1 person in mi,False
weather,is it going to be warmer in 2 years and a half in deweese ?,False
weather,is hail in the weather forecast for monterey bay national marine sanctuary,False
weather,what will the weather be in four weeks around tsingy de bemaraha strict nature reserve ?,False
restaurant,book me a restaurant in guadeloupe,False
restaurant,book in ukraine at a highly rated restaurant,False
restaurant,find a table somewhere for me and my step mother in graniteville de,False
weather,will it be stormy in charleston,False
weather,tell me if it ll be temperate in 8 seconds in guatemala,False
restaurant,book a restaurant for 1 in nine weeks,False
restaurant,book a pub that serves fries for 9 people,False
restaurant,book a table at any restaurant for eight people,False
restaurant,book the labworth café in ethiopia for six people,False
weather,is it supposed to be chillier in favoretta,False
weather,i need the weather in muncie,False
restaurant,book restaurant for party of 7 at a pub in ford heights,False
weather,how is the forecast for ok ?,False
weather,will it be windy at medicine rocks state park on may 24,False
weather,tell me if it ll be freezing next month in rhode island,False
restaurant,book a table for 10 in char no4 in colombia,False
restaurant,book a spot at a crab restaurant,False
restaurant,book me best joint restaurant for 2 members at american samoa today,False
weather,what s the weather in stamps,False
restaurant,i need to book the fashion cafe for meal in lavina,False
weather,what will the weather be like in farmington canal state park trail,False
restaurant,im looking to reserve a table at a pasta restaurant in serbia,False
weather,will it be colder at five o clock at the apolobamba integrated management natural area,False
restaurant,book a highly rated food court for 2 people on jul 4th,False
restaurant,book a restaurant for 5 people,False
restaurant,id like to go to a restaurant in french polynesia,False
weather,tell me the weather forecast for inniswold réunion,False
restaurant,book a restaurant in nebraska on january 25 2034 for me and my mommy,False
weather,what s the weather in ecola state park in three minutes,False
restaurant,please get me a reservation at a restaurant with a pool for manuela and yvonne,False
weather,what s the weather like in forty fort,False
restaurant,book red crown tourist court now for ten not far from tin city,False
restaurant,book a restaurant that serves trottole in tillicum,False
restaurant,i need a table at the ledbury at 18 oclock,False
restaurant,book a spot for ten in upper marlboro pr,False
restaurant,me and terrie need a table at a bar in hypoluxo ut,False
weather,what s the weather for this year in oregon,False
weather,will there be snowfall this month in ut,False
weather,what will the weather be at nine am in hi ?,False
weather,what will the weather be in meeres-nationalpark insel bastimentos at twelve pm ?,False
restaurant,i want a table for 8 in plain on aug 5,False
restaurant,id like a restaurant on 6 1 2027 for 5 people in iowa city,False
restaurant,book a table for my great grandfather and i at a place in booker ak,False
weather,whats the temperature not far from valley of fire,False
restaurant,i want an indoor restaurant for a party of five in columbus junction,False
restaurant,book a spot for 8 at the kitchin on october the 13th 2039,False
restaurant,book a reservation for a pub with ma po tofu in moldova,False
restaurant,i would like reservations for cliff house in seven months for six people,False
weather,is it humid in otsego réunion,False
weather,what is the weather forecast for here,False
weather,weather for september seventh 2039 in salinas river national wildlife refuge,False
weather,is it overcast in bermuda,False
restaurant,book a reservation for a gastropub serving liver and onions,False
restaurant,book a table for 6 in new hampshire for next week,False
weather,what s the weather forecast for etna green in 11 months ?,False
restaurant,we want to eat at a brasserie with sicilian food in nebraska,False
weather,what are the weather conditions in noel ?,False
weather,what s the weather like in topock,False
restaurant,book a molecular gastronomy serving restaurant on march the 20th,False
weather,will it get hotter far away in afghanistan ?,False
weather,is there a snowstorm coming to ukraine,False
restaurant,i want to eat at a bakery with deidre and rosa in jersey,False
restaurant,book me a pub nine weeks from now for 4 people,False
weather,is the weather chilly in dew de,False
restaurant,book a table for ten people at a restaurant that serves noodle,False
restaurant,make me a reservation somewhere near here for me and my step brother by adelines apartment,False
weather,will it be chillier in portugal in one hour ?,False
weather,can you tell me if it ll be freezing in wrightstown in seven years ?,False
weather,i d like the weather forecast in gang mills four years from now,False
restaurant,i want to book a restaurantin perrytown missouri for candice jeannie and nichole,False
weather,what is the weather of east portal ks,False
weather,what will the weather be in east new market antarctica,False
