Intent,Sentence,Outlier
movie,what films are at kerasotes theatres,False
movie,what movie house is playing the animated movies nearest ?,False
music,play some fourties andrew lloyd webber on groove shark,False
movie,find careless love,False
restaurant,i need to book a restaurant in sunnybrook for 7,False
movie,what is the movie schedule for train,False
music,play them by guy-manuel de homem-christo,False
movie,what films are showing at national amusements,False
movie,what time is the closet cinema playing movies the closest,False
music,play some music using slacker,False
movie,what time is the graduates of malibu high playing at cobb theatres,False
music,play a 1950 album on iheart,False
movie,what time is hold that blonde playing at the closest cinema ?,False
movie,show me the movie schedule for the cooper foundation,False
movie,what is the movie schedule at the fox theatres,False
music,play a record from the year 1979,False
restaurant,need a jewish in maine to book a restaurant,False
movie,what are the movies movie times nearby,False
music,play the album a kiss before you go by bt,False
music,play some techno,False
music,play sunshine reggae on youtube,False
movie,find the movie schedule for movies close by,False
movie,when is the woman going to be scheduled at the closest movie house ?,False
movie,is you will meet a tall dark stranger at bow tie cinemas,False
restaurant,i want to make a reservation at the conflict kitchen for one,False
restaurant,book a restaurant in lake fenton for four,False
music,play punk rock music,False
music,can you use pandora to play a soundtrack from 1999 by david sitek ?,False
movie,show me the movies at the closest cinema,False
restaurant,book a pub for two on jan first 2037,False
restaurant,i need a highly rated oyster bar in ar in a month for jeanne collins amy and i,False
music,play a 2001 sound track on deezer,False
restaurant,find a reservation for 3 people,False
music,play music from 1950,False
restaurant,i want to book the best steakhouse with south american cuisines in alaska,False
movie,give me the movie schedule at santikos theatres,False
restaurant,book a restaurant at sixteen oclock in sc,False
restaurant,please reserve a table at the food truck in wheeler for december 4th 2019,False
music,play top-twenty fourties movement music by mohammad reza lotfi,False
music,play me a nineties song by joseph genaro,False
restaurant,book a spot for ten at a restaurant with a spa in us minor outlying islands,False
movie,is the swan available to watch at the movie house now ?,False
restaurant,book me a bar where i can get a bear claw in as,False
music,play ep from quasimoto from the nineties,False
restaurant,book a reservation for 8 at a restaurant that serves chicken fried bacon in aruba,False
restaurant,i need to book the best food court in within the same area as ok that serves persian food for my ex husband and i,False
restaurant,lets go to a bistro in sd,False
movie,what time is bhoot returns showing at douglas theatre company,False
movie,what are movie times for movies playing in the neighborhood ?,False
movie,where is the nearest movie house that is playing sirivantha,False
music,play something from the twenties on lastfm,False
movie,find santikos theatres showing animated movies,False
restaurant,i need a reservation for next week with a party of six,False
music,play some songs from 1958,False
movie,find the movie schedule for century theatres,False
music,play the newest released song from 1951,False
movie,can you give me the movie times,False
movie,find the schedule for movies at plitt theatres,False
music,plan an album by roni duani,False
restaurant,i need a table for 1 minute from now at any pub for five around in that also serves fisnn chips,False
music,i want to hear music by madeleine peyroux from 1991 on youtube,False
music,play zvooq,False
movie,tell me what films are around here,False
movie,find the movie schedule for fox theatres at supper time,False
movie,find a cinema for the tenderfoot nearest me,False
restaurant,book a restaurant in goshenville pr for october 16 2038,False
restaurant,book a spot for nine near togo,False
music,play heavy machinery by phil spector on zvooq,False
restaurant,book a table at a pool bar,False
restaurant,make me a reservation at a bar for a party of 7 in indonesian,False
movie,is jack the ripper playing in one hour at the nearest movie house ?,False
restaurant,book a table at a restaurant within the same area as the octagon christchurch in allentown,False
music,play some symphonic rock,False
restaurant,book mars 2112 in rwanda for 4 people,False
restaurant,book pm park clear lake iowa at 5 am for 6 people,False
music,play my trabajo relax playlist,False
restaurant,book a table for kirsten price audra and i faraway from our location at an outdoor taverna,False
music,play the song little robin redbreast,False
music,play some origa on google music,False
music,i want ohear the 1996 soundtrack from deezer,False
music,use groove shark to play music from the nineties,False
movie,find me showtimes for animated movies in the neighbourhood,False
restaurant,i need to book a table at a bar in micronesia for tia madeline and estela,False
movie,is ce cher intrus at imax corporation,False
movie,find dipson theatres animated movies,False
restaurant,party for 2 in cleveland,False
restaurant,book a table for 3 at a top-rated restaurant,False
restaurant,book reservations at a restaurant in ne for 4 people on apr 2 2021,False
music,play some fun-punk,False
restaurant,book me a reservation for a mediterranean restaurant on confederate memorial day nearby ocean grove,False
movie,what movie schedules start at sunset ?,False
music,play step up your game by marc cohn,False
music,i need to hear the song aspro mavro from bill szymczyk on youtube,False
music,play white noise,False
restaurant,book a spot for 8 in a cafeteria with german chocolate cake in ecru new mexico,False
music,play some seventies track from top rie tomosaka,False
movie,what films are playing at the nearest movie house,False
restaurant,looking for a tibetan restaurant and need reservations for 1,False
music,play zvooq latest track by peter appleyard,False
movie,find the broken,False
movie,what is the movie schedules at for douglas theatre company at 0 p m ?,False
music,i wish to listen to some fifties music,False
movie,can i get the newest movie schedule in the area for animated movies ?,False
restaurant,book a table for 9 scheduled for april the 8th in nj,False
restaurant,at ten am i want to reserve a spot for 9 people to eat in monaco,False
restaurant,book a reservation for a parry of eight for a restaurant in birch river mo,False
restaurant,book a spot far from Åland,False
movie,show movie schedules for marcus corporation,False
music,play me a frank farian ep,False
music,let s play the album handover on deezer,False
movie,find the schedule for heart beats,False
restaurant,i need to book a tropézienne restaurant six hours from now,False
restaurant,book a delicatessen that is indoor for 3,False
music,play geddy lee music on spotify sort by top,False
movie,what movie theatre is playing the deaths of ian stone,False
restaurant,i need a table for 2 on feb 18 at main deli steak house,False
movie,i need information on movie schedules,False
restaurant,book reservations at a nearby restaurant in montenegro for four people,False
music,use vimeo to play de camino a clase playlist,False
movie,give me a list showtimes for the night of taneyamagahara,False
music,play some mf doom from the sixties on pandora,False
restaurant,find a reservation at boone tavern for 4 people in 10 24,False
restaurant,i want seats for 4 at a sichuan food restaurant in indonesia,False
restaurant,i need a reservation for a restaurant now with a party of 9 in hilt,False
music,use slacker to listen to seventies music,False
restaurant,book a restaurant with parking for three people,False
music,play strength of street knowledge on groove shark,False
restaurant,book a restaurant in gate city for 5 people,False
music,put on vimeo and play kacapi suling,False
movie,what time is three cuckoo clocks playing?,False
music,play kurt cobain ballad tunes,False
music,use netflix to play bizzy bone kiss me goodnight sergeant major,False
music,play me a song by teitur lassen on groove shark,False
restaurant,i would like to book a fry sauce bar for jul 3 2019,False
movie,is blood is not fresh water playing at this movie theatre at 2 am ?,False
music,play the music genre synthpop,False
restaurant,can i get a table for 3 in gu at a restaurant in the neighboring area that serves chicken french ?,False
restaurant,book this week for their step sisters workplace close,False
movie,i want to see the happy thieves at marcus corporation can you show me movie times,False
restaurant,book a theme restaurant in cameroon for 6 people,False
restaurant,book me a reestaurant that is close in the country of cocos islands,False
restaurant,reservea table for five people on september second in gabon,False
music,play the best chant of 1975,False
movie,what is the closest movie house playing what the swedish butler saw,False
restaurant,book a tavern on lincolns birthday lincolns day,False
restaurant,book a restaurant in three points,False
music,play sixties theme music,False
movie,i need to know what theatre is playing a happy coersion,False
restaurant,book a table on 6 14 2035 at a bakery within walking distance of equatorial guinea that serves paella,False
movie,find the nearest place at four o clock with a movie house showing wow the kid gang of bandits,False
music,play an album from the fourties,False
restaurant,i need a table at a steakhouse in encino that serves meatcake,False
restaurant,i need a fast food restaurant that will seat two in a smoking room,False
restaurant,book a popular restaurant for two which is distant from avalon,False
music,play rie fu music sorted by the best,False
restaurant,get me a reservation for 1 somewhere in spade at seventeen oclock,False
music,can you play an ep from the year 1958 ?,False
music,play any track by flame,False
movie,when is the blue of heaven playing?,False
restaurant,i need a reservation for four at a restaurant in 1 hour and 1 second,False
restaurant,me and katharine would like to go eat at jan 22nd in ia,False
movie,when is the blood of others playing?,False
restaurant,book in southern shores for 8 at ariston cafe,False
movie,is the matinee idol 06 30 cinema sold out?,False
movie,please find the closest cinema that s playing movies at 9 am,False
movie,when does miss sloane play at imax corporation,False
music,i m looking for the last track by fei yu ching from the fourties,False
movie,is a short film about killing at north american cinemas,False
movie,what are the current showtimes for love fiction ?,False
movie,what is the showtime for arsho,False
restaurant,bar restaurant for november the twelfth 2030 that is popular and for a party of ten,False
restaurant,i need a reservation for five at a top-rated english restaurant in elma,False
restaurant,book a restaurant for monique stewart arlene and jami,False
movie,find a movie theatre with beware of bachelors,False
music,play some fourties music from erin harkes,False
music,play me a popular ronnie wood soundtrack,False
movie,i want a list of showings of days of fire at harkins theatres,False
restaurant,book a table for ten people in eucalyptus hills,False
restaurant,book a spot for elise and alma at a brasserie in ravensdale mh for this week,False
movie,i d like to watch wish you were dead,False
restaurant,book a table in glennie for 1 in the northern mariana islands,False
music,play a seventies soundtrack by steve walsh on groove shark,False
music,open google music and play women of jazz playlist,False
movie,please shoe me the movie schedule for today,False
movie,where can i see animated movies in the neighborhood,False
movie,where is the closest cinema playing soapsuds and sapheads,False
restaurant,book a restaurant in french southern territories on dec the fifth 2026 for two,False
restaurant,please book me a table for three at an american gastropub,False
restaurant,find me a table at a javanese brasserie,False
movie,find half a truth,False
movie,find the watcher at united paramount theatres,False
movie,find me the movie times for the marcus corporation,False
movie,show me the movie schedules for the nearest movie theatre in invasion u s a,False
music,play who do you think you are by magnifico with spotify,False
movie,is arthur 2 – on the rocks playing at 20 44 ?,False
music,play while we were waiting by sippie wallace on vimeo,False
restaurant,i need a dinner reservation in three months for a restaurant in hills and dales,False
music,play the album by paul barker playing the greatest from 1978,False
music,play some music by jody williams from 2001,False
movie,can i get the movie schedules for loews cineplex in six hours seventeen minutes and eighteen seconds,False
music,play music from 2012 on netflix,False
restaurant,book a table for nine people next mar,False
restaurant,book a restaurant for a party of 7 in paraguay on saturday,False
restaurant,i need a reservation for eight at the original soup man in northern mariana islands,False
music,play the newest twenties melody,False
restaurant,make me a reservation for a party of 2,False
restaurant,i would like to book a restaurant in singapore for nine in 19 hours and 1 second,False
movie,find movie schedules in warren theatres,False
restaurant,i need a reservation in steele city,False
music,play a track by deeyah khan,False
restaurant,book rosalie stewart and evelyn at a restaurant,False
restaurant,i need reservations for a party of 8 within the same area at 01 48 35 at a restaurant in armenia that serves tuscan cuisine,False
restaurant,i would like to book at clinton street baking company & restaurant in brookneal,False
music,play paul ortiz music from 1990,False
music,can i hear a tune from vladimir vysotski ?,False
music,play top-50 eighties theme from alain caron,False
music,play some good music from 2012,False
music,can you play crossover ?,False
music,play some stephen jones on youtube,False
music,play a native us song on last fm,False
music,play the latest ep by joel hastings on itunes,False
restaurant,need a table at a highly rated south tyrolean joint,False
music,play music on deezer by imogen heap,False
movie,what is the closest movie house playing films,False
music,play apbl98 by alden penner,False
movie,list movie schedule,False
restaurant,book a restaurant in fort gates fl,False
music,play seven steps to heaven by wikluh sky,False
restaurant,book the boon brick store for nine people,False
movie,what time are films showing in the neighborhood,False
movie,i d like to know when i can see the taking of flight 847 the uli derickson story at amco entertainment,False
music,play the symphony by tetsuya ogawa from 1953,False
movie,find movie schedules at loews cineplex entertainment,False
restaurant,id like a table at the san francisco brewing company in puerto rico at noon,False
movie,which movies are showing at southern theatres ?,False
restaurant,book a table for 10 at the dome edinburgh,False
restaurant,book a reservation for irene and rosella at the room in the elephant in israel,False
music,play music on pandora,False
movie,what s the closest movie house showing animated movies,False
restaurant,id like a table for my step grandfather and i at five fifty-five in nv,False
movie,find the schedule for brick,False
restaurant,book a spot for nine at the cubby bear in luxor,False
music,play some good movement music by brian littrell from around 2001,False
movie,i want to see animated movie in the neighbourhood,False
restaurant,pizzeria restaurant in kellnersville hi that is outdoor for ten,False
movie,what is the movie schedule,False
movie,find close by movies movie times,False
movie,find good night and good luck at a cinemark theatres,False
restaurant,find me a table for four somewhere,False
restaurant,book a spot at a restaurant faraway from 138th st,False
movie,i want to watch the shamrock handicap right now,False
music,play some music from the sixties,False
music,play fifties track music,False
music,i want to hear the album suites & sweets,False
movie,list movie times with meal,False
restaurant,book a restaurant for a meal for 4 people,False
movie,what movies are at loews cineplex,False
restaurant,book a reservation for louisiana fried chicken this winter in taiwan,False
movie,what time is just around the corner playing,False
restaurant,id like a table for 3 at a tavern in the vatican,False
movie,please tell me the current and local movie times,False
music,play all music alan released in 1997,False
restaurant,reserve a table for two at the restaurant at 9 pm,False
music,play thirties on lastfm,False
music,play the song i get ideas as performed by richard kruspe,False
movie,when can i see journey to the end of the night ?,False
movie,where is the nearest cinema that is playing films,False
movie,where is the closest movie theatre playing yo robot,False
movie,show me the films at the closest cinema,False
music,play stefon harris s song,False
music,play the newest ballad from chad urmston,False
movie,where is the closest cinema playing osmanthus alley,False
music,play music by helen ward,False
movie,does pacific theatres have animated movies starting in 1 minute ?,False
music,play music by otis redding,False
restaurant,book a table for pearl and verna slated ash wednesday in gabon,False
restaurant,i need a table for one,False
music,open youtube,False
music,play something from the twenties,False
restaurant,book a restaurant for 2 in cross timbers district of columbia,False
movie,what time is a battle of wits starting?,False
music,play some seventies music on netflix,False
music,play lorenzo palacios quispe,False
movie,what movie theatre is the closest that is playing cheat you fair the story of maxwell street right now,False
movie,show movie times at kerasotes theatres,False
movie,what movies are close by,False
music,play some carmen mcrae from ed robertson off of itunes,False
music,play in the arms of god on zvooq by nimal mendis,False
restaurant,book me a reservation at an oyster bar that serves crab cake for two people,False
movie,show me the closest movie house playing animated movies please,False
music,play the playlist gypsy swing,False
movie,show a movie schedule with bow tie cinemas,False
restaurant,book a table for two at a restaurant faraway from office in california,False
restaurant,book tartine in mississippi for 5,False
music,play elliot easton s album beautiful,False
movie,what time is balkan rhapsodies 78 measures of war playing at malco theatres ?,False
music,will you play me the most popular sound track from 2006,False
restaurant,book a restaurant in medford lakes on sep 8 2033 for essie tonya and i,False
music,can you play some music on youtube,False
movie,show me the movie times for what s playing now,False
music,i want to hear that track from 1991,False
movie,i want the movie schedules for movies around here,False
movie,i want to see return to yesterday,False
restaurant,id like a table for five at any restaurant,False
restaurant,book reservations for five at eleven madison park today within walking distance from flaxton,False
music,play some songs from the fifties,False
restaurant,book a breakfast in a restaurant for eight,False
music,play the top song by amon amarth on groove shark,False
music,play a symphony from bob hardy please,False
movie,what are the local movie times,False
movie,what animated movies are playing nearby right now ?,False
movie,will you please pull up movie schedules for me?,False
restaurant,book an osteria in north salt lake for three,False
restaurant,lets go and take elsa and i to westhampton beach in 1 hour to the american chinese cuisine at the tea house,False
movie,i need the closest movie theatre playing incense for the damned,False
movie,what is the movies playing at north american cinemas,False
restaurant,book a restaurant for august fourth not far from the marshall islands,False
music,play fourties record,False
music,play some 1991 dave barker,False
music,play symphony music from the fourties with google music,False
restaurant,book a restaurant for one in skillman,False
restaurant,i would like to eat fast food and have a party of two in kentucky,False
restaurant,book a spot for vicki and i at a restaurant in puerto rico,False
music,play fourties music on pandora,False
movie,when can i go see the untold story ?,False
restaurant,i want to eat a a brasserie that serves muffuletta where can i get a reservation?,False
restaurant,need a table for nine in east prairie la,False
restaurant,my brother in law and i would like to go to guinea-bissau for food,False
movie,fine movie times for loews cineplex entertainment,False
music,please play a song by everlast,False
restaurant,book me a reservation at a burger joint close-by choate on july 16th 2022,False
movie,showtimes for the films at santikos theatres,False
music,play the top of emil de cou,False
music,open spotify and play a couple of celtic songs,False
music,play victoria banks s album,False
movie,i d like to watch movies at amco entertainment,False
movie,what films are at imax corporation at 11 p m,False
movie,find the schedule for blood orgy of the leather girls at a movie house,False
movie,what is the movie schedule at dipson theatres,False
music,play innovations by kokia,False
restaurant,please book a room to accommodate one in 11 weeks near bahamas restaurant,False
movie,what are the movie times for malco theatres,False
restaurant,can you place a reservation for me at ariston cafe,False
music,i want to hear ding dong bell on groove shark,False
restaurant,i want to take christy louise and alexandra to eat at 17 38 04 anywhere in ne,False
restaurant,book the space aliens grill & bar in hord wy for feb the twenty-seventh,False
restaurant,book a spot for my colleague and i at a pizzeria with a pool in owings mills wisconsin,False
music,i want to hear a top ten soundtrack from 1984 by shinehead,False
music,play ciribiribin by sandeep khare,False
restaurant,book a brasserie that serves mezzes in iowa,False
music,play this is animal collective please,False
movie,give me pacific theatres movie schedules,False
movie,find afternoon movie times for movies in the neighborhood,False
music,play pop music with groove shark,False
movie,give me the movie times,False
restaurant,book a table for five at a restaurant with the best rating,False
movie,what is the movie schedule for animated movies playing in the neighborhood ?,False
music,use deezer to play the last song from lee dorrian,False
restaurant,book me seating at a popular joint for sep the 10th,False
restaurant,in a week make a reservation for a table of 7 in district of columbia,False
restaurant,i would like to find a cafe that serves grilled meat close by in tunisia and need a table for 2 one second from now,False
movie,what time is between tears and smiles playing,False
music,i want to hear somi s songs from the twenties,False
movie,movie schedule for harkins theatres,False
movie,what is the movie schedule for the movies that are playing nearby ?,False
restaurant,book a spot at savoy hotel and grill that is neighboring wisconsin,False
music,play the best bruce ruffin music on youtube,False
music,play me a song by michael diamond,False
movie,show me movie times for southern theatres,False
music,play the most popular miles jones track,False
movie,is redacted playing at the closest cinema ?,False
movie,when will the santikos theatres be showing animated movies,False
restaurant,book north indian osteria at 12 am,False
movie,let me get the movie schedule for lunch time,False
movie,can i have the movie schedule for imax corporation,False
music,play fight on state,False
music,play slacker tunes,False
movie,when is blood and ice cream-trilogie playing at the nearest movie theatre ?,False
restaurant,make reservations for me at a taverna in hong kong,False
restaurant,i need a table for 4 at a restaurant around 0 am,False
music,play 1958 music,False
music,play twenties chant from lagaylia frazier on itunes,False
music,play hora din moldova by yamazaki maso,False
music,play a new tune by louis silvers,False
music,play the song jingle bells,False
music,play any chanson,False
music,play some seventies music by janne puurtinen on youtube,False
restaurant,book a reservation for seven people at a highly rated restaurant that serves moroccan food in east greenville,False
music,play some indie music on spotify,False
music,play me a popular song by koichi domoto,False
restaurant,make me a reservation at a fast food restaurant for elba and corina at a restaurant with parking,False
restaurant,book a bakery for lebanese on january 11th 2032,False
music,play melody music from the fourties,False
movie,what are the movie times for dickinson theatres,False
music,play top-ten eighties song,False
restaurant,i need to book a restaurant that serves sundanese in bonaire for 7,False
movie,where is the nearest movie house that is playing sirivantha,False
restaurant,i need to book a restaurant for eight nearby limerick one year from now that serves jerky,False
restaurant,book a bar in san marino for five,False
movie,i d like to see movie schedules for kerasotes theatres,False
restaurant,book a spot for six in greece,False
restaurant,i want a table for four at a place in california,False
restaurant,id like a table for my teenager and i at the washington dc jewish community center,False
music,i wish to listen to good symphony music by mi lu bing,False
restaurant,book a table for doris and i in new tulsa,False
movie,what time is g-men vs the black dragon playing at harkins theatres,False
movie,show movie schedule,False
movie,show movie schedules of film nearby,False
music,play a 1977 record by bitty mclean on google music,False
music,play the track pocahontas john farnham,False
