Intent,Sentence,Outlier
search,who was the artist who did the painting called spyro 2 season of flame ?,False
search,i want to hear the soundtrack to the platinum rule,False
search,help me find the work unite and win,False
search,i d like to watch the trailer for dungeons & dragons chronicles of mystara,False
weather,tell me whether bahrain will be humid in one hour and 2 minutes,False
search,find the game blogbridge,False
search,find a painting called satisfaction is the death of desire,False
weather,what is the forecast for colder conditions within the same area of this current place,False
weather,what is the temperature for montserrat on sep the fourth 2024,False
search,i d like to watch episodes from the tv series the secret of queen anne or musketeers thirty years after,False
weather,what s the forecase for inverness on february 5th 2031 ?,False
search,can you find a photograph of ace ventura the cd-rom game,False
weather,is it temperate in the current location now,False
search,i want to watch supernatural the unseen powers of animals,False
weather,tell me the weather for comertown,False
search,i want to view the picture in old monterey,False
weather,i need a weather forecast for são tomé and príncipe on december 8th 2026,False
search,i m looking for the saga lifelong ambitions,False
search,i want to read mad money,False
search,can you get me the television show called start it up ?,False
search,find the video game called turnin me on,False
weather,what s the weather in new zealand ?,False
weather,what is the forecast for bonner starting oct 24th 2025 for argentina,False
weather,is it chilly in nightmute,False
weather,will it be foggy in the same area of parc provincial kettle lakes on february the thirteenth 2018 ?,False
search,find a novel called testing anywhere,False
weather,what is the posey island state park forecast for colder temps at meal time,False
search,need the saga called the black lamp,False
weather,will it be warmer in ristigouche ecological reserve on nov the twentieth,False
weather,how will the weather be five weeks from now in moneta ?,False
weather,what is the foreast for my current location,False
weather,what s the weather like at powers lake ?,False
weather,what is the close by greenland forecast,False
weather,what weather will hi have will there be hail twenty one minutes from now,False
weather,in portales gambia what is the humidity this morning,False
weather,what is the temperate in beltsville,False
weather,show me the forecast for the distant area of me at three pm,False
search,find the movie take another picture,False
search,find the tv series treeful of starling,False
search,can you find me the naked city – justice with a bullet album ?,False
search,look for the creative work the testament of gideon mack,False
weather,what s the weather like in north brunswick township virginia,False
search,where can i watch the television show called fangs of the arctic ?,False
search,search for tv show live at apollo,False
weather,what is the weather at my current location,False
search,find wxhexeditor,False
search,please look up the lamentable journey of omaha bigelow into the impenetrable loisaida jungle television show,False
weather,will there be a blizzard at 2 am in my current place,False
weather,weather in 3 minutes at jean lafitte national historical park and preserve,False
search,i m looking to find the trailer for brought by the sea,False
search,find a show called time is just the same,False
search,show creative picture of wonderful town,False
search,find movie titled triumph of the spirit,False
weather,what will the weather be in la at 9 o clock,False
search,help me locate a game called the master of ballantrae,False
search,what does for all the wrong reasons look like,False
weather,what is the weather forecast for sunset in bouvet island ?,False
weather,what is the predicted weather on mar 27 for farragut state park ?,False
weather,tell me the weather forecast for eight am in reminderville fl,False
search,find the album just for laughs,False
weather,will it get windy in ocean breeze park ?,False
weather,tell me if it ll be hotter a week from now in waxhaw,False
search,find a love song,False
weather,tell me if it ll be freezing here in 21 seconds,False
search,please find me the picture of the getaway black monday,False
weather,what s the weather forecast for croatia on jul 25th,False
weather,is there a blizzard in stonewood ?,False
weather,tell me the weather forecast one year from now in kulpsville togo,False
search,find the book bad day on the block,False
weather,show weather forecast at three am in wauregan,False
weather,what s the weather forecast for haigler ?,False
search,find the photograph hearts burst into fire,False
search,find pat garrett y billy the kid,False
weather,will there be hail in 8 minutes in iroquois ma ?,False
search,play trailer of do whatever turns you on,False
weather,how will the weather be at 9 am in anguilla ?,False
search,look up adobe brackets soundtrack,False
weather,what s the weather going to be like in pr at nineteen o clock,False
search,play the lure of the mask song,False
weather,i want food in zaleski,False
search,where do get photograph of my own best enemy,False
weather,what s the weather forecast for breakfast time in palau ?,False
weather,tell me if it ll be humid in ga one minute from now,False
search,find a book called tron legacy reconfigured,False
weather,what is the weather forecast for moffett,False
weather,will it be hotter at nine am in serbia,False
search,where can i watch the television show you make me hate music,False
weather,is it going to be chilly today in abo wi,False
weather,is it freezing near medley ?,False
search,give me a link to the saga called copper – justice is brutal,False
weather,tell me the weather forecast close to romania,False
weather,what is the weather forecast for four pm close to stretch point state park,False
search,i want the video game southwest riders,False
search,can you pull up queen of the organ,False
search,i d like to see jacksonville daily progress saga,False
search,play print the legend soundtrack,False
search,play tv show way of the samurai 2,False
search,search for to heart 2,False
weather,will it blizzard today in sint maarten,False
weather,what is the nh forecast for mexican hat,False
weather,what will the weather forecast be in mount victory delaware in 1 second ?,False
search,read the book journal of the bombay natural history society,False
search,can i see the boat people ?,False
weather,will it be chilly in milligan college ak on law day,False
search,can you find the soundtrack for fast food nation,False
search,find the show carnik con,False
weather,is it warm faraway in niger ?,False
search,show me the work the catholic weekly,False
weather,will it hail today in west point at 11 36 48,False
weather,what is the weather forecast for my current spot on jan third 2036,False
search,bombshells saga download,False
weather,in two hundred forty eight days what will mp weather be like,False
weather,will it in hail in my current position on 12 10 2035 ?,False
search,i want to read the novel love is in control,False
weather,is it chilly in fm,False
weather,tell me the weather forecast for my current spot 1 minute from now,False
weather,what s the weather forecast for moss hill ?,False
weather,how much rain are we getting in current position,False
search,find the painting icac investigators 2014,False
weather,how s the forecast for chad on september 28 2034,False
weather,weather for swaziland,False
weather,what is the forecast for 9 seconds from now close by here,False
search,where can i find the work it was raining that night ?,False
weather,tell me the weather forecast for casa grande ruins national monument,False
weather,is it going to storm in black rock alaska,False
weather,what will the weather be faraway in new jersey in ten weeks ?,False
search,find a game called the life and loves of tschaikovsky,False
search,please find me the work earth intruders,False
weather,tell me the weather forecast for here in seven years,False
weather,weather at breakfast in montana,False
search,find home fires,False
search,find bullet and a target a television show,False
weather,will it rain in barberville,False
search,find me the picture live in paris 1975,False
search,i m looking for the saga the hardest part,False
weather,which day this week will it get chilly in palmetto in,False
search,where can i listen to the song the imposter ?,False
search,find american psychologist a game,False
weather,what is the weather in hadar,False
weather,what will the weather be in umatilla malta ?,False
weather,when will wi be temperate ?,False
weather,what s the weather looking like in reklaw at 03 19 13 pm,False
search,help me find the work titled singstar take that,False
weather,is it going to be warm on march the 12th in pendleton delaware ?,False
search,how can i view the show corpus a home movie about selena ?,False
search,find the covered wagon a game,False
search,please search the work the mercenary,False
weather,is it overcast in ziwa rhino sanctuary ?,False
weather,will it be hotter in pruntytown rhode island,False
search,find merry arizona 97 desert stars shine at christmas,False
search,find the painting retro active,False
search,show creativity of novel lock,False
weather,what is the forecast for de on 9 11 2035,False
weather,is it supposed to be chilly in kuwait ?,False
search,please find the song house of wedlock,False
search,find a saga called the life of riley,False
search,when was the soundtrack for those were the days – the best of leningrad cowboys published?,False
search,pull up sweeney todd - il diabolico barbiere di fleet street,False
weather,what s the forecast for east sonora qatar,False
weather,will it be nice on aug the nineteenth in beda bulgaria,False
weather,will there be wind in me ?,False
search,find me the balance and timing book,False
search,find the from the hut tv series,False
weather,tell me if it ll be chillier now in engadine,False
search,where can i find the tv show a step away,False
weather,can you give me the forecast for osgood,False
search,find the family jams saga,False
search,find the 180,False
weather,what s the weather 1 minute from now in mount nimba strict nature reserve,False
search,find the putrid death sorcery soundtrack,False
search,search for the world is a game,False
search,please look up the immortals television show,False
search,can you find the novel stoneage romeos,False
search,find me the show girl soundtrack,False
weather,what is the gearhart forecast,False
weather,what s the weather faraway from here on sep the fifteenth,False
search,i want the photograph of walt before mickey,False
search,i d like to see hannah montana and miley cyrus best of both worlds concert,False
search,show video game and the quality of life,False
search,please find pretty baby,False
search,find a new machine,False
weather,what will the weather be in peru ?,False
search,find a soundtrack called pax warrior,False
search,where can i buy a copy of the picture called turn against this land ?,False
search,would like to find the trailer for an experiment with time,False
weather,is it going to be temperate in farallon islands now,False
weather,will it snowstorm next week in west winfield finland ?,False
weather,will it be cold close-by iowa on september twenty-first 2025,False
weather,what is the bethany beach forecast,False
search,please search for the work all the wrong reasons,False
search,find the quest of iranon,False
search,show the second civil war saga,False
search,get jump down painting,False
search,where can i find a painting called battlestations pacific,False
weather,what is the storm forecast in the same area of honduras,False
weather,is it cloudy in georgia,False
search,search for the abel sánchez the history of a passion novel,False
weather,what is the temperature at eifel national park,False
search,can you pull up the television show called electric boogaloo,False
search,please help me search the tv series a mouse divided,False
search,show creativity of the oxford companion to beer tv show,False
weather,will it storm in north sioux city al,False
weather,is it going to be freezing in one hour in puerto rico,False
search,i m looking for paris match,False
weather,what s the weather like in the dana biosphere reserve six years from now,False
weather,tell me if it will storm at my current location,False
weather,how s the weather in brookdale zimbabwe,False
weather,what s the weather in low moor,False
search,find a photograph called cope park,False
search,find confusion bay,False
search,i want to listen to the song only the greatest,False
weather,what s the weather in swift river reservation,False
weather,is it supposed to be chilly in de tonight ?,False
search,where can i listen to the song the lost worlds of planet earth,False
weather,will it get foggy in spring hill ?,False
weather,will it be hot in new york on october the 1st 2026 ?,False
weather,what is the weather like in detroit,False
search,show the blue meaning television show,False
search,find journal of the european economic association a movie i want to see,False
weather,tell me if it ll be colder in steptoe battlefield state park in one minute,False
search,find a video game called victory march,False
weather,in bon secour national wildlife refuge at twelve pm will it be chilly,False
weather,is the expected weather temperate here in 1 month,False
weather,what is the current position forecast for starting on july 22,False
weather,what will the weather be like at my current spot on january the 19th,False
weather,in morgan mill will it be sunny,False
search,please search the irv gotti presents the murderers picture,False
weather,how chilly is it close to hollidaysburg ?,False
search,find the gill deacon show,False
weather,will there be wind on january 24 2019 in ransom,False
weather,is it going to be warm here,False
weather,will it get colder in alaska ?,False
search,play the putrefactive infestation trailer,False
weather,will it be sunny a lot in honduras next autumn,False
weather,forecast for vi,False
search,search for ayumi hamasaki countdown live 2007–2008 anniversary song,False
weather,will there be a depression in the weather here on cyber monday ?,False
search,i m looking for the show sex and candy,False
search,find the show we chase the waves,False
search,looking for novel build engine,False
weather,is it supposed to hail in rosenberg in the french polynesia,False
search,find the tv series the parent trap iv hawaiian honeymoon,False
weather,tell me if it ll be rainy here on dec the 25th 2033,False
search,show song schedule come into the world,False
weather,what is the forecast in kearneysville,False
weather,what is the weather like for fleischmanns lesotho 43 weeks from now,False
weather,what will the weather be like 19 minutes from now in nepal,False
weather,is there hail forecast for hale center on 7 22 2030 ?,False
weather,what s the weather forecast for tomorrow around sankertown ?,False
search,find me a movie with the name oshin,False
search,search for the painting smart money,False
weather,what will the weather be in palm bay pa ?,False
search,i m looking for a novel called the adventures of lolo ii,False
search,look for the game find another way,False
search,i m looking for the show pulse 2 afterlife,False
weather,what s the weather forecast for porphyry island provincial park right now,False
search,find the show the best of the township idols,False
weather,what is the weather forecast for Åland,False
weather,what s the weather in stone mountain kentucky,False
weather,weather in tioga colorado,False
weather,how much humidity is there in ut ?,False
search,find games wizards play tv series,False
search,i want to play the video game espn major league soccer,False
weather,what is the humidity in missouri city sc,False
search,find me the book with the title of the rainwater lp,False
search,find the game saturday review,False
search,find drowning with land in sight,False
search,can you help me find tears from a willow ?,False
weather,will it be snowy in pillow indiana ?,False
weather,will there be a blizzard in north carolina,False
search,play the crowd a study of the popular mind soundtrack,False
search,find head start,False
search,where can i get the video game faith in chaos ?,False
weather,tell me how bellwood weather is,False
search,find me the river of love saga,False
weather,will it be hotter netherlands antilles flats on april the 27th,False
search,i want to see the trailer for the entity,False
weather,is the forecast windy in nigeria on nov the 6th,False
search,find the saison 7 de how i met your mother show,False
search,please find me the youth against fascism television show,False
weather,will it be warm in gilmer keeling islands ?,False
search,get me the soundtrack from sensation comics,False
search,i d like to watch miss congeniality,False
search,find the game just dance greatest hits,False
search,find a photograph of adventure time the secret of the nameless kingdom,False
weather,is it going to be snowy in ochopee massachusetts ?,False
search,find a tv show called union,False
search,can i see the show heroes of might & magic 4 ?,False
weather,will it be chilly in oakdale ok,False
weather,is it chillier here,False
search,find the game a russian beauty and other stories,False
search,please find me the work ace of spades,False
search,search for the game the last horror movie,False
search,find me the extreme ghostbusters game,False
weather,weather for this winter here,False
search,show me the book it might as well be spring,False
weather,will it be warmer in minidoka ok on good friday ?,False
weather,is it humid in kuwait,False
weather,is it freezing in tira,False
search,i want to see the television show called cuts both ways,False
search,show me the sex therapy painting,False
search,find live at bonnaroo,False
search,please look up amrithavaahini,False
search,please get me the crime and punishment in suburbia trailer,False
search,find the love and war soundtrack,False
search,find the international journal of robotics research soundtrack,False
weather,whats the weather in fernando new jersey,False
weather,is it chilly on oct 19th in il,False
search,find the picture vertically challenged,False
search,need to find the tv series called administrative behavior,False
weather,is the forecast hot in 1 hour in leasburg ?,False
search,find the novel a hat in time,False
search,i m looking for a photograph called merry christmas,False
weather,what is the weather forecast for la cienega,False
search,look for summer with monika,False
weather,what will the temperate be here on shmini atzeret,False
weather,is there snowfall in hineston new hampshire,False
search,play the last mile album,False
weather,tell me when it ll be cloudy in woodport,False
weather,tell me the weather forecast for 10 21 2024 in metamora,False
search,find a tv show called the traffic policeman,False
weather,is it going to be cold 21 weeks and a half from now in salemburg,False
weather,what s the weather like in saint regis falls nd,False
weather,tell me if it will be hot on jun the 10th in san de fuca sweden,False
weather,show me the dresden weather forecast,False
weather,will it be hotter close by here at 13 o clock ?,False
search,find a book called environment and behavior,False
weather,what s the weather look like for mh,False
weather,tell me if it will it be windy in grizzled squirrel wildlife sanctuary,False
weather,what is the weather like at emma wood state beach,False
search,play me the saga the party’s over,False
weather,how will the weather be in six minutes close to moosic,False
search,where to watch show extremely live,False
search,please get me the work shirley aviatrice,False
search,find a trailer called way down yonder in new orleans,False
weather,what s the weather for new york on july the 28th 2032,False
weather,can you give me the weather forecast in tajikistan ?,False
weather,what is the weather like now in washington,False
weather,is it supposed to gt colder in or,False
weather,tell me the weather for sewickley at twelve am,False
search,play me the trailer for chasing after shadows living with the ghosts,False
weather,what is the weather at the current position,False
weather,show chillier conditions next week in camp bird,False
weather,what will the weather be in in ?,False
weather,what s the weather going to be like near sawtooth national recreation area at 2 pm ?,False
weather,need to see if there will be fog,False
search,show song black heart white soul,False
weather,what will the weather be in romania at 4 ?,False
search,i d like to see the photograph the light,False
search,please pull up the album the last war,False
search,i need work of father dearest,False
search,i d like to see the book city university of hong kong law review,False
search,where can i purchase the tv series the mating season,False
weather,will it be snowy on january 26th in trentwood illinois,False
weather,tell me the weather forecast for june seventeenth 2034 in fl,False
search,find a tv series called armageddon summer,False
search,i need chapter one of the show get it for me please,False
weather,will there be alot of wind on march 13th in lost creek bahrain,False
search,find the good wife,False
search,find cascading waterfall,False
search,show me the song the incredible hulk returns,False
weather,i need a forecast for jetmore massachusetts in 1 hour and 1 second from now,False
weather,tell me the weather forecast for sugarloaf provincial park ten weeks from now,False
search,find the saga a very school gyrls holla-day,False
search,find a tv show called zen the music of fred katz,False
weather,what will the weather be at noon in durbin oh ?,False
weather,what s the weather in andorra,False
search,i am looking for the work nikki,False
weather,forecast for willits christmas island twenty three minutes from now,False
search,find a soundtrack called the christmas shoes,False
weather,what will the humidity be in ar in 49 weeks and a half from now,False
search,i want to find the show from where to eternity,False
search,find old school junkies the album a video game,False
search,look for the no bigger than a minute soundtrack,False
weather,how cloudy is it in morrisonville kentucky,False
weather,what is the weather forecast this week close-by my current position,False
weather,is the weather hot in miller house nv,False
search,can you find the television show manifesto of nevermore,False
search,show the matrix revolutions,False
search,i want to listen to the soundtrack bed of roses,False
search,what is the michael moore is a big fat stupid white man video game ?,False
search,download the red eagle tv show,False
search,find the song the fourth man,False
weather,can you tell me what the weather is doing in north epworth guam,False
search,i want to watch the television show little things,False
weather,tell me the weather forecast for my current place at 15 o clock,False
weather,forecast for addo-elefanten-nationalpark,False
weather,what s the weather forecast for central north dakota ?,False
weather,what will be the temperate in tyresta national park on 7 18 2030 ?,False
search,find taskcracker for outlook a game,False
weather,will it get chillier in 2 seconds in republic of the congo ?,False
weather,will it get chillier in sinclair in 8 hours,False
search,where can i find appalachian journey,False
weather,what is the forecast for foggy conditions here in twenty one minutes,False
search,find a song called bronco billy,False
weather,this month will the sun be scorching in la,False
search,i d like to see the television show best-of design of a decade 2003–2013,False
search,please find me the game called the salvation,False
weather,will it get hotter in hext ?,False
search,play the television show tears laid in earth,False
search,play the game piety street,False
search,find the cartel vol 2 novel,False
search,look for the girl in mirror movie,False
search,how can i watch the television show tinker bell and the legend of the neverbeast ?,False
weather,will it be chilly at 11 am in loup city,False
weather,united states has warm weather on next wed,False
search,help me the find the thug lordz trilogy book,False
search,i d looking for the saga playcanvas,False
weather,will it be colder this autumn in wren saint martin,False
search,find drumline a new beat a picture,False
search,i d like to see jack,False
weather,what is the chilly forecast for mustoe north carolina,False
search,find a book called kiss symphony - alive iv,False
search,please show me the picture history repeating,False
weather,what is the weather in sint maarten,False
weather,what will the weather be like on september 26th in eastlake,False
search,i want to see plague soundscapes,False
search,i d like to hear the song impractical jokers uk,False
weather,how windy is it in anderson lake state fish and wildlife area ?,False
weather,will it be hot three minutes from now faraway from saint croix state park,False
search,find the video game tenacious d in the pick of destiny,False
search,find sailing the seas of cheese,False
search,show creativity of sacred fire live in south america,False
search,find the killing fields,False
weather,what s the weather like in calpella,False
search,find me the young doctors in love tv show,False
weather,one hour from now what will it be like in cholame rhode island,False
search,where can i find information on brats in battalions ?,False
search,search for the video game the book of heroic failures,False
weather,will it be freezing in new preston venezuela ?,False
search,find a television show called servidor apache,False
search,show movie schedule of the big mouth,False
weather,what s the weather in singapore,False
search,show me the live in whitby album,False
weather,will there be fog in my current position,False
