Intent,Sentence,Outlier
search,where can i see the trailer for phineas redux ?,False
weather,will it be getting colder in sahuarita ?,False
weather,is agnew united states has chilly weather,False
search,where can i watch the tv series breed the pain ?,False
search,look for the thorns saga,False
search,where can i stream a television show called safety ep ?,False
search,please find me glass cloud – single,False
search,find a video game called new york 911,False
search,search for tera the exiled realm of arborea,False
search,i d like to hear the song in a reverie,False
weather,what is the weather forecast for yoakum sc ?,False
search,what is party all night,False
search,show creative photograph of icewind dale heart of winter,False
search,where can i purchase the saga the second life of samuel tyne,False
weather,will it snow in haigler bosnia and herzegovina,False
weather,show me the forecast for anatone louisiana on november 7th,False
weather,will it feel nicer in finland or new mexico today,False
search,find a soundtrack called the outpost,False
weather,what is the johnson creek forecast for chilly weather,False
search,find a song called this champagne mojito is the last thing i own,False
search,find the mystery woman saga,False
search,find a book called screwed,False
search,show me heavenly sword,False
search,find a trailer called hellboy the troll witch and others,False
weather,check the weather forecast in seven weeks for emida,False
weather,what is the freezing forecast for british virgin islands,False
weather,what is the weather forecast nearby sc,False
search,can you please look up the game the islanders ?,False
weather,weather in radnor township wv,False
search,find tortured man,False
weather,what is the weather going to be like this evening in arkansas,False
search,can you help me find the author! author ! trailer ?,False
weather,weather for oct 16 in mo,False
weather,what will the weather be for hooksett,False
weather,what will the weather be in grand coteau ut at six pm ?,False
search,find a show called the paper route,False
search,show acta mathematicae applicatae sinica tv show,False
weather,what s the weather going to be like around lewis and clark trail sixteen hours from now ?,False
weather,what s the weather in ri ?,False
weather,what s the weather in south hill,False
weather,is there snowstorm in la ?,False
weather,what is the weather in mascotte,False
search,find the living room tapes a tv series,False
weather,what will the humidity be in beroun on aug 26,False
search,play a trailer for sencha touch,False
search,i m looking for the music of nashville season 3 saga,False
search,show tv show schedule archiveis,False
search,please search the work eve-olution,False
weather,what will the weather be like at 3 am in trinidad and tobago,False
weather,what s the weather going to be one hour from now in taiwan,False
search,find the picture their finest hour,False
weather,will it be warmer at 15 o clock in deepwater bonaire,False
weather,what is the southern shops forecast for warm temps,False
search,show creativity of book future of the past,False
search,find a tv series called the golden hits of sandie shaw,False
weather,how much fog is there in tarpon springs ?,False
weather,will it be cloudy by five pm in gobler jersey,False
weather,what weather is predicted for loyalhanna ?,False
search,find a trailer called sheriff of tombstone,False
weather,weather for ma in the morning,False
search,what is the tv show this is halloween ?,False
weather,is it supposed to hail in ny,False
weather,what is the humidity in serbia,False
search,play if you go,False
search,i d like to see confessions of an indian teenager,False
weather,what is the weather not far from current position,False
search,find as live as it gets,False
weather,what is the weather going to be like on st patrick s day ?,False
search,find a soundtrack called the spanish jade,False
weather,what is the weather like in hurstville ?,False
search,show the collectors video game,False
weather,what is the pw forecast for jul 9 in robert,False
weather,what will the weather be like in 16 weeks at the ivory coast,False
weather,will there be a snowfall here in the neighboring areas?,False
weather,what is the weather in arkansas the city of morrison,False
search,please search the songs for the deaf video game,False
search,please search for the work wholehearted,False
search,show the night riders,False
weather,what is the forecast for petersville oh,False
search,find me the lace and whiskey soundtrack,False
search,where can i purchase papers in regional science the album ?,False
search,where can i locate leo the lion for purchase,False
search,find to each his own cinema an album,False
search,look for the trailer for red stallion in the rockies,False
weather,show cloud forcast in 1 hour in ia,False
search,find black mirror iii final fear,False
search,find the movie shake your spirit,False
search,i want to find the video game masada anniversary edition vol 3 the unknown masada,False
search,find a tv show called randy scouse git,False
weather,what will the weather be in nationalpark rila on nov 25 ?,False
weather,what will the weather be next apr in mt ?,False
search,please find me the platinum box ii song ?,False
weather,will it storm in charles pinckney national historic site,False
search,find the show the naked gun,False
search,what type of movie is houston press ?,False
search,find the show titled the most charming and attractive,False
search,could i download chavez inside the coup ?,False
weather,will the wind die down at my current location by supper time?,False
weather,is there a snowstorm in the forecast for el cenizo,False
weather,tell me the weather forecast for here,False
search,find the album future of the past,False
weather,is there weather going to get chilly when i get close to new york ?,False
search,find half a sixpence photograph,False
weather,let me get the forecast in allardt canada,False
search,show the immortal grand prix,False
weather,what s the weather in paulette yemen,False
search,please help me find the short program saga,False
weather,what will the weather be a nine in willow river state park ?,False
weather,is the weather going to be colder in gu in 11 years,False
search,find your personal touch,False
weather,show the forecast nearby in twenty two minutes in french polynesia,False
weather,what will the weather be like in the falkland islands starting may 25 2022,False
search,please get me stories from the english and scottish ballads show,False
weather,what s the weather in niagara,False
search,show the trailer of deadly skies,False
search,i want to listen to the song first time for everything,False
weather,will there be fog not far from mexico on apr 27,False
weather,can you tell me the weather forecast for six am in grenada,False
weather,is it going to be warmer 165 days from now at nairobi national park,False
weather,tell me if it ll be freezing 333 days from now in caplinger mills florida,False
weather,weather for noon in ca,False
weather,is it forecast to be hot in greenland this winter ?,False
weather,what is the weather forecast for ridge farm new york,False
weather,what will the weather be like 1 minute from now within the same area of my current location,False
weather,is it going to be windy faraway from the valley of fire,False
weather,will there be sun in the manassas national battlefield park ?,False
weather,what was the weather in my current position last october,False
search,find the labyrinthe game,False
search,find a saga called set sail the prairie,False
weather,will it be warm in kipp rhode island one hour and 9 seconds from now ?,False
weather,what is the mississippi for the week,False
weather,will it be colder in cut ma tomorrow,False
search,want to find a creative work called the prayer,False
weather,is it going to be warm here for brunch,False
search,where can i buy a photograph called feel the love ?,False
search,show me the movie black summer,False
search,show the singles collection volume 4,False
search,i want the song phrazes for the young,False
search,find a picture called neighbourhood,False
search,please help me search the banker television show,False
search,i want to listen to the soundtrack adobe digital editions,False
weather,how hot will be there in kanwar lake bird sanctuary tomorrow ?,False
search,find a show called big broadcast of 1938,False
search,find the exile and the kingdom,False
search,i want to play the video game called china seas,False
search,find an album called thursday night baseball,False
search,find join the dots b-sides and rarities,False
search,show creativity of song a discord electric,False
search,i want to watch the tv show official detective,False
weather,how warm will it be in 10 minutes,False
weather,what is the predicted weather for wells in indiana ?,False
weather,show weather forcast for february the 8th on current spot in neighboring,False
search,play the home is where the music is tv series,False
search,show the put yourself in his place game,False
search,show creativity of home brew,False
weather,will it be hot in saint jo alaska,False
search,i am looking for a creative work called something warm,False
weather,tell me if it ll be chilly here at 0 pm,False
weather,what is the orlovista forecast for midday within walking distance,False
weather,will it be warm in zambia at 9 pm,False
search,find me the book called suffer,False
search,find boyish story,False
search,can you please find me dream ?,False
search,show creativity of accident analysis & prevention,False
weather,will it be warm in the current place next spring,False
weather,what s the weather here on 2 7 2021,False
search,play the album the outpost,False
search,find the movie chaos is me,False
search,find the another ticket game,False
weather,what weather is in saint vincent and the grenadines on thursday,False
weather,will it snow on apr eighteenth 2029 in myanmar ?,False
weather,what is the weather forecast for theodore roosevelt inaugural national historic site,False
search,search for live forever the rise and fall of brit pop tv show,False
weather,will it be stormy in saint pierre and miquelon in the city of wenham,False
weather,what will the weather by close by the current position at 02 02 30 ?,False
search,find a tv show called shake hands with beef,False
search,i need journal of pediatric oncology nursing help me find,False
weather,what is the forcast now in kansas,False
search,find me an echo in the darkness,False
search,i want to watch the show frank sinatra sings the select sammy cahn,False
weather,will there be a storm nearby,False
search,find me i am mariah… the elusive chanteuse,False
search,find the apple address book television show,False
weather,is it cloudy in cuba ?,False
search,play the video game the genesis machine,False
search,where can i download the game miss robin hood,False
search,find half cut tea,False
search,what is the price for the album praise the lord and pass the ammunition ?,False
search,i want to play a game called scotland tonight,False
weather,is it warm at seven am in greenland,False
search,play video game manifesto of nevermore,False
search,how do i see the tv series to see the invisible man ?,False
search,where can i purchase wuthering heights,False
weather,how s the weather looking in pheba,False
search,show family plot,False
weather,will it hail in 1 minute in toms river,False
weather,what is the forecast for march the twelfth faraway from pine mountain state resort park,False
search,i want television show come again smith,False
weather,tell me when it will be chilly in chicken united kingdom,False
search,show the chemdexcom photograph,False
search,show me the movie purple heart diary,False
search,find a tv series called dirty politics,False
weather,what does it feel like in connecticut,False
weather,what s the weather here in 52 and a half weeks,False
weather,will there be a storm faraway from chapman ranch ?,False
search,i need to find the creative work burn baby burn,False
search,search for innocence from hell,False
weather,tell me the current forecast for switzerland,False
weather,what is the forecast in the same area as fiji,False
search,find the youth against christ saga,False
weather,what will the weather be in stelvio national park 1 hour and 1 minute from now ?,False
weather,what will it be like feb the twentieth in colorado,False
search,find back for good a novel i want to read,False
weather,how will the weather be in bhutto family mausoleum next autumn ?,False
search,find a novel called twins of evil,False
search,find a saga called lovex discography,False
search,show the mickey mouse photograph,False
weather,weather here at two pm,False
search,show me horton and the kwuggerbug and more lost stories,False
search,look for the trailer of guitar heaven santana performs the greatest guitar classics of all time,False
weather,what is the forecast for chandler,False
weather,what kind of weather will be in va 12 years from now ?,False
weather,is there forecast to be snow in gu this summer ?,False
search,where can i find police story 3 supercop,False
weather,what is the weather forecast 131 days from now in atanassow-see,False
search,find the angry birds movie,False
search,can you find a picture of the rambler,False
search,what is the cave canem demos photograph ?,False
weather,what is the fiji forecast for warm temps,False
weather,show weather forcast for t hstone memorial st joseph peninsula state park on one hour from now,False
search,find the trailer for the spooky sisters,False
weather,will it be sunny in corcovado indonesia ?,False
search,please search for the live in san juan capistrano picture,False
weather,what s the weather forecast near to fern creek this winter ?,False
search,where to get painting of channel 4 news,False
weather,will it be chilly around oregonia in 9 months,False
weather,what weather will it be in battlement mesa ?,False
weather,will it be warm in jenners panama on august the sixteenth ?,False
search,what is the release date for the dvd called wild is the wind ?,False
search,find a soundtrack called billboard hot r&b hits 1981,False
weather,what is the mt forecast for 22,False
weather,weather for 9 3 2034 at bridle trails state park,False
search,i m looking for the trailer to evil or divine - live in new york city,False
search,play the song evocation i – the arcane dominion,False
weather,will it be warmer in ct,False
weather,on april 2nd what will the weather be here,False
search,i d like to see the book the royal thousand,False
search,find the fire in our throats will beckon the thaw tv show,False
weather,what is the weather of new jersey palisades at three hundred three days from now,False
weather,what s the forecast for tonight far from east carpathian biosphere reserve ?,False
search,hook me up with a song by dancing girl,False
weather,when will the weather be temperate like it is now in stansbury park in tuvalu,False
search,i want to listen to the song the loving spirit,False
search,search for big ideas painting,False
weather,what is the weather prediction for acworth north korea in six years,False
weather,how s the weather going to be on jul 2 in whiteside,False
search,look up the dock of the bay show,False
search,show the soonchild painting,False
weather,what is the weather forecast two hours and seventeen seconds from now in elgin schoolhouse state historic site,False
search,find the picture chorus line,False
search,what is the cheapest price for the saga called 2006 wikipedia cd selection ?,False
weather,what is the weather forecast for boden,False
weather,tell me if there will be hail at tea time in nordland,False
weather,what s the weather at eleven pm in craig mountain wildlife management area,False
weather,what will the weather be in cummings mississippi in eleven years,False
weather,what will the weathr be in akin jamaica ?,False
search,can you search a song for mama book for me?,False
search,show me tears on my pillow,False
search,find a trailer called storm center,False
search,search for the album frog and the birdsong,False
search,can you find me the work titled a little curious ?,False
weather,what is the weather forecast for maryland,False
weather,can you tell me the weather conditions for patricia,False
search,where can i purchase the twenty chickens for a saddle saga ?,False
search,find the app store,False
weather,will it get hotter in zenith ct ?,False
search,i m looking for an album called the orchestrion project,False
search,search for the dark side of the mind movie,False
search,show the best of minnie riperton saga,False
search,find the tv show starship titanic,False
weather,is maalaea has chillier weather,False
weather,what will the weather be in the current spot on 12 14 2023,False
search,find a painting called songs from tsongas,False
weather,will it be cloudy in guadeloupe next year,False
search,find the tv series the farewell tour,False
weather,what is the weather forecast here one minute from now,False
weather,what is the weather forecast for new mexico,False
weather,what is the forecast for swain,False
search,find information about the album flipper city,False
search,find the photograph the air is on fire soundscape,False
search,find all about aubrey,False
weather,please give me the forecast for branton,False
weather,will it be chillier in uruguay in 213 days ?,False
weather,what s the weather forecast for seychelles ?,False
weather,what will the weather be like in 1 minute in my current position,False
weather,will it be chilly in liberty city bhutan ?,False
search,find the little death a soundtrack,False
weather,tell me when there will be a snowstorm in clifton forge,False
search,need to find a creative work with the title sometimes the blues is just a passing bird,False
weather,is there fog in new york,False
weather,what is the predicted weather for my current spot next month ?,False
search,find an album called stumblestoprepeat,False
weather,will it be overcast in south dakota,False
search,where can i watch the trailer for home economics,False
search,find a novel called nature reviews genetics,False
search,where can i find the picture of house foundation,False
search,find the moldy peaches,False
search,show me a picture called heart like a hurricane,False
search,find the burn the sky down album,False
search,look for the saga called death in paradise,False
weather,forecast for 11 am in nauru,False
search,look for the album called the tale of mr jeremy fisher,False
weather,is it rainy at the edward l ryerson conservation area ?,False
search,find a video game called young,False
search,look up the hard to handle tv show,False
weather,will it be sunny in spain on 3 26 2023 ?,False
weather,what is the weather forecast for maryland,False
search,find a painting called the legend of tashan dorrsett,False
search,what is the picture called lest we forget the best of ?,False
search,find laserlight,False
weather,please tell me the forecast for here,False
search,i want the show the sense apparatus,False
search,find at this point in time,False
search,find a tv show called the extraordinary,False
search,want to see the dungeons & dragons chronicles of mystara,False
weather,what is the weather forecast one minute from now in macao,False
weather,what s the humidity right now in aguila,False
weather,will it be windy at two pm in france ?,False
weather,what is the weather forecast in the country of chile fifteen hours from now,False
weather,what s the weather in la pine,False
weather,is it going to be chilly at nine am in doolittle,False
search,find a game called albino blacksheep,False
weather,weather for apr the thirteenth in djibouti,False
weather,will it be hot in dongola cameroon,False
search,find the blood red sandman,False
search,find thunder in the east,False
search,where can i watch the latest episode of the tv show chu chu and the philly flash ?,False
weather,what will the weather be like in three weeks in gates michigan,False
search,find me a game called thesis eleven,False
weather,tell me the weather forecast for my current spot on dec fourth 2021,False
search,find the innocent when you dream saga,False
search,play pirates of the caribbean online,False
weather,what s the forecast for walker bay nature reserve for next year ?,False
search,where can i get lahore,False
search,find a tv show called perfect chemistry,False
search,find a song called in your eyes,False
search,show creativity of what is dead may never die,False
weather,what s the forecast for lake ilo national wildlife refuge,False
search,find me a game called merle haggard presents his 30th album,False
weather,when it comes to dukes and the district of columbia what will the weather be in one hour,False
search,where can i find the movie called cracking contraptions ?,False
search,show me the saga my darling,False
search,find a video game called peaches discography,False
weather,what is the eugene t mahoney state park forecast for 2 days from now,False
weather,will there be sun ten minutes from now in uintah,False
search,find conker live and reloaded,False
weather,what is the weather in neighboring oh,False
search,show me the movie sonic triple trouble,False
weather,what is the weather for my current place,False
weather,what s the weather here ?,False
weather,tell me the weather forecast for huxley ms,False
search,i m looking for the tv series called unborn,False
search,find a photograph called shout it out,False
search,can yo find me the game a silence that screams ?,False
search,find heroquest ii legacy of sorasil,False
search,can you help me find scholarmate ?,False
weather,is there a blizzard coming to el verano,False
search,find the show manthan,False
search,find a picture called how much wood would a woodchuck chuck,False
weather,will it be stormy not far from id on 10 2 2021,False
weather,is it going to hail in mount san jacinto state park,False
weather,will it be nice now in norway,False
search,find the most important people a television show,False
search,show creativity of night of the hunter,False
search,show me it might as well rain until september,False
weather,is it forecast to be chillier around texas ?,False
weather,will it be hotter in md on apr 10th ?,False
search,show creativity of photograph of my wonderful day,False
search,where can i find on the marble cliffs,False
weather,is it going to be hot on oct the 8th 2020 in the neighboring greenland area,False
weather,what s the weather forecast for walsenburg vermont for july 13th ?,False
weather,is it going to be colder in queen anne on mon ?,False
weather,what s the weather like today in plankinton ?,False
search,play me the tv show seal team,False
search,find check in,False
weather,tell me the weather for next week at cathedral state park,False
weather,what s the forecast for wendell ?,False
search,can you find the album simplescreenrecorder,False
weather,will it be freezing one second from now in aragon pakistan,False
weather,is it nice now in madawaska,False
search,i d like to listen to the song the natural farmer,False
weather,what is the british virgin islands forecast for next november,False
search,find starcross,False
weather,what is the forecast in mer rouge and palestine,False
search,find a photograph called accion newspaper,False
search,find goodreader,False
weather,how will the weather be this month in or,False
search,find loved ones for me,False
weather,what is the weather not far from upper klamath national wildlife refuge ?,False
weather,is there snow in jan in castle dale mayotte,False
search,please find the infrared riding hood tv show,False
weather,tell me the forecast for rogers city ms,False
search,show creativity of painting of me too,False
search,search for the television show me and my guitar,False
weather,will the weather be stormy in aurora ?,False
weather,is it going to be nice at 6 am at chippewa lake,False
search,show me the novel all i need to know,False
weather,what s it like in bahrain right now ?,False
search,where is winterheart’s guild,False
weather,what is mo forecast for hotter temps in kalkaska,False
weather,is it warmer in monson u sminor outlying islands,False
weather,tell me if it will hail in kyrgyzstan,False
search,find the passion of michel foucault novel,False
weather,is it forecast to be warm in doi inthanon national park ?,False
weather,what will the weather be at ten am in fourche nv,False
search,is it possible to find the book live in europe online?,False
weather,what s the weather forecast for 8 hours from now in cape verde ?,False
weather,what s the weather forecast in humphrey ?,False
search,find politicsnation with al sharpton,False
search,find a video game called batman the return of bruce wayne,False
search,find an album called preminchi choodu,False
weather,weather in selinsgrove,False
weather,what will the weather be in worthington springs ?,False
weather,will it be freezing 5 seconds from now in patmos,False
search,find book the music lovers,False
weather,is it cold ever in farristown tanzania,False
search,show creative book named pencil thin mustache,False
weather,what is the weather for yemen,False
weather,will it be hot in the cayman islands on november 12th 2035,False
search,find me the novel titled fertile ground,False
weather,is it chillier in mint hill fm,False
weather,how cold is it in my current position ?,False
weather,what s the weather in heritage hill state historical park,False
weather,will there be a cloud next year in kewanee,False
search,where to buy book bright ambush,False
weather,is there a storm in new mexico in fort sumner,False
search,find trivial pursuit america plays,False
weather,is there any hail in monterey bay national marine sanctuary,False
weather,forecase for ohio in twenty one hours and one second,False
weather,what is the forecast this month in kosovo,False
weather,check the weather forecast for the current position,False
