Intent,Sentence,Outlier
search,find me the seven-ups,False
search,can you pull up the sanford herald,False
search,play the album journeyman,False
search,play cry baby lane,False
search,find me a soundtrack by ghost town prophecy,False
search,search for trailer jazz impressions of the usa,False
search,find the album follow that camel,False
search,find the rewind the film tv show,False
search,find a book called the echo chamber,False
search,find me the book my people were fair and had sky in their hair… but now they’re content to wear stars on their brows,False
search,show book name straight no chase,False
search,find the show trancers,False
search,go to after dusk they come,False
search,find an album called the aboriginal port folio,False
search,look for fighting vipers 2,False
search,find switching channels,False
search,find the via dolorosa songs of redemption saga,False
search,where can i buy a hardcover copy of the book the intangibles of leadership ?,False
search,i d like to hear the song daimidaler prince vs penguin empire,False
search,show creativity of soundtrack iheartradio countdown,False
search,play the discografia de the pretty reckless saga,False
search,where can i find the saga addicted to love,False
search,show the glass cloud – single tv series,False
search,book of two for the road,False
search,where can i find the novel the great irish bake off,False
search,show the creativity of saga the dissociatives,False
search,play the song memories are my only witness,False
search,can you find the soundtrack for westcountry live,False
search,find the press of atlantic city movie,False
search,where can i watch the tv show terrorists the kids they sentenced,False
search,pull up mafia the city of lost heaven,False
search,show me the lights out saga,False
search,find a tv series called manufacturing consent,False
search,find me shack out on 101,False
search,where to get saga of a brush with the law,False
search,search for the picture boomtown,False
search,find the book called black wings of destiny,False
search,show the creativity of where what when,False
search,find a video game called the yellow claw,False
search,show creativity of the house of the dead,False
search,what is the read all about it picture ?,False
search,find the movie don’t break the heart that loves you,False
search,show me the television show the science of breath,False
search,i want to find a book called cash-cash,False
search,find me the memorial,False
search,find me the show the skull,False
search,i m looking for river disturbance,False
search,i want to watch the tv show down on abby,False
search,find tv series titled sonata mix dwarf cosmos,False
search,find a tv show called the fighting men,False
search,find all jets are gonna fall today saga,False
search,find becoming royston,False
search,i want to watch the trailer ad nauseam,False
search,painting of live from the el rey theatre,False
search,show creativity of adobe air,False
search,show 50 words for snow creative picture,False
search,play the case of the whitechapel vampire tv series,False
search,locate the koi to senkyo to chocolate television show,False
search,find flesh and bullets,False
search,show me the picture batman the long halloween,False
search,find the transformers generations video game,False
search,show the feed the kitty painting,False
search,look for the public toilet painting,False
search,where can i watch tv series shopping spree,False
search,find the photograph the remix please,False
search,find a television show called sensation comics,False
search,has the tv series puppet master axis of evil been cancelled?,False
search,look up the cool cafe cool tape vol 1 video game,False
search,show me tv series lego star wars 3 the clone wars,False
search,find a television show called main street,False
search,i want to read the novel pokémon the movie black—victini and reshiram and white—victini and zekrom,False
search,i want to see the book the mailroom hollywood history from the bottom up,False
search,can you find the book beatmania iidx 10th style,False
search,find the dressmaker,False
search,find me the album the demon,False
search,find a soundtrack called the dragon,False
search,show me the everybody wants you picture,False
search,find the picture of the harsh light of day,False
search,look up the making of milwaukee,False
search,please find the novel good doctor,False
search,where can i view the trailer extreme – the collection,False
search,please pull up the photograph entitled another period,False
search,where can i get intel array building blocks,False
search,find google news,False
search,where can i find the song red back fever,False
search,find the sentimental bloke novel,False
search,can you get me the maldeamores saga ?,False
search,find a television show called basement screams,False
search,can you find the trailer for the young martyr ?,False
search,can you locate west coast wrestling connection,False
search,play saga the yellow rose of texas,False
search,look up the park album,False
search,how do i get the game still on it ?,False
search,please search for the tv series titled i need romance,False
search,find a game called gladiators australian series 1,False
search,find long walk to forever a novel,False
search,show me the saga the buffalo boy,False
search,find a show called some kind of dangerous,False
search,i d like to watch the tv series called fires of life,False
search,go to the television show nothing without you,False
search,play me an album by lunchbox,False
search,find a tv show called ruthless,False
search,get the video game of the chipmunk song,False
search,find the work i looked up,False
search,find a photograph of time loves a hero,False
search,show me a video game made by tmpgenc,False
search,find under night in-birth,False
search,play the movie i want my mtv the uncensored story of the music video revolution,False
search,i m looking for the game called summer of fear,False
search,find a video game called ibm program temporary fix,False
search,where can i view the trailer jeeves and wooster in perfect nonsense,False
search,find an album called list of re hamatora episodes,False
search,where can i purchase the video game the blue generation,False
search,find the tyrant,False
search,where can i buy the soundtrack bridge of souls,False
search,please find me the hanging valley movie,False
search,search for the toucher and rich show,False
search,please find me a novel called the caledonian-record,False
search,show me the photograph a woman from the street,False
search,help me locate the tristan betrayal,False
search,find resurrection of evil,False
search,find me under the skin,False
search,find a soundtrack for meditations,False
search,please help me find i want to take you higher the game,False
search,play the soundtrack for back to the future,False
search,where can i find the jkt48 school,False
search,look for the kiss the girls game,False
search,i want to watch the movie maxime,False
search,show me the album til the morning,False
search,find trailer of jazz impressions of the usa,False
search,show the minutes to midnight photograph,False
search,show me neurotoxicology,False
search,show me photoscape,False
search,i need to find best of the west rides again,False
search,i m looking for 1634 the ram rebellion,False
search,get me information on the riverfront times,False
search,i am looking for the tv show called the flight of the lost balloon,False
search,show me interesting times the secret of my success,False
search,find a work with the name of come sing,False
search,show the whispering willows novel,False
search,show me the photograph of minutes to midnight,False
search,find the life of riley a photograph,False
search,can you pull up channel m news,False
search,find the valentyne suite,False
search,where to buy painting target practice,False
search,find a video game called fare thee well celebrating 50 years of the grateful dead,False
search,find a picture called ready,False
search,find a game called a very special christmas 7,False
search,find a television show called the high chaparral,False
search,show me the tv series called take me to your heaven,False
search,find i could fall in love,False
search,i want to play the video game international pinguicula study group newsletter,False
search,find a painting called mister whiskers my favourite nursery rhymes,False
search,look for the journal of toxicology and environmental health soundtrack,False
search,i d like to see the new jackals,False
search,what system is bloodhounds of broadway the game for?,False
search,find harry potter and the deathly hallows – part 2,False
search,show creativity in all nudity shall be punished,False
search,can you find a photograph entitled beneath the harvest sky,False
search,i want to see everytime we touch which is a painting,False
search,where can i find the novel a woman in the web,False
search,look for a terrible vengeance,False
search,is salò the tv show available to watch anywhere?,False
search,play song softly,False
search,find the tv series box of moon light,False
search,search for teenage mutant hero turtles fall of the foot clan photograph,False
search,get me the trick or treats soundtrack,False
search,can you play the wanderer and his shadow,False
search,i d like to see the novel an inquiry into the good,False
search,i m looking for the work titled converging conspiracies,False
search,find z cars,False
search,show creativity of official history of australia in the war of 1914–1918,False
search,show me the trailer a self made hero,False
search,i m looking for a soundtrack titled bowie at the beeb,False
search,i need to find the saga trail of the yukon,False
search,where can i watch the television show the private affairs of bel ami ?,False
search,where can i find the ricky skaggs discography,False
search,play the new noise theology ep,False
search,find a soundtrack called new religion,False
search,can i see the encounters ?,False
search,can you please find the notebook of trigorin game ?,False
search,play blind company,False
search,find me the documentary a winter of cyclists,False
search,where to get painting of the man in the white suit,False
search,find live in tokyo for me,False
search,search for the show the caretaker,False
search,find the best man holiday saga,False
search,look up the rock the blind photograph,False
search,find a game called the guyra ghost mystery,False
search,where can i view the photograph the phantom horse,False
search,find the song called international journal of bilingualism,False
search,what is the song the beast from 20 ?,False
search,i am looking for a work called carry you home,False
search,show creative picture of brenda’s got a baby,False
search,i need a photograph of days of wine and roses and other tv requests,False
search,search for the adventures of cookie & cream,False
search,find return to krondor,False
search,find the television show called tactics,False
search,find a tale of two cities a painting,False
search,find a book called the polish bride,False
search,find a movie called single collection hotchpotch,False
search,please find me the magic hour saga,False
search,where can i purchase the tv series liar game - the final stage,False
search,find a painting called boating on the river epte,False
search,find a song called be quick or be dead,False
search,show me the photograph called hola mary lou prom night ii,False
search,find the album titled spasmolytic,False
search,where can i get the album so fresh the hits of spring 2011,False
search,find a photograph called free the universe,False
search,please pull up the trailer for stares and whispers,False
search,play the game sugarfoot,False
search,find business ethics a european review,False
search,can you get the tv show enter the matrix ?,False
search,show he who fears the wolf creative photograph,False
search,find a movie called emerald city,False
search,where can i find the movie the national law review,False
search,find the painting the adventures of teddy ruxpin,False
search,find earth moving,False
search,please find the tv show the dreamstone,False
search,find me the song 2 fast 2 furious,False
search,find the still life american concert 1981 soundtrack,False
search,i d like to find the soundtrack tianjin today evening news,False
search,i d like to hear the song in a reverie,False
search,find a show called lipstick vogue,False
search,find the hundred-foot journey,False
search,can you please find me the biggest loser brunei the spirit of life photograph ?,False
search,pull up the movie toy and help yourself,False
search,find sweet sensation,False
search,i want to watch the television show symphony for solo piano,False
search,play the widow of saint-pierre saga,False
search,show the man from london video game,False
search,i need to find the creative work prince hours,False
search,is there a game called the neutral zone ?,False
search,i d like to see the paul murray live television show,False
search,find mash confusion,False
search,search for the television show called educational psychologist,False
search,i m looking for right on track,False
search,please get me exploring the reef tv show,False
search,i d like to see the saga 12 soulful nights of christmas,False
search,play the rest of my life,False
search,i want to see the tv show cause & effect,False
search,show olympia 81 saga,False
search,find a trailer for pesterminator the western exterminator,False
search,where can i find a photograph of the lieutenant of inishmore ?,False
search,where can i purchase the tv series the royal sessions,False
search,find the song titled the rivalry red v blue,False
search,find fragile frontiers the secret history of mumbai terror attacks,False
search,find a tv show called the god boy,False
search,where can i see the show kind of glue ?,False
search,show creative soundtrack pitch black brigade,False
search,where can i find the game kaakai newspaper,False
search,can you find the movie accidentally in love,False
search,go to the tv series love berry,False
search,i d like to see the painting i looked up,False
search,find a television show called i got a bag of my own,False
search,nightwork soundtrack download,False
search,i want to listen to the song shamus,False
search,can you find me the back when i knew it all album ?,False
search,search for television show windows live tv,False
search,where can i see the trailer for experienced ii embrace tour 2013 budokan ?,False
search,show creativity in ah,False
search,please look for the tv show memoirs from a bedroom issue 1,False
search,look for a photograph of i wanna sex you up,False
search,rate trailer geek chic,False
search,find me the big sean discography soundtrack,False
search,i want to watch tv series the practical pig,False
search,when was the album start a fire released?,False
search,find the trailer for on the good ship lollipop,False
search,find fanatic,False
search,find the photograph among the living,False
search,find the movie curl,False
search,play me a trailer for the north-west passage,False
search,where can i see the trailer of take me to the king,False
search,i d like to see the saga song of the saurials,False
search,find the movie you must first learn to draw the real,False
search,find a show called ichibyōgoto ni love for you,False
search,show a family torn apart tv show,False
search,show the sad songs for dirty lovers album,False
search,look for the learning & behavior picture,False
search,i m looking for a picture titled rock painting,False
search,i d like to hear the soundtrack for just once in my life,False
search,where can i find the painting of without condition,False
search,there s a famous painting called thursday do you have an image of it?,False
search,find the madwoman in the attic,False
search,get me a johnny cool photograph,False
search,i d like to see sex tape - finiti in rete,False
search,find a novel called industry,False
search,where can i find a copy of i bury the living ?,False
search,show the three tales album,False
search,find a novel called east liberty,False
search,i d like to see the show migration,False
search,show me the book the republican brain,False
search,go to your heart belongs to me,False
search,i want to watch the tv series krieg in chinatown,False
search,please search for the legend of korra book,False
search,find the real dirt on farmer john a saga,False
search,where can i find the world according to paris ?,False
search,find a song called magic in the water,False
search,find me a game called spaceball,False
search,find me the travel weekly,False
search,play the lousy dance trailer,False
search,show me the photograph johnny cash the complete columbia album collection,False
search,go to the movie the best of pirates of the mississippi,False
search,i m looking for the television show the flame,False
search,show me the picture creatures of light and darkness,False
search,show the kindness of women picture,False
search,find manual of love 2,False
search,search for the song called journal of the american statistical association,False
search,show me the picture sex and drugs and jesus christ,False
search,where can i watch the tv series the trifecta ?,False
search,find tv series titled a life in the death of joe meek,False
search,find an album called from the terrace,False
search,show nightcall,False
search,what is the television show phil ochs there but for fortune playing,False
search,show me happiness was free,False
search,looking for free four tobias tells the divergent knife-throwing scene,False
search,find a picture called cahoots,False
search,show the late great townes van zandt,False
search,play the tv show iron seed,False
search,where is the tv show am universum,False
search,show me the album andrews university seminary studies,False
search,what is the tv show journal of personality and social psychology ?,False
search,show the trailer of rugrats go wild,False
search,find me the picture entitled i’ll take care of you,False
search,where can i view the picture of workin’ with the miles davis quintet,False
search,how to buy picture of agent hamilton but not if it concerns your daughter,False
search,when was the tv show crazysexycool taken off air?,False
search,i d like to see the painting empire of two worlds,False
search,find the television show birth of the cool,False
search,search for the un provinciale a new york tv show,False
search,find the endangered species song,False
search,show me the picture totally true love,False
search,find a tv series called white bread black beer,False
search,find something crucial a book,False
search,i want to watch escape the fate discography,False
search,i m looking for the show called the origin of the milky way,False
search,can you get me the all night long 3 the final chapter novel ?,False
search,find the book time and again,False
search,can you find me the spectres television show ?,False
search,find night of passion,False
search,read the novel on-line encyclopedia of integer sequences,False
search,find a show called the inheritors,False
search,find stained glass windows,False
search,where can i see the television show jimmy two-shoes ?,False
search,search for pat and margaret,False
search,i want to find the adventures of lomax,False
search,show creative trailer of the sword of the lord,False
search,look for the show named chestnut mare,False
search,show me rapid city muscle car,False
search,where can i see the trailer for love on the beat,False
search,find an art called cassidy,False
search,show creativity cum on feel the noize the video game,False
search,show the lateness of the hour,False
search,i need a book called student demonstration time,False
search,pull up the book live and unreleased the radio show,False
search,find a novel called episodi di sons of anarchy,False
search,find my only wish in some form of creative work,False
search,show that little band of gold,False
search,show me a photograph called the daily slovak news,False
search,can you pull up my name is brain brian,False
search,is there a chinese wikipedia,False
search,wish to read the novel called the wizard of stone mountain,False
search,show me the painting called the descendants,False
search,find attack surface analyzer a painting,False
search,need to find the soundtrack called fire in the valley,False
search,find a soundtrack for lords of the rising sun,False
search,do you know of a song by the mande studies association ?,False
search,show creativity of video game labyrinth,False
search,find live at the brixton academy,False
search,i m trying to find the final solution video game,False
search,can you pull up the american music awards of 1975,False
search,info on show natural language and linguistic theory,False
search,find the video game the tomb,False
search,can you get me the rakuen tsuihou expelled from paradise television show ?,False
search,i want sugarfoot,False
search,find a game called the oh in ohio,False
search,how can i watch the television show straight shooter ?,False
search,listen to dragon ball music collection,False
search,find the book cold comfort,False
search,find racing the beam the atari video computer system,False
search,can you find the show the dumping ground survival files,False
search,where can i view the photograph occasional wife,False
search,trailer of gate of thunder,False
search,find the modern world video game,False
search,find the movie ircle,False
search,i want to read the book crash landing,False
search,find the last angry moose,False
search,find the novel a civil war army vs navy,False
search,find later that evening,False
search,i d like to watch the tv series sailor moon supers the movie,False
search,find history of north dakota a tv series,False
search,show creative photograph named none of the above,False
search,find the song ticks,False
search,find my tribute show,False
search,search for police women of cincinnati,False
search,show tv show named i fell in love with a dead boy,False
search,how do i get the soundtrack for hearts of fencing ?,False
search,find tv series of noroi - the curse,False
search,find the tv show when i was a boy,False
search,find cut the rope,False
search,show me the picture nothin,False
search,find back to boomtown classic rats hits a soundtrack,False
search,find a tv show called frontiers in ecology and the environment,False
search,get me a photograph of trac,False
search,find the movie yoshimi battles the hip-hop robots,False
book,rate the lotus and the storm zero of 6,False
book,rate the fall-down artist 5 stars,False
book,rate this novel a 4,False
book,give 5 out of 6 points to absolutely positively not series,False
book,i give emile or on education five points,False
book,rate licence renewed a 4,False
book,a rating of 5 of 6 points goes to dickson mccunn trilogy,False
book,rate beyond the shadows 3 of 6,False
book,give 2 out of 6 points to the following textbook,False
book,the previous textbook is a 3,False
book,rate in stars as a 6 for lord of the shadows which gets a four,False
book,rate small screen big picture a 0 out of 6,False
book,rate the current novel a 0 out of 6 points,False
book,give this book a rating of 3,False
book,i would give this current textbook five points or a rating of 6,False
book,i would give sixty lights chronicle a rating of five and a best rating of 6,False
book,rate this book titled cold two stars,False
book,i want to rate this current series a value of five and a best rating of 6,False
book,rate the current book a zero of 6,False
book,rate this novel 1 of 6,False
book,i would rate this chronicle 4 stars,False
book,give a human being died that night 3 stars,False
book,i m rating the skystone with three points,False
book,rate this current saga 3 out of 6 points,False
book,rate the wild boy series 3 out of 6 stars,False
book,rate the current saga a five,False
book,give 0 rating to she and allan book,False
book,rate the current series a one,False
book,i want to give this album 3 points,False
book,rate the cry of the owl a four,False
book,i want to give this album zero out of 6 stars,False
book,swine not ? deserves four points,False
book,i rate naked in death a 5,False
book,give the current series 3 points,False
book,rate this novel a 3,False
book,rate the keys to the white house a zero,False
book,rate an act of terror 2 stars,False
book,i m rating the skystone with three points,False
book,rate the current series a one,False
book,i rate american history a survey a 5,False
book,give this current novel a 4,False
book,give this current novel a three,False
book,the stars for this are 4 for a textbook,False
book,rate the current chronicle book three points,False
book,rate the bunce 1 stars,False
book,give this textbook a rating of 3,False
book,another girl another planet gets only one of a possiable 6 rating,False
book,rate this textbook 2 of 6 stars,False
book,i give the spirit of st louis a 1,False
book,rate the book post office four points,False
book,give 5 rating for this textbook,False
book,i give this next essay zero out of 6 points,False
book,rate the watsons four of 6 stars,False
book,this novel should get zero points for how intrepid it is,False
book,i didn t like the book nobody lives for ever i give it a 2,False
book,rate this current book album four stars,False
book,give the current novel 5 points,False
book,give death on the nile a three,False
book,rate this current essay three out of 6 stars,False
book,this is rated 5 out of 6 for an essay,False
book,i give a zero rating for this essay,False
book,rate this book a zero,False
book,rate the current album 3 of 6 stars,False
book,i rate the chronicle son of the tree with four of 6 points,False
book,i rate the variation of animals and plants under domestication a value of 0,False
book,the current textbook gets 3 stars,False
book,rate the stars shine down 5,False
book,give one / 6 points to who will cry when you die,False
