Intent,Sentence,Outlier
search,find the book the crowd roars,False
search,look for fighting vipers 2,False
search,find switching channels,False
search,where can i buy a hardcover copy of the book the intangibles of leadership ?,False
search,i d like to hear the song daimidaler prince vs penguin empire,False
search,show creativity of soundtrack iheartradio countdown,False
search,play the discografia de the pretty reckless saga,False
search,where can i find the saga addicted to love,False
search,book of two for the road,False
search,where can i find the novel the great irish bake off,False
search,show the creativity of saga the dissociatives,False
search,play the song memories are my only witness,False
search,find the return to grace saga,False
search,i want to watch manthan,False
search,find the press of atlantic city movie,False
search,where can i watch the tv show terrorists the kids they sentenced,False
search,pull up mafia the city of lost heaven,False
search,find a soundtrack called i still believe in you,False
search,find a tv series called manufacturing consent,False
search,i d like to see the picture teleform,False
search,find me shack out on 101,False
search,find the book called black wings of destiny,False
search,can you get me the education of little tree song ?,False
search,where can i buy the something borrowed saga ?,False
search,find a movie called no 1 in heaven,False
search,show the creativity of where what when,False
search,find a video game called the yellow claw,False
search,what is the read all about it picture ?,False
search,find the movie don’t break the heart that loves you,False
search,show me the television show the science of breath,False
search,i want to find a book called cash-cash,False
search,find me the memorial,False
search,find me the show the skull,False
search,i m looking for river disturbance,False
search,i want to watch the tv show down on abby,False
search,find the ghostly swim 2 book,False
search,find tv series titled sonata mix dwarf cosmos,False
search,show creativity of sing to the dawn,False
search,find all jets are gonna fall today saga,False
search,please search the young warriors game,False
search,find becoming royston,False
search,i want to watch the trailer ad nauseam,False
search,painting of live from the el rey theatre,False
search,where do i play the video game the wild geese ?,False
search,find saison 7 de sons of anarchy,False
search,play the case of the whitechapel vampire tv series,False
search,locate the koi to senkyo to chocolate television show,False
search,show gd&top painting,False
search,show me the picture batman the long halloween,False
search,find the transformers generations video game,False
search,show the feed the kitty painting,False
search,where can i find the sounds to consume album ?,False
search,find the photograph the remix please,False
search,find a television show called sensation comics,False
search,show me the book f-1 grand prix part ii,False
search,please find the tv series back to bach,False
search,find me the album the weed tree,False
search,has the tv series puppet master axis of evil been cancelled?,False
search,show me tv series lego star wars 3 the clone wars,False
search,i want to read the novel pokémon the movie black—victini and reshiram and white—victini and zekrom,False
search,i want to see the book the mailroom hollywood history from the bottom up,False
search,i d like to see level headed,False
search,can you find the book beatmania iidx 10th style,False
search,i want a photograph of elizabeth the queen,False
search,where can i find the game a little bit of mambo,False
search,find the dressmaker,False
search,find me the album the demon,False
search,find a soundtrack called the dragon,False
search,show me the everybody wants you picture,False
search,help me find where the wild things are,False
search,find the picture of the harsh light of day,False
search,where can i view the trailer extreme – the collection,False
search,find mother earth a tv show,False
search,please pull up the photograph entitled another period,False
search,where can i get intel array building blocks,False
search,can you find a creative work called a saintly switch,False
search,where can i find the song red back fever,False
search,find the sentimental bloke novel,False
search,can you get me the maldeamores saga ?,False
search,find the television show riding with the king,False
search,find a television show called basement screams,False
search,find the song occasional wife,False
search,can you locate west coast wrestling connection,False
search,find a tv series called church of the truly warped,False
search,play saga the yellow rose of texas,False
search,look up the park album,False
search,show me the movie haunted spooks,False
search,looking for the trailer for shaolin temple,False
search,how do i get the game still on it ?,False
search,please search for the tv series titled i need romance,False
search,find a game called gladiators australian series 1,False
search,find long walk to forever a novel,False
search,show me the saga the buffalo boy,False
search,can i see the tv show the closer i get ?,False
search,find a show called some kind of dangerous,False
search,play the movie white christmas,False
search,find a tv show called ruthless,False
search,want to find a photograph called the nine maidens,False
search,find the work i looked up,False
search,find a photograph of time loves a hero,False
search,show me a video game made by tmpgenc,False
search,find framing the early middle ages a game,False
search,find under night in-birth,False
search,play the movie i want my mtv the uncensored story of the music video revolution,False
search,i m looking for the game called summer of fear,False
search,find a video game called ibm program temporary fix,False
search,find the video game thale,False
search,she me the sons of satan praise the lord picture,False
search,i want to watch the movie x window display manager,False
search,find me an album called rejoicing with the light,False
search,find an album called list of re hamatora episodes,False
search,where can i purchase the video game the blue generation,False
search,find the tyrant,False
search,where can i buy the soundtrack bridge of souls,False
search,play the sea cabinet,False
search,find a tv show called revenge of the nerds,False
search,please find me the hanging valley movie,False
search,search for the toucher and rich show,False
search,give me a link to the a little something for us tempunauts soundtrack,False
search,please find me a novel called the caledonian-record,False
search,show me the photograph a woman from the street,False
search,help me locate the tristan betrayal,False
search,find me under the skin,False
search,find a soundtrack for meditations,False
search,please help me find i want to take you higher the game,False
search,please get me the very best of chicago only the beginning,False
search,play the soundtrack for back to the future,False
search,where can i find the jkt48 school,False
search,find donkey town a show,False
search,find the show the demi-gods and semi-devils,False
search,please search for the two faces of my girlfriend saga,False
search,look for the kiss the girls game,False
search,i want to watch the movie maxime,False
search,show me the album til the morning,False
search,show the minutes to midnight photograph,False
search,show me photoscape,False
search,i need to find best of the west rides again,False
search,i m looking for 1634 the ram rebellion,False
search,i m looking for the cineexport painting,False
search,get me information on the riverfront times,False
search,i am looking for the tv show called the flight of the lost balloon,False
search,show me interesting times the secret of my success,False
search,find a work with the name of come sing,False
search,where can i view the picture reaching horizons,False
search,show the whispering willows novel,False
search,show me the photograph of minutes to midnight,False
search,find the life of riley a photograph,False
search,can you search for twilight is gone ?,False
search,can you pull up channel m news,False
search,find the photograph canaich,False
search,where to buy painting target practice,False
search,find a video game called fare thee well celebrating 50 years of the grateful dead,False
search,find a television show called the high chaparral,False
search,show me the tv series called take me to your heaven,False
search,i d like to see the the gathering storm tv series,False
search,find i could fall in love,False
search,find the novel make peace not war,False
search,show me the tv show limit of love umizaru,False
search,i want to play the video game international pinguicula study group newsletter,False
search,find a painting called mister whiskers my favourite nursery rhymes,False
search,look for the journal of toxicology and environmental health soundtrack,False
search,what system is bloodhounds of broadway the game for?,False
search,find harry potter and the deathly hallows – part 2,False
search,show creativity in all nudity shall be punished,False
search,can you find a photograph entitled beneath the harvest sky,False
search,i want to see everytime we touch which is a painting,False
search,where can i find the novel a woman in the web,False
search,is salò the tv show available to watch anywhere?,False
search,play song softly,False
search,want to find the novel called innocent until caught 2 guilty,False
search,find a saga called the devil went down to georgia,False
search,can you play the wanderer and his shadow,False
search,i d like to see the novel an inquiry into the good,False
search,show me the the defenestration of ermintrude inch tv series,False
search,show me a picture of love,False
search,find z cars,False
search,show creativity of official history of australia in the war of 1914–1918,False
search,show me the trailer a self made hero,False
search,i m looking for a soundtrack titled bowie at the beeb,False
search,find the game titled iparty with victorious,False
search,i need to find the saga trail of the yukon,False
search,how can i see the tv series mothstorm ?,False
search,play the new noise theology ep,False
search,find a soundtrack called new religion,False
search,can i see the encounters ?,False
search,can you please find the notebook of trigorin game ?,False
search,play blind company,False
search,find me the documentary a winter of cyclists,False
search,search for the show the caretaker,False
search,find the best man holiday saga,False
search,look up the rock the blind photograph,False
search,find a game called the guyra ghost mystery,False
search,where can i view the photograph the phantom horse,False
search,find the song called international journal of bilingualism,False
search,looking for a black ribbon for deborah,False
search,fine a movie called right here right now,False
search,what is the song the beast from 20 ?,False
search,i want to play the game pesterminator the western exterminator,False
search,i am looking for a work called carry you home,False
search,show creative picture of brenda’s got a baby,False
search,i need a photograph of days of wine and roses and other tv requests,False
search,can you search miracle in the rain ?,False
search,find return to krondor,False
search,find me royal astronomy,False
search,find a tale of two cities a painting,False
search,find a book called the polish bride,False
search,find a movie called single collection hotchpotch,False
search,please find me the magic hour saga,False
search,where can i purchase the tv series liar game - the final stage,False
search,find a painting called boating on the river epte,False
search,find a song called be quick or be dead,False
search,search for the painting the elder scrolls i arena,False
search,search for the george and the big bang tv show,False
search,find the photograph underneath the tree,False
search,find the album titled spasmolytic,False
search,looking for the photograph the crimson climax,False
search,where can i get the album so fresh the hits of spring 2011,False
search,show movie the skeptic – das teuflische haus,False
search,play the game sugarfoot,False
search,find business ethics a european review,False
search,what song is detective conan dimensional sniper,False
search,can you get the tv show enter the matrix ?,False
search,show he who fears the wolf creative photograph,False
search,where can i find the movie the national law review,False
search,find the painting the adventures of teddy ruxpin,False
search,find make your play,False
search,i want to see the television show the muppet christmas carol,False
search,please find the tv show the dreamstone,False
search,find me the song 2 fast 2 furious,False
search,find the still life american concert 1981 soundtrack,False
search,i d like to hear the song in a reverie,False
search,find a show called lipstick vogue,False
search,find the hundred-foot journey,False
search,can you please find me the biggest loser brunei the spirit of life photograph ?,False
search,pull up the movie toy and help yourself,False
search,i m hoping you can find a photograph from live at the isle of wight 1970,False
search,i want to watch the television show symphony for solo piano,False
search,play the widow of saint-pierre saga,False
search,find the game endangered species,False
search,i need to find the creative work prince hours,False
search,when and where is distrowatch playing,False
search,find a soundtrack called meet the vogues,False
search,find a saga called shame on you,False
search,i d like to see the paul murray live television show,False
search,find mash confusion,False
search,search for the television show called educational psychologist,False
search,i m looking for right on track,False
search,i d like to see the saga 12 soulful nights of christmas,False
search,where can i find the soundtrack for steamboat bill ?,False
search,i want to see the tv show cause & effect,False
search,show olympia 81 saga,False
search,find ek boond ishq,False
search,where can i find a photograph of the lieutenant of inishmore ?,False
search,find the song titled the rivalry red v blue,False
search,show me live at the kings center,False
search,find fragile frontiers the secret history of mumbai terror attacks,False
search,find a tv show called the god boy,False
search,i d like to see the trailer for history and theory,False
search,where can i see the show kind of glue ?,False
search,where can i find the game kaakai newspaper,False
search,can you find the movie accidentally in love,False
search,play the nubians of plutonia trailer,False
search,i d like to see the painting i looked up,False
search,can you find me the back when i knew it all album ?,False
search,find a tv show called ride the wind,False
search,can you search the picture titled the accounting ?,False
search,where can i see the trailer for experienced ii embrace tour 2013 budokan ?,False
search,please look for the tv show memoirs from a bedroom issue 1,False
search,look for a photograph of i wanna sex you up,False
search,rate trailer geek chic,False
search,find me the big sean discography soundtrack,False
search,i want to watch tv series the practical pig,False
search,when was the album start a fire released?,False
search,find the trailer for on the good ship lollipop,False
search,please find the packed to the rafters work,False
search,find a video game called the last american virgin,False
search,find fanatic,False
search,find a movie called the easy way to stop smoking,False
search,find the photograph among the living,False
search,where can i see the trailer of take me to the king,False
search,find me the book filthy lucre live,False
search,i d like to see the saga song of the saurials,False
search,find a show called ichibyōgoto ni love for you,False
search,show a family torn apart tv show,False
search,show the sad songs for dirty lovers album,False
search,look for the learning & behavior picture,False
search,i m looking for a picture titled rock painting,False
search,where can i find the painting of without condition,False
search,where can i purchase paradise tonight online?,False
search,look for all broken up and dancing which is a video game,False
search,where to buy book charlie countryman deve morire,False
search,get me a johnny cool photograph,False
search,look for the editor & publisher tv series,False
search,i d like to see sex tape - finiti in rete,False
search,where can i find a copy of i bury the living ?,False
search,show the three tales album,False
search,find a novel called east liberty,False
search,i need the game the aria music show,False
search,go to your heart belongs to me,False
search,show creative picture of the secret doctrine,False
search,i want to watch the tv series krieg in chinatown,False
search,please search for the legend of korra book,False
search,find the real dirt on farmer john a saga,False
search,find a song called magic in the water,False
search,find me a game called spaceball,False
search,play the lousy dance trailer,False
search,show me the photograph johnny cash the complete columbia album collection,False
search,go to the movie the best of pirates of the mississippi,False
search,i m looking for the television show the flame,False
search,show me the picture creatures of light and darkness,False
search,show the kindness of women picture,False
search,find manual of love 2,False
search,where can i watch the tv series the trifecta ?,False
search,find an album called from the terrace,False
search,show nightcall,False
search,find me the novel london has fallen,False
search,what is the television show phil ochs there but for fortune playing,False
search,find the game company of heroes,False
search,looking for free four tobias tells the divergent knife-throwing scene,False
search,find a picture called cahoots,False
search,play the tv show iron seed,False
search,where is the tv show am universum,False
search,what is the tv show journal of personality and social psychology ?,False
search,show the trailer of rugrats go wild,False
search,i need to find the so nice soundtrack,False
search,show me the video game when in rome 2007,False
search,i d like to see the painting empire of two worlds,False
search,find the television show birth of the cool,False
search,search for the un provinciale a new york tv show,False
search,show the swan princess,False
search,show me the picture totally true love,False
search,find a tv series called white bread black beer,False
search,find something crucial a book,False
search,want to see the trailer for the prefect,False
search,i want to watch escape the fate discography,False
search,find a show called star trek starfleet academy starship bridge simulator,False
search,i m looking for the show called the origin of the milky way,False
search,can you find me the spectres television show ?,False
search,find night of passion,False
search,play disney sing it! – high school musical 3 senior year,False
search,read the novel on-line encyclopedia of integer sequences,False
search,play me the show house of stairs,False
search,find a show called the inheritors,False
search,find a book called the cia world factbook,False
search,find remedial chaos theory a soundtrack,False
search,i want to find the adventures of lomax,False
search,show creative trailer of the sword of the lord,False
search,look for the show named chestnut mare,False
search,play me the show cheaper by the dozen 2,False
search,show me rapid city muscle car,False
search,where can i see the trailer for love on the beat,False
search,show creativity cum on feel the noize the video game,False
search,find five spanish songs a photograph,False
search,find the trailer platinum in da ghetto,False
search,i need a book called student demonstration time,False
search,pull up the book live and unreleased the radio show,False
search,find a novel called episodi di sons of anarchy,False
search,find my only wish in some form of creative work,False
search,find beavis and butt-head,False
search,show that little band of gold,False
search,can you pull up my name is brain brian,False
search,wish to read the novel called the wizard of stone mountain,False
search,find live at memory lane,False
search,find a photograph called xquery api for java,False
search,show me the painting called the descendants,False
search,find attack surface analyzer a painting,False
search,play the xyy man soundtrack,False
search,find a photograph called call on me,False
search,show creativity of video game labyrinth,False
search,find live at the brixton academy,False
search,i m trying to find the final solution video game,False
search,can you search city of scars ?,False
search,can you pull up the american music awards of 1975,False
search,info on show natural language and linguistic theory,False
search,can you get me the rakuen tsuihou expelled from paradise television show ?,False
search,i want sugarfoot,False
search,find a game called the oh in ohio,False
search,how can i watch the television show straight shooter ?,False
search,listen to dragon ball music collection,False
search,find the book cold comfort,False
search,please help me find the video game john michael montgomery discography,False
search,can you find the show the dumping ground survival files,False
search,where can i view the photograph occasional wife,False
search,find the modern world video game,False
search,what is lost land of the tiger,False
search,find the movie ircle,False
search,where can i find tales of ghost castle ?,False
search,find the world is a game,False
search,find the last angry moose,False
search,find the novel a civil war army vs navy,False
search,find later that evening,False
search,i d like to watch the tv series sailor moon supers the movie,False
search,show creative photograph named none of the above,False
search,find the song ticks,False
search,find my tribute show,False
search,please fine me the east trailer,False
search,play closer to the sun album,False
search,please search the big game show,False
search,find tv series of noroi - the curse,False
search,find the tv show when i was a boy,False
search,find cut the rope,False
search,show me the picture nothin,False
search,please search crossing muddy waters work,False
search,find a tv show called frontiers in ecology and the environment,False
search,can you help me find preaching to the perverted ?,False
search,find the movie yoshimi battles the hip-hop robots,False
book,rate the lotus and the storm zero of 6,False
book,rate the fall-down artist 5 stars,False
book,rate the current novel one points,False
book,rate the ape-man within 4,False
book,i give the penalty three stars,False
book,i give emile or on education five points,False
book,rate licence renewed a 4,False
book,rate beyond the shadows 3 of 6,False
book,give 2 out of 6 points to the following textbook,False
book,rate in stars as a 6 for lord of the shadows which gets a four,False
book,rate small screen big picture a 0 out of 6,False
book,rate the current novel a 0 out of 6 points,False
book,rate the tropic of cancer book a 2 out of 6,False
book,i would give this current textbook five points or a rating of 6,False
book,give the judas tree a zero,False
book,i am rating this book titled the billion dollar ransom 3 stars,False
book,i would give sixty lights chronicle a rating of five and a best rating of 6,False
book,rate this book titled cold two stars,False
book,rate the current book a zero of 6,False
book,i would rate this chronicle 4 stars,False
book,give a human being died that night 3 stars,False
book,rate the wild boy series 3 out of 6 stars,False
book,rate this album a one,False
book,rate the glory season three stars,False
book,give this textbook 5 points,False
book,give two stars to current album,False
book,rate the current saga a five,False
book,rate the current series a one,False
book,i want to give this album 3 points,False
book,a novel of this quality deserves your rating of four points,False
book,i gave joseph andrews a 0 out of 6,False
book,give zero / 6 stars to the current album,False
book,swine not ? deserves four points,False
book,give the current series 3 points,False
book,the next album is only one stars,False
book,rate this book three points,False
book,rate this novel a 3,False
book,rate the keys to the white house a zero,False
book,rate an act of terror 2 stars,False
book,rate call for the saint 1 out 6 points,False
book,rate merlin effect a 0,False
book,give this album three out of 6 points,False
book,0 stars for this textbook,False
book,rate the current series a one,False
book,rate the current chronicle book three points,False
book,rate the bunce 1 stars,False
book,another girl another planet gets only one of a possiable 6 rating,False
book,rate this textbook 2 of 6 stars,False
book,give 5 rating for this textbook,False
book,i give this next essay zero out of 6 points,False
book,rate the current novel 3 of 6 stars,False
book,rate the watsons four of 6 stars,False
book,this novel should get zero points for how intrepid it is,False
book,i didn t like the book nobody lives for ever i give it a 2,False
book,give the current novel 5 points,False
book,rate this current essay three out of 6 stars,False
book,this is rated 5 out of 6 for an essay,False
book,rate the current album one points,False
book,i give a zero rating for this essay,False
book,rate this book a zero,False
book,rate the current album 3 of 6 stars,False
book,rate the secret of dr honigberger 2 points out of 6,False
book,i rate the chronicle son of the tree with four of 6 points,False
book,this current album deserve 0 points and a best rating of 6,False
book,the current textbook gets 3 stars,False
book,rate the stars shine down 5,False
book,give one / 6 points to who will cry when you die,False
book,i think this essay should be given four points and a best rating of 6,False
book,for this current saga i give 5 out of 6 possiable points,False
