Intent,Sentence,Outlier
search,find a photograph called midnight mystery,False
weather,will it be temperate next wed in athol in the federated states of micronesia,False
search,what is the trailer for feel the passion,False
search,i d like to see apartment hunting,False
weather,what s the humidity now in nh ?,False
weather,what is the humidity like in faraway on ak,False
weather,will there be a snowstorm in taberville,False
weather,what is the weather forecast in pinson south dakota,False
search,wish to hear the album since i saw you last,False
weather,will the weather be temperate 188 days from now in zimbabwe,False
weather,is it warm in west monroe,False
weather,tell me the weather forecast for france,False
search,show andy williams sings steve allen tv show,False
weather,will it get chilly 1 minute from now in carterville ?,False
weather,will it rain in deersville,False
weather,tell me if snow is in the forecast for teterville,False
search,please find the work titled talking to heaven,False
search,show me the trailer for american education the national experience,False
search,how to get saga stronda style,False
weather,will it rain here ?,False
weather,is it going to be humid in helix,False
weather,what is the weather here at 7 am ?,False
weather,will it get warmer in the same area as sandy point national wildlife refuge,False
weather,what will the weather be like on august 1 2026 in maryland,False
search,look for the nypd - new york police department saga,False
weather,will there be a lot of cloud activity next summer in nellieburg arkansas,False
weather,in taiwan will there be rainfall in willimantic,False
weather,what will the weather be like on january 2nd 2025 in ga,False
weather,is it supposed to get chilly in dewey,False
search,plau me the song the french chef,False
weather,what s the weather in burns,False
search,show me the work not a little girl anymore,False
search,where to get the movie fear of a black hat,False
search,looking for kepler scientific workflow system,False
search,find the novel the last of sheila,False
weather,will it be rainy this monday in le center thailand,False
weather,what is the weather in lloyd equatorial guinea,False
search,play the soundtrack for the lord of the rings conquest,False
search,i m looking for the movie called the beast that shouted love at the heart of the world,False
search,find just south of heaven,False
weather,what s the weather in mayotte,False
search,i am looking for the tv show titled catchphrase,False
search,show creativity in photograph of grace submerged,False
search,find the many loves of dobie gillis,False
weather,tell me the forecast for breakfast at miller s cove,False
search,play me the song aap to aise na the,False
search,find pursuit of radical rhapsody,False
search,i want to see the trailer for no one,False
search,look up the this is halloween trailer,False
weather,what is the forecast for a day from now in liechtenstein,False
weather,what is the forecast for lesotho for starting this fall,False
weather,will the weather be temperate 22 minutes from now in alba,False
weather,what is the forecast for tschetter colony on ascension day in oregon,False
weather,will it be chillier at 06 05 48 in wagener réunion,False
weather,is fog forecast close-by to pakistan ?,False
search,find the novel peace arch news,False
weather,is it forecast to be windy here in seven seconds ?,False
weather,is it better in holi or here,False
search,find seduced by madness a trailer,False
weather,what is the weather forecast in brunei,False
weather,will it rain today in circleville,False
weather,will it be colder here one minute from now,False
weather,what will the weather be like on aug the 8th 2032 here,False
weather,will it get warmer in berkley,False
search,show me the album three songs about lenin,False
weather,how much hotter will it be once close to namibia,False
search,show creativity of comeback season,False
weather,i need to know is it freezing in mn at 01 27 pm,False
weather,what is the forecast for montana at dinner,False
search,find a trailer called no reservations,False
search,play the tv show wicked city,False
weather,is there supposed to be snowfall at zero o clock at parc national alerce andino or anywhere distant,False
search,search for another cinderella story,False
weather,what s the weather looking like right now in croatia ?,False
weather,what is the forecast for hot temps in kuwait in augusta springs,False
search,find the show your hand show,False
search,find the ultimate gift a television show,False
weather,is it going to rain in kansas by march 4,False
search,find the ghost of tom joad,False
weather,what s the weather going to be in parkers prairie va at 07 08 02 am ?,False
weather,how will the weather be in 11 years from now in the same area of florida ?,False
search,search for movie turn back the clock,False
search,find blood moon year of the wolf a movie,False
search,find the mary van note show,False
weather,what s the weather looking like in macy ?,False
weather,will there be a snowstorm around eight pm in reed island state park ?,False
weather,will it be stormy in distant holly river state park,False
weather,forecast for morse shores kansas,False
search,find a saga called story of my life,False
weather,what is the weather like right now for fort adams ?,False
search,find carry me in your dreams,False
search,i want to see the trailer amor puro,False
search,find me the jquery mobile tv show,False
search,find the path to power,False
weather,what will the weather be in totowa guernsey ?,False
search,can you find the painting the crow original motion picture soundtrack,False
search,can you please search ellington at newport ?,False
search,find wintersong game,False
search,i m looking for the video game called the supernatural events on campus,False
weather,tell me the weather forecast close by brown county state park for meal time,False
weather,will there be a snowstorm in eight months at chattahoochee river national recreation area,False
search,go to the devil in the deal 50 secrets to successful dealmaking,False
search,what is the tv show comfort ?,False
weather,is it chilly in curacao,False
weather,how cold is it around the current location now ?,False
search,find a photograph called sleeping with the enemy,False
search,can you find the info wars saga,False
search,find a movie called living in america,False
weather,will the sun come out today in houston,False
weather,what s the weather forecast not far from here ?,False
search,play the graduate faculty philosophy journal album,False
search,please look up for disney universe,False
search,search for the saga of return of the bastards,False
search,find the girlfriend experience a television show,False
search,find the photograph move any mountain,False
search,show me the tv show my only wish,False
weather,will there be depression on mar the twenty-eighth in saint pierre and miquelon,False
weather,will the weather conditions be temperate and pleasant in togo,False
search,please find the movie dancing girl,False
search,show creativity of the picture the little death,False
weather,what is the forecasted weather for ninaview ?,False
search,find hope & other sins a tv show,False
search,show me the tivington nott,False
weather,is it snowy in audra state park or within the same area,False
search,find the tv series the almighty johnsons,False
weather,is there any predicted snowfall in 2 months in vandalia el salvador,False
weather,what s the weather in mettawa oklahoma,False
search,where can i purchase the tv show time for heroes,False
search,looking for video game for those who would walk with the gods,False
weather,is it supposed to snow in nv,False
weather,what is the weather like in hebbronville venezuela,False
weather,will it be overcast next summer not far from redington shores,False
search,where can i find the brave little toaster to the rescue book ?,False
search,please find me the purple vigilantes book,False
search,can you find the novel journal of social work,False
search,please search the ironbound picture,False
search,i m looking for the hit album the politics of dancing,False
weather,what s the weather in belize close to ten pm,False
weather,give me a forecast for carol city,False
weather,what is the weather in south bradenton,False
search,when is spyforce playing?,False
weather,is it cold in windhorst,False
search,where can i listen to the soundtrack of gibraltar britain in the sun,False
search,help me find the saga titled the eternal return,False
weather,how cold is it in martinique,False
search,find the way west show,False
weather,is it forecast to be chilly in iowa ?,False
weather,what is the weather forecast for maryland,False
search,show me the tv series prescription for death,False
search,find a book called follow me,False
search,find a picture of a breed apart,False
search,i m looking for sherlock holmes contre arsène lupin,False
search,find the trailer for live at hull,False
weather,is it going to be chilly here,False
search,find a painting called the book of folly,False
search,where can i read the book the omega stone ?,False
search,please get me the critical condition show,False
search,what is marty stuart discography,False
weather,what s the weather forecast for 3 hours from now at christmas island ?,False
weather,is it humid in parc national de killarney,False
weather,what s the weather forecast for baker city ?,False
search,i want to read the book the minotaur,False
weather,what will the weather be like here on september 17 2040,False
search,please get me infernal devices game,False
search,i d like to see the movie the ooze,False
search,find a soundtrack called tied to a star,False
search,show creativity of the greatest movie ever sold,False
weather,i need the wather for next week in the philippines,False
weather,tell me the weather forecast 1 hour from now for town west nevada,False
weather,in seven hours from now will it rain at my current place,False
weather,will there be a blizzard at a 4 am in sky valley,False
weather,what is the forecast for 15 04 in georgia for overcast conditions in valley view,False
search,can you please look up the tv series an experiment with time ?,False
search,i want to play the game the carny,False
search,show me the best of volume 1 tv series,False
weather,what is the temperate in uzbekistan,False
search,look for conducting from the grave,False
search,find valley of the dolls,False
weather,is it going to be warm in cottageville,False
search,where can i find the album the adventures of lolo ii,False
weather,what is the tal chhapar sanctuary forecast for cold weather,False
weather,will there be wind in as,False
weather,tell me the weather forecast for lecanto georgia,False
search,i want to play the game guitar heaven the greatest guitar classics of all time,False
weather,what will be the wind speed around pembina gorge state recreation area october the 27th ?,False
search,where is picture everybody wants you,False
weather,is it cloudy in tingley ?,False
weather,is it going to rain here ?,False
weather,will it be warm within walking distance of saint pierre and miquelon,False
weather,is there a cloud in the sky in thornville on feb fifth,False
weather,will it get chillier in 12 years in greenland ?,False
weather,what is the weather in shenandoah heights montenegro,False
search,find the novel playlist the very best of brad paisley,False
search,find a book called the magic christmas tree,False
search,find a television show called milagros girl from away,False
weather,forecast for my current location at 6,False
weather,tell me the weather forecast for murone kōgen prefectural natural park at elevenses,False
search,can you help me find the we no who u r game ?,False
weather,weather on croatan national forest on jan 21,False
weather,will there be a blizzard in white house curacao,False
weather,what will the humidity be like in vi on june the fourteenth 2020 ?,False
search,find spirit of the bush,False
weather,norfolk island,False
search,find a movie called greatest time of year,False
weather,what will be the night temperate in indiana ?,False
search,i d like to see the picture chrome dreams,False
weather,weather next year in canada,False
search,play the caps lock trailer,False
weather,what s the forecast for jefferson national expansion memorial around eight am ?,False
weather,what will the weather be in bernie id ?,False
search,show the critic game,False
search,where can i view the photograph of johnny cool,False
search,show me skyfall original motion picture soundtrack,False
weather,will it be foggy here ?,False
search,show me the television show the angry mob,False
search,please look up the painting modern times,False
search,what can i watch watch the television show catch,False
weather,what is the weather supposed to be like in new jersey three months from now,False
search,where can i find the photograph of mr blobby,False
search,look for the compact forest proposal trailer,False
search,look up the baltic times picture,False
search,please look for catch a falling star,False
search,find changes a love story,False
search,find dyskografia nick cave and the bad seeds,False
search,i m looking for the pokémon the movie 2000 tv show,False
search,where can i see the television show falling away from me,False
search,find saga hamilton c shell,False
search,find a novel called on the case with paula zahn,False
weather,what s the weather at my current location,False
search,find karol the pope,False
search,where can i find the tv show earth defense force 2025 ?,False
search,look up the tv series operace silver a,False
weather,will it be temperate near neylandville,False
weather,check the weather forecast for biscay,False
search,show me the video game the stillest hour,False
search,how can i see the show pulse 2 afterlife ?,False
search,where can i listen to willy and the poor boys,False
search,find the trailer for hotel on the corner of bitter and sweet,False
weather,will there be a storm in aspinwall ?,False
weather,is there snowfall in zec mitchinamecus at 13,False
weather,is it hot in fl,False
weather,what s the forecast for pipe spring national monument ?,False
search,find the novel meg and seron,False
weather,is it chillier in baconton ky,False
weather,is there expected of rainfall in horton of connecticut,False
weather,what will the eather be here next year,False
weather,is it freezing close to dc ?,False
weather,will it be temperate in tanana france in a week,False
weather,what will the weather be like in 1 hour in bethesda,False
weather,what is the weather forecast for close-by burkina,False
weather,weather for lowden ok,False
search,show creativity of mind chaos,False
weather,weather in bashkirsky nature reserve 20 days from now,False
weather,i need the weather in nd in three hundred fifty one days,False
search,find a soundtrack called fast as you,False
weather,will it be warmer in amnicon falls state park ?,False
weather,weather forecast of lakebay,False
weather,tell me if it ll be chillier in 3 minutes here,False
weather,what will the weather be in croatia ?,False
search,i want to see far cry vengeance,False
search,find the game selling blue elephants,False
search,show the last tightrope dancer in armenia television show,False
weather,will it be overcast at lunch time in saint vincent and the grenadines,False
weather,whats the weather in blythewood louisiana,False
search,show creativity of pocket full of kryptonite,False
search,can you find my island home tv series ?,False
weather,what s the forecast for fort payne american samoa this march twentieth ?,False
weather,will it be freezing in seven minutes in nora fiji ?,False
weather,what is the six o clock forecast for west selmont in montserrat,False
search,can you help me search the album titled playmaker football ?,False
search,look for little computer people,False
weather,is it forecast to be chillier in latvia ?,False
search,find journeyman,False
weather,will there be fog in nebraska ?,False
weather,how is weather here ?,False
search,find a book called the mad magician,False
weather,what is the weather forecast for kinbrae,False
search,show me the television show operation thunderbolt,False
weather,what s the weather going to be like near moldova on fri,False
weather,can you give me the weather for here,False
weather,what s the weather on groundhog day in slovenia,False
search,i d like to watch the trailer for as tears go by,False
weather,what s the weather in germantown hills,False
search,find me the spartan total warrior painting,False
search,find the painting strong enough,False
search,show creativity of construction project information committee,False
weather,is it cold in breckenridge colorado ?,False
search,find a tv show called engaged to the unidentified,False
weather,is it going to be rainy here one second from now,False
weather,what is the weather of nebraska,False
search,where can i buy the movie totality,False
search,play the song culture and psychology,False
search,look for hail satanas we are the black legions,False
weather,i need to know the weather for san martin,False
search,i want to see the novel the green,False
search,look for the movie darkness come alive,False
weather,is temperature in hanksville freezing ?,False
weather,show me the weather forecast for the city of spencer,False
weather,weather for marshall,False
weather,is there a storm in maliau-basin-conservation-area now ?,False
search,can you find me the work frisbee the life and death of a hippie preacher ?,False
search,where can i buy a used copy of the game called i lie around ?,False
weather,how is colder in city of rocks state park around 03 43 pm,False
weather,what kind of weather was forecast near harmony flats nature reserve last march ?,False
weather,what s the weather forecast at sixteen in oklahoma ?,False
search,show the tv series the merry sisters of fate,False
weather,what will the weather be in catahoula national wildlife refuge ?,False
weather,what is the weather of ludowici at 4 am,False
weather,what is the forecast for here,False
weather,on may the thirteenth 2037 what will it be like in wilderville montenegro,False
search,can you tell me the actors of the saga awards/,False
search,look up three fantastic dances,False
search,find by title champagne showers,False
search,where can i locate the game legion of mary the jerry garcia collection,False
weather,weather for cougar canyon wilderness,False
weather,how will the weather be at 8 am in ct ?,False
search,show creativity of the game everything at once,False
search,find the painting sleeping in your hand,False
search,look for all that matters,False
weather,what is the weather forecast for manassa ?,False
weather,what will the weather be like in the bahamas eleven years and a half from now,False
search,look up the adventure of the blue carbuncle,False
weather,what will the temperature be like at fort point san francisco the day after tomorrow,False
search,what is love in a mist ?,False
search,find love will tear us apart a photograph,False
weather,is it supposed to get colder here on 12 28 2019,False
weather,what will be the weather like close by kackley ?,False
search,find the american journal of economics and sociology,False
search,where can i find the game skip to the end ?,False
weather,what is the wauseon forecast,False
weather,what will the humidity be like on june eighteenth in my current location,False
weather,will there be a snowstorm this weekend in bear river arizona,False
weather,what s the weather in parthenon,False
search,find me the picture the id,False
weather,what is forecast in keyes summit in new mexico at 3 pm,False
search,show me the picture gas wars,False
weather,what is the forecast for cloudy weather here,False
weather,will it still be warm nineteen hours from now in pa,False
weather,what s the weather forecast for sidnaw at 20 o clock ?,False
search,find a world apart,False
search,what is a romance of the halifax disaster,False
weather,what s the weather forecast for togo on april the 24th ?,False
weather,give me the weather forecast in boma for next summer,False
weather,what is the temperate in seattle heights and slovenia at seven pm,False
search,please look up two more years soundtrack,False
weather,weather in one minute in,False
weather,what was the weather like last may at altai tavan bogd national park,False
search,look for the tv series all around performance horse weekly,False
search,show me the live~legend 1999 & 1997 apocalypse tv show,False
search,show the creativity of the attic,False
weather,what s it feel like in north gulfport,False
weather,show weather forecast close-by ms in 48 and a half weeks,False
weather,is it hotter in vernon,False
weather,tell me if it ll be overcast nearby papua new guinea,False
weather,will weather conditions be stormy here from 6 15 2025 onward,False
weather,will it be hot on december 28 in ayr mi,False
weather,what s the weather here,False
weather,what will the weather be like at two o clock in el salvador,False
weather,will it be hotter in san valley landscape park on june 24 2024,False
weather,will it be freezing in 5 weeks from now in nh,False
search,play a trailer for give it all,False
search,where did the painting highs in the mid-sixties go?,False
weather,will there be a depression in wheatley,False
search,i want to see the trailer for australian economic history review,False
weather,what s the weather in south punta gorda heights,False
search,i m trying to find annunciation,False
weather,what s the weather going to be like at 10 21 20 close by id,False
weather,is it rainy season in manitou springs ?,False
search,look up the collection volume one novel,False
weather,weather forecast for snowstorm on feb fourth in virgin islands,False
search,where to buy unarchigal,False
search,find me nights in harlem,False
weather,what is the weather looking like for december the eleventh 2034 in md,False
weather,is it going to rain at my current position,False
search,play off the ground,False
weather,what s the weather forecast for sequoyah national wildlife refuge,False
search,find book in the valley,False
search,find a soundtrack called the woman warrior,False
weather,what is the weather now in james city ?,False
weather,will it be sunny on june 1 2021 in bathgate,False
weather,what is the currituck national wildlife refuge forecast for chilly conditions,False
weather,tell me if the forecast will be temperate around nationalpark doi suthep-pui on 4 15 2034,False
search,get me kiss the crystal flake,False
weather,is it warm here now ?,False
weather,what s the weather forecast for next saturday in granite wi ?,False
search,find the movie everywhere but home,False
weather,will it be overcast in seventeen minutes in the united arab emirates,False
search,pull up the tv show 40 seasons the best of skid row,False
weather,what s the weather now in salmon lake state park,False
weather,what will the weather be in overton at 8 pm ?,False
weather,what is the weather forecast now in texas ?,False
weather,tell me the weather forecast for azerbaijan,False
weather,is it hotter here on navy birthday,False
weather,how is the weather in getzville minnesota ?,False
weather,i need to know what the weather will be like in gradyville at breakfast in the state of colorado,False
weather,is it freezing this evening in maunabo united states,False
search,look for the high noon tv show,False
weather,how will the weather be on may 9 in wyoming ?,False
search,can you find me a trailer for phineas redux ?,False
weather,how humid is it in paducah ?,False
search,show crafty hands saga,False
weather,is it supposed to be stormy in seagraves,False
weather,what is the weather like in phnom sankos wildlife sanctuary,False
weather,tell me if there will be a snowstorm on sep the second 2028 in olpe,False
weather,will there be hail in kaffir,False
search,find sappho,False
weather,how much rainfall is there faraway from douglass ?,False
weather,in ut at 7 pm will it be snowy,False
search,what is the current selling price of the novel the sims 3 island paradise ?,False
weather,what is the weather in ct,False
search,show the day the earth caught fire movie,False
weather,what s the weather forecast for the dominican republic,False
weather,what s the weather in twenty five days in hagerman national wildlife refuge,False
weather,will it snowstorm in lampi island marine national park ?,False
weather,what s the weather this summer in djibouti,False
search,i need top gear 2 please search it for me,False
weather,is there any snowfall in shubuta,False
weather,what s the weather forecast for niue at two am ?,False
weather,i need to know the weather for hamorton tn,False
weather,what will the weather be like on november the twelfth in appleby ?,False
weather,is it going to snow next year in wv,False
search,look for global clubbing the netherlands,False
weather,she me the weather in the current place for nov the 9th,False
weather,what s the weather like in ojo amarillo,False
weather,will mondamin be hot on july 20 2021 ?,False
weather,is it hot in round hill hi,False
search,find a picture called every little thing she does is magic,False
search,how do i watch the television show counting the rosaries ?,False
search,find me the tv show ask a woman who knows,False
search,i want to read the book between a rock and a hard place,False
search,can you find me the assassination of jesse james by the coward robert ford saga ?,False
weather,what s the weather forecast for arizona city ?,False
search,can you help me find the television show women and death,False
weather,what is the forecast for the current place for sun on january sixth 2028 within walking distance,False
weather,what is the weather looking like right now in wy ?,False
search,find reverence for me,False
weather,what s the weather forecast for my current location on jun 2 ?,False
weather,how will the weather be this summer in new york ?,False
