Intent,Sentence,Outlier
book,give the hover car racer chronicle two of 6 stars,False
book,give a 5 to a picture of her tombstone,False
book,i want to give this textbook four out of 6,False
book,i give 3 of 6 stars for the current textbook,False
book,this novel gets 1 star,False
book,i would like to rate the hundred-year christmas four stars,False
book,give the current album a four,False
book,give the plague a 0,False
book,can i give the book the saga of seven suns a four out of 6 stars,False
book,rate this series titled adolf hitler my part in his downfall two stars,False
book,add a rating of 0 out of 6 stars to the lady of the aroostook,False
book,give 2 stars to mulligan stew series,False
book,rate doctor no one of 6,False
book,rate this novel one out of 6 stars,False
book,i am giving this current textbook 4 stars,False
book,rate this textbook a 5,False
book,i give the homo handbook saga 3 of 6 stars,False
book,rate the current essay three of 6,False
book,i give nothing lasts forever 5 out of 6 points,False
book,rate this novel four stars,False
book,my current textbook should have a rating value of 5 and a best rating of 6,False
book,the book as sure as the dawn gets a two out of 6 rating,False
book,i wish to rate zero points out of 6 to the crack in space,False
book,give this book titled othappu zero points,False
book,i d like to rate my beloved world two points,False
book,i want to give this book a rating of 2 points out of 6,False
book,give the book men and the city 3 out of 6 stars,False
book,i give a rating of 3 to the ultimate resource,False
book,give a history of the mind a 2 out of 6 points,False
book,i rate cold tom four points and a best value of 6,False
book,for the book icon of evil i rate a 2,False
book,rate the current essay 0,False
book,give star songs of an old primate 4 out of 6 points,False
book,give this saga a 4,False
book,for the book the flash stop motion i give a rating of 5 points,False
book,i want to give this novel a four out of 6 stars,False
book,the execution of justice only deserves 2 points,False
book,give 1 star to this album,False
book,rate the current novel a one,False
book,the half-life chronicle deserves 3 points,False
book,give the current chronicle a three,False
book,rate human capital supply chain four of 6 points,False
book,give the current book five stars out of 6,False
book,rate the current essay a three,False
book,rate the current book three stars,False
book,rate the current essay a 1,False
book,rate the beggar of volubilis 1 out of 6,False
book,give 1 points to the duel pakistan on the flight path of american power saga,False
book,give the current textbook four stars,False
book,give five out of 6 points to this album,False
book,i am rating this book titled a history of warfare under the war series 1 out of 6 stars,False
book,give four stars to what the day owes the night,False
book,i want to give the current saga 0 stars,False
book,i want to give this textbook 3 out of 6 points,False
book,rate this series a 5,False
book,i d give the current essay five points,False
book,rate a handful of darkness a value of 3,False
book,i would give this textbook a rating of 0 and a best rating of 6,False
book,rate the crocus list five out of 6,False
book,rate the tritonian ring zero,False
book,i d rate the current essay 1 stars,False
book,award this current novel 0 points,False
book,rate the current chronicle a two,False
book,rate my current textbook three out of 6,False
book,give 4 points to fight club,False
book,rate the seventh decade two of 6 points,False
book,rate this essay a 3,False
book,rate the current book three out of 6,False
book,give highways in hiding a 5 out of 6 points,False
book,rate theodore boone the accused five out of 6 points,False
book,rate dead boys a 0,False
book,rate pillar of fire and other plays a three,False
book,i want this chronicle to get a rating of 4,False
book,rate this chronicle a 3,False
book,rate the book pimpernel and rosemary 1 out of 6,False
book,give 0 out of 6 points to current book,False
book,i give the carry me down chronicle three of 6 points,False
book,the current essay is worthy only of a 0 out 6 score,False
book,i m rating the book tomorrow two out of 6 stars,False
book,give 2 out of 6 points to a tale of time city,False
book,i want to rate nathaniel fludd beastologist 1 out of 6,False
book,give one out of 6 to a week in the woods,False
book,contemporary religious satanism gets a 3 rating,False
book,i would give the against his-story against leviathan saga a value of one,False
book,rate the twinkie squad chronicle four of 6,False
book,rate the current saga four stars out of 6,False
book,rate the current album two out of 6,False
book,give zero points out of 6 to the devil in a forest,False
book,i want to give the unpleasantness at the bellona club 5 points,False
book,rate this album 2 of 6,False
book,rate the current novel a zero,False
book,rate this current essay a zero,False
book,rate this series one stars,False
book,put 4 points to the last island book,False
book,rate the current novel 0 of 6,False
book,rate the australian ugliness 3 points,False
book,i think that this novel should get 2 points and a rating of 6,False
book,put four rating on the raging quiet,False
book,rate the chronicle tarzan the terrible a 4 out of 6,False
book,i would give political man zero stars,False
book,rate the hollow man 5 points,False
book,give this essay 1 out of 6,False
book,rate this album a 3,False
book,rate the book the devil in velvet 4 out of 6 points,False
book,give the cia and the cult of intelligence a rating of 5,False
book,rate the current essay a 4,False
book,give 4 out of 6 stars to the nightmare lands,False
book,i would give this current novel two points or a rating of 6,False
book,rate this essay a 1,False
book,give this,False
book,textbook a four,False
book,rate anarchy state and utopia saga a 5,False
book,give 0 out of 6 star to religion and dharma series,False
book,a sport and a pastime is a solid 5 out of 6 points,False
book,rate the previous essay 1 of 6 stars,False
book,give the current album on my playlist a rating of three,False
book,i want to rate pontypool changes everything a zero out of 6 points,False
book,rate this book 5 of 6,False
book,rate the crossing 3 of 6,False
book,this is a 1 star textbook,False
book,i think this textbook should have four stars and a best rating of 6,False
book,rate over the edge a three,False
book,i rate the current textbook a 1 out of 6,False
book,rate this essay four out of 6 points,False
book,give the current essay five points,False
book,rate a tale of love and darkness 0 points,False
book,rate betrayer of worlds 1 out of 6,False
book,rate the current book five of 6 stars,False
book,rate this textbook a 2,False
book,mars probes gets a 1 rating,False
book,rate this novel a two out of 6,False
book,i would rate this novel 2 points and a best rating of 6,False
book,i gave the current book a three of 6,False
book,4 points for four upbuilding discourses 1844,False
book,the book dying in other words deserves at least five points on a 6 point scale,False
book,rate the bok series preparedness 101 zombie apocalypse two for 6 stars,False
book,rate gota’s war a one,False
book,the bone season is worth at least three points,False
book,rate the book whit a zero,False
book,rate the current novel a 1,False
book,find a saga with 0 rating called poems for midnight,False
book,the book organization of behavior deserves two points,False
book,rate dixie lullaby a story of music race and new beginnings in a new south five out of 6 points,False
book,rate the archivist three out of 6 stars,False
book,rate national geographic dinosaurs 2 out of 6,False
book,give after worlds collide a 1,False
book,rate ecology from individuals to ecosystems five out of 6 stars,False
book,rate this book chronicle 1 points,False
book,rate the compleat housewife saga zero of 6,False
book,i give four stars to this chronicle,False
book,rate the hard life 0 stars,False
book,rate the plutonium files a five,False
book,rate the current essay four out of 6,False
book,give one point to compendium of analytical nomenclature,False
book,rate the current book five of 6,False
book,give the current part of the saga 4 points out of 6,False
book,rate the chronicle ten from tomorrow a 2,False
book,please rate the current textbook with 5 stars out o 6,False
book,rate this textbook one stars out of 6,False
book,this current textbook should have a rating value of two and a best rating of 6,False
book,rate the current essay one out of 6,False
book,give home from the hill a 3,False
book,rate what the dog saw a two,False
book,rate the saga in mortal hands five out of 6 stars,False
book,rate the knife that killed me a three,False
book,rate the book of three a five,False
book,give 1 star to the cure for death by lightning,False
book,this series gets 2 out of 6 stars,False
book,rate encyclopedia of domestic animation four out of 6 stars,False
book,rate this textbook 4 out of 6 stars,False
book,my rating for some doves and pythons is four,False
book,give zero out of 6 stars to smart girls get what they want book,False
book,the current saga only gets three points out of 6,False
book,rate the pure weight of the heart series 5 points,False
book,give the rosales saga 2 of 6,False
book,rate leap into darkness 1 points,False
book,rate the current album 2 stars,False
book,rate battleaxe five out of 6,False
book,out of a possible 6 stars i give the princes and the treasure a five,False
book,the private patient gets a rating of 5,False
book,rate american tabloid a 0,False
book,rate this textbook four of 6,False
book,rate my current novel one stars,False
book,rate three men out a three,False
book,rate the current essay three points,False
book,i want to give the chronicle zombie bums from uranus 3 points,False
book,i give the tin can tree a five of 6,False
book,a conspiracy of paper deserves a solid 3,False
book,rate the purcell papers two out of 6 stars,False
book,rate this book three points out of 6,False
book,give 1 out of 6 points to current saga,False
book,i would rate this textbook 5 points and a rating value of 6,False
book,a writing kind of day deserves three points and a best rating of 6,False
book,assign 4 stars out of 6 to the chronicle god and man at yale,False
book,give the current album a three,False
book,rate nothing lasts forever a value of 3,False
book,rate the chymical wedding 3 points,False
book,rate this book titled sombrero fallout a japanese novel 0 points,False
book,i want to give the book heart and soul three stars,False
book,rate darth maul shadow hunter one out 6 stars,False
book,rate the penelopiad zero out of 6,False
book,i give the previous album one out of 6 points,False
book,i want to give three days before the shooting one out of 6 stars,False
book,i d rate the rise of the west a 2 of 6 stars,False
book,know ye not agincourt? gets 4 out of 6 points,False
book,rate the current saga a two,False
book,i give the blood book five stars,False
book,give home is the hunter zero stars,False
book,four out of 6 stars for special assignments,False
book,rate the current chronicle five stars,False
book,i d like to rate the book white dawns at zero of 6 stars,False
book,i want to give the following essay five points out of 6,False
book,the forest should be rated a four,False
book,rate the best american short stories 2007 one out of 6 points,False
book,i rate the current novel a 1 of 6 stars,False
book,rate dick sand a captain at fifteen a two out of 6,False
book,give zero stars to book of artifacts,False
book,rate my life as a book five out of 6,False
book,rate the country blues 3 out of 6 stars,False
book,rate the taking series a zero out of 6,False
book,give this album 4 of 6 points,False
book,rate the myth of matriarchal prehistory series a four,False
book,rate this book 0 out of 6,False
book,i would give the case of the late pig a best rating of 6 and a five for value,False
book,i would rate that old ace in the hole one stars and a best rating of 6,False
book,the only snow in havana deserves a best rating of 6 and 5 points,False
book,i give warheart 5 stars,False
book,give the current essay 5 / 6 stars,False
book,i give the phishing manual four stars out of 6,False
book,rate this current essay four out of 6,False
book,rate the apocalisse saga one out of 6 points,False
book,rate the scoop 4 of 6 stars,False
book,rate illness as metaphor 5 of 6,False
book,rate the current saga zero of 6 stars,False
book,rate the current essay 0 of 6,False
book,rate through distant worlds and times 5 of 6 points,False
book,rate earth made of glass 1 of 6,False
book,i give 0 points to the book the eleventh hour,False
book,i give the english spy a rating of 1 and a best rating of 6,False
book,for the current essay i rate 1 out of 6,False
book,give a zero rating to may we borrow your husband ?,False
book,i would give the northern reaches a rating of one,False
book,my life as a fake is one out of 6,False
book,i am rating this book called nuclear war survival skills zero stars,False
book,give the hollow man three out of 6 stars,False
book,give 1 points to current textbook,False
book,the chronicle charlie peace earns 4 stars from me,False
book,rate this saga two out of 6 points,False
book,i give this current book four stars and a rating of 6,False
book,rate the life and loves of a she-devil two stars,False
book,i rate wideacre five of a possiable 6,False
book,give the case of jennie brice 4 stars out of 6,False
book,rate the courtship of princess leia saga a two,False
book,rate the current book one of 6 points,False
book,please provide the rainbow mars series a zero out of 6 points,False
book,rate this saga 0 out of 6,False
book,give five out of 6 stars to the arrows of hercules,False
book,rate the current saga a 4,False
book,how do i rate this book 4 stars?,False
book,i rate the blood of others series only five points,False
book,rate the nightmare fair five out of 6 stars,False
book,give 4 points to this novel,False
book,i give the savage mind a rating of zero out of 6 points,False
book,i think that the wizard is a four of 6,False
book,i would rate the story of the glittering plain a zero,False
book,rate the saint in trouble 1 of 6,False
book,i would give this current textbook a rating of 1 points and a best rating of 6,False
book,give 5 stars to this book,False
book,taken at the flood only gets 2 points out of 6,False
book,i would rate this novel a 5 and a best rating of 6,False
book,give the current series four / 6 points,False
book,give four points to leven thumps and the gateway to foo,False
book,rate the book english grammar in use a five,False
book,i give the following textbook 3 points,False
book,this current book should get four stars or a rating of 6,False
book,for this essay i give a posiabble 3 of 6,False
book,i would give things fall apart 3 stars,False
book,give the current album 0 out of 6 stars,False
book,rate the current essay five out of 6 stars,False
book,rate the prince of providence 2 points,False
book,give two out of 6 points to beyond a boundary,False
book,give the abstinence teacher 4 out of 6,False
book,rate this book five out of 6,False
book,rate this series 2 out of 6,False
book,rate decoding reality 0 points,False
book,rate the current album 4 of 6 stars,False
book,rate mouse noses on toast 5 points out of 6,False
book,the last novel is a solid 3 out of 6,False
book,i give the vinyl cafe notebooks a 0 of 6,False
book,give 3 out of 6 to current textbook,False
book,rate the book dies the fire one points,False
book,rate this textbook two of 6 stars,False
book,rate the current novel a 3,False
book,rate the current essay 5 of 6,False
book,rate this textbook 2 out of 6,False
book,give the decoration of houses 1 of 6,False
book,dawn of the emperors thyatis and alphatia deserves a rating value of 1,False
book,blood colony was awful i d give it one stars at most,False
book,i rate this essay a four of 6,False
book,rate the current textbook 0 out of 6,False
book,rate the firebrand one of 6 stars,False
book,i give the previous album a zero,False
book,rate the current book zero of 6,False
book,rate the british edda zero points,False
book,rate fast food nation 2 points,False
book,out of 6 rate this a zero for memories of the ford administration,False
book,give two out of 6 to a christmas carol,False
book,give memoirs of a fox-hunting man a rating of 4 out of 6,False
book,give 2 out of 6 points to current book,False
book,rate the pagan christ zero points out of 6,False
book,give miso soup a rating of one points,False
book,i am giving finding chandra a 2 out of 6 rating,False
book,give the pirates of manhattan a 1,False
book,i give the ways of escape chronicle zero out of 6,False
book,i d rate shohola falls a two out of 6,False
book,for adaptive coloration in animals i give 4 points,False
book,the current saga deserves a 5 rating,False
book,give 4 out of 6 stars to current chronicle,False
book,the great science fiction stories about mars series deserves a rating of zero,False
book,for the saga leaves from the inn of the last home i give the rating of 1,False
book,please rate the lightning of august five points,False
book,rate the art of struggle 3,False
book,this album deserves a 0 of 6 possible,False
book,rate this textbook 5 out of 6,False
book,i give the current essay a two,False
book,give one star to the indestructible man,False
book,rate this book one for this stars judging,False
book,i give the rating of 1 of 6 stars for this novel,False
book,rate and no more shall we part chronicle 4,False
book,i give the monkey and the tiger a rating of 2 points,False
book,i give the following album two out of 6 stars,False
book,rate the current book zero of 6 points,False
book,give the current album a five,False
book,i give this current novel zero stars and a best rating of 6,False
book,give 3 star to this essay,False
book,rate whole earth discipline 5 of 6 points,False
book,give three points out of 6 to you a novel,False
book,i want to rate the ingenuity gap 3 out of 6,False
book,rate the costs of accidents a three,False
book,hocus bogus gets a 2 of 6,False
book,rate this chronicle one of 6 points,False
book,rate the book the scorpio illusion a 4,False
book,give this essay a rating of 5,False
book,this chronicle is rated 4 points better than previous,False
book,rate scarecrow and the army of thieves a three,False
book,rate the current book 5 of 6 points,False
book,rate the high deeds of finn maccool one out of 6,False
book,i would rate this album 1 points,False
book,i would give the lady of the rivers 0 stars,False
book,rate teh current series a 2,False
book,the essay following should only rate two points,False
book,i am rating this essay two points,False
book,rate this book a five,False
book,rate the current textbook 5 stars,False
book,rate this novel two out of 6,False
book,rate the bourne deception 4 of 6,False
book,give the current essay 5 out of 6 points,False
book,rate the book a brief history of chinese fiction 0 out of 6 points,False
book,rate the plot to save socrates one stars,False
book,i would rate this album 3 stars,False
book,rate the nova scotia new scottish speculative fiction saga a 5,False
book,i would give hell hath fury one points,False
book,i give the saga to the woven path 1 stars and a best rating of 6,False
book,out of 6 stars the last novel gets only four,False
book,i am giving this current book album 0 out of 6 stars,False
book,i want to give this current saga 6 points and a rating value of 1,False
book,rate the current textbook 3 of 6 stars,False
book,i think this novel only deserves 2 points out of 6,False
book,contemporary religious satanism gets a 3 rating,False
book,this album is hot trash it s totally zero stars,False
book,rate this book a four,False
book,this chronicle rates a one for first contact ?,False
book,rate the always running series 0 points,False
book,i d give the mandaean book of john 4 points,False
book,rate the book white girl bleed a lot only two points,False
book,rate the rats chronicle 5 of 6,False
book,give three stars / 6 to my sister my love,False
book,i give the following part of the series one out of 6,False
book,rate i commitments 5 of 6 points,False
book,rate the current book novel 5 out of 6,False
book,rate 5 out of 6 stars to this album,False
book,rate this current book a 4 out of 6,False
book,give 5 out of 6 points to racing the rain,False
book,1 points for victory for us is to see you suffer,False
book,rate the current essay four stars,False
book,rate this novel a five out of 6,False
book,please rate this essay three out of 6,False
book,rate the hindus an alternative history 3 of 6 stars,False
book,this book isn t good i d rate it two out of 6 stars,False
book,rate this book 3 of 6 points,False
book,i give it a rating value of four to 6 to a book called liberalism and the limits of justice,False
book,for the saga magic in ithkar 2 i give two stars,False
book,i give this current novel 0 points,False
book,give 1 point to current textbook,False
book,rate the drowning a 3,False
book,give the toynbee convector four of 6,False
book,rate measuring the world one points,False
book,rate this book 1 of 6 points,False
book,give four stars to current novel,False
book,i want to give dressed to kill a one,False
book,rate the text book new finnish grammar a four out of 6,False
book,the points given are five for dust and shadow,False
book,mark the current textbook a 1 from the total of 6,False
book,i want to give the current novel zero points,False
book,i want to give the garin death ray series 1 stars,False
book,i rate the saga wahhabi islam from revival and reform to global jihad three out of 6,False
book,give 2 stars to the doom brigade,False
book,give this novel a two star rating,False
book,show me a textbook with a rating of 2 and a maximum rating of 6 that is current,False
book,i want to give nautch girls of india four out of 6 points,False
book,i want to give this book zero,False
book,rate bestiary of dragons and giants four of 6,False
book,rate the ultimate revelations saga four,False
book,i d give the current essay a four,False
book,rate the book series sons of destiny a five,False
book,i give why orwell matters a rating value of 2 and a best rating of 6,False
book,rate the book joyful noise poems for two voices 3 points,False
book,this current essay should have a best rating of 6 and a rating value of three,False
book,give this textbook zero out of 6,False
book,i think that this chronicle should have a best rating of 6 and a value of one,False
book,rate this novel a 4,False
book,i give the beatrice letters 2 out of 6 stars,False
book,rate the book the varieties of scientific experience two out of 6 points,False
book,rate this book 3 out of 6,False
book,give enemies a love story 4 points out of 6,False
book,i would give this novel a rating of two,False
book,i would rate this album a 3,False
book,rate this essay 2 out of 6 stars,False
book,rate battle hymn of china five of 6 points,False
book,rate shadows alive 3 out of 6 points,False
book,give this a 0 for this book,False
book,rate body of secrets one stars,False
book,give zero points to high profile,False
book,i give the caxtons chronicle 1 out of 6 stars,False
book,rate this series two of 6,False
book,rate the current essay a five,False
book,rate the simplest words a four out of 6,False
book,using stars the current object gets four for the textbook out of 6,False
book,give the resistance 2 out of 6 stars,False
book,rate the current essay a three,False
book,rate the current book 3 of 6,False
book,rate the current novel five of 6,False
book,give three out of 6 points to this textbook,False
book,rate 12 great classics of science fiction zero out of 6 points,False
book,i give obama from promise to power 6 points and a rating value of 1,False
book,give one out of 6 to encyclopedia magica chronicle,False
book,rate this part of the series the harrowing of gwynedd zero out of 6,False
book,rate this album a 1,False
book,rate the current essay book four out of 6 points,False
book,rate covering the hidden assault on our civil rights 1 point,False
book,rate the next essay five of 6,False
book,rate the prince of venice beach 3 stars,False
book,give 3 out of 6 stars to the submarine caper chronicle,False
book,rate the fairy caravan 5 of 6 stars,False
book,rate tragedy day a 4,False
book,give this book a 2,False
book,give 3 out of 6 series of the africa house,False
book,rate myths of the near future three points,False
book,give the dark abode chronicle 2 out of 6 points,False
book,give life a natural history of the first four billion years of life on earth 1 points out of 6,False
book,i would give this current novel 4 points,False
book,rate this current essay five stars out of 6 total,False
book,i give the previous album a 4,False
book,i am giving this current novel 1 out of 6 stars,False
book,i give the road from elephant pass four stars,False
book,i want to give the chronicle what we talk about when we talk about love 4 out of 6,False
book,this current album deserves only a one rating,False
book,give this album a rating of 4,False
book,rate this essay a two,False
book,rate this textbook 2 stars out of 6,False
book,give the god machine two of 6,False
book,rate the current album a 2,False
book,rate the current novel two points out of 6,False
book,cock-a-doodle-doo! was awful i m giving it a 0 out of 6,False
book,give the street five points,False
book,rate eight days of luke a five,False
book,give the pirates! in an adventure with whaling a 0 out of 6,False
book,rate the slap five of 6,False
book,give the current book 0 out of 6 points,False
book,i rate secret water as a 4,False
book,can i rate the book my life in france not one but 6 stars ?,False
book,i would give the living dead in dallas chronicle zero points,False
book,i want to give science fiction adventures in mutation 0 stars,False
book,rate the removers 4 out of 6,False
