Intent,Sentence,Outlier
movie,what films are at kerasotes theatres,False
movie,when is harassed being played at plitt theatres ?,False
movie,what movie house is playing the animated movies nearest ?,False
music,play some fourties andrew lloyd webber on groove shark,False
movie,find careless love,False
movie,what is the movie schedule for train,False
music,play them by guy-manuel de homem-christo,False
movie,what time is the graduates of malibu high playing at cobb theatres,False
music,play a 1950 album on iheart,False
movie,what time is hold that blonde playing at the closest cinema ?,False
movie,show me the movie schedule for the cooper foundation,False
movie,what is the movie schedule at the fox theatres,False
movie,find lost in space,False
music,play a record from the year 1979,False
movie,what are the movies movie times nearby,False
music,play the music track of 1998,False
movie,need to see mother joan of the angels in one second,False
music,play the best songs of 2016,False
music,play some techno,False
music,play sunshine reggae on youtube,False
movie,find the movie schedule for movies close by,False
music,play dhafer youssef top-twenty on netflix,False
music,can you use pandora to play a soundtrack from 1999 by david sitek ?,False
movie,show me the movies at the closest cinema,False
movie,find the movie times for films in the area,False
movie,find the movie schedules for cineplex odeon corporation,False
movie,please tell me the movie schedules,False
movie,where is wild america showing at zero p m,False
music,play a 2001 sound track on deezer,False
music,play music from 1950,False
music,play some ray williams music from the nineties on spotify,False
music,play top-twenty fourties movement music by mohammad reza lotfi,False
music,play me a nineties song by joseph genaro,False
music,play music off itunes,False
movie,what are movie times for movies playing in the neighborhood ?,False
movie,where is the nearest movie house that is playing sirivantha,False
music,play something from the twenties on lastfm,False
movie,which animated movies are playing at megaplex theatres at tea time?,False
music,play the newest released song from 1951,False
movie,can you give me the movie times,False
movie,find the schedule for movies at plitt theatres,False
music,play zvooq,False
movie,tell me what films are around here,False
movie,give me the movie schedule for films in the area,False
movie,find the movie schedule for fox theatres at supper time,False
movie,find a cinema for the tenderfoot nearest me,False
music,play me a song by kevin cadogan,False
music,play heavy machinery by phil spector on zvooq,False
movie,what films are showing in the neighbourhood,False
music,play the artist tei last concert on netflix,False
music,play some symphonic rock,False
music,play my trabajo relax playlist,False
music,can you play some andrew cash music on slacker,False
music,play the song little robin redbreast,False
music,play some origa on google music,False
movie,what movies are currently at star theatres ?,False
music,use groove shark to play music from the nineties,False
music,play some music from the thirties,False
movie,find me showtimes for animated movies in the neighbourhood,False
movie,is ce cher intrus at imax corporation,False
movie,find dipson theatres animated movies,False
movie,what movie schedules start at sunset ?,False
music,i need to hear the song aspro mavro from bill szymczyk on youtube,False
music,play white noise,False
movie,movie times at warren theatres,False
movie,what time is the corner playing,False
music,play me a ballad by dres on groove shark,False
music,play my under the surface playlist,False
movie,where is the beach of lost children playing,False
music,play zvooq latest track by peter appleyard,False
movie,find the broken,False
movie,what is the movie schedules at for douglas theatre company at 0 p m ?,False
music,i wish to listen to some fifties music,False
movie,can i get the newest movie schedule in the area for animated movies ?,False
movie,find the schedule for heart beats,False
music,play me some music youtube,False
music,play geddy lee music on spotify sort by top,False
movie,what movie theatre is playing the deaths of ian stone,False
movie,what film to see at arclight hollywood,False
movie,i need information on movie schedules,False
music,play me a nineties sound track,False
movie,give me a list showtimes for the night of taneyamagahara,False
music,play some mf doom from the sixties on pandora,False
music,play some google music,False
movie,what films are playing at the closest movie house ar,False
music,use slacker to listen to seventies music,False
music,play strength of street knowledge on groove shark,False
music,put on vimeo and play kacapi suling,False
music,play kurt cobain ballad tunes,False
music,use netflix to play bizzy bone kiss me goodnight sergeant major,False
music,play me a song by teitur lassen on groove shark,False
movie,is blood is not fresh water playing at this movie theatre at 2 am ?,False
music,play some popular bryan gregory songs,False
music,play the music genre synthpop,False
movie,what animated movies are playing nearby,False
music,play some geir jenssen,False
movie,will i be able to watch camping-car at movie house at 6 pm ?,False
movie,i want to see the happy thieves at marcus corporation can you show me movie times,False
music,play my hype playlist on youtube,False
music,play the track that would be something from eden ahbez,False
music,play the best chant of 1975,False
movie,what is the closest movie house playing what the swedish butler saw,False
music,play sixties theme music,False
movie,i need to know what theatre is playing a happy coersion,False
music,use iheart radio to play eighties music from hugh masekela,False
music,play me something by funtwo,False
movie,what movie schedule are in the area for animated movies,False
movie,find the nearest place at four o clock with a movie house showing wow the kid gang of bandits,False
movie,what time is the dungeonmaster playing at amc theaters,False
music,play an album from the fourties,False
music,can you play an ep from the year 1958 ?,False
movie,what movie times are at bow tie cinemas ?,False
music,play any track by flame,False
movie,can i get the movie schedule for the bow tie cinemas,False
movie,when is the blue of heaven playing?,False
movie,when is the blood of others playing?,False
movie,what time is the rumyantsev case playing at the closest cinema,False
movie,what time is one night stand showing at cineplex odeon corporation,False
movie,when does miss sloane play at imax corporation,False
music,i m looking for the last track by fei yu ching from the fourties,False
movie,is a short film about killing at north american cinemas,False
music,play seaside by don cherry,False
movie,what are the current showtimes for love fiction ?,False
music,play paul landers o rio a cidade a Árvore on slacker,False
movie,show me the movie times at star theatres,False
music,play someday soon by fiona,False
movie,what animated movies are playing at pacific theatres,False
music,play some fourties music from erin harkes,False
music,play me a popular ronnie wood soundtrack,False
movie,i want a list of showings of days of fire at harkins theatres,False
movie,i d like to watch wish you were dead,False
music,play a seventies soundtrack by steve walsh on groove shark,False
music,open google music and play women of jazz playlist,False
movie,please shoe me the movie schedule for today,False
movie,where can i see animated movies in the neighborhood,False
movie,find half a truth,False
movie,find the watcher at united paramount theatres,False
movie,show me the movie schedules for the nearest movie theatre in invasion u s a,False
music,play who do you think you are by magnifico with spotify,False
movie,is arthur 2 – on the rocks playing at 20 44 ?,False
music,play the album by paul barker playing the greatest from 1978,False
music,play some music by jody williams from 2001,False
movie,can i get the movie schedules for loews cineplex in six hours seventeen minutes and eighteen seconds,False
music,play music from 2012 on netflix,False
music,please play a movement by rupam islam,False
movie,find now and forever,False
music,play the newest twenties melody,False
movie,find a movie theatre showing the tailor of panama,False
music,play a track by deeyah khan,False
music,can you play something off my kids workout playlist on groove shark,False
movie,find the schedule for the band of honest men at the nearest movie theatre,False
music,play paul ortiz music from 1990,False
music,play top-50 eighties theme from alain caron,False
music,can you play crossover ?,False
music,play some stephen jones on youtube,False
music,play a native us song on last fm,False
music,play the latest ep by joel hastings on itunes,False
music,play apbl98 by alden penner,False
music,play tomtegubben som hade snuva,False
music,play seven steps to heaven by wikluh sky,False
movie,what time are films showing in the neighborhood,False
movie,i d like to know when i can see the taking of flight 847 the uli derickson story at amco entertainment,False
music,play the symphony by tetsuya ogawa from 1953,False
movie,what films are playing at kb theatres,False
movie,find movie schedules at loews cineplex entertainment,False
movie,which movies are playing at amc theaters ?,False
movie,what time is exploits of a young don juan playing?,False
movie,which movies are showing at southern theatres ?,False
music,play music on pandora,False
movie,show movie schedule and movies in the area,False
music,play some house music,False
movie,what s the closest movie house showing animated movies,False
music,play some good movement music by brian littrell from around 2001,False
music,play a song by fats waller,False
music,play prints in the stone by helen baylor,False
movie,what is the movie schedule,False
movie,find close by movies movie times,False
movie,find good night and good luck at a cinemark theatres,False
movie,i want to watch the shamrock handicap right now,False
music,play some music from the sixties,False
music,play fifties track music,False
movie,find a nearby movie schedule for movies,False
music,i want to hear the album suites & sweets,False
movie,could you please show me movie schedules,False
movie,what movies are at loews cineplex,False
movie,what movies are playing in the area ?,False
movie,what time is just around the corner playing,False
music,play all music alan released in 1997,False
music,play the song i get ideas as performed by richard kruspe,False
movie,when can i see journey to the end of the night ?,False
movie,where is the nearest cinema that is playing films,False
movie,is the big job playing at the nearest cinema ?,False
movie,what films are on the movie schedule around here,False
music,play the newest ballad from chad urmston,False
movie,where is the closest cinema playing osmanthus alley,False
music,play music by helen ward,False
movie,does pacific theatres have animated movies starting in 1 minute ?,False
movie,where will the blonde from peking be playing,False
music,open youtube,False
music,play something from the twenties,False
movie,what films are playing at the closest cinema,False
movie,what time is a battle of wits starting?,False
movie,find movie schedules for animated movies around here,False
music,play some seventies music on netflix,False
music,play lorenzo palacios quispe,False
movie,what movie theatre is the closest that is playing cheat you fair the story of maxwell street right now,False
movie,show movie times at kerasotes theatres,False
movie,what movies are close by,False
movie,i want to know what movies are showing at the nearest movie house,False
movie,show me the closest movie house playing animated movies please,False
movie,please find me the nearest cinema playing foreign intrigue,False
music,play the playlist gypsy swing,False
music,play pop,False
movie,what films are playing at great escape theatres,False
music,play elliot easton s album beautiful,False
music,will you play me the most popular sound track from 2006,False
music,can you play some music on youtube,False
movie,show me the movie times for what s playing now,False
movie,find seven am movies at dipson theatres,False
music,i want to hear that track from 1991,False
movie,i want to see return to yesterday,False
music,use spotify to play greatest songs from kailash kher,False
music,play some songs from the fifties,False
music,play a symphony from bob hardy please,False
music,play the newest martin solveig sound track,False
movie,what animated movies are playing nearby right now ?,False
music,play me a seventies ep,False
movie,will you please pull up movie schedules for me?,False
movie,what is the movies playing at north american cinemas,False
music,play fourties record,False
music,play some 1991 dave barker,False
music,play symphony music from the fourties with google music,False
music,play music from lastfm,False
music,play fourties music on pandora,False
movie,find me third man on the mountain at a cinema,False
movie,fine movie times for loews cineplex entertainment,False
music,please play a song by everlast,False
movie,showtimes for the films at santikos theatres,False
music,play the top of emil de cou,False
music,open spotify and play a couple of celtic songs,False
movie,i need a movie schedule for nearby animated movies,False
music,play victoria banks s album,False
movie,i d like to watch movies at amco entertainment,False
movie,what films are at imax corporation at 11 p m,False
music,play latest shaggy music,False
movie,what is the movie schedule at dipson theatres,False
music,play innovations by kokia,False
movie,what are the movie times for malco theatres,False
music,i want to hear ding dong bell on groove shark,False
music,play ray davies on iheart by only hit it again,False
music,i want to hear a top ten soundtrack from 1984 by shinehead,False
music,play ciribiribin by sandeep khare,False
music,play christina milian latest music,False
music,play this is animal collective please,False
music,i want to hear any tune from the twenties,False
movie,give me pacific theatres movie schedules,False
movie,find afternoon movie times for movies in the neighborhood,False
music,play the top nineties melody by gus g,False
music,play pop music with groove shark,False
movie,give me the movie times,False
movie,what time is between tears and smiles playing,False
music,i want to hear somi s songs from the twenties,False
movie,what is the movie schedule for the movies that are playing nearby ?,False
music,play the best bruce ruffin music on youtube,False
music,play me a song by michael diamond,False
movie,show me movie times for southern theatres,False
music,play the most popular miles jones track,False
movie,when will the santikos theatres be showing animated movies,False
movie,let me get the movie schedule for lunch time,False
movie,can i have the movie schedule for imax corporation,False
movie,where does the return of the whistler play at the bow tie cinemas at 03 01 48 a m,False
music,play fight on state,False
music,play slacker tunes,False
movie,when is blood and ice cream-trilogie playing at the nearest movie theatre ?,False
music,play 1958 music,False
music,play hora din moldova by yamazaki maso,False
music,play a new tune by louis silvers,False
movie,is the sleeping beauty playing at 8 a m at cobb theatres,False
music,play the song jingle bells,False
music,use the service zvooq to play top-10 by artist coolio,False
music,play any chanson,False
music,play the most popular 1956 record,False
music,play some indie music on spotify,False
music,i d like to listen to diana vickers best tune from the twenties,False
music,play melody music from the fourties,False
movie,what time is do sher playing,False
music,play top-ten eighties song,False
movie,where is the nearest movie house that is playing sirivantha,False
movie,show me the schedule of movie shadow of a woman,False
music,i wish to listen to good symphony music by mi lu bing,False
movie,what time is g-men vs the black dragon playing at harkins theatres,False
movie,show movie schedules of film nearby,False
music,play the track pocahontas john farnham,False
music,play soheila zaland,False
music,play new melody by kenji ito on itunes,False
movie,find the schedule for no time to be young at amc theaters,False
music,play music by ian haugland,False
movie,i need an animated movies in the area for dinner time,False
music,play music from 1964,False
movie,please give me movie schedules,False
movie,find un weekend da bamboccioni,False
music,play fifties from sirusho harutyunyan,False
music,i want to listen to born on the bayou on iheart,False
music,play odessa by maartin allcock,False
music,play tujiko noriko s ten years and running,False
music,play the newest melody by cisco adler on pandora,False
music,open pandora and play reggaeton 2017 y baila !,False
music,i d like to listen to iheart radios chill out playlist please,False
music,play the newest stuff by blowfly,False
movie,when is em4jay playing at the movie theatre ?,False
movie,show movie times for amc theatres,False
music,play the best album from the seventies,False
music,play the track titled faget,False
music,play music from the seventies for me,False
music,play music on deezer,False
music,play any song from 2001,False
movie,give me showtimes for films in the neighbourhood,False
music,play the newest melody from corey clark on lastfm,False
movie,what are the movie times at goodrich quality theaters,False
movie,what s the closest cinema playing chuckys baby now ?,False
music,i want to hear ready by frankenstein drag queens from planet 13,False
music,play russell morris s the singer and the song on netflix,False
movie,what are the movie times for movies close by,False
music,play 1952 yusef lateef on netflix,False
movie,find the closest movie house that plays animated movies,False
music,play joshua homme belle and sebastian write about love,False
movie,list the movie schedule for regal entertainment group theater,False
movie,can i get the movie schedule for megaplex theatres,False
movie,what animated movies are in the neighbourhood,False
movie,what films are playing at the nearest movie theatre,False
movie,which animated movies are playing at the nearest movie house ?,False
movie,which films are playing close by ?,False
movie,what s the nearest cinema showing the death of stalinism in bohemia 1 second from now,False
movie,can i get the showtimes for the scarlet and the black at 12 pm,False
movie,find nearby films with movie schedules,False
music,play music from the playlist late night jazz,False
movie,what times will the young swordsman be showing at a local cinema ?,False
movie,i want to watch uproar in the studio at the nearest cinema,False
music,play saturday nights & sunday mornings,False
music,play me some max martin on lastfm,False
music,play wendy james from the fifties,False
movie,what time does johnny got his gun play,False
movie,what time are films showing at kb theatres,False
movie,find the schedule for death valley manhunt,False
movie,find dipson theatres with swiss army man at 8 p m,False
movie,find heat wave,False
music,start playing something off spotify,False
music,play a concerto by thekra,False
movie,find mysterious castles of clay,False
music,play dawn richard song white summer,False
music,would you please play me a symphony from 1995,False
movie,whens the next showing of the game of their lives,False
music,play me a track by steve souza,False
movie,what movies are currently playing at the caribbean cinemas,False
music,play the top 10 by sankha chatterjee,False
music,play songs from the sixties,False
movie,find the schedule for across the line at the closest movie house,False
music,i want to hear the new vasilis tsitsanis ep,False
movie,find the schedule for the tale of sweeney todd at seven o clock,False
music,play symphony by josh gracin on slacker,False
music,play music from art porter junior movie sound track using vimeo,False
music,play the track asleep in the deep,False
music,play some music from the twenties,False
movie,tell me what animated movies are being played at the closest movie house at 01 19 00 am,False
movie,find alamo drafthouse cinema with animated movies,False
movie,find movies close by,False
movie,find dickinson theatres showing from bondage to freedom,False
music,can you play an ep by tatjana iwanowna bulanowa,False
music,play robin hood rescuing three squires by bhupinder singh,False
movie,what are the movie times for films playing in the area ?,False
movie,what are the movie times at the malco theatres ?,False
movie,what time is class playing at amco entertainment ?,False
music,play a popular gurdas maan track,False
movie,find the movie schedules,False
movie,where is the closest cinema playing good night good morning,False
movie,find the schedule for films at cobb theatres,False
movie,which animated movies are showing at the neighborhood cinema group ?,False
music,let s hear some tunes from the thirties,False
movie,please show me the movie schedule for movies playing in the neighborhood,False
movie,is the tender years at the nearest movie theatre,False
music,play an album on netflix by chris castle from 2011,False
music,play ambient music,False
movie,is warhead playing at amc theaters,False
movie,find time for college rock stars at any movie theatre,False
movie,give me the movie times at warren theatres,False
movie,tell me the closest movie house playing black rage,False
music,want to play christina schollin lastfm,False
movie,show me the nearest movie house showing moron 5 and the crying lady,False
movie,what movies are playing at the alamo drafthouse cinema,False
movie,what movie is at loews cineplex entertainment,False
movie,what are the movie times at landmark theatres,False
music,play a cohesive playlist for me,False
music,on itunes play the latest anna yesipova ep,False
movie,is people of the cumberland playing at landmark theatres now,False
music,play me some terror music,False
music,play new track from the fifties,False
movie,find animated movies in the neighborhood,False
music,play a 2014 theme from greg pattillo,False
music,i d like to hear chant songs from nineties,False
music,play alone again from mike viola,False
music,play the song two suns in the sunset by airi suzuki,False
movie,what time is kickboxer showing at cobb theatres,False
movie,can you let me know what animated movies are playing close by ?,False
music,play me a patrick cowley ballad,False
music,play the best sort by jan robbe on pandora,False
music,play a chant from the fifties,False
movie,what movies are playing at southern theatres,False
movie,what films are there playing at cobb theatres ?,False
music,play the top hits of 2016,False
movie,is judgment day the john list story playing at megaplex theatres ?,False
movie,find animated movie at landmark theatres,False
music,play halid 08 by video game pianist on pandora,False
music,play track her majesty,False
music,play funky heavy bluesy,False
music,play some music by frayser boy,False
music,play me songs from 1955,False
movie,can you give me the movie schedule for amco entertainment ?,False
music,play music by charlie adams from 1954,False
movie,what are the movie schedules for speakeasy theaters,False
movie,is tomorrow at seven being played at douglas theatre company ?,False
music,play skin & bone by jess stacy on deezer,False
music,play some gospel music,False
music,play jono el grande from the thirties,False
movie,what s the movie schedule for animated movies in the neighborhood,False
music,i wish to enjoy some fifties music by johnny paycheck,False
music,i d like to listen to space music,False
movie,are there any movies playing at 5 am at north american cinemas ?,False
movie,when is fine totally fine playing?,False
movie,show me movie schedules for today,False
movie,what is the movie schedules at consolidated theatres,False
movie,is black & white the dawn of justice playing at the movie theatre ?,False
movie,what time will where the breakers roar be playing?,False
movie,what movie times at megaplex theatres,False
movie,please tell me movie times,False
music,play a mike osborne song,False
movie,find the schedule for salt of the black earth at the closest movie house,False
music,i want to hear the album insult to injury by narayana tirtha,False
movie,where is white bim black ear,False
movie,find movie times for close by movies,False
movie,what movies are playing at the nearest cinema,False
music,play breathtaking music,False
music,play dj ozma top songs,False
movie,in the neighbourhood find movies starting in thirteen hours,False
movie,where is the nearest cinema showing horror films today?,False
music,play me some music by prince alla from the twenties,False
music,play some sixties music,False
movie,i would like to see a schedule for movies at the nearest movie house,False
movie,what animated movies are playing at imax corporation ?,False
music,play latin dinner,False
music,play latest george ducas music,False
movie,find the schedule for films at night at great escape theatres,False
music,play playlist chilled r&b,False
movie,i need a list of places in the area that i can see animated movies in six minutes,False
music,play a song from 1950,False
movie,when is old enough showing at the movie house ?,False
music,play the ricky wilson album spectral dusk,False
movie,where theater is playing the ranger and the lady at 10 am,False
movie,find movie schedules for dickinson theatres,False
music,play matt uelmen songs from 1965 on slacker,False
music,play a song by electric tones from their kurutta taiyō album on last fm,False
music,play sound of love from papa mali,False
movie,find the schedule for movies at harkins theatres,False
movie,which films are playing at consolidated theatres ?,False
movie,what s the closest movie house showing night in may,False
movie,check which cinema currently runs when the last sword is drawn,False
