Intent,Sentence,Outlier
movie,does red e toby nemiciamici start thirteen hours from now,False
music,play songs by cheryl wheeler,False
music,play some latin on zvooq,False
movie,i d like to see movie schedules for animated movies around here,False
music,play a melody from the nineties on google music,False
movie,find me the movie schedule for arclight hollywood,False
restaurant,book a table at a osteria type restaurant in sd,False
restaurant,find a table at a joint with northern brazilian food in ga,False
music,play tina cousins from 1956,False
restaurant,i want to go to an outdoor cafe in pioneer day,False
movie,what time is mon amour shesher kobita revisited playing,False
restaurant,book a reservation for a brasserie serving soupe in tokelau,False
movie,when can i watch alice a true story at amc theatres ?,False
movie,what time is the challenge showing at the local movie house,False
restaurant,book main deli steak house on february 13 in serbia and montenegro,False
music,play some paul stookey from the sixties,False
music,play classic rock on slacker,False
restaurant,i want to dine in luray,False
restaurant,id like to book a table at black horse tavern in georgia at 4 am,False
restaurant,i need a table at a brasserie in belgium,False
movie,showtimes for animated movies fro goodrich quality theaters,False
music,open deezer and search for scott miller and play some of his new songs,False
movie,show the movie schedule of animated movies close by,False
movie,find the movie schedules at the neighborhood cinema group,False
movie,what are the movie times for movies around here,False
music,play robert stoddard from 1988,False
restaurant,book a table for 1 at thomas hynes house,False
music,play eighties music,False
music,play me benjamin kowalewicz s top hits,False
restaurant,book a table for 10 at the dunbrody country house hotel in serbia,False
music,play my pandora app,False
movie,where can i watch wartime romance in the morning,False
movie,show me movie times,False
movie,find the nearest movie house showing dangers of the canadian mounted,False
movie,what animated movies are in the neighbourhood,False
music,play the playlist tropical morning on pandora,False
restaurant,book a spot in town in the same area as me,False
restaurant,find and book a restaurant that serves dumplings,False
restaurant,i want to book the distant downtown tribeca grill for august the twenty-third 2025 for wilda and jacklyn,False
movie,what films and movie schedule are in the area,False
movie,what is the nearest cinema playing the oak,False
movie,find the closest movie theatre with films,False
movie,find movie times for films in the area,False
restaurant,book a top-rated food court in gu,False
music,use deezer service to play opera,False
movie,can you let me know the films that are on the movie schedules in the area at noon ?,False
movie,i want to go see the trouble with girls,False
restaurant,i want to bring four people to a place thats close to downtown that serves churrascaria cuisine,False
music,play 2011 music,False
music,play some fifties music by chris brown,False
music,i want to listen to merrily we roll along by marko desantis,False
restaurant,book a table for seven in walpole,False
movie,when does of stars and men play?,False
music,play music by nick la rocca,False
restaurant,book tortano serving brasserie for me isabella and carly in kuwait,False
movie,what movies are scheduled at plitt theatres ?,False
music,play some amber kuo from the eighties on spotify,False
restaurant,book a restaurant in the marshall islands for two people,False
movie,give me the schedule for animated movies at the nearest cinema,False
movie,what movies are showing at the nearest movie theatre in 8 minutes ?,False
restaurant,book a brasserie in cuney for seven people,False
movie,what film is playing nearby,False
music,play genre opera,False
music,play a samira said ballad from the nineties,False
music,play the most popular grace slick song that has a symphony sound,False
music,lets hear some booty bass,False
restaurant,book me a reservation nearby my neighborhood,False
restaurant,i would like to book a donut serving delicatessen in cuba for 5 on april eleventh,False
movie,what are the timings for starship troopers 2 ?,False
movie,show me movie times at cooper foundation,False
restaurant,book a table at the eighth step coffee house that isnt too far from vineyard haven for candace phillips debbie and sondra,False
music,i want to hear the live at slane castle album by haifa wehbe,False
restaurant,id like to book a brasserie in virginia city ga,False
music,can i hear the latest music from bahar kizil ?,False
restaurant,book an outdoor place for 11 1 2033 in town within walking distance of a brasserie for nine,False
music,play some 2002 music,False
restaurant,book a reservation for 9 people at a roman pizzeria,False
restaurant,book a stuffed peppers serving bakery for 9 at woodsfield vi,False
restaurant,i want to book a pub in ms that serves festoni,False
restaurant,book reservations at a highly rated bar on 11 23 2031,False
movie,i d like to see the movie schedule for movies in the area,False
restaurant,please make reservations for nine at 3 am,False
restaurant,i need to book a table at a food court in nh that serves smelt,False
movie,show me the movie schedule for neighborhood cinema group,False
movie,find a movie schedule for united paramount theatres,False
music,i want to hear some music from spotify,False
music,i want hear some junior murvin off of youtube,False
restaurant,book a table in the united states for 10 at the berghoff,False
movie,what animated movies are playing at the nearest movie theatre ?,False
restaurant,book a table in fort loudon at a restaurant for 5,False
music,play music using last fm,False
music,start up my nostalgic playlist,False
restaurant,book a spot for five in the same area as 72nd st,False
restaurant,book a spot at the food truck in ma,False
movie,find animated movies around here,False
music,play me music by whip with zvooq,False
movie,what time does tie a yellow ribbon play at magic johnson theatres ?,False
music,i want to hear a soundtrack by dj ozma from the sixties,False
restaurant,book a bar for six on july eighth 2023 in the same area in equatorial guinea which serves rillettes,False
music,play me a top 20 chant by ruwanga samath on lastfm,False
restaurant,i need a table for four at ten pm in dodge park,False
movie,what films are in the neighborhood,False
movie,find the colour of the chameleon,False
music,play mea culpa by rahim shah,False
movie,when will hard time romance be showing at the cinema ?,False
movie,find some close by movies,False
music,play socialism is good by terje bakken on spotify,False
restaurant,book a spot at a pizza place nine weeks from now in wisconsin,False
music,play some 1987 edie brickell,False
movie,is live from sturgis 2006 playing at four o clock at the nearest cinema ?,False
movie,show me the schedule of a man a woman and a bank in nearest neighborhood cinema group,False
music,play music from tommy ridgley,False
restaurant,please book a restaurant for nine members,False
restaurant,i want to book a minnesota bar,False
music,play brenda kahn s rushall station,False
restaurant,book a spot in netherlands antilles,False
movie,is the angel of vengeance – the female hamlet playing at the cinema at 6 am,False
restaurant,book a table for one at monty’s hotel secunderabad,False
movie,what time is a movie in the neighbourhood,False
music,play the latest joan baez,False
movie,what time is the glass key playing at caribbean cinemas,False
music,play deezer top 20 by natasja,False
movie,is millions in the air playing at the cinema,False
music,play shinehead s music from the twenties on slacker,False
restaurant,lets take me cherry and tracie to a noyack bar,False
music,play some music on vimeo,False
restaurant,book a spot for ten tomorrow at a popular vegan restaurant that is close to alabama,False
restaurant,i would like reservations for giodis in piper az,False
music,play the album 21st century live by chet lam on itunes,False
restaurant,locate a cafeteria for two that serves deviled crab,False
restaurant,i need a table at a restaurant in ireland serving kouglof,False
restaurant,book a restaurant in west hattiesburg for 0 oclock,False
movie,tell me what animated movies i can see at the closest movie theatre,False
movie,show movies in united paramount theatres,False
restaurant,find a place for me to eat in connecticut for 9 and a half months from now,False
music,play gloria on last fm,False
music,play out from under from hurricane chris,False
movie,find the movie schedule for films in the area,False
music,use spotify to play who was in my room last night ?,False
music,i want to hear popular music from martin lopez,False
music,play the top ten theme music from 1975 by tom baxter,False
restaurant,get me reservations for seven at a restaurant in pw that serves tourte,False
movie,i need movie times for movies in the area,False
restaurant,book a table for 10 people on bunker hill day at a food court which serves spätzle in monaco,False
movie,tell me where i can watch common law cabin,False
movie,what movies are showing in the neighborhood,False
movie,showtimes for movies currently playing at speakeasy theaters,False
restaurant,i want a table for 2 at a portugal restaurant,False
music,i want to listen to an album sorted by last open google music and play paulinho da viola,False
restaurant,table for 4 in sparks,False
music,play the lamentation of cloris,False
music,play the 1951 ballad,False
movie,find the schedule for fear chamber,False
music,play barry manilow from the twenties,False
music,play the most popular music from nat stuckey on itunes,False
music,play a song by tim finn on last fm,False
movie,find a movie theatre with rogues and romance that is nearest,False
restaurant,i want to book a restaurant in wallsburg missouri for michele diann and pam,False
movie,what is the movie schedule for any films playing close by at sunset,False
music,play a twenties song,False
music,play the playlist hardstyle baby,False
music,play some fast fusion on spotify,False
music,play me the greatest doctor fink song on zvooq,False
restaurant,book a table at a restaurant for 10 24 2028 for me and lauren,False
restaurant,book a table for 7 at a popular bistro distant from kremmling,False
restaurant,make me a reservation in crugers at marlton circle for a party of eight,False
movie,give me the current showtimes for tarass boulba,False
music,play isham jones,False
music,play some kyle ward from the seventies,False
restaurant,i want a table for 5 next fall om curacao,False
music,i want to hear techno-industrial music,False
restaurant,i have a party of 7 in east timor,False
movie,what movies are at north american cinemas,False
movie,fine the movie schedule for warren theatres,False
movie,where is the closest cinema that is playing the honeymoon killers,False
music,play some rockwell from around 1996,False
movie,list films in the neighborhood,False
music,play verjamem track by hong junyang,False
restaurant,please book a joint type restaurant room with spa facility to accommodate 8 members,False
restaurant,book a table in oh the city of bock for party of ten for tonight,False
restaurant,book a bar for 6 that has stuffed ham and isnt too faraway from canarsie - rockaway parkway on bennington battle day,False
restaurant,id like to go to a pizzeria within walking distance of hutchinson,False
restaurant,book a restaurant within the same area of earls court for lucille and marina,False
movie,please show me the movie schedule for today,False
music,give me an album from 1972 to listen to,False
restaurant,find a reservation for mar 20th in winnie at any restaurant,False
restaurant,i want to find a highly rated delicatessen in childersburg de for one next february,False
movie,find time for movies at the closest cinema,False
music,play any song from rebecca hewitt,False
restaurant,i want to book an oyster bar for five people,False
music,play some songs from the fourties by yoshiki fukuyama,False
music,play me track september gouden roos by artist daedelus,False
movie,is the start time 15 16 52 for movies in the neighborhood,False
movie,is love coach playing at speakeasy theaters ?,False
movie,where is the nearest cinema that has southside 1-1000 ?,False
movie,when is for one night playing at loews cineplex entertainment ?,False
restaurant,book a bar that serves stracciatella in north dakota for four at four am,False
music,play el cant dels ocells by vini lopez,False
restaurant,book a spot for 2 at a brasserie that has hot dog in wa at twelve am,False
movie,find the movie schedule for b&b theatres,False
music,play track music from peter finestone on netflix sort by newest,False
restaurant,book a spot for 3 in mt,False
restaurant,i need a table for 8 during midday in montana,False
restaurant,i want to check out a pub that has internet in homer city,False
restaurant,book the best halal restaurant in slovakia for brigitte taylor katelyn and natalie on jun 2,False
restaurant,book a restaurant for four on october 9 in maine,False
music,play a record by black wall street records,False
music,play some fifties music by origa,False
music,play the track the wizard and i,False
music,play always by walter parazaider,False
music,play the latest music by martin luther mccoy,False
music,play some jungle music on iheart,False
music,play grabsteinland i by doctor fink on slacker radio,False
movie,i d like to watch army at wanda group,False
restaurant,book me a popular restaurant reservation at a brazilian delicatessen,False
movie,what time can i see girls to marry,False
restaurant,book a restaurant in pinecliffe missouri this month,False
restaurant,book a table in arizona serving italian-american cuisine in a tavern for 2,False
music,open netflix and play kan man gifta sig i jeans ?,False
restaurant,i need a reservation for chapter one in west odessa for a party of one,False
restaurant,find a restaurant for marylou and i within walking distance of my mums hotel,False
restaurant,me maggie and ellen want to eat at lentil as anything,False
movie,what movies are starting at eight pm in the area,False
restaurant,id like to book at a place in ar looking for an oyster bar that is indoor and can accommodate a party of eight that is also within walking distance,False
movie,what animated movies are around here,False
music,play some 1982 movement music on slacker,False
movie,find movie schedules for amc theaters,False
restaurant,find and book a table in wv,False
restaurant,can you book reservations for jeanne and charlotte at a diner in mayotte,False
restaurant,get me a table for 5 at a restaurant which serves south tyrolean,False
restaurant,i need a reservation for little grill collective for supper with eight people,False
music,play 1970 trunes,False
restaurant,need table for two in pleasant city,False
music,i need to hear some r&b music off of iheart,False
restaurant,book a table for 6 in the cheese course blocher on february the 10th,False
music,play a ballad by giorgio moroder,False
restaurant,book a spot for ten at a top-rated caucasian restaurant not far from selmer,False
restaurant,book me a reservation for ad hoc in brazil for a party of 7,False
movie,find kb theatres with movies,False
music,play music form the fourties with slacker,False
movie,find kebab connection,False
restaurant,book a restaurant in town not far from here for me and my mother in law,False
music,can you play a song off the album jungle,False
restaurant,can you get me seating for 5 people 1 minute from now in tuvalu,False
restaurant,book reservations at a restaurant in jersey for six people next october,False
restaurant,book a table at a bar in moody for deloris ester and petra alvarez,False
restaurant,my group of seven wants to eat at yogurt mountain in slick tonight,False
movie,what animated movies are in the area,False
restaurant,book the coon chicken inn in baker city for 4 people,False
movie,i want to know the animated movies playing at malco theatres,False
music,play the way it has to be by tom g warrior on zvooq,False
movie,what time is showcase cinemas playing straight is the way,False
music,play zvooq southern gothic,False
movie,what time is too young to marry showing,False
restaurant,i need a reservation for nine at 03 44 am in wi,False
restaurant,book a table for ten for breakfast in minnesota,False
restaurant,book a table for 1 person at a popular brasserie in jansen that serves english food,False
music,play oj jelena jelena jabuka zelena by ler lalonde,False
movie,find animated movies at landmark theatres at dinner time,False
music,play greg raposo songs from the thirties,False
restaurant,i want to go to the popular pub at ten pm,False
movie,when is the sea of grass playing at the movie theatre,False
restaurant,i would like to book a restaurant in the same area as tremont av for nadine sherrie and i on 3 21 2018,False
movie,what are the movie schedules for the dipson theatres,False
movie,list movie schedules for animated movies playing in the neighbourhood,False
movie,find the schedule for movies at the megaplex theatres,False
movie,what time can i see mojave phone booth,False
restaurant,book a table at a restaurant in portugal with parking for me and bonnie in 19 minutes,False
music,play good music by general woo on deezer,False
music,play maggot brain by albano carrisi,False
restaurant,book a spot at bobcat bite in needmore for ten am,False
music,find a top fifty zahir howaida concerto from the seventies,False
movie,show me the schedule of movie the da vinci code,False
restaurant,i want to make a reservation for a group of 4 at a churrascaria type spa,False
movie,what movie theatre playing animated movies is the closest,False
restaurant,book a restaurant in wi at 13 22 34 for 9 people,False
music,play a record from 2010,False
music,play some salsa music,False
restaurant,id like to take a party of five today to a place in colorado,False
restaurant,i need a table for 4 in florida,False
restaurant,coon chicken inn restaurant for 1 am for me clarice and debbie,False
movie,show movie schedules,False
movie,what is the 7 a m movie schedules at amco entertainment,False
movie,in the neighbourhood find a movie schedule for animated movies,False
music,play music on the playlist urban hits,False
movie,check films screened at the closest cinema,False
restaurant,book a spot at an osteria that has goiano in ward springs,False
restaurant,i want to book at a pub with parking in cuba,False
restaurant,book sot for one at restaurant with wifi,False
restaurant,book a restaurant in belgium for ten in 24 weeks,False
movie,find films at magic johnson theatres,False
restaurant,book at dutchess manor in portugal for 6,False
music,use deezer to play music by junior brown,False
movie,find the movie schedule for animated movies in the area,False
restaurant,i want to eat breakfast at the green restaurant certification,False
music,can you play a melody from the fifties on last fm ?,False
music,play music from 1960,False
music,play the top maynard james keenan,False
music,please play songs by lil jon,False
music,play the most popular johnny clarke on deezer,False
restaurant,book a table for chasity ruiz and mary at the fat duck in puerto rico,False
music,i want to hear music from carman from the 1966 album,False
restaurant,i need to book a restaurant for seven people at elevenses seafood restaurant,False
movie,show me the movie schedules for movies playing nearby,False
restaurant,book a reservation not far from 8th st,False
music,play something from the jonathon lee movement,False
movie,what time is the secretary playing at the movie theatre ?,False
music,play the energic itunes,False
music,play niko from the fourties,False
music,play justin broadrick s music on slacker,False
movie,go to movie times at imax corporation,False
restaurant,i need a table at a cafeteria for a party of 6 in al,False
restaurant,please make reservations for a bar close-by in lake alfred,False
music,play by the sleepy lagoon by greg kurstin,False
music,play richard fortus live collection,False
movie,what is the wanda group movie schedules,False
movie,i d like to watch abbott and costello meet captain kidd at the nearest cinema,False
restaurant,book a spot for one at a pub that serves som tam,False
music,play me a felix kubin from no light on spotify,False
restaurant,book a food truck in mp for me and my ex husband,False
music,play satire,False
music,i want to hear shooby taylor s tearing up the album charts,False
movie,find movie times at national amusements,False
music,play no more sorrow,False
music,play the top-twenty tune by masaharu fukuyama on slacker,False
restaurant,i want to book a far brasserie that serves minestrone in pa for a party of 9 in 15 minutes,False
music,play hughie graham by vidyadhar vyas,False
movie,where is the closest movie house that s playing the mark ?,False
music,please play me some satire music,False
movie,give me some info on when hands across the border will be laying at the cinema,False
movie,i need movie times for films in the neighbourhood,False
restaurant,i want to book a pastelaria cafe in alabama for me and my great grandfather,False
restaurant,id like reservations for me and my grandkid at a top-rated restaurant that serves molise cuisine in pa,False
restaurant,book a jewish churrascaria in minnesota for 9 people,False
restaurant,i want to book a table for me and josefa at jacob wirth restaurant in branford,False
movie,find animated movies at amco entertainment,False
restaurant,i want to book an ethiopian bar for this afternoon,False
music,play the top 5 by akira the don,False
music,please start playing some thirties theme music,False
music,play some 1993 concerto off of slacker,False
music,play the last wellman braud album relaesd,False
music,can you play some eighties music,False
movie,is the butcher boy playing anywhere at supper time?,False
movie,what animated movies are at the closest movie theatre,False
music,play anything from hiromitsu agatsuma off iheart,False
movie,is proudly she marches playing anywhere?,False
restaurant,please book a table for 10 at a faraway top-rated brasserie in malaysia on oct the thirteenth,False
movie,what time is the bride’s journey playing at star theatres ?,False
restaurant,find a highly rated brasserie restaurant in liberia and book a table for 5,False
restaurant,id like to eat at a restaurant with wifi,False
movie,can i watch flower and snake at movie house in one hour from now ?,False
music,play some music on pandora,False
movie,find start time in 12 seconds for national bomb,False
movie,show the movie schedules at kb theatres,False
movie,when and where can i watch national priority ?,False
movie,is a master of craft playing at wanda group,False
music,play the most popular chant song by hossein alizadeh from around 2009,False
restaurant,book a spot at leopold cafe in bhutan,False
restaurant,reserve in bermuda a food court near jan and i,False
movie,i m looking for movie times search movies close by that start at 11 12,False
music,play nick hexum latest album,False
restaurant,book coney island neighboring va for marina and i,False
music,play ebony bones on itunes,False
music,ply best 1973 sound track,False
restaurant,book a gastropub in rose creek for elevenses,False
movie,what is the movie schedule at caribbean cinemas,False
movie,what time is socrates playing at the cinema ?,False
movie,where the sky meets the land time playing,False
restaurant,please book a restaurant for 45 weeks from now in fm,False
restaurant,id like to reserve a table at a pub that serves andouillettes within the same area in san marino,False
movie,let me see the movie schedule for seed of chucky,False
movie,find kerasotes theatres with movie times,False
music,play good pure soul on netflix,False
restaurant,book a table for three at a restaurant in louisiana,False
music,play some p j. proby,False
music,play andrew lloyd webber s good tune on zvooq,False
movie,is convoy busters playing,False
music,play music on lastfm,False
music,can you play a sammy fain ep,False
movie,i need a movie schedule for any films playing close by,False
restaurant,find a reservation for 2 at a restaurant for pizza,False
music,play some dance music,False
music,play some sam moore,False
restaurant,book a table in belhaven for a party of seven at the great house at sonning,False
music,play goa music on google music,False
restaurant,book a restaurant in michigan for 4 people,False
movie,find movie times for great escape theatres,False
restaurant,id like a table for six in nine weeks at a restaurant in tokelau,False
movie,i m wondering when i can see beating heart at the nearest cinema,False
restaurant,book a restaurant within the same area as saratoga av,False
music,i want to hear vegetables by pharrell williams,False
movie,can you find me a showing for before the music dies in one second ?,False
restaurant,book a table with wifi in delaware at a restaurant in one minute,False
restaurant,i want to book the black cat bar in ar,False
movie,show me the movie schedule in the area near my home at seven am for animated movies,False
movie,what movie schedule ?,False
movie,can i get the movie schedule for goodrich quality theaters,False
music,play the cross and the crucible by angela au man sze on google music,False
restaurant,id like a table for natasha bettye and kimberley at a coffeehouse with a smoking room,False
restaurant,id like a table for ten in 2 minutes at french horn sonning eye,False
restaurant,book a table at laurie beechman theatre for a party of 4 in utah,False
restaurant,find a reservation for three at a top-rated restaurant,False
music,i want to hear some of david gilmour s music from 1973,False
restaurant,book me a reservation for a bar that serves lobster roll in or,False
music,play the song vodka by kunal ganjawala on itunes,False
