Intent,Sentence,Outlier
restaurant,book a kuwait place at seven am at the middle east,False
restaurant,book a table at the irma hotel in mount repose,False
movie,is the start eim 23 hours twenty one minutes and one second from now for morgan – a suitable case for treatment at santikos theatres,False
movie,is the king of the kitchen playing in fifteen hours ?,False
movie,find regal entertainment group animated movies,False
movie,when is that forward center died at dawn playing at the closest cinema ?,False
movie,show me the schedule of films close by,False
movie,what are the movie schedules for animated movies close by,False
restaurant,i need fast food for nine within the same area as bowers that has a pool nearby on 4 17 2033,False
movie,movie times at cooper foundation for sunset,False
movie,can i get the the showtimes for the jade faced assassin cinema ?,False
restaurant,i need a restaurant now for a party of ten,False
movie,find time for trouble for two in one minute at landmark theatres,False
restaurant,book for one in indiana at a restaurant,False
movie,find a movie schedule in the neighborhood for animated movies,False
movie,can i get the showtimes for films at malco theatres,False
movie,what is the movie schedule of animated movies nearby,False
restaurant,book a tea house on 5 20 2028 in pataskala that serves crepe in nc for five,False
movie,can i get the movie times for the newest movies around here ?,False
movie,is the little irish girl playing,False
movie,what animated movies are playing at dipson theatres ?,False
movie,find the movie schedule for animated movies around here,False
restaurant,book a reservation for a popular bakery in patetown,False
movie,show me movie times at harkins theatres,False
movie,give me the showtime for bobby yeah playing at the cinema,False
movie,can you pull up a movie schedule for me?,False
restaurant,book a table at t-rex in one minute in osierfield,False
restaurant,i need a table booking for a highly rated sardinian pub,False
restaurant,book a popular joint in ocean gate for seven people at elevenses,False
movie,where can i watch key to the city,False
movie,what is the nearest movie theatre playing stray cat rock wild jumbo in 7 seconds,False
restaurant,i need to book a highly rated restaurant in coronado,False
restaurant,make me a reservation at taverna in a smoking room,False
movie,whats the closest movie house showing medal of honor,False
restaurant,i would like to book a restaurant in poncha springs for 8 at 00 32 am,False
restaurant,book a table somewhere in dominica for 2 minutes from now,False
movie,i want to see movie schedules at plitt theatres,False
movie,find the movie schedule at malco theatres,False
movie,find the schedule for to shoot an elephant at the nearest movie theatre,False
restaurant,book a table for nine at canteen lunch in the alley at midnight,False
movie,give me a list of films that play in the neighbourhood,False
restaurant,restaurant in west virginia for my son and i,False
restaurant,get me a highly rated restaurant in nigeria,False
restaurant,id like to eat at a top-rated place on nov the twenty-sixth in the food court i need reservations for 7 in the city of kane or somewhere near there,False
restaurant,book a table for a party of twelve in lewisville american samoa for a party of 7 at the ballachulish house,False
restaurant,book me a pizzeria that serves oreo for eight,False
restaurant,book a restaurant for marcella erma and leanne rivera,False
restaurant,please book a table for 6 people in the same area as bedford park blvd-lehman college,False
movie,what is the closest cinema today playing animated movies ?,False
restaurant,restaurant near in town uses in two years,False
movie,where can i find the movie schedules ?,False
restaurant,i want to book the best pub for 6 in new mexico,False
movie,is brother at united paramount theatres,False
restaurant,im in mi and want to eat somwhere nearby midday,False
movie,is thenaruvi playing at the douglas theatre company in one hour ?,False
movie,what theater is showing from paris with love and when?,False
restaurant,i need to book a table for five at the crooked house of windsor,False
restaurant,please book a restaurant in village green ca,False
restaurant,need to book a table in ludden,False
movie,what time is the rocketeer showing,False
movie,what time is tom y jerry showing at alamo drafthouse cinema,False
restaurant,book the light horse tavern for 4 people,False
restaurant,i need a restaurant on july 18th in rose bud,False
restaurant,book me a restaurant for nine in statham,False
restaurant,book a restaurant for five in karnataka,False
movie,show movie schedules close by movies,False
movie,what movies are playing at cobb theatres,False
restaurant,book a table at one oclock at a bar that has parking,False
restaurant,take me to the top-rated taverna in sealy for trattoria next week for 5,False
movie,what time is company men showing,False
movie,what time is dive bomber playing,False
restaurant,book for six on jan 18 2029,False
restaurant,i need a reservation for 3 hours from now with a party of nine in neighboring sweden,False
restaurant,i need a reservation in 1 second in atlas with a party of nine,False
restaurant,book in town for 3 at a restaurant outdoor that is not far,False
restaurant,book a table over the internet for six at a food truck in vanuatu for two pm,False
movie,can you let me know when talk of the devil is playing at the movie theatre ?,False
movie,what is the nearest movie theatre playing the collaborators,False
movie,find the movie schedules for animated movies in the neighbourhood,False
movie,what is the movie schedule for the b&b theatres,False
restaurant,book a table in alberton for me and my mother in law at a restaurant,False
movie,find films with movie schedules that are nearby,False
restaurant,book a table for 3 at one of the restaurants in washington dc in riverview,False
restaurant,book a reservation for a restaurant serving burger in malaysia,False
movie,where is all night long 3 playing 1 hour from now,False
restaurant,reserve a table for one at a top-rated restaurant nearby that serves goiano for this month in md,False
movie,what time is twin peaks fire walk with me showing,False
movie,what are the movie schedules for movies showing in the neighbourhood ?,False
restaurant,book a spot for one at four am,False
movie,find time for movie times now,False
movie,what are the movie times for the movies in the neighbourhood,False
movie,i want to watch fist of the north star 1 minute from now,False
restaurant,i need a popular moroccan cafeteria,False
restaurant,i want to eat at a brasserie that has internet near greenland at elevenses,False
movie,what s the movie schedules for magic johnson theatres,False
restaurant,book reservation in gasconade at the best restaurant in dc,False
restaurant,book a socca serving steakhouse for 2 in saint james alabama,False
movie,what time is unholy women playing?,False
restaurant,book a table for 3 in macao,False
restaurant,book a spot for 1 at a pub with internet,False
restaurant,please find me a table at a place that serves glace has room for six and a pub atmosphere,False
movie,are any animated movies playing at magic johnson theatres ?,False
movie,find the nearest movie theatre for animated movies,False
restaurant,i need a table for nine in atlas in 1 second,False
restaurant,book a spot at a restaurant with trattoria in otho de,False
restaurant,book a reservation for a restaurant in palau in six years,False
movie,show me the schedule for arclight hollywood for animated movies,False
restaurant,id like to eat souvlaki fast food with a party of two,False
movie,what films are playing at pacific theatres,False
restaurant,book a reservation for me and my wife at the middle east in guernsey,False
movie,i need to see some movie schedules,False
movie,what time are the animated movies playing at mann theatres ?,False
restaurant,book itsu for tonight,False
restaurant,i need a table at surf taco in east uniontown,False
restaurant,book a restaurant this week for joni wilda sanders and i in al,False
movie,what animated movies are showing at star theatres,False
movie,list movies at imax corporation,False
movie,ticket for the perfect man at dickinson theatres at 10 a m,False
restaurant,i would like to book the best southeastern brazilian food court,False
movie,when can i see the crew of the dora,False
restaurant,on april the twenty-seventh 2022 id like to make reservations at a spanish diner,False
restaurant,book a reservation at a restaurant nearby their airbnb,False
movie,movie schedules for neighborhood cinema group,False
movie,what animated movies are playing at the closest movie house,False
restaurant,book a spa in pizzeria on november 24 2036,False
restaurant,book a spot for marlene jordan and i on oct the 6th,False
restaurant,book a southeastern brazilian cusinie pub,False
restaurant,book a table for ida monica and etta at cold spring tavern in md,False
restaurant,i need to book a restaurant that has wifi far from tx for me and my parents,False
restaurant,book australian food in armour for 7 pm for four at a pub best rated in ut,False
restaurant,i have a party of 8 and we want to go to a restaurant that serves croquembouche,False
movie,what animated movies are at pacific theatres,False
restaurant,book a reservation for 7 people at the french laundry on june the 8th 2029,False
movie,what time is the world according to john coltrane playing,False
movie,when this evening is casa amor exclusive for ladies playing and where,False
restaurant,i want to book a restaurant with creamed eggs on toast on kansas day within walking distance of british indian ocean territory,False
restaurant,im looking for a churrascaria place with wifi that can serve a party of five,False
restaurant,book a sushis serving restaurant in uzbekistan,False
restaurant,book for two in jordan that is close,False
movie,is one night surprise at the cinema,False
restaurant,book a spot for 1 at a restaurant this evening,False
movie,what time is phera playing,False
movie,what is the movie schedule for movies in the neighborhood,False
movie,what are the movie times for films playing in the area ?,False
movie,which is the nearest cinema showing a cooler climate that starts now ?,False
movie,can i get the cineplex odeon corporation showings for small town story ?,False
movie,what movie theatre is showing if the huns came to melbourne,False
movie,what is the movie schedule for today?,False
restaurant,book a highly rated bar in burkina for georgia and i,False
movie,i d like to watch the holy office at cooper foundation,False
restaurant,book me a reservation for 10 in oman,False
restaurant,at thirteen oclock book a table for margie and i in vanuatu,False
movie,is romulus and the sabines playing at the nearest cinema at ten,False
restaurant,i need to book a table at a fast food spot that serves slinger in pr,False
movie,find a united paramount theatres and movie times at 4 a m,False
movie,what cinema is the closest showing movies,False
restaurant,i need a reservation for 8 at a top-rated restaurant in hagaman,False
restaurant,i want to book a table at the commons restaurant in south pekin new hampshire for a party of 10 on january the 24th,False
restaurant,book a highly rated fast food restaurant in falmouth,False
movie,is the skull playing at loews cineplex,False
movie,what time is the face in the moonlight showing?,False
restaurant,book a cafe for one in the cocos islands,False
movie,what time is the ladies diplomat playing?,False
movie,which films are playing at the closest cinema ?,False
restaurant,i would like to book the best food court with persian food within the same area as ok for my ex husband and i,False
movie,find the movie schedule for amco entertainment 1 minute from now,False
restaurant,book a restaurant in al at oak ridge,False
movie,where can i get movie schedule,False
movie,what is the movie schedules for animated movies nearby,False
movie,show me some movie times,False
movie,find three in the attic,False
movie,show me the new showings for animated movies in the neighborhood,False
restaurant,book a brasserie restaurant at 18 28 and order wings,False
movie,when is percy jackson playing at the movie theatre ?,False
movie,where is boo to you too! winnie the pooh playing,False
restaurant,book a gastropub serves waffle for 8,False
restaurant,my sons and i want to dine at the water club in georgia,False
movie,please inform me when i can see the abdication at a movie theatre,False
movie,what animated movies are showing nearby,False
movie,what movies are scheduled at the nearest movie theatre ?,False
restaurant,i need a reservation for 6 pm with a party of 10 at sand lake,False
restaurant,i need a restaurant that can accommodate a party of ten in avant,False
movie,what time is the eddy duchin story playing,False
restaurant,book a spot for six at a restaurant in nj,False
movie,what animated movies are playing nearby ?,False
movie,showtimes for the closest movie theatre that is showing operation autumn,False
restaurant,book a restaurant close by my daughterss work location with burrito three years from now,False
movie,what is the nearest movie house playing george washington slept here,False
restaurant,id like a bar with hawaiian food in nd,False
movie,what movies are in the neighbourhood,False
restaurant,i need a reservation for claudine kelsey and shelley at a restaurant in palestine,False
restaurant,book for six for 1 hour and 1 minute from now,False
restaurant,book french food for me and angeline at a restaurant,False
restaurant,book a spot for robyn martinez maude and i at a steakhouse not far from their place,False
restaurant,get me a table at the hand & flowers for sixteen hours,False
restaurant,book a diner for 1 in green isle,False
restaurant,book a spot for 2 at a restaurant in pw,False
restaurant,i want to book a cafeteria for 4 that has meze,False
restaurant,i really need a top-rated restaurant that can seat 3 people in 1 minute from now,False
restaurant,i want to book a restaurant,False
restaurant,book a table in fleetwood at a nearby deli,False
restaurant,book a restaurant in ca for my parents and i on oct the seventeenth,False
restaurant,book a food truck that is highly rated in honduras,False
restaurant,book a table for four around midnight in saint pierre and miquelon,False
movie,what time is the bride from hell playing at malco theatres,False
restaurant,book a reservation for four in cajahs mountain in 1 year,False
movie,give me the movie schedules for southern theatres,False
restaurant,book a spot at the top-rated pub in garner,False
movie,in 1 hour and 1 minute find a cinema nearest for films,False
movie,show movie times at cinemark theatres,False
restaurant,book a spot at a highly rated afghan restaurant,False
restaurant,let me get reservations for a party of three at a bar with a pool,False
movie,where is puthri playing,False
movie,is the couch trip at the nearest cinema,False
movie,i d like to watch demolition man at 11 09 pm,False
movie,let me know the movie times for films in the area,False
movie,what time is a man for burning playing,False
restaurant,me bobbie and colette want to go to the peak lookout in felicity,False
restaurant,please book me seating at the food court in hazel green for nine,False
restaurant,me and my mummy want to go to an indian bar next winter within the same area of cortelyou rd,False
restaurant,book a churrascaria restaurant that serves spring rolls for one person,False
restaurant,book a tyrolean restaurant in crocker indiana now for 3 people,False
movie,when is bless the child playing at the movie theatre,False
restaurant,book a spot for 8 at a popular taverna,False
movie,what time does a king in new york play in malco theatres,False
restaurant,i need a table in tn thats not to far for a party of ten,False
restaurant,book a spot at a taverna with internet in mississippi,False
restaurant,book a restaurant for one person at 7 am,False
movie,what time is in the crosswind playing at marcus corporation ?,False
restaurant,i need a pub with a smoking room in ucolo reserved,False
restaurant,book a table for vermicelli at a restaurant,False
restaurant,locate the best pub in apache junction,False
movie,can i get the showtimes for the closest cinema showing i’m a cyborg but that’s ok,False
movie,i want to see the movie schedule for kb theatres,False
movie,what movie times are there for 5 p m ?,False
restaurant,book seating for one person at a food truck,False
restaurant,book a restaurant for one for this month,False
restaurant,book a restaurant for nine in south sudan,False
restaurant,book a restaurant for me valarie and caroline in 56 weeks in soldier pond,False
restaurant,book a table for ten in pollock pa,False
restaurant,book a bar in sc in leonville,False
restaurant,book a table for 10 people at a restaurant which offers internet,False
restaurant,i want to book an indonesian food truck,False
restaurant,book a restaurant near the city of wakefield for 5 people,False
movie,fine a movie schedule,False
restaurant,i want tables for 6 at a kosher steakhouse around kosovo,False
movie,show movie schedules for animated movies playing close by now,False
restaurant,i would like to book a bistro for 7,False
movie,find cinemark theatres with films,False
restaurant,book a table for seven during our thailand trip that is within walking distance of our hotel,False
movie,can i get showtimes for films in the neighborhood,False
restaurant,book a cafeteria having pool for four in algeria,False
movie,find the closest cinema playing little red monkey,False
movie,when can iw atch great balls of fire! - vampate di fuoco,False
movie,i want the film for nearest movie theatre,False
movie,what are the movie schedules for animated movies playing in the neighborhood,False
restaurant,i want to book a pizza restaurant close to astor place for nine at 3 am,False
movie,is love is a ball playing right now ?,False
movie,is the belles of st clements playing at star theatres in 8 minutes ?,False
restaurant,find a table for 8 somewhere in bonaire in 345 days,False
restaurant,i need a table for four at a restaurant in al,False
movie,find the schedule for films around here,False
restaurant,i want a table for my grandson and i somewhere in arkansas,False
movie,what movies are at malco theatres,False
movie,find the closest movie theatre for films,False
restaurant,book a spot distant from the neighborhood on the week-end,False
movie,give me the movie listings at the closest cinema please,False
movie,please provide me with movie schedules,False
restaurant,book a spot for me reyna and maxine at a taverna on monday,False
movie,show me the schedule of films in cobb theatres,False
movie,is the day of the beast playing at three p m ?,False
restaurant,book a table for sep the second 2020 at a highly rated place for me and my baby at a joint serving cambodian,False
restaurant,i want a restaurant reservation for a party of 8 at a vegetarian tea house,False
restaurant,book a spot for 8 at a tavern on jun the 11th 2034,False
movie,show me the schedule of films in the neighbourhood,False
restaurant,i need to book a table for three at a restaurant in south sudan,False
movie,can i see the movie times for the great escape theatres,False
movie,what is the movie schedule at cineplex odeon corporation 12 hours from now,False
movie,what is the movie times at marcus corporation,False
restaurant,make a reservation at a diner which serves chowder in mt for august the 17th 2024,False
restaurant,book a manadonese restaurant for two,False
restaurant,book a spot for nine at a top-rated brasserie that has swiss within the same area of new york,False
restaurant,lets go eat in friday 43 days from now,False
restaurant,i want to book a restaurant for 6 on january third within walking distance of northvale,False
restaurant,need a table for sep first in haiti for a party of three,False
movie,what is the nearest cinema showing love in mandya ?,False
movie,find movie times for alamo drafthouse cinema at 10 37 p m,False
movie,what films are going to be playing at harkins theatres at zero a m ?,False
movie,what time is the clutching hand playing at amco entertainment,False
movie,what time can i watch son of rambow tonight at fox theatres,False
movie,what animated movies are playing at the closest cinema,False
movie,what are the movie times,False
restaurant,i need a table at t-rex for nine in brunei,False
movie,what are the movie schedules for movies playing in the neighborhood,False
restaurant,book a table for four in orchard grass hills nv,False
movie,find the movie times now,False
movie,show animated movie at century theatres,False
restaurant,evangeline and petra cooper want to go to a restaurant in 9 years,False
movie,give me the movie schedules at showcase cinemas,False
movie,what movie theatre is showing titanic the legend goes on,False
movie,what time is a man for burning playing,False
movie,find kerasotes theatres movie schedules,False
restaurant,book a spot for 9 in new mexico,False
restaurant,book a party of 4 at eddie’s attic,False
restaurant,book a table in greece for 4,False
restaurant,restaurant in watauga for me and my aunt,False
movie,find out what films are being played in the neighbourhood,False
restaurant,book for lobster newberg this week in malaysia at a restaurant for four,False
movie,find time for enkitta mothathe at pacific theatres,False
restaurant,book me a table at the highly rated cafeteria in federated states of micronesia,False
restaurant,i need a table in your position at churrascaria for a hot dog in the same area,False
restaurant,i want to book a food court for 5 at 1 am,False
movie,i need to see a list of films and movie times in the area,False
restaurant,1 minute from now i will need reservations at a restaurant in vanlue,False
movie,i need movie schedules,False
movie,is there a movie theatre showing last cab to darwin today?,False
restaurant,i need to book a restaurant in burkettsville in 2 years for rhoda adams roxanne and i,False
restaurant,book a restaurant in northern mariana islands with kristine alisha and florine,False
restaurant,book a restaurant for ten in exmore at sunset,False
restaurant,book at beardslee castle in fairview lanes for fifteen oclock,False
restaurant,table for 6 at a bar,False
restaurant,book a spot in the same area as yankee doodle coffee shop in madagascar,False
restaurant,book laurelhurst theater for 8 people,False
restaurant,can you get me seating for a party of 5,False
restaurant,id like to eat english cuisine at a restaurant in ettrick,False
restaurant,id like to eat at an outdoor restaurant,False
movie,show movie schedules for douglas theatre company,False
restaurant,book in falkland islands at atomic cafe,False
restaurant,i need a table for 4 at the brass rail,False
restaurant,in one hundred twenty seven days id like to eat at a pizzeria in north lima,False
movie,can you pull up showings for pop goes the easel at the local movie theatre ?,False
restaurant,book a boon brick store for my grandkid and i at evans mills,False
restaurant,id like to go to a halal restaurant in twenty minutes around the district of columbia and book seats for four,False
restaurant,i need a reservation for the french laundry in oh for six,False
restaurant,i need a reservation for the berghoff in jamaica in 18 seconds,False
restaurant,book city tavern in poland,False
restaurant,lets get a table for 10 at space aliens grill & bar,False
movie,what time is doc savage the man of bronze playing,False
restaurant,book a restaurant on san jacinto day in anderson for me and my colleagues,False
movie,can i get the showtimes for the man who could talk to kids ?,False
restaurant,my great grandfather and i would like to get together at a taverna,False
restaurant,book a spot at an indoor gastropub in ny,False
restaurant,book a table for six in a togo restaurant,False
restaurant,book in vermont at the maisonette,False
restaurant,book a taverna that serves bengali for six at five,False
movie,what films are playing at goodrich quality theaters,False
movie,what movies are at the nearest movie house,False
restaurant,book me a table at the goof for a party of eight in the state of nv,False
movie,i d like to watch broadway nights at megaplex theatres,False
restaurant,book a reservation for eight people in north dakota,False
restaurant,book a table for 2 guests at a restaurant in lazy mountain ny,False
movie,find the schedule for vanishing of the bees at a movie house,False
restaurant,book for 2 at a cafe for burgers in gasport,False
movie,when is red shirts showing at dickinson theatres,False
restaurant,book a reservation for a restaurant serving wontons for ten people in leopold,False
movie,show me the nearest movies at movie theatre for twenty one o clock,False
movie,what time is sontha ooru playing,False
movie,what s the closest cinema showing animated movies,False
restaurant,please find a restaurant in sierraville wyoming that has room for 6,False
restaurant,book a reservation for clinton street baking company & restaurant distant from downtown,False
movie,find partners in action at dickinson theatres,False
restaurant,find a reservation within walking distance of paulines place for a party of 10 at fourteen oclock at a restaurant that serves aioli,False
movie,show the movie schedule for animated movies in the neighbourhood,False
restaurant,book a reservation at a restaurant with me matilda and deana,False
restaurant,book a table at the vortex bar & grill on alaska day in the state of rhode island,False
restaurant,make reservations for 7 people at a top-rated brazilian pub around rockaway park-beach 116th,False
restaurant,i need a table in one hour from now at somewhere not far from la,False
restaurant,book a tea place at seven,False
restaurant,book a table at a french restaurant for fern and i,False
movie,give me the movie times for fox theatres,False
