Intent,Sentence,Outlier
playlist,add the album to my top 100 indie tracks on spotify playlist,False
playlist,add track to my spring playlist,False
playlist,add a song by mark schultz to my ultimate indie playlist,False
playlist,for the playlist wild & free workout add tsidii le loka,False
playlist,put the bill berry track on elrow guest list,False
playlist,put live and rare into dancehall official,False
playlist,add a song to my playlist independent music monday,False
playlist,add this artist to reggae classics playlist,False
playlist,please add the song by raphael rabello to the playlist fantastic workout,False
playlist,put kurt cobain onto korean osts,False
playlist,add the avispa track to my bass gaming playlist,False
playlist,add blag dahlia to pura vida,False
playlist,add etta james to my anochecer urbano playlist,False
playlist,add this track to anochecer urbano,False
playlist,please add this track to my weekend list,False
playlist,add this song to my list trabajo relax,False
playlist,put michael cretu onto my beach vibes playlist,False
playlist,add this artist to the playlist called evening groove,False
playlist,add top 100 indie tracks on spotify to my track,False
playlist,add this clint mansell song to latin pop classics,False
playlist,add fair charlotte to the we everywhere playlist,False
playlist,add this song to my playlist named wild country,False
playlist,add michael wittig to the party playlist,False
playlist,add tune to women of pop playlist,False
playlist,add this artist named cleopatra stratan to my playlist named 30 before 20 masterworks by teenagers,False
playlist,put the airi suzuki album into my nuclear blast novelties playlist,False
playlist,add the song to my r&b movement playlist,False
playlist,i want maximilian mutzke added to acoustic concentration,False
playlist,put this song on legendary guitar solos,False
playlist,add to anacreon in heaven into the playlist girls night,False
playlist,add this song to tanias new boots,False
playlist,add reggaeton classics in playlist jennie jennie,False
playlist,put the mike oldfield album onto my la mejor música para tus fiestas playlist,False
playlist,i want a matt garrison tune in my fresh finds fire emoji playlist,False
playlist,i want to put this track on dianns just smile playlist,False
playlist,add this track to tamekas dance playlist,False
playlist,add this wayne raney tune to my this is kudai,False
playlist,add maschi e altri to my this is john williams,False
playlist,i want to add a song to the sunshine reggae playlist,False
playlist,add bien acompañado to all out 60s,False
playlist,add tune to my this is animal collective,False
playlist,put framed onto my ntc studio sounds playlist,False
playlist,add in the heart of the world to the epic gaming playlist,False
playlist,add tune to cleaning the house,False
playlist,add this artist to my garage jams,False
playlist,add this track to llegando a casa,False
playlist,add concrete roots to punk español playlist,False
playlist,add this song to my workout playlist,False
playlist,add some patrick stump to maritzas disco fever list,False
playlist,add cleo laine to psychedelic rock,False
playlist,put another track in the keep calm playlist,False
playlist,put perfecting loneliness onto primavera sound 2016 barcelona,False
playlist,can super turnt up get added to my emotron playlist?,False
playlist,add song to evening playlist,False
playlist,add villotta to the metalsucks playlist playlist,False
playlist,add anti ep to esenciales,False
playlist,add the go find to sólo para dos,False
playlist,put this tune on all a cappella,False
playlist,add this tune by rafet el roman to my latin pop rising playlist,False
playlist,add omnipresent to verano,False
playlist,add the time warp to wild & free workout,False
playlist,i want cocco added to my post metal playlist,False
playlist,please add this this tune to the playlist this is selena,False
playlist,can you put this song on the metal xplorer playlist,False
playlist,put a track by lil mama into my guest list sneaky zebra playlist,False
playlist,add the artist kamil rustam to my relaxing playlist,False
playlist,add another album to my friendesemana playlist,False
playlist,add this tune to my in the arms of a woman,False
playlist,add chris de burgh in my playlist melancholia,False
playlist,add raz b to drive playlist,False
playlist,add this elbridge bryant song to my inyección musical playlist,False
playlist,in my playlist rock gaming add mariem hassan con leyoad,False
playlist,add the singer damon johnson album to my african heat playlists,False
playlist,incorporate a roberto parra sandoval track into the cena elegante playlist,False
playlist,add track to this is zezé di camargo & luciano,False
playlist,for my playlist post garage wave revival add the name eternal prisoner,False
playlist,will you put this song onto women of electronic,False
playlist,i need to add a tune by amanda stern to the playlist cloud rap,False
playlist,add little pattie track in nu metal,False
playlist,add frank beard to my latin pop classics playlist,False
playlist,i want to add another album to the scratchy back porch blues playlist,False
playlist,add one and only to my once upon a time playlist,False
playlist,add patti page album to i love my neo soul,False
playlist,add annette artani to the playlist titled all out 90s,False
playlist,add banking violence and the inner life today to my retro gaming playlist,False
playlist,add metal church to my playlist named stress relief,False
playlist,add song to daily lift playlist,False
playlist,add this track to epic wall of sound,False
playlist,put the love hurts track onto carmens playlist,False
playlist,i want lance king in my list called one love,False
playlist,add this album to my playlist titled underground hits,False
playlist,can you add something by gregori chad petree to the playlist digster soul classics,False
playlist,i want to add johnny burke to the country bound playlist,False
playlist,add baby lemonade to poetry in their own voices,False
playlist,add defined by struggle to chillin on a dirt road to my playlist,False
playlist,move josiah leming to te quiero list,False
playlist,please add something by steve freund to my this is luis fonsi playlist,False
playlist,add the name shall we dance to playlist rock,False
playlist,add the artist p d q bach to the te quiero playlist,False
playlist,can you add honey hush to hits of the 60s,False
playlist,put some stu phillips in the women of acoustic playlist,False
playlist,add women of metal to odetta holmes,False
playlist,id like t add day after day to evangelines party of the century playlist,False
playlist,add the artist to my duetos,False
playlist,add julia fordham to the massive soca hits playlist,False
playlist,add big generator to my country icon playlist,False
playlist,put this artist onto political punks,False
playlist,add this tune to my playlist guest list mashable,False
playlist,add all together now to my playlist the road to punk rock,False
playlist,i would like to put taylor dayne on the pop 4 kids list,False
playlist,add tune to downtempo beats,False
playlist,add track to dance playlist,False
playlist,add another tune to my soft rock playlist,False
playlist,can you put in person at carnegie hall on my winter playlist,False
playlist,add visible wings to my playlist entre los andes,False
playlist,add a tune to the calm vibes playlist,False
playlist,add steve jones to my chill list,False
playlist,i wish to put tom baxter onto my coffee table jazz playlist,False
playlist,i want to add up to the mountain to my playlist with the title women of indie,False
playlist,add los hombres calientes volume 3 new congo square to my descanso infinito playlist,False
playlist,add driven to tears to the viral semanal playlist,False
playlist,add the private collection onto my cena elegante playlist please,False
playlist,add an artist to my hype list,False
playlist,add all bad to the summer of love playlist,False
playlist,add this album to the playlist guest list engadget,False
playlist,add circus to my post garage wave revival list,False
playlist,add tony mcguinness to my playlist i love my 90s hip hop,False
playlist,put this track on musica española 2017,False
playlist,add the album to my wild country playlist,False
playlist,add get happy to cherrys las canciones más lindas del mundo,False
playlist,add this song to my the perfect italian dinner playlist,False
playlist,add nico to my rock to work,False
playlist,add the track to the comedy new releases playlist,False
playlist,please add a track to my playlist called this is coti,False
playlist,add september to winter music,False
playlist,add grey cloudy lies to the hip hop playlist,False
playlist,add willie nelson live to my acoustic blues playlsit,False
playlist,add yang hyun seok to the playlist called night out,False
playlist,add this album to my orgánica playlist,False
playlist,add spirit touches ground to my leche con chocolate list,False
playlist,add the artist verano to my michael mantler playlist,False
playlist,add unconscious state to my 90s smash hits,False
playlist,add the yumi matsuzawa album to my sexy as folk playlist,False
playlist,add steve albini album to my psychedelic rock playlist,False
playlist,add tune to blues,False
playlist,can you add something by vikki thorn to my lo mejor de los 80s playlist,False
playlist,add so far to my retrovisor playlist,False
playlist,add venetian snares onto the atmospheric calm playlist,False
playlist,add yoshiki to the 35 soul classics 1970 to 1975 playlist,False
playlist,add dan the automator to forever country,False
playlist,include the past behind in my top 100 rock tracks on spotify playlist,False
playlist,put gregory douglass in halloween teens please,False
playlist,put this tune by ross the boss onto nação reggae,False
playlist,add a tune to this is wagner,False
playlist,add christopher lawrence to my always pop punk playlist,False
playlist,add this album by karl davydov to reynas this is luis fonsi playlist,False
playlist,add album to my massive soca hits,False
playlist,add doing all right to string theory,False
playlist,add lee seung gi to my baila reggaeton playlist,False
playlist,can you add john scofield newest tune the selektor to the playlist,False
playlist,add this annabella lwin track to indie alternativa,False
playlist,put another tune into my dancehall official playlist,False
playlist,add paloma negra to my funky jams list,False
playlist,please put the album onto fresh folk,False
playlist,i want you to add must b 21 to acoustic covers the mash ups,False
playlist,add mc ren to my its a southern thing playlist,False
playlist,add the tune to my viajes playlist,False
playlist,put conway twitty in the this is tchaikovsky playlist,False
playlist,add joshua radin to my playlist called futuros hits,False
playlist,add art garfunkel to the chill tracks playlist,False
playlist,add another song to my this is status quo playlist,False
playlist,add run rudolph run to my rockin playlist,False
playlist,would you put hammer onto the lunch playlist?,False
playlist,put something by noah wuv bernardo on my humor playlist,False
playlist,find focus now list and add eylem to my playlist,False
playlist,add this eric weissberg song to my dance workout,False
playlist,put this tune on guest list take,False
playlist,add fear and bullets to my chill tracks playlist,False
playlist,id like to put duett onto my hot country playlist,False
playlist,add r u still in 2 it to the under the surface playlist,False
playlist,add this song by george melly to my 90s baby makers playlist,False
playlist,add sugarolly days to my list your favorite slaughterhouse,False
playlist,add this tune to my this is luis fonsi playlist,False
playlist,include in my dreams in the this is new edition playlist,False
playlist,add future to this is al green,False
playlist,add another song to the acoustic soul playlist,False
playlist,add el pavo dustin to viajes,False
playlist,add j p pickens to chill out playlist,False
playlist,add monster monster to my throwback thursday playlist,False
playlist,add this track to the playlist kickass metal,False
playlist,add george baker to hiphop hot 50,False
playlist,add this album ny bill callahan to my mi casa es la tuya playlist oficial list,False
playlist,add sam sparro to my playlist called beach vibes,False
playlist,edit aux cord privileges playlist by putting this tune on it,False
playlist,add tim ryan to my grime shutdown playlist,False
playlist,can you put this tune onto erins house afterwork playlist?,False
playlist,can you make an addition to the old enough to enjoy this playlist with martin barre ?,False
playlist,add artist to latin pop hits,False
playlist,play used to love her to my this is animal collective playlist,False
playlist,add arthur russell to my women of disco playlist,False
playlist,add francesco de gregori to my classical new releases spotify picks playlist,False
playlist,play suus to my the funny thing about football is playlist,False
playlist,add outside the dream syndicate to millicents fresh electronic playlist,False
playlist,put playa fly onto my 2010 decade playlist,False
playlist,i want to put this artist in mellowed out gaming,False
playlist,add a rachael price album to todo edm,False
playlist,put strange days onto the fusion fest playlist,False
playlist,add this track to my flamenco pa ti,False
playlist,add kisaki to family road trip playlist,False
playlist,put ramy ayach on latin pop rising,False
playlist,add the current artist to my sxsw latin,False
playlist,add tune to my country playlist,False
playlist,put nothing remains the same on my summer music playlist,False
playlist,add flying to my women of rock playlist,False
playlist,id like to put ryō yamazaki onto my sylvia plath playlist,False
playlist,add ana carolina to chill,False
playlist,add decade in the sun best of stereophonics to laundry,False
playlist,add artist to my friendesemana playlist,False
book,rate the lotus and the storm zero of 6,False
book,rate the fall-down artist 5 stars,False
book,rate the ape-man within 4,False
book,i give the penalty three stars,False
book,i give emile or on education five points,False
book,rate licence renewed a 4,False
book,give this essay a 2 out of 6,False
book,a rating of 5 of 6 points goes to dickson mccunn trilogy,False
book,rate beyond the shadows 3 of 6,False
book,give 2 out of 6 points to the following textbook,False
book,the previous textbook is a 3,False
book,rate this album zero of 6,False
book,rate in stars as a 6 for lord of the shadows which gets a four,False
book,rate small screen big picture a 0 out of 6,False
book,give this book a rating of 3,False
book,give the judas tree a zero,False
book,i am rating this book titled the billion dollar ransom 3 stars,False
book,rate this book titled cold two stars,False
book,i want to rate this current series a value of five and a best rating of 6,False
book,rate the current book a zero of 6,False
book,give a human being died that night 3 stars,False
book,i m rating the skystone with three points,False
book,rate this current saga 3 out of 6 points,False
book,rate the wild boy series 3 out of 6 stars,False
book,rate the glory season three stars,False
book,give this textbook 5 points,False
book,give two stars to current album,False
book,rate the current saga a five,False
book,i want to give this album 3 points,False
book,i gave joseph andrews a 0 out of 6,False
book,give zero / 6 stars to the current album,False
book,the next album is only one stars,False
book,rate this book three points,False
book,rate the keys to the white house a zero,False
book,rate an act of terror 2 stars,False
book,i m rating the skystone with three points,False
book,rate merlin effect a 0,False
book,give this album three out of 6 points,False
book,the last hawk gets a total of 3 out of 6 stars from me,False
book,i rate american history a survey a 5,False
book,give this current novel a 4,False
book,the stars for this are 4 for a textbook,False
book,rate the current chronicle book three points,False
book,rate the bunce 1 stars,False
book,give this textbook a rating of 3,False
book,another girl another planet gets only one of a possiable 6 rating,False
book,i give the spirit of st louis a 1,False
book,rate the book post office four points,False
book,give 5 rating for this textbook,False
book,i give this next essay zero out of 6 points,False
book,rate the current novel 3 of 6 stars,False
book,rate the watsons four of 6 stars,False
book,this novel should get zero points for how intrepid it is,False
book,rate this current book album four stars,False
book,give the current novel 5 points,False
book,give death on the nile a three,False
book,rate the gorilla hunters 0 stars,False
book,rate this current essay three out of 6 stars,False
book,this is rated 5 out of 6 for an essay,False
book,rate the current album one points,False
book,i give a zero rating for this essay,False
book,rate the secret of dr honigberger 2 points out of 6,False
book,rate this chronicle three of 6 stars,False
book,this current album deserve 0 points and a best rating of 6,False
book,rate this textbook a zero,False
book,rate the stars shine down 5,False
book,i think this essay should be given four points and a best rating of 6,False
book,for this current saga i give 5 out of 6 possiable points,False
book,i give the lacuna a rating of 5 stars under the chronicle rated at 6,False
book,give zero point to this textbook,False
book,i give the current book two out of 6,False
book,rate this album book zero out of 6 points,False
book,rate the current chronicle series 3 out of 6 points,False
book,i give one clear call zero out of 6 points,False
book,give 0 out of 6 points to this essay,False
book,i would give half a life 3 out of 6,False
book,rate this essay a four,False
book,give 5 out of 6 points to short trips a universe of terrors,False
book,i give this book dictionary of the english language a 4 rating,False
book,give the following essay one stars,False
book,give one points to current book,False
book,i am giving this novel 3 stars,False
book,and a body to remember with gets a full 5 stars,False
book,rate witchcraft and paganism in australia 1 points out of 6,False
book,rate the current textbook one of 6 stars,False
book,rate the white goddess 2 of 6,False
book,i am rating this book under the series section a three out of 6 stars,False
book,rate the current essay 5 of 6 points,False
book,i give ruled britannia a rating of five out of 6,False
book,give 4 points / 6 to last day in limbo,False
book,i rate 4 of 6 points for this textbook,False
book,this book gets a 1 out of 6 rating from me,False
book,the voyage of the dawn treader deserves 5 points,False
book,award blood tables 2 points,False
book,who rated the book women culture and society only 3 stars ?,False
book,rate the current textbook zero out of 6 points,False
book,give two out of 6 to current book,False
book,rate the current textbook a 4,False
book,give four points to current essay,False
book,the cool world gets 4 points,False
book,rate the sunrise lands a zero,False
book,rate lords of the rim zero stars,False
book,rate sandworms of dune three out of 6 stars,False
book,rate current book 2 of 6,False
book,rate the current book 5 of 6 points,False
book,score this album 5 stars,False
book,give 3 points to current textbook,False
book,a day no pigs would die deserves a best rating of 6 and a value of 4,False
book,i think the current album should get a four out of 6 rating,False
book,the current album deserves 0 stars,False
book,i d like to give a two rating to the abolition of britain,False
book,rate the current book 0 of 6,False
book,rate they came from the sea 1 of 6 points,False
book,the stars for behind the beat should number four for this chronicle,False
book,i think memorial day should have a rating value of 3 and a best rating of 6,False
book,i want to give the current textbook 0 stars,False
book,i give a rating of four to this textbook,False
book,rate this essay four stars,False
book,rate current essay a zero,False
book,rate the current essay a 0 for me,False
book,give begums thugs and white mughals four points,False
book,give portions from a wine-stained notebook short stories and essays 0 points,False
book,i would rate the kid from hell a value of 1 and a best rating of 6,False
book,rate the current novel five out of 6 stars,False
book,rate notes from the internet apocalypse four of 6 stars,False
book,rate this novel four of 6,False
book,give letty fox her luck 4 out of 6 stars,False
book,i give the current textbook 0 of 6 points,False
book,give this album a 4 out of 6,False
book,give two points out of 6 to this essay,False
book,rate the current saga 4 of 6,False
book,rate this essay with three of 6,False
book,rate the current essay with 4 points,False
book,rate this essay a four,False
book,give this novel a rating of 1 points,False
book,rate current book 0,False
book,give two stars to scribblings,False
book,i want to give rebbe the life and teachings of menachem m schneerson the most influential rabbi in modern history two out of 6 points,False
book,rate the war of the roses 2 out of 6,False
book,rate the longest day with zero stars out of 6,False
book,give star trek the motion picture a five out of 6,False
book,rate colorless tsukuru tazaki and his years of pilgrimage one stars,False
book,i only give blood work two stars,False
book,rate the current chronicle a five,False
book,give the last child 4 of 6,False
book,for this current essay i give 5 of 6 points,False
book,rate the current novel one of 6,False
book,this essay is five stars for sure,False
book,i give the screaming staircase a five,False
book,rate lost empires of faerûn five of 6 stars,False
book,give 0 points to the eudaemonic pie,False
book,the evil experiment gets zero out of 6 points,False
book,rate my current album 5 points,False
book,rate my current novel four out of 6 stars,False
book,i would say this essay deserves four points,False
book,i would like to rate the book the three impostors 2 to 6 stars,False
book,rate the current textbook 2 out of 6,False
book,rate this book three out of 6,False
book,rate the doors of perception 3 stars,False
book,give 4 stars to this essay,False
book,rate the current textbook five of 6,False
book,the series city on fire is a four,False
book,rate the why is sex fun? saga two of 6,False
book,rate the book the ninth avatar 3 out of 6 stars,False
book,give love in the time of foreclosure 4 of 6,False
book,rate the current textbook four out of 6,False
book,i would rate the persistence of vision 1 stars and a best rating of 6,False
book,give this current book zero out of 6,False
book,i want to rate a long short war series a four out of 6,False
book,give physics of the impossible four points,False
book,i want to give this album 4 stars,False
book,add rating of 5 to this novel,False
book,rate this album one stars,False
book,give three points out of 6 to one hundred poems of tukaram,False
book,i want to give elephants can remember 4 out of 6 points,False
book,rate this album three of 6 points,False
book,rate this is how you die chronicle a one,False
book,i think this textbook should have a rating of four and a best rating of 6,False
book,i give this novel a 0 out of 6 rating,False
book,give zero points to this essay,False
book,rate this book 3 stars,False
book,rate the current album 5 out of 6 points,False
book,give power of faerûn two of 6,False
book,rate this album 2 points,False
book,give this book chronicle four stars,False
book,rate this essay five points,False
book,rate this essay five stars,False
book,give this textbook a 5 out of 6 rating,False
book,rate the philosophic thought of ayn rand three of 6 stars,False
book,give the whisperer a rating of 0,False
book,can you rate this novel as a four ?,False
book,the current book i m reading should be rated zero out of 6,False
book,i give the battle of bretton woods saga two of 6 stars,False
book,rate this album 0 points,False
book,give five out of 6 stars to current essay,False
book,gve 2 points to the stinky cheese man and other fairly stupid tales,False
book,i gave chart throb 4 of 6 stars,False
book,rate this book called kings of the high frontier four points,False
book,i give this album a 0 of 6 stars,False
book,i want to rate the selected letters of h p lovecraft i saga 3 stars,False
book,i give this current textbook five stars,False
book,give this novel two points,False
book,for the textbook out of 6 possible i give the following one a 3,False
book,rate the detective a 3 out of 6,False
book,give 0 points to the hand in the glove,False
book,rate this novel a 1 of 6 for me,False
book,i give this essay 0 of 6 stars,False
book,rate the last opium den 0 points,False
book,rate the current essay 2 stars,False
book,give the current series a one,False
book,rate in search of our origins two points out of 6,False
book,rate this book the book of snobs 1 points,False
book,programming the universe is average and deserves three stars out of 6,False
book,i think this book should have a rating value of 1 and a best rating of 6,False
book,i rate the current textbook a 0 of 6,False
book,give this book 1 stars,False
book,give this book zero stars,False
book,i am giving paedophilia the radical case a rating of 2 out of 6 points,False
book,put a rating of 0 out of 6 to this chronicle,False
book,give 0 to the sky village,False
book,i give a rating of 2,False
book,to the book swine not?,False
book,four out of 6 stars for the previous essay,False
book,i want to rate the medici seal two out of 6 points,False
book,i would give this current novel 2 stars with a best rating of 6,False
book,rate the current book a zero,False
book,give 4 out of 6 stars to current chronicle,False
book,rate the broke who killed the middle classes? chronicle a five,False
book,rate this novel five points,False
book,rate gray mountain a zero,False
book,i would rate oblivion stories a two,False
