Intent,Sentence,Outlier
playlist,add this tune to my bedroom jams playlist,False
playlist,add showcase in a suitcase to the chill out playlist,False
playlist,add yma sumac to this is animal collective,False
playlist,add an album to the días de frío playlist,False
playlist,add the tune by misato watanabe to the trapeo playlist,False
playlist,please add carmel to my lunchtime playlist,False
playlist,add licorice mckechnie to just dance by aftercluv,False
playlist,napoleon xiv should be added to sharlenes playlist transatlantic lullaby,False
playlist,can you add danny carey to my masters of metal playlist,False
playlist,add this tune to my top 100 rock tracks on spotify,False
playlist,add this song to my this is kevin johansen,False
playlist,estelle should be on my spring playlist,False
playlist,put the frl menke song in my comedy top tracks,False
playlist,i need to add another track to my cleaning playlist,False
playlist,add this track to my love hurts playlist,False
playlist,add ashley mcisaac to my r&b party classics playlist,False
playlist,add ian stuart donaldson to canadian country,False
playlist,add igor talkow to my women of k-pop list,False
playlist,add this album to my playlist named café libros,False
playlist,add space cowboy to my the funny thing about football is playlist,False
playlist,please add the singer valery kipelov to the perfect concentration list,False
playlist,add a song to ultimate indie,False
playlist,add a song by masayoshi yamazaki to my this is los fabulosos cadillacs playlist,False
playlist,add keltech to my 70s road trip playlist,False
playlist,add bilal to winter,False
playlist,move el viaje de copperpot into my emily dickinson playlist,False
playlist,add songs tune in reggae infusions,False
playlist,add tune to african heat,False
playlist,add track by monster bobby to peace playlist,False
playlist,please put this tune into the all a cappella playlist,False
playlist,add zos kia cultus to the this is philip glass playlist,False
playlist,add dying mapa i to más que amigos,False
playlist,put this track on alok house party playlist,False
playlist,my té para tres needs brave and crazy added on,False
playlist,add a song by claude vonstroke to the under the surface playlist,False
playlist,add xenomania to operación bikiniplease,False
playlist,add curse song to my playlist guest list engadget,False
playlist,can you put musiri subramania iyer s song onto the lo-fi love soundtrack?,False
playlist,add you put a move on my heart to the martin garrix show,False
playlist,add to my playlist lazy chill afternoon nothing can stop us,False
playlist,add brian may to my reggae infusions list,False
playlist,add this rob campanella tune to psychedelic rock,False
playlist,can you put this track onto classic jazz funk ?,False
playlist,add the patty patty sound to my metal talks kreator playlist,False
playlist,add i messed up to hit rewind,False
playlist,add song to kids workout,False
playlist,i want to add this bon scott song to my post-grunge list,False
playlist,add the artist todd snider to my electro latino playlist,False
playlist,put this album on my wild country playlist,False
playlist,can you put a song from tom jones on my electronica & dance playlist,False
playlist,add lisa m to my guitar hero live playlist,False
playlist,add this artist to romántica,False
playlist,want to add pacific ocean blues to the playlist named lunch,False
playlist,add desert sessions to my i love my 80s rollerdisco playlist,False
playlist,add irish heartbeat to my trapeo playlist,False
playlist,add artist to my texas red dirt playlist,False
playlist,can you put freddie freeloader on the playlist instrumental madness,False
playlist,add come on a cone to power walk playlist,False
playlist,add this artist to my grandes unplugged playlist,False
playlist,put li yuchun s album onto the kickass metal playlist,False
playlist,add this album to jenifers mellow dinner playlist,False
playlist,add joe gibbs to my the bachelor party playlist,False
playlist,add a tune to my elrow guest list,False
playlist,add peter banks to verano forever list,False
playlist,add song to instrumental study,False
playlist,id like to put qriii onto songs to sing in the car,False
playlist,put pedro navaja onto my flamenco pa ti playlist,False
playlist,add thomas anders to my crossroad blues,False
playlist,add zamiast burzy to phunkadelic,False
playlist,i want to add a tune to my spanish metalblood playlist,False
playlist,add wastedagain to the wild & free workout playlist,False
playlist,add the trey gunn tune to my french n heavy playlist,False
playlist,add hello i must be going to the power ballads playlist,False
playlist,add la woman to my soul lounge playlist,False
playlist,put corrina corrina onto my classical x list,False
playlist,add this candi staton artist to my dancefloor hits,False
playlist,add this tetsuya komuro track to my soulful disco playlist,False
playlist,i want to add this so chan whee tune to latin alternative music,False
playlist,add song to my el mejor pop en español,False
playlist,add the track to the metal talks metallica playlist,False
playlist,put the song playing on lavernes rapcaviar playlist,False
playlist,add a kanon wakeshima track to the feeling blue playlist,False
playlist,add entre um coco e um adeus to taylors this is john williams playlist,False
playlist,add appreciation day to my folksy love,False
playlist,this artist should go onto my playlist called the piano bar,False
playlist,add inca roads to my weekend,False
playlist,put this album in my fiesta section,False
playlist,add this song to enids romántica playlist,False
playlist,add this artist to my throwback dance party playlist,False
playlist,add animal stories to maryannes by per yngve ohlin,False
playlist,add vyechnyy strannik to lo que suena new york,False
playlist,please add chris frantz to pop rising list,False
playlist,put artist hridaynath mangeshkar onto my night out playlist,False
playlist,add album to acoustic spring,False
playlist,add contact to my nu metal playlist,False
playlist,add entity eternally to playlist lazy chill afternoon,False
playlist,add bronislau kaper to the drive playlist,False
playlist,please add this track to my de camino playlist,False
playlist,add karusellen to jazz brasileiro,False
playlist,add this song by chieko ochi to the drum & breaks playlist,False
playlist,add roel van velzen to the night playlist,False
playlist,add artist danny carey to my classic jazz singers playlist,False
playlist,add por tu maldito amor to my orgullo gay,False
playlist,add shahrum kashani to my country hits,False
playlist,i want another song in the women of latin music playlist,False
playlist,add opus de funk to my list acoustic blues,False
playlist,add genocide to electronic bliss,False
playlist,add this track to my playlist named trabajo relax,False
playlist,for my playlist latin pop rising add aira yuhki,False
playlist,ad artist to sxsw latin my playlist,False
playlist,add keke wyatt to my evening commute playlist,False
playlist,add album to my country hits,False
playlist,add the wee wee man to pamelas stress relief playlist,False
playlist,add hound dog taylor to the miami 2017 guest list playlist,False
playlist,add ihsahn to hip hop 2017 new school,False
playlist,add this album the the playlist canciones que lo van a petar,False
playlist,add the open door to autumn music,False
playlist,add this artist named trevor mcnevan to the playlist top gaming tracks,False
playlist,i want to add something by jarvis cocker to my rock español playlist,False
playlist,this tune should go on my coffee table jazz playlist,False
playlist,add jim martin to deathcore,False
playlist,my timeless love songs playlist should include viderunt omnes,False
playlist,add the album to my top 100 indie tracks on spotify playlist,False
playlist,add rosemary clooney to pura vida playlist,False
playlist,add a song by mark schultz to my ultimate indie playlist,False
playlist,for the playlist wild & free workout add tsidii le loka,False
playlist,put take up thy stethoscope and walk onto my verano playlist,False
playlist,put live and rare into dancehall official,False
playlist,add a song to my playlist independent music monday,False
playlist,put kurt cobain onto korean osts,False
playlist,add the avispa track to my bass gaming playlist,False
playlist,add blag dahlia to pura vida,False
playlist,add etta james to my anochecer urbano playlist,False
playlist,add this track to anochecer urbano,False
playlist,please add this track to my weekend list,False
playlist,add paper doll to the power walk playlist,False
playlist,add this artist to the playlist called evening groove,False
playlist,add top 100 indie tracks on spotify to my track,False
playlist,add this clint mansell song to latin pop classics,False
playlist,add track to orgullo gay,False
playlist,add michael wittig to the party playlist,False
playlist,add tune to women of pop playlist,False
playlist,put the airi suzuki album into my nuclear blast novelties playlist,False
playlist,add scott putesky to concentración indie rock playlist,False
playlist,i want maximilian mutzke added to acoustic concentration,False
playlist,put this song on legendary guitar solos,False
playlist,add coordinates of confusion to bass face playlist,False
playlist,add blood guts & glory to my this is chopin,False
playlist,please place tim wright s track onto the queen playlist,False
playlist,add to anacreon in heaven into the playlist girls night,False
playlist,add this tune by shagrath to black sabbath the ozzy years,False
playlist,add to my playlist heavy gamer the name blaydon races,False
playlist,add this song to tanias new boots,False
playlist,put the mike oldfield album onto my la mejor música para tus fiestas playlist,False
playlist,i want a matt garrison tune in my fresh finds fire emoji playlist,False
playlist,i want to put this track on dianns just smile playlist,False
playlist,add décadas to my list neo da matrix,False
playlist,add split the difference to my womens lit playlist,False
playlist,add some fujimoto yae to my women of rock list,False
playlist,put say it ain’t so into my trap land playlist,False
playlist,add bien acompañado to all out 60s,False
playlist,i want lay down your arms in the indie español playlist,False
playlist,put framed onto my ntc studio sounds playlist,False
playlist,add the darkest red to this is jennifer lopez,False
playlist,add in the heart of the world to the epic gaming playlist,False
playlist,add this artist to lo más dance playlist,False
playlist,add this artist to my garage jams,False
playlist,add this track to llegando a casa,False
playlist,add concrete roots to punk español playlist,False
playlist,i want to add broken hearted melody to the playlist post garage wave revival,False
playlist,add cleo laine to psychedelic rock,False
playlist,put another track in the keep calm playlist,False
playlist,put perfecting loneliness onto primavera sound 2016 barcelona,False
playlist,can super turnt up get added to my emotron playlist?,False
playlist,add song to evening playlist,False
playlist,add villotta to the metalsucks playlist playlist,False
playlist,add anti ep to esenciales,False
playlist,edit top 100 indie tracks on spotify playlist by adding smokefree rockquest 2005,False
playlist,add a song to my playlist impulso creativo,False
playlist,add the go find to sólo para dos,False
playlist,put this tune on all a cappella,False
playlist,add this tune by rafet el roman to my latin pop rising playlist,False
playlist,add this artist to my morning rhythm playlist,False
playlist,add omnipresent to verano,False
playlist,put this tune by mark norman on my keep calm list,False
playlist,add the time warp to wild & free workout,False
playlist,i want cocco added to my post metal playlist,False
playlist,can you put this song on the metal xplorer playlist,False
playlist,put a track by lil mama into my guest list sneaky zebra playlist,False
playlist,add the artist kamil rustam to my relaxing playlist,False
playlist,add this tune to my in the arms of a woman,False
playlist,add chris de burgh in my playlist melancholia,False
playlist,add la voce to my dubstep dangles dirty playlist,False
playlist,send the track from andrew hewitt to the piano ballads playlist,False
playlist,add raz b to drive playlist,False
playlist,add this elbridge bryant song to my inyección musical playlist,False
playlist,add the singer damon johnson album to my african heat playlists,False
playlist,can you put consequences on my sos 48 2016 playlist,False
playlist,can my electro sur have this song added to it?,False
playlist,add track to this is zezé di camargo & luciano,False
playlist,for my playlist post garage wave revival add the name eternal prisoner,False
playlist,i want to put paul young onto all new all now,False
playlist,add little pattie track in nu metal,False
playlist,add hopeful to my this is enrique iglesias,False
playlist,add current track to hillary clintons womens history month playlist,False
playlist,add a kj 52 track to the te quiero playlist,False
playlist,my feelin good playlist needs some mai selim in it,False
playlist,add anson hu to my conexiones list,False
playlist,add a track by big sha to my this is miranda lambert playlist,False
playlist,add this artist to my 59th grammy awards,False
playlist,add rmx works from cyber trance presents ayu trance 3 to judys sophisticated dinner playlist,False
playlist,add one and only to my once upon a time playlist,False
playlist,add new metal tracks in my tune,False
playlist,add patti page album to i love my neo soul,False
playlist,add annette artani to the playlist titled all out 90s,False
playlist,add banking violence and the inner life today to my retro gaming playlist,False
playlist,put this tune on my your favorite coffeehouse playlist,False
playlist,add metal church to my playlist named stress relief,False
playlist,add track to fresh finds,False
playlist,add album to this is trey songz playlist,False
playlist,add song to daily lift playlist,False
playlist,add without your love to my showstopper being mary jane list,False
playlist,add this track to epic wall of sound,False
playlist,can you add a track by david wolfenberger to janells all funked up playlist,False
playlist,i want lance king in my list called one love,False
playlist,add this album to my playlist titled underground hits,False
playlist,i want to add johnny burke to the country bound playlist,False
playlist,add maria magdalena to my poetry in their own voices playlist,False
playlist,add baby lemonade to poetry in their own voices,False
playlist,add defined by struggle to chillin on a dirt road to my playlist,False
playlist,move josiah leming to te quiero list,False
playlist,incorporate nao kawakita into the epic classical playlist,False
playlist,add bret mckenzie to my pop commute playlist,False
playlist,add the name shall we dance to playlist rock,False
playlist,can you add honey hush to hits of the 60s,False
playlist,put some stu phillips in the women of acoustic playlist,False
playlist,add women of metal to odetta holmes,False
playlist,add revolution revolución to my political punks,False
playlist,add zion golan to my signed xoxo playlist,False
playlist,add ava leigh to my grime instrumentals playlist,False
playlist,add daedelus to my lazy chill afternoon,False
playlist,add julia fordham to the massive soca hits playlist,False
playlist,add a track to my alok house party playlist,False
playlist,add big generator to my country icon playlist,False
playlist,put this artist onto political punks,False
playlist,add this tune to my playlist guest list mashable,False
playlist,add all together now to my playlist the road to punk rock,False
playlist,i would like to put taylor dayne on the pop 4 kids list,False
playlist,add tune to downtempo beats,False
playlist,add track to dance playlist,False
playlist,add another tune to my soft rock playlist,False
playlist,can you put in person at carnegie hall on my winter playlist,False
playlist,add visible wings to my playlist entre los andes,False
playlist,add a tune to the calm vibes playlist,False
playlist,stick fonseca in the songs to sing in the car playlist,False
playlist,i wish to put tom baxter onto my coffee table jazz playlist,False
playlist,add cary brothers to rock the 2000s playlist,False
playlist,put horace silver and the jazz messengers on my running to rock 170 to 190 bpm playlist,False
playlist,i want to add up to the mountain to my playlist with the title women of indie,False
playlist,add los hombres calientes volume 3 new congo square to my descanso infinito playlist,False
playlist,add driven to tears to the viral semanal playlist,False
playlist,add the private collection onto my cena elegante playlist please,False
playlist,add boyce and hart to urban hits playlist,False
playlist,add an artist to my hype list,False
playlist,add this track by flesh n bone to cherrys spa treatment playlist,False
playlist,add all bad to the summer of love playlist,False
playlist,add this album to the playlist guest list engadget,False
playlist,add circus to my post garage wave revival list,False
playlist,this track should get added to spain top 50,False
playlist,add get happy to cherrys las canciones más lindas del mundo,False
playlist,add halley to this is tchaikovsky,False
playlist,add this song to my the perfect italian dinner playlist,False
playlist,add this song to my canción del día playlist,False
playlist,add nico to my rock to work,False
playlist,please add a track to my playlist called this is coti,False
playlist,add grey cloudy lies to the hip hop playlist,False
playlist,add willie nelson live to my acoustic blues playlsit,False
playlist,add yang hyun seok to the playlist called night out,False
playlist,add an album to my playlist bachata lovers,False
playlist,add this album to my orgánica playlist,False
playlist,add spirit touches ground to my leche con chocolate list,False
playlist,i want to add the war is not over to geraldines pop punk powerhouses playlist,False
playlist,add hello my lover goodbye to my deathcore playlist,False
playlist,i need to add to the funk soul disco playlist my favorite artist,False
playlist,add the artist verano to my michael mantler playlist,False
playlist,add the yumi matsuzawa album to my sexy as folk playlist,False
playlist,add warning device to my mac n cheese playlist,False
playlist,add this tune to hipster soul,False
playlist,add tune to blues,False
playlist,can you add something by vikki thorn to my lo mejor de los 80s playlist,False
playlist,add venetian snares onto the atmospheric calm playlist,False
playlist,add theater to my new metal tracks playlist,False
playlist,add yoshiki to the 35 soul classics 1970 to 1975 playlist,False
playlist,add dan the automator to forever country,False
playlist,add tune to my mellow bars playlist,False
playlist,include the past behind in my top 100 rock tracks on spotify playlist,False
playlist,put gregory douglass in halloween teens please,False
playlist,add lene lovich to my track radar latino,False
playlist,add christopher lawrence to my always pop punk playlist,False
playlist,add geminism to power workout list,False
playlist,add album to my massive soca hits,False
playlist,add doing all right to string theory,False
playlist,add milas poli to my indie bluegrass,False
playlist,add lee seung gi to my baila reggaeton playlist,False
playlist,can you add john scofield newest tune the selektor to the playlist,False
playlist,add this annabella lwin track to indie alternativa,False
playlist,put another tune into my dancehall official playlist,False
playlist,add paloma negra to my funky jams list,False
playlist,please put the album onto fresh folk,False
playlist,add mc ren to my its a southern thing playlist,False
playlist,add the tune to my viajes playlist,False
playlist,put conway twitty in the this is tchaikovsky playlist,False
playlist,add joshua radin to my playlist called futuros hits,False
playlist,add art garfunkel to the chill tracks playlist,False
playlist,add bryan gregory to the playlist emily dickinson,False
playlist,add another song to my this is status quo playlist,False
playlist,add the album to my sleep playlist,False
playlist,put something by noah wuv bernardo on my humor playlist,False
playlist,add this eric weissberg song to my dance workout,False
playlist,add rak biszewilo to my playlist named jazz,False
playlist,add fear and bullets to my chill tracks playlist,False
playlist,id like to put duett onto my hot country playlist,False
playlist,add r u still in 2 it to the under the surface playlist,False
playlist,add this song by george melly to my 90s baby makers playlist,False
playlist,add this tune to my this is luis fonsi playlist,False
playlist,include in my dreams in the this is new edition playlist,False
playlist,add future to this is al green,False
playlist,add steve winwood to my playlist old school metal,False
playlist,add changes & things to hot 50 playlist,False
playlist,add george baker to hiphop hot 50,False
playlist,add the artist leann rimes to the women of indie playlist,False
playlist,edit aux cord privileges playlist by putting this tune on it,False
playlist,can you put this tune onto erins house afterwork playlist?,False
playlist,add artist to latin pop hits,False
playlist,play used to love her to my this is animal collective playlist,False
playlist,add arthur russell to my women of disco playlist,False
playlist,add francesco de gregori to my classical new releases spotify picks playlist,False
playlist,play suus to my the funny thing about football is playlist,False
playlist,add outside the dream syndicate to millicents fresh electronic playlist,False
playlist,add this tune to the duetos playlist,False
playlist,put playa fly onto my 2010 decade playlist,False
playlist,add that was only yesterday the last ep to my afternoon train ride playlist,False
playlist,put strange days onto the fusion fest playlist,False
playlist,add this track to my flamenco pa ti,False
playlist,add philip labonte to women of r&b playlist,False
playlist,put ramy ayach on latin pop rising,False
playlist,add tune to my country playlist,False
playlist,put nothing remains the same on my summer music playlist,False
playlist,add flying to my women of rock playlist,False
playlist,id like to put ryō yamazaki onto my sylvia plath playlist,False
playlist,add sweets edison to relaxing playlist,False
playlist,add ana carolina to chill,False
playlist,add decade in the sun best of stereophonics to laundry,False
playlist,add artist to my friendesemana playlist,False
book,rate the fall-down artist 5 stars,False
book,rate the current novel one points,False
book,rate the ape-man within 4,False
book,give 5 out of 6 points to absolutely positively not series,False
book,i give emile or on education five points,False
book,rate licence renewed a 4,False
book,give this essay a 2 out of 6,False
book,a rating of 5 of 6 points goes to dickson mccunn trilogy,False
book,rate beyond the shadows 3 of 6,False
book,give 2 out of 6 points to the following textbook,False
book,the previous textbook is a 3,False
book,rate in stars as a 6 for lord of the shadows which gets a four,False
book,give 0 stars to this textbook,False
book,give this book a rating of 3,False
book,rate the tropic of cancer book a 2 out of 6,False
book,give the judas tree a zero,False
book,rate this book titled cold two stars,False
book,rate the current book a zero of 6,False
book,i would rate this chronicle 4 stars,False
book,give a human being died that night 3 stars,False
book,rate this current saga 3 out of 6 points,False
book,rate the wild boy series 3 out of 6 stars,False
book,rate this album a one,False
book,give this textbook 5 points,False
book,rate the current saga a five,False
book,give 0 rating to she and allan book,False
book,i want to give this album 3 points,False
book,rate the cry of the owl a four,False
book,a novel of this quality deserves your rating of four points,False
book,i want to give this album zero out of 6 stars,False
book,swine not ? deserves four points,False
book,give the current series 3 points,False
book,rate this book three points,False
book,rate the keys to the white house a zero,False
book,rate an act of terror 2 stars,False
book,rate call for the saint 1 out 6 points,False
book,rate merlin effect a 0,False
book,the last hawk gets a total of 3 out of 6 stars from me,False
book,0 stars for this textbook,False
book,give this current novel a 4,False
book,give this current novel a three,False
book,rate the current chronicle book three points,False
book,rate the bunce 1 stars,False
book,give this textbook a rating of 3,False
book,rate this textbook 2 of 6 stars,False
book,rate the book post office four points,False
book,give 5 rating for this textbook,False
book,i give this next essay zero out of 6 points,False
book,rate the current novel 3 of 6 stars,False
book,rate the watsons four of 6 stars,False
book,rate this current book album four stars,False
book,give the current novel 5 points,False
book,rate this current essay three out of 6 stars,False
book,this is rated 5 out of 6 for an essay,False
book,rate the current album one points,False
book,i give a zero rating for this essay,False
book,rate the current album 3 of 6 stars,False
book,rate this chronicle three of 6 stars,False
book,i rate the chronicle son of the tree with four of 6 points,False
book,this current album deserve 0 points and a best rating of 6,False
book,i rate the variation of animals and plants under domestication a value of 0,False
book,rate this textbook a zero,False
book,the current textbook gets 3 stars,False
book,rate the stars shine down 5,False
book,i think this essay should be given four points and a best rating of 6,False
book,for this current saga i give 5 out of 6 possiable points,False
book,i give the lacuna a rating of 5 stars under the chronicle rated at 6,False
book,give zero point to this textbook,False
