Intent,Sentence,Outlier
movie,can you tell me the movies playing at united paramount theatres,False
movie,tell me the films playing at the closest movie house to me,False
music,play yo ho from the new york pops on youtube,False
movie,find movies that are nearby,False
music,play my new indie mix on google music,False
music,turn on last fm,False
music,play some thirties music on netflix,False
movie,what theater is playing death drums along the river at 5 pm,False
music,play water under the bridge by hariprasad chaurasia,False
music,play safe rock and roll sucks on lastfm,False
movie,are any films play at the santikos theatres,False
music,play some rachel stevens off of itunes,False
music,use spotify to play me music,False
music,play say a word by la india,False
music,play how does it work by helen carter,False
music,plpay the top ten track from asia nitollano on spotify,False
movie,is and the ship sails on playing at douglas theatre company 1 minute from now ?,False
music,play something off rage radio,False
movie,what animated movies are showing at loews cineplex,False
movie,find the movie schedules for me,False
movie,what time is stranger in town playing at the nearest cinema ?,False
music,play mikazuki sunset,False
movie,what films are showing at cineplex odeon corporation ?,False
movie,what are the movie times for animated movies nearby ?,False
movie,what movies are playing at warren theatres,False
music,play the greatest adrian kowanek music,False
music,play music from artist ashley,False
movie,tell me when howling ii your sister is a werewolf is playing,False
movie,what time will paris by night aired,False
movie,what films are showing at the closest movie theatre ?,False
movie,i m looking for local movie schedules,False
music,play a tune by margaret kelly on iheart,False
music,i d like to hear infinite indie folk on slacker,False
movie,please tell me what the movie schedule looks like for the amc theatres in twenty one hours,False
music,i want to hear symphony songs from rebecca cartwright on last fm,False
movie,i want to watch mister cool,False
music,use the service itunes to play melody from 1998,False
movie,find the schedule for chronicle of my mother at the nearest cinema in 1 minute and 8 seconds,False
movie,what films are showing in the neighborhood,False
music,play music from 1959 by lenny leblanc on pandora,False
music,play some armik from the fourties,False
music,play slacker radio,False
movie,is the ghost breakers playing at plitt theatres in two hours,False
movie,what films are showing at cooper foundation,False
music,play me a 2003 song by charles neidich,False
music,listen to vertexguy track,False
movie,find the movie schedule for films in the area,False
movie,find endless horizons,False
movie,show me the schedule of movie michel strogoff,False
music,open up music on last fm,False
movie,what are the movie schedule at malco theatres,False
movie,give me the movie schedule for animated movies showing in the neighborhood,False
movie,where s the nearest movie house playing no trains no planes,False
movie,what films are at the nearest movie theatre,False
movie,find the schedule for metallica through the never,False
movie,i d like to watch health warning at the closest movie house,False
music,play some glenn miller,False
movie,show movie schedule for animated movies in the neighborhood,False
music,i want to listen to speed metal symphony,False
music,play music from my relentless playlist,False
movie,i want movie times for fox theatres,False
music,play a 1964 symphony on netflix,False
movie,is the lady and the highwayman playing at 7 a m at dipson theatres ?,False
music,play top 100 indie tracks on spotify on lastfm,False
movie,what animated movies are playing at the douglas theatre company,False
movie,where animated movies does north american cinemas feature,False
movie,please show me the closest movie house playing wild on the beach in 1 minute,False
movie,what is the movie schedules for the movies nearby playing 23 seconds from now,False
music,i want to hear music off my indie festival playlist,False
movie,show me the movie schedules for movies playing around here today,False
music,i d like to hear helen baylor,False
music,play some music on vimeo,False
music,play henrie mutuku album from 1957,False
movie,find movie schedules at imax corporation,False
movie,is goodbye mr chips showing twelve minutes from now,False
movie,what is the nearest cinema playing romance of the limberlost,False
movie,is holy matrimony playing at national amusements ?,False
music,play a new symphony by perfecto de castro on lastfm,False
music,play 2004 guy sebastian on itunes,False
movie,is the strange case of the end of civilization as we know it playing at the movie theatre,False
movie,find the schedule for tube at the closest movie theatre,False
music,play some music on itunes,False
music,play inside the eye by twinkie clark,False
movie,whats the closest cinema that shows movies at 12 a m,False
music,play me a song by steve hackett from manuel,False
music,i want to hear a sandra ep,False
music,play fourties tunes by bryan webb on groove shark,False
music,play some techno on lastfm,False
music,play record from the seventies,False
movie,check the movie schedules,False
music,play music by billy powell,False
music,play some 1954 songs on my itunes,False
movie,what animated movies are showing in the area ?,False
music,play my trapeo playlist,False
movie,i want to see the movie schedules for animated movies around here,False
movie,when is sea of fear being shown at the closest movie theatre ?,False
movie,i want to see movie times at neighborhood cinema group,False
music,play music year 2016 by artist michiru yamane,False
movie,what s the movie schedule for films in the neighbourhood,False
movie,give me the schedule for what a wonderful place at cinemark theatres,False
music,play foundling by jean grae on vimeo,False
music,play i believe from chico buarque off of iheart,False
movie,find captain kronos - vampire hunter,False
music,i d like to hear some trip-hop,False
movie,let me know when i can watch actrices,False
music,play giovanni battista guadagnini s 1982 tracks,False
movie,at amc theaters what is the movie schedule ?,False
music,please play some music from the seventies movement,False
movie,what are the movie times for the caribbean cinemas ?,False
music,use itunes to play dancing playlist,False
music,please play something on last fm,False
music,play dave mason s soundtrack on last fm,False
music,play valerij kipelov on vimeo,False
music,play the seventies album on last fm,False
movie,is dead fish playing at the movie house,False
music,play me songs from agreable,False
music,play the galway races on netflix,False
movie,please give me information on when prisoner of zenda will be shown,False
music,play the track goodbye alexander goodbye honey boy from ehsaan noorani,False
music,i want to hear something by joe dolce on google music,False
music,will you pull up my jueves de antaño playlist,False
movie,find the schedule for central airport at the closest movie theatre,False
music,play the edge by deezer on vans warped tour compilation 2003,False
movie,what s the closest movie theatre that s showing dough nuts ?,False
music,play some music from 1985 by rolf harris,False
movie,is unsettled land playing at the movie theatre,False
movie,what are the movie times for films playing nearby,False
movie,i d like to see movie times please,False
movie,what time does kraken tentacles of the deep play,False
movie,please give me the movie schedule for pacific theatres,False
music,play a top-five song by pete candoli,False
music,play the charlie hunter theme off of last fm,False
music,play make the cowboy robots cry by sabin rai on vimeo,False
movie,when is nattbuss 807 playing at a movie theatre near me,False
movie,find a movie theatre with life and death,False
music,play some 50 shades of love,False
music,can you play a song by ken,False
music,can you play some music from 1999,False
music,play a nineties tune by sugar minott on netflix,False
movie,what is the films with movie times in the area,False
movie,i d like to watch apocalypse 2024,False
movie,can i get todays movie schedule for the movies that are close by ?,False
movie,what movies are starting in 1 second at a theater in the neighborhood ?,False
movie,show me the movie schedules for animated movies around here,False
movie,can i watch the sound of war in thirteen minutes at the nearest cinema,False
music,play an album from the fourties new first,False
music,play a top symphony from the fourties,False
movie,which movie theatre nearest me is showing animated movies starting now ?,False
music,can you play the newest record from 1966 by tony lee,False
music,play a record from 2015,False
music,play leanne dobinson right to dream,False
music,play lenny kaye music,False
music,play an album from 1987,False
movie,what films are playing at dipson theatres and when,False
movie,where can i see young goethe in love ?,False
music,i want to hear secrets on parade from tommy walter,False
music,play some seventies music on netflix,False
movie,find death is called engelchen at neighborhood cinema group,False
music,play a song off get up offa that thing by doseone on last fm,False
movie,show me the schedule of movie interview the documentary in loews cineplex,False
movie,is tarzan of the apes playing at cobb theatres,False
movie,find movies nearest to a movie house,False
music,play the top caleigh peters,False
music,play new movement from mike oldfield on vimeo,False
music,open my music playlist on youtube,False
movie,where is the nearest movie theatre that is playing the king maker,False
music,play the top-fifty theme songs by dennis brown,False
music,i need rave slacker to play,False
movie,what movie times,False
movie,i need movie times for movies playing in the area,False
movie,what films are showing in the area ?,False
music,play matt walker tunes,False
music,play ecstatic,False
music,play some music by mark heard,False
music,play some eighties by amirbai karnataki,False
movie,what time is bloody twilight playing?,False
music,can you play the greatest songs by mauro picotto,False
music,play me a mario vazquez movement,False
music,play some spotify by danni bassan,False
music,play salmonella dub dvd by mario rubalcaba on vimeo,False
movie,find movie schedules for imax corporation,False
music,play realization by randy jackson,False
movie,which movies are playing in the neighborhood ?,False
music,i want to hear jon sholle s stuff from 2009 on groove shark,False
music,play the last chris douglas on slacker,False
movie,where can i watch the sword of ali baba at two p m ?,False
music,play some classical music on spotify,False
music,play the song shine a light,False
music,play the best elizaveta khripounova,False
movie,what time is living is easy with eyes closed playing,False
music,play bob hilliard top-twenty music,False
movie,find the schedule for the solitude of prime numbers at the nearest cinema in 1 hour,False
music,play a fairouz tune on deezer,False
movie,find the movie schedule for nearby movies,False
movie,what is the movie schedule for films in the neighbourhood,False
music,play me a mel draisey tune from the fourties with vimeo,False
movie,when are the movie schedules,False
music,i want to listen to my spain top 50 playlist on groove shark,False
music,play the soft parade,False
music,play rhythmic,False
movie,list movie times at cinemark theatres,False
music,play the last theme by behzad mirkhani,False
music,play some rock & roll by deezer,False
music,use pandora to play korean osts,False
music,play something from 1981,False
music,play the latest ep from lobby loyde on netflix,False
music,play pandora christian gangsta rap,False
movie,are there movies at malco theatres,False
music,play pandora,False
music,play seasons in the sun by rosco gordon on iheart,False
music,play revival music,False
music,play soundtrack by armand van helden,False
movie,which films are playing in the neighbourhood ?,False
movie,i d like to know the movie times for movies nearby me,False
music,play me a nineties ep,False
movie,i would like to see the closest cinema playing films,False
music,play some twenties chant music on slacker,False
movie,is hercules and xena the battle for mount olympus playing at the closest cinema,False
music,play some movement music by perez prado on iheart,False
music,play some music from 1958 on deezer,False
movie,show films at the nearest cinema,False
movie,what animated movies are at fox theatres,False
movie,find movie schedules for close by films,False
music,can you play some music from my road trip album,False
movie,what movies are playing at the closest movie theatre,False
movie,can i get the movies showtimes for the closest movie house,False
movie,show me the current movie times,False
movie,show me the nearest movie house showing the luckiest girl in the world,False
movie,showtimes for the alamo drafthouse cinema for todays movies,False
music,let me listen to rouhollah khaleghi on deezer,False
movie,in one hour find king of hearts,False
music,play some sixties music by gaudi on last fm,False
movie,what is the movie schedule for films that are playing nearby in 15 minutes,False
movie,i d like to watch movies around here can i see the movie schedules,False
music,play some joeri basjmet,False
movie,what is the movie schedules for movies in the area,False
music,play music by don reno,False
music,play asia nitollano using itunes,False
movie,find the movie schedules for speakeasy theaters,False
movie,what time can i see the conflicts of life,False
music,play a melody by shada hassoun,False
music,i want to hear the latest twenties album from kyle riabko,False
movie,what kind of films are at the closest movie house,False
movie,what time is pussyfoot playing at pacific theatres ?,False
music,play a top five linda strawberry ep,False
music,play goldie hill s record on google music,False
music,play the playlist funtime activity,False
music,play the top fifty soundtrack from the twenties,False
movie,find chained heat,False
movie,find a movie house with hollow reed,False
movie,what theater is playing haunted honeymoon,False
music,play one way ticket by ray kennedy,False
movie,shoe the movie showings for the closest cinema showing international movies,False
movie,i d like to see local movie times,False
movie,what s today s movie schedule,False
movie,what movie theatre is palying the hurricane five hours from now,False
movie,what is the closest movie theatre showing in pursuit of honor ?,False
music,play funtime activity,False
music,play yusef lateef songs from the fifties,False
movie,what movie times are there at arclight hollywood,False
music,play theme music from the twenties by tata young,False
movie,what time is the mourner playing at the movie house ?,False
music,play a 1994 tune by lena horne,False
music,play some sonu niigaam from the fifties,False
movie,what animated movies are playing now in the neighborhood,False
music,play entre raices y antenas by lynn & wade llp,False
movie,movie schedule of films around here,False
music,"play bill evans album the best of the 12"" mixes",False
music,play the song american patrol by lauryn hill,False
music,i want to hear some acid punk music,False
movie,i need to see the movie schedules,False
movie,find the schedule for movies at southern theatres,False
movie,find kerasotes theatres showing animated movies,False
music,play tenerife sea by daniel salomon on lastfm,False
movie,what is the nearest movie house showing animated movies,False
music,play tune from sonny stitt,False
music,play lil hardin armstrong from itunes,False
music,please play an album from 1987,False
movie,find the closest movie theatre with animated movies,False
movie,find me the showtimes for until death at the nearest movie house,False
music,play 1981 tunes by jiles perry richardson on lastfm for theme music,False
movie,11 seconds from now find a cinema with first monday in october,False
music,play some music from 1962 from adeyto,False
music,play top-twenty song from 2015,False
music,play a song from 2003,False
movie,can i see the movie schedules nineteen minutes from now ?,False
music,turn on google music to play 1991,False
music,play mere lapsed by marilyn moore,False
music,play a twenties soundtrack on youtube,False
movie,tell me the movie schedules,False
music,play the last soundtrack from the sixties,False
movie,i d like to watch in high places,False
music,play music from the punk genre on last fm,False
movie,can i get the showtimes for films close by ?,False
movie,i d like to watch films at marcus corporation at twelve p m,False
movie,what time is phil ochs there but for fortune playing at the movie house,False
movie,are there any animated movies playing at the closest cinema ?,False
movie,i d like to watch movies at the closest movie theatre,False
music,play a melody from elmer bernstein,False
music,play songs by gamble rogers,False
movie,what animated movie are at the theater in the neighborhood,False
music,play some paulinho da viola from 1965,False
movie,find the nearest movie theatre with movies,False
movie,find out what films are playing at north american cinemas,False
movie,can i get the showtimes for animated movie in the neighbourhood ?,False
music,play a movement from the nineties,False
movie,what animated movies are playing close by at four o clock ?,False
movie,i d like to watch nathan the wise at the closest movie house,False
music,play the música da série de filmes o hobbit album by alex otaola,False
music,play a song from my workout playlist on groove shark,False
music,play glenn yarbrough tunes,False
movie,show me the movie times for caribbean cinemas in 1 second,False
movie,find national amusements showing the sea is behind,False
movie,list movies for nearest movie house at brunch time,False
music,play some music from 2011 on lastfm,False
movie,find me the age for love playing at the closest movie house,False
movie,what animated movies are at the closest movie house near brunch,False
music,play a record from 1982,False
movie,is love marilyn playing,False
music,play music from 1968 on vimeo,False
music,play some papoose from 2003 on youtube,False
movie,show me the movie schedule for loews cineplex,False
movie,find the schedule for better this world at a movie house,False
movie,find the schedule for movie times,False
movie,what animated movies are showing in the area,False
music,play anweshaa by the new first,False
music,play some maynard james keenan songs from scenes from the big chair,False
movie,in the area find some films,False
movie,i need the movie schedules for century theatres,False
movie,give me the showtimes for the rum diary at mjr theatres at meal time,False
movie,what time is tommy and quadrophenia live playing at marcus corporation,False
movie,show me the movie schedule,False
music,play me some music on deezer,False
music,play neutrons by seun kuti,False
music,play symphony music from 1991 by irvin mayfield,False
movie,is liberator playing at the imax corporation at 11 ?,False
music,play gary chapman music from the fifties,False
music,please play something that s freak folk on google music,False
movie,is lord jim at the movie house,False
music,play the top 1991 sound track,False
movie,give me a list of movie times for films in the area,False
movie,find the schedule for for the day of the jackal at pacific theatres,False
movie,what time is bhoomi geetha playing at the movie theatre,False
music,please use itunes to play something from 1986,False
music,i want to hear a top five ballad from 2002,False
movie,can i go see cash and curry at a movie theatre ?,False
music,can you play me some eighties music by adele,False
movie,can i get the marine 2 showtimes,False
music,can you play a chant by butch trucks on spotify,False
music,play a fifties theme on lastfm,False
music,play tanti auguri a te from bruce gilbert,False
music,play a track by mila islam from deezer,False
movie,what time is the cobbler playing at the closest movie theatre ?,False
movie,what film is playing at landmark theatres,False
movie,what movies are playing at dipson theatres,False
movie,find the movie schedules at magic johnson theatres,False
music,play some 1962 theme music,False
music,use service vimeo the genre slow rock,False
movie,what movie theatre closest to me is playing animated movies and when,False
movie,show me when and where i can see song of summer,False
music,play me the greatest howard levy song,False
music,play the top song from damon albarn using slacker,False
music,play twenties music off of my itunes,False
music,play that would be something by eden ahbez,False
music,play pura vida,False
music,play music from itunes for ric grech,False
music,play the album cara de dios,False
music,play chant music from 1993,False
music,i want toi hear some pop punk perfection 🍕 off of deezer,False
music,play a sound track by vegard sverre tveitan,False
movie,find national amusements showing the trouble with harry,False
music,play wow by jon theodore,False
music,play some 1999 symphony from minami takahashi,False
music,play escapada,False
movie,what are the movie schedules for great escape theatres,False
music,play something off google music,False
music,play any album from the twenties,False
movie,what time is irreconcilable differences playing regal entertainment group,False
movie,what is the nearest cinema playing the hour of temptation,False
movie,find what movies are showing at the nearest movie house,False
music,play randy castillo s music from 1952,False
music,play some music from the fourties,False
movie,what time is i know that you know that i know lpaying,False
movie,show me a movie theatre where screamplay is playing,False
movie,does mexican werewolf start at three am,False
music,sort to the last song on playlist from 1983 a chant by mark oliver everett,False
music,play some jpop on google music,False
music,play some space music on google music,False
music,i want to hear theme songs from zeebra from the sixties on slacker,False
music,play robin hood and the bishop of hereford by jon mayer,False
movie,what animated movies are at the nearest cinema,False
music,play a ladyhawke record,False
music,play music from the artist taktloss from the record in the thirties,False
music,play stevan faddy on google music,False
movie,find the schedule for idols of clay at a movie house,False
music,play a song on zvooq,False
movie,what movies are playing at amc theatres ?,False
movie,find movie schedules with animated movies close by,False
music,play the top-5 sort of ballad music from 2012,False
music,play regulate…g funk era by artist iouri bachmet on groove shark,False
music,play my tribute by billy cox,False
music,play some acapella music,False
music,can you play something off johan larsson s travelers and thieves,False
music,play a top-fifty 1965 album by ski,False
music,play the mister music man by gene de paul,False
movie,show me the movie times for films nearby,False
music,use netflix to play michael white tune from 1955,False
movie,i want to know the films playing at the closest movie house,False
music,play music from lastfm,False
music,play tom baxter tracks,False
music,play sense tu from ebi hamedi,False
movie,find movie schedules for movies in the area,False
movie,can i get the showtimes for the closest movie theatre that has the newest films,False
movie,when is eye of the spider playing at regal entertainment group ?,False
music,i want to hear a 1976 symphony by jam master jay,False
music,play me a song from 1972 by sweet emma barrett,False
movie,can i get the newest listings for movies at harkins theatres,False
movie,what are the movie schedules for the caribbean cinemas,False
music,i want to hear a good album from toni cottura,False
music,play the last sound track by soko from around 1975,False
music,play music from 2005 by justin broadrick,False
movie,is the missing clerk playing,False
movie,show me movie schedule for animated movie around here at eleven a m,False
movie,where is the chief cook playing,False
music,play pandora tunes from the fourties,False
movie,can i get the movie times for in the neighbourhood movies,False
music,play some music from miss platnum,False
movie,what time is the queen of moulin rouge playing?,False
movie,when will the flower and the angry waves be showing?,False
music,play some glenn stetson music on spotify,False
movie,tell me the movie schedules for loews cineplex entertainment,False
movie,what s the movie schedule at national amusements,False
music,play the song domino by luca turilli,False
music,play the top-ten chant doda songs from the twenties,False
music,play music by don cherry,False
music,play a melody from elmer bernstein,False
movie,find a cinema closest with animated movies,False
music,play some oleg anofriyev from 1960,False
movie,can you let me know where i can watch the nest ?,False
movie,what time is utamaro and his five women showing at alamo drafthouse cinema,False
movie,what is the movie schedules,False
music,play music from 2012 by yossif kobzon on last fm,False
music,i wish to listen to eighties music by mike dean,False
music,use google music to play a song,False
music,play music from the twenties with slacker,False
music,i want to hear eighties music by noko on deezer,False
music,play the top jazz record from 1951,False
movie,please tell me the movie schedules ?,False
music,play dj cameo on itunes,False
movie,i d like to watch the details at the cinema,False
music,play these four walls by yummy bingham,False
music,play some folk-rock music,False
music,play some caribou from the sixties,False
movie,what time is careful he might hear you playing at the cinema,False
music,play me a twenties song,False
music,play the track siberian khatru on zvooq,False
music,play the newest ep from the sixties,False
movie,what films are at cineplex odeon corporation,False
