Intent,Sentence,Outlier
movie,what films are at kerasotes theatres,False
movie,what movie house is playing the animated movies nearest ?,False
restaurant,i need to book a restaurant in sunnybrook for 7,False
movie,what is the movie schedule for train,False
movie,what films are showing at national amusements,False
movie,please check the movie schedule,False
movie,what time is the closet cinema playing movies the closest,False
restaurant,book me a reservation for the brazen head in hecker,False
movie,show me the movie schedule for the cooper foundation,False
movie,find lost in space,False
restaurant,need a jewish in maine to book a restaurant,False
restaurant,book james d conrey house for madeleine keisha and clara alvarez far from your colleagues college,False
restaurant,book a table at a bar in argentina,False
movie,need to see mother joan of the angels in one second,False
movie,find the movie schedule for movies close by,False
movie,when is the woman going to be scheduled at the closest movie house ?,False
movie,is you will meet a tall dark stranger at bow tie cinemas,False
movie,show me the movies at the closest cinema,False
movie,find the movie schedules for cineplex odeon corporation,False
restaurant,book a pub for two on jan first 2037,False
movie,where is wild america showing at zero p m,False
restaurant,find a reservation for 3 people,False
movie,show movies at the nearest movie house,False
restaurant,i want to book the best steakhouse with south american cuisines in alaska,False
movie,give me the movie schedule at santikos theatres,False
restaurant,book a restaurant at sixteen oclock in sc,False
restaurant,please reserve a table at the food truck in wheeler for december 4th 2019,False
restaurant,book a spot for ten at a restaurant with a spa in us minor outlying islands,False
restaurant,i want a table for eight at gu,False
restaurant,i need to book the best food court in within the same area as ok that serves persian food for my ex husband and i,False
restaurant,lets go to a bistro in sd,False
movie,what time is bhoot returns showing at douglas theatre company,False
movie,what are movie times for movies playing in the neighborhood ?,False
movie,find santikos theatres showing animated movies,False
restaurant,book a restaurant for three people in jenkins,False
movie,which animated movies are playing at megaplex theatres at tea time?,False
movie,find the movie schedule for century theatres,False
movie,find the schedule for movies at plitt theatres,False
movie,what are the movie schedule now,False
restaurant,i need a table for 1 minute from now at any pub for five around in that also serves fisnn chips,False
movie,tell me what films are around here,False
movie,give me the movie schedule for films in the area,False
movie,find a cinema for the tenderfoot nearest me,False
restaurant,book a table at a pool bar,False
restaurant,make me a reservation at a bar for a party of 7 in indonesian,False
movie,what films are showing in the neighbourhood,False
restaurant,book the middle east restaurant in in for noon,False
restaurant,book a spot for nine in lavalette guam,False
restaurant,book a brasserie for connie scott and madeline in northern mariana islands in eleven hours,False
movie,where is nichiren to mōko daishūrai playing,False
movie,is jack the ripper playing in one hour at the nearest movie house ?,False
restaurant,book a restaurant for four in trinidad and tobago,False
restaurant,book a table for kirsten price audra and i faraway from our location at an outdoor taverna,False
movie,what movies are currently at star theatres ?,False
movie,find me showtimes for animated movies in the neighbourhood,False
restaurant,i need to book a table at a bar in micronesia for tia madeline and estela,False
movie,find dipson theatres animated movies,False
restaurant,party for 2 in cleveland,False
restaurant,book a table for 3 at a top-rated restaurant,False
restaurant,book me a reservation for a mediterranean restaurant on confederate memorial day nearby ocean grove,False
movie,what movie schedules start at sunset ?,False
restaurant,book a spot for 8 in a cafeteria with german chocolate cake in ecru new mexico,False
movie,movie times at warren theatres,False
movie,what time is the corner playing,False
movie,is the happy hooker goes hollywood at the movie house nearest me,False
movie,where is the beach of lost children playing,False
movie,find the broken,False
restaurant,book a table for 9 scheduled for april the 8th in nj,False
restaurant,book a reservation for a parry of eight for a restaurant in birch river mo,False
restaurant,book a spot far from Åland,False
movie,show movie schedules for marcus corporation,False
movie,what movie house is the closest playing animated movies,False
restaurant,i need to book a tropézienne restaurant six hours from now,False
restaurant,make a table reservation at the top-rated brasserie in cotton center,False
restaurant,book a delicatessen that is indoor for 3,False
movie,what movie theatre is playing the deaths of ian stone,False
movie,what film to see at arclight hollywood,False
restaurant,i need a table for 2 on feb 18 at main deli steak house,False
movie,i need information on movie schedules,False
restaurant,book reservations at a nearby restaurant in montenegro for four people,False
restaurant,find a reservation at boone tavern for 4 people in 10 24,False
restaurant,i want seats for 4 at a sichuan food restaurant in indonesia,False
restaurant,i need a reservation for a restaurant now with a party of 9 in hilt,False
restaurant,book a restaurant with parking for three people,False
restaurant,book a restaurant in gate city for 5 people,False
movie,what time is three cuckoo clocks playing?,False
restaurant,i would like to book a fry sauce bar for jul 3 2019,False
movie,is blood is not fresh water playing at this movie theatre at 2 am ?,False
restaurant,i want to book a restaurant for supper in kellerton for 2,False
restaurant,can i get a table for 3 in gu at a restaurant in the neighboring area that serves chicken french ?,False
restaurant,id like reservations for two at a pizzeria 22 weeks from now,False
movie,find a movie house closest with beethoven lives upstairs,False
movie,what animated movies are playing nearby,False
movie,will i be able to watch camping-car at movie house at 6 pm ?,False
restaurant,book me a reestaurant that is close in the country of cocos islands,False
restaurant,reservea table for five people on september second in gabon,False
restaurant,i need a table at somewhere within walking distance of nv on november the 24th 2027,False
restaurant,book a tavern on lincolns birthday lincolns day,False
restaurant,book a restaurant in three points,False
movie,what time is the bride wore boots playing,False
movie,i need to know what theatre is playing a happy coersion,False
restaurant,book a table on 6 14 2035 at a bakery within walking distance of equatorial guinea that serves paella,False
movie,what movie schedule are in the area for animated movies,False
movie,what time is the dungeonmaster playing at amc theaters,False
restaurant,book a restaurant for me and my mother in law in montserrat,False
restaurant,i need a table at a steakhouse in encino that serves meatcake,False
restaurant,i need a fast food restaurant that will seat two in a smoking room,False
restaurant,book a popular restaurant for two which is distant from avalon,False
restaurant,get me a reservation for 1 somewhere in spade at seventeen oclock,False
movie,what movie times are at bow tie cinemas ?,False
restaurant,i want to book the clarke cooke house in uzbekistan,False
movie,is this film going to be at malco theatres ?,False
movie,can i get the movie schedule for the bow tie cinemas,False
movie,when is the blue of heaven playing?,False
restaurant,i need a reservation for four at a restaurant in 1 hour and 1 second,False
restaurant,me and katharine would like to go eat at jan 22nd in ia,False
movie,when is the blood of others playing?,False
movie,what time is the rumyantsev case playing at the closest cinema,False
movie,what time is one night stand showing at cineplex odeon corporation,False
movie,please find the closest cinema that s playing movies at 9 am,False
movie,when does miss sloane play at imax corporation,False
movie,what are the current showtimes for love fiction ?,False
movie,what is the showtime for arsho,False
restaurant,bar restaurant for november the twelfth 2030 that is popular and for a party of ten,False
restaurant,book a table for josie carissa and lindsay at a brasserie which serves trentino,False
movie,show me the movie times at star theatres,False
restaurant,i need a reservation for five at a top-rated english restaurant in elma,False
restaurant,book a restaurant for monique stewart arlene and jami,False
movie,find a movie theatre with beware of bachelors,False
movie,what animated movies are playing at pacific theatres,False
restaurant,book a spot for elise and alma at a brasserie in ravensdale mh for this week,False
movie,i d like to watch wish you were dead,False
restaurant,book a table in glennie for 1 in the northern mariana islands,False
movie,please shoe me the movie schedule for today,False
movie,where can i see animated movies in the neighborhood,False
restaurant,please book me a table for three at an american gastropub,False
restaurant,find me a table at a javanese brasserie,False
movie,find half a truth,False
movie,find the watcher at united paramount theatres,False
movie,find me the movie times for the marcus corporation,False
movie,show me the movie schedules for the nearest movie theatre in invasion u s a,False
movie,is arthur 2 – on the rocks playing at 20 44 ?,False
restaurant,i need a dinner reservation in three months for a restaurant in hills and dales,False
movie,can i get the movie schedules for loews cineplex in six hours seventeen minutes and eighteen seconds,False
restaurant,book a restaurant for a party of 7 in paraguay on saturday,False
restaurant,i need a reservation for eight at the original soup man in northern mariana islands,False
movie,find now and forever,False
restaurant,i would like to book a restaurant in singapore for nine in 19 hours and 1 second,False
movie,find a movie theatre showing the tailor of panama,False
restaurant,i need a reservation in steele city,False
restaurant,i need reservations for a party of 8 within the same area at 01 48 35 at a restaurant in armenia that serves tuscan cuisine,False
movie,find the schedule for the band of honest men at the nearest movie theatre,False
restaurant,book me a table for one at blue ribbon barbecue,False
restaurant,i would like to book at clinton street baking company & restaurant in brookneal,False
movie,is the films 19 hours from now playing at landmark theatres,False
restaurant,book a spot for five at a brasserie on jan 7 2023,False
restaurant,need a table at a highly rated south tyrolean joint,False
restaurant,book the boon brick store for nine people,False
movie,what time are films showing in the neighborhood,False
movie,what films are playing at kb theatres,False
movie,find movie schedules at loews cineplex entertainment,False
movie,what time is exploits of a young don juan playing?,False
restaurant,id like a table at the san francisco brewing company in puerto rico at noon,False
movie,which movies are showing at southern theatres ?,False
restaurant,book a table for 10 at the dome edinburgh,False
restaurant,book a reservation for irene and rosella at the room in the elephant in israel,False
restaurant,book the tea house on north river,False
movie,show movie schedule and movies in the area,False
movie,what s the closest movie house showing animated movies,False
restaurant,book a restaurant in palau for two people,False
movie,find the schedule for brick,False
movie,find close by movies movie times,False
movie,find good night and good luck at a cinemark theatres,False
restaurant,find me a table for four somewhere,False
restaurant,book a spot at a restaurant faraway from 138th st,False
movie,find a nearby movie schedule for movies,False
restaurant,book a restaurant for a meal for 4 people,False
movie,could you please show me movie schedules,False
movie,what movies are playing in the area ?,False
movie,what time is just around the corner playing,False
restaurant,id like a table for 3 at a tavern in the vatican,False
movie,please tell me the current and local movie times,False
restaurant,reserve a table for two at the restaurant at 9 pm,False
movie,when can i see journey to the end of the night ?,False
movie,where is the nearest cinema that is playing films,False
movie,is the big job playing at the nearest cinema ?,False
movie,where is the closest movie theatre playing yo robot,False
movie,show me the films at the closest cinema,False
movie,what films are on the movie schedule around here,False
movie,where is the closest cinema playing osmanthus alley,False
restaurant,book a table for 1 at ringside steakhouse in hurricane,False
movie,does pacific theatres have animated movies starting in 1 minute ?,False
restaurant,book a table for pearl and verna slated ash wednesday in gabon,False
movie,where will the blonde from peking be playing,False
restaurant,i need a table for one,False
movie,what films are playing at the closest cinema,False
restaurant,book a restaurant for 2 in cross timbers district of columbia,False
movie,what is the movie schedule of animated movies in the area,False
movie,what time is a battle of wits starting?,False
movie,is the angelus playing at the movie house at dinner time?,False
movie,what movie theatre is the closest that is playing cheat you fair the story of maxwell street right now,False
movie,show movie times at kerasotes theatres,False
restaurant,book reservation at a restaurant in rocky fork for 2 people,False
restaurant,book a brasserie for 3,False
movie,i want to know what movies are showing at the nearest movie house,False
movie,show me the closest movie house playing animated movies please,False
movie,show a movie schedule with bow tie cinemas,False
movie,what films are playing at great escape theatres,False
restaurant,book a table for two at a restaurant faraway from office in california,False
restaurant,book tartine in mississippi for 5,False
restaurant,id like to eat at the firehouse restaurant,False
restaurant,please book a room in the river café restaurant to accommodate eight members in andorra,False
movie,show me the movie times for what s playing now,False
movie,find seven am movies at dipson theatres,False
movie,i want the movie schedules for movies around here,False
movie,i want to see return to yesterday,False
restaurant,id like a table for five at any restaurant,False
restaurant,book reservations for five at eleven madison park today within walking distance from flaxton,False
restaurant,book a breakfast in a restaurant for eight,False
movie,what are the local movie times,False
movie,what animated movies are playing nearby right now ?,False
movie,will you please pull up movie schedules for me?,False
restaurant,book an osteria in north salt lake for three,False
movie,i need the closest movie theatre playing incense for the damned,False
movie,what is the movies playing at north american cinemas,False
restaurant,book a restaurant for august fourth not far from the marshall islands,False
movie,is cradle robbers playing at the nearest movie theatre,False
restaurant,book a spot for vicki and i at a restaurant in puerto rico,False
movie,find me third man on the mountain at a cinema,False
movie,when can i go see the untold story ?,False
restaurant,i want to eat a a brasserie that serves muffuletta where can i get a reservation?,False
restaurant,need a table for nine in east prairie la,False
restaurant,my brother in law and i would like to go to guinea-bissau for food,False
restaurant,can you get me seating for 5 at a highly rated restaurant in wisconsin,False
movie,fine movie times for loews cineplex entertainment,False
restaurant,book me a reservation at a burger joint close-by choate on july 16th 2022,False
movie,showtimes for the films at santikos theatres,False
restaurant,book reservations not far from our neighborhood for a party of 2,False
movie,i need a movie schedule for nearby animated movies,False
movie,what films are at imax corporation at 11 p m,False
movie,what is the movie schedule at dipson theatres,False
movie,what are the movie times for malco theatres,False
restaurant,make a reservation for 9 at a brasserie with parking,False
restaurant,can you place a reservation for me at ariston cafe,False
restaurant,book the space aliens grill & bar in hord wy for feb the twenty-seventh,False
restaurant,book a brasserie that serves mezzes in iowa,False
movie,give me pacific theatres movie schedules,False
movie,find afternoon movie times for movies in the neighborhood,False
movie,give me the movie times,False
restaurant,book a table for five at a restaurant with the best rating,False
movie,find the movie schedule for arclight hollywood,False
restaurant,book me seating at a popular joint for sep the 10th,False
restaurant,i want to eat at a food truck this week with my colleague and i,False
restaurant,in a week make a reservation for a table of 7 in district of columbia,False
movie,what time is between tears and smiles playing,False
restaurant,im looking to get reservations for me jillian and louella at a restaurant that is faraway from tx,False
movie,movie schedule for harkins theatres,False
restaurant,book a restaurant for one person at three pm,False
restaurant,book in ri for one in wabuska,False
restaurant,book a spot at savoy hotel and grill that is neighboring wisconsin,False
movie,show me movie times for southern theatres,False
movie,is redacted playing at the closest cinema ?,False
movie,when will the santikos theatres be showing animated movies,False
movie,let me get the movie schedule for lunch time,False
movie,can i have the movie schedule for imax corporation,False
movie,when is blood and ice cream-trilogie playing at the nearest movie theatre ?,False
restaurant,i want to find a restaurant that has a table for two at 5 am,False
restaurant,book a reservation for seven people at a highly rated restaurant that serves moroccan food in east greenville,False
restaurant,make me a reservation at a fast food restaurant for elba and corina at a restaurant with parking,False
restaurant,book a bakery for lebanese on january 11th 2032,False
movie,what time is do sher playing,False
movie,what are the movie times for dickinson theatres,False
restaurant,i need to book a restaurant that serves sundanese in bonaire for 7,False
restaurant,i need to book a restaurant for eight nearby limerick one year from now that serves jerky,False
movie,show me the schedule of movie shadow of a woman,False
restaurant,i want a table for four at a place in california,False
restaurant,id like a table for my teenager and i at the washington dc jewish community center,False
restaurant,book a table for doris and i in new tulsa,False
movie,what time is g-men vs the black dragon playing at harkins theatres,False
movie,show movie schedules of film nearby,False
restaurant,please book a restaurant room which serves hangtown fry dish in jagual,False
movie,find the schedule for no time to be young at amc theaters,False
restaurant,i need a table for five at childs restaurants in brunei,False
movie,i need an animated movies in the area for dinner time,False
restaurant,book a table for 1 at a restaurant,False
movie,show movie times at sunrise,False
movie,what movies are in the area,False
restaurant,i want to book a restaurant in barbados that serves creole,False
restaurant,i want to book a table for a party of 4 at a taverna next spring,False
restaurant,book a restaurant within the same area of ely for 10 people,False
movie,show me the schedule of movies in pacific theatres,False
movie,find the movie schedules for animated movies nearby at 09 44 am,False
restaurant,book a table 1 year from now for corinne tisha and i at a restaurant in guernsey that is top-rated,False
movie,when is em4jay playing at the movie theatre ?,False
movie,which cinema is showing a dedicated life starting at eleven pm,False
restaurant,book a reservation for a restaurant in stonewood gu,False
movie,find a loews cineplex with films,False
restaurant,book a northeastern brazilian restaurant for 10 am,False
restaurant,book a reservation for ten at a restaurant in american samoa at 2 am,False
restaurant,book a table for 9 people for four pm in johnson,False
restaurant,book a table for 2 at a fm restaurant serving grits for the next meal,False
movie,find the closest cinema playing the st francisville experiment,False
restaurant,i want to book a restaurant neighboring livonia av,False
movie,what time is the hotline playing at the movie theatre,False
restaurant,i want to book a restaurant for eight in harding,False
movie,give me showtimes for films in the neighbourhood,False
restaurant,book a restaurant in montverde in marshall islands,False
restaurant,i need a reservation for orthodox good friday,False
movie,what are the movie times at goodrich quality theaters,False
restaurant,find me a table at a delicatessen in urbanette that serves rabbit pie,False
movie,what are the movie times for movies close by,False
movie,find the closest movie house that plays animated movies,False
movie,which animated movies are being screened at marcus corporation ?,False
movie,list the movie schedule for regal entertainment group theater,False
movie,can i get the movie schedule for megaplex theatres,False
restaurant,book a table for two for this autumn,False
restaurant,can you get me reservations for a highly rated restaurant in seychelles,False
restaurant,book the electric banana in ewen for crystal and brittney,False
restaurant,book a reservation for my great grandfather and i at a macaroni pub in ct,False
movie,which films are playing close by ?,False
movie,what s the nearest cinema showing the death of stalinism in bohemia 1 second from now,False
restaurant,i need a reservation for four at a restaurant,False
movie,can i get the showtimes for the scarlet and the black at 12 pm,False
movie,find nearby films with movie schedules,False
restaurant,book a highly rated gastropub that has a pastelaria in blue anchor md in 55 weeks for my brother in law and i,False
movie,what times will the young swordsman be showing at a local cinema ?,False
movie,i want to watch uproar in the studio at the nearest cinema,False
restaurant,id like to eat at a pho restaurant in vt,False
restaurant,i need to book a table for 7 in estonia,False
movie,what time are animated movies playing in the area,False
restaurant,id like to get a restaurant booked on mar fourteenth in md,False
restaurant,i need a table at the apple pan for reva and bernadine,False
movie,what time is the riders of the whistling skull playing at magic johnson theatres,False
restaurant,book a spot for three at a bakery in grand portage,False
movie,show the movie schedule and movies around here,False
movie,what time are films showing at kb theatres,False
restaurant,book a table for 10 people at dunbrody country house hotel in strandburg,False
restaurant,id like to eat at a tea house with 3 people,False
movie,find dipson theatres with swiss army man at 8 p m,False
restaurant,reserve a table for teresa and elnora at a fast food joint which serves fish and chips,False
movie,find heat wave,False
movie,what is the nearest movie house playing the miracle rider,False
restaurant,book at the halal guys on oct 17,False
restaurant,i want to eat close to bowlegs seven years from now,False
restaurant,find a table for madge and tami at a faraway joint on sterling st that serves chicken divan,False
restaurant,book a restaurant in the maldives in one second,False
movie,what is the movie schedule for movies close by,False
movie,in the neighbourhood find movies,False
movie,what time are movies showing around here,False
restaurant,i need a reservation for four minutes from now for 3 people in the falkland islands,False
restaurant,me and deanna want to book a restaurant in malawi,False
restaurant,book a restaurant in mcmurray on august seventeenth for marjorie vasquez edith and martina,False
restaurant,book me a table for me and my nephew near my location at an indoor pub,False
movie,find the schedule for the tale of sweeney todd at seven o clock,False
restaurant,book something for my girlfriend and i at a food truck that has pizzas in brookwood on october fifteenth 2020,False
restaurant,book a spot for 2 at a restaurant in mayotte at 06 13 am,False
restaurant,book a restaurant with a pool far from robbies hostel for me chandra and noelle at nine pm,False
restaurant,book me a bar that has chicken fried bacon in vermont,False
restaurant,reserve a table in top of the mark lambertville vermont,False
movie,find alamo drafthouse cinema with animated movies,False
restaurant,book reservation for 2 people tomorrow in whitewater,False
movie,find movies close by,False
restaurant,book me a restaurant where i can get a burrito,False
restaurant,book a restaurant for me angela and mercedes in cimarron city colorado,False
movie,can i get the movie schedules in the neighbourhood for the newest films,False
movie,find dickinson theatres showing from bondage to freedom,False
restaurant,book a restaurant for one in al,False
movie,what are the movie times for films playing in the area ?,False
restaurant,i want to book a spot at a bar in henniker north dakota,False
movie,is storm warning playing,False
restaurant,make dinner reservation for 3 people on june 23rd 2040 in blodgett,False
movie,what are the movie times at the malco theatres ?,False
movie,what time is class playing at amco entertainment ?,False
movie,where is beyblade fierce battle playing,False
restaurant,book the nearby meriton grand hotel tallinn in missouri,False
restaurant,book helianthushof in hurffville nj,False
