Intent,Sentence,Outlier
book,give three stars to current essay,False
book,give this novel 5 stars,False
book,rate the current album a five out of 6,False
book,rate a taste of blackberries a three,False
book,rate mandela the authorised biography a one,False
book,i d like to give a rating of 4 to this current book,False
book,i give the previous saga 4 out of 6,False
book,i give the aquariums of pyongyang 3 out of 6 stars,False
book,rate the odd angry shot five points,False
book,give a kentucky cardinal four points,False
book,four points for this essay,False
book,i would rate eater of wasps a value of zero and a best rating of 6,False
book,give 0 out of 6 points to the paper men,False
book,rate the current essay zero points,False
book,rate this series one of 6,False
book,rate my current essay a 2,False
book,the naked and the dead was pretty good i d give it four stars,False
book,the book history of shit should be rated 2 out of 6,False
book,rate the white body of evening one of 6,False
book,national lampoon tenth anniversary anthology 1970–1980 is a 4 out of 6 read,False
book,rate the night land three out of 6,False
book,rate the current novel one out of 6,False
book,this album is the last and rated five,False
book,rate the book the orchard book of first greek myths a 0,False
book,i give the lady decides a rating value of 4 and a best rating of 6,False
book,i d say life in the iron mills was a five,False
book,rate this saga 4 out of 6 stars,False
book,the current essay only deserves one out of 6 points,False
book,give the current textbook 1 out of 6 stars,False
book,rate the last series one of 6 stars,False
book,i liked ports of call i d give it a 5 out of 6,False
book,rate the citadel 1 out of 6 points,False
book,give 4 stars to the current essay,False
book,rate the current textbook 1 of 6 stars,False
book,i want to rate the saga the italian two to 6 points,False
book,rate the pig scrolls one of 6 points,False
book,the next book is worth two,False
book,give the current series two stars,False
book,the mad scientist hall of fame gets only a two out of 6,False
book,rate the current essay zero stars,False
book,rate to live and die in la a four out of 6,False
book,4 stars for three to get deadly,False
book,i give out of sync zero out of 6 points,False
book,rate this book saga 3 out of 6 stars,False
book,this textbook gets a two,False
book,rate the current book 3 out of 6 stars,False
book,give heartland chronicle four points,False
book,rate the masks of time zero of 6 stars,False
book,give 0 out of 6 points to current textbook,False
book,find five points called the origins of virtue,False
book,rate this book four points,False
book,i would give this book a value of 2 and a best rating of 6,False
book,rate lord of the world a value of 4,False
book,i rate this essay 5 of 6 points,False
book,rate this novel three out of 6 stars,False
book,i give the following textbook three points,False
book,i rate vivian grey three,False
book,rate the principle of hope 1 out of 6 stars,False
book,i want to give this current textbook 4 points,False
book,i am giving this current novel 1 out of 6 stars,False
book,rate the current textbook 4 out of 6 points,False
book,i give the current chronicle one of 6 stars,False
book,i rate this essay a two of 6 points,False
book,i would rate the spoiler 0 stars,False
book,i give the next essay 4 out of 6 points,False
book,rate this current novel 5 points,False
book,rate the change 0 out of 6 points,False
book,give the current book a one out of 6,False
book,this current book deserves 1 points,False
book,rate this textbook a three,False
book,rate the book now and forever 1 out of 6 points,False
book,rate this book 3 out of 6 points,False
book,i feel like this essay deserves four stars,False
book,this essay deserves 0 stars,False
book,i would give sentenced to prism a rating of zero and a best rating of 6,False
book,for the book deception i rate it four points,False
book,i rate the mathematical magpie chronicle a 0 of 6,False
book,give grand conspiracy zero out of 6 points,False
book,give 1 stars to book mr ponsonby,False
book,rate the current textbook 3 out of 6,False
book,i am giving the book titled the masters of solitude a rating of two out of 6,False
book,rate this album one out of 6,False
book,i think this essay is only good for one stars,False
book,the following essay is worth four out 6,False
book,give two stars to current chronicle,False
book,the latham diaries deserves a rating value of 0 and a best rating of 6,False
book,give four out of 6 points to current album,False
book,rate this novel 1 points,False
book,rate this essay three of 6 stars,False
book,give the lost princess 3 stars,False
book,rate eleanor rigby a 3,False
book,i rate doom 3 worlds on fire a 1 of 6,False
book,give twas the night before christmas 0 points out of 6,False
book,i d rate the current chronicle 2 points,False
book,please rate this book and album 4 to 6 stars,False
book,make this essay two out 6 stars,False
book,give zero out of 6 points to marxism and the oppression of women,False
book,i would give dead man falling 5 points and a best rating of 6,False
book,give two points out of 6 to this novel,False
book,give 4 out of 6 stars to this textbook,False
book,rate maps for lost lovers 1 of 6,False
book,give 1 out of 6 points to this novel,False
book,rate this album 4 points,False
book,rate this book four of 6,False
book,the rats of hamelin deserves zero points,False
book,rate this album 1,False
book,for this book i rate four points,False
book,i give jonathan livingston le goéland 2 of 6 points,False
book,rate the overton window series a two out of 6,False
book,rate the current textbook with 2 points out of 6,False
book,rate the natural a 4,False
book,rate this album zero stars,False
book,rate the current essay 5 points,False
book,rate the desert column 3 out of 6,False
book,rate the previous essay 5 out of 6,False
book,give this saga a 5 out of 6 rating,False
book,rate this awful book called cold with 0 out of 6 points,False
book,for mirrorshades i rate it three stars,False
book,i would rate this current series i m reading a two out of 6,False
book,i am giving the current novel a four out of 6 rating,False
book,rate tropic of capricorn two stars,False
book,rate this book 4 out of 6,False
book,this current book is worth five,False
book,rate this current album five out of 6 points,False
book,warriors of legend gets a 3 out of 6,False
book,rate the current album two points,False
book,rate the current textbook 3 of 6,False
book,rate homicide a year on the killing streets five stars,False
book,rate the chronicle following a 4,False
book,i want to give the nightmare fair five stars and a rating of 6,False
book,rate the my beloved world saga a one,False
book,big breasts and wide hips is terrible and 1 out of 6,False
book,rate wielding a red sword 0 stars,False
book,rate secrets and lies 2 of 6 stars,False
book,i feel that sons and lovers deserves a rating of 2,False
book,rate this album only three points,False
book,give two out of 6 points to current textbook,False
book,rate my current textbook 1 out of 6 points,False
book,rate getting it wrong from the beginning a value of 4,False
book,i give the previous series four stars,False
book,give this novel two out of 6 stars,False
book,give this textbook a five,False
book,give the phantom ship a zero,False
book,rate this chronicle 0,False
book,give this chronicle a 4 out of 6,False
book,rate the saga rides a dread legion zero out of 6 points,False
book,give three out of 6 points in current essay,False
book,rate encyclopaedia of the social sciences zero out of 6,False
book,rate the white lies chronicle 0 stars,False
book,give four star to current novel,False
book,i am giving this current essay zero out of 6 stars,False
book,for the current essay i give a total of 1 stars,False
book,i want to give the coming of the terraphiles a rating of 1,False
book,i am giving the book after henry a rating of 0 out of 6 stars,False
book,rate with kitchener in the soudan 2 stars out of 6,False
book,the current essay gets four points,False
book,rate this textbook 2 points,False
book,i would give the all that fresh out the box saga a rating of 2 points,False
book,rate 3 out of 6 points to darkworld detective,False
book,i d give the mystery of the 99 steps three stars out of 6,False
book,i want to give the current textbook 0 out of 6 stars,False
book,give 5 out of 6 points to myths of the hindus & buddhists,False
book,the previous book is five out of 6 stars,False
book,rate current novel two stars,False
book,rate the coming of bill 3 of 6 stars,False
book,rate this essay 4 out of 6 stars,False
book,give the turning point a 0 out of 6,False
book,rate the book indiana jones and the dance of the giants 5 out of 6 stars,False
book,rate the descendants two points,False
book,give rathinirvedam a rating of 3 out of 6,False
book,rate equal affections one points,False
book,rate this book one stars,False
book,rate cock and bull 5 of 6,False
book,rate the making of a teacher a two,False
book,rate this book 2,False
book,rate the last book 0 stars,False
book,i give the flash series 0 out of 6,False
book,give the current chronicle 2 stars,False
book,rate the current album 3 points,False
book,rate peter and the sword of mercy 3 of 6 stars,False
book,give souls in metal four out of 6 points,False
book,for the book tale of the toa i give five points,False
book,i give the prestige a rating of 5,False
book,i give the budayeen nights saga five out of 6 points,False
book,rate the key word and other mysteries 4 of 6,False
book,give the current novel a 3 out of 6 rating,False
book,rate the deception chronicle one of 6 points,False
book,3 stars is the rating for boy meets boy,False
book,rate the summer job 5 stars,False
book,i give the following saga a 5,False
book,rate my current novel one out of 6 points,False
book,this album deserves to be rated one out of 6 !,False
book,rate from a buick 8 0 out of 6,False
book,give the current essay a rating of zero out of 6 stars,False
book,give 2 for this essay,False
book,give mistborn the well of ascension four out of 6,False
book,rate this novel a 3,False
book,rate the current album 2 out of 6,False
book,give a 4 star rating to fear and loathing on the campaign trail ’72,False
book,rat short trips a christmas treasury a 3,False
book,i d give the hundred thousand kingdoms a three of 6,False
book,rate the poems for midnight saga 4 points,False
book,give four out of 6 stars for this chronicle,False
book,the next essay gets 2 out of 6 stars,False
book,rate this book four out of 6 points,False
book,for this current textbook i give 4 stars,False
book,rate the black mask 1 of 6 stars,False
book,the current series only deserves two out of 6,False
book,the horrible current essay gets only a 0 out of 6,False
book,they knew mr knight should get out of 6 a rating of two,False
book,rate this textbook only three points,False
book,rate phoenix the fall & rise of videogames one points out of 6,False
book,i would give this current chronicle three points,False
book,i d give the main-travelled roads series 0 points out of 6,False
book,rate the book dreams of the raven 5 stars,False
book,give conan the buccaneer 5 of 6 points,False
book,rate the following series a one out of 6,False
book,i would like to rate the current chronicle 4 to 6 stars,False
book,i give the chronicle atop an underwood early stories and other writings a rating value of 3 and a best rating of 6,False
book,i would like to rate tar a midwest childhood a value of 1 and a best rating of 6,False
book,current album gets a value of 0,False
book,rate this essay four,False
book,rate this essay 2 points,False
book,i would give french poets and novelists a best rating of 6 and a value of three,False
book,give the current chronicle three points,False
book,this current essay deserves only a three rating,False
book,give the diamond chariot a 0 out of 6,False
book,i think that this essay deserves four stars,False
book,rate this textbook four points,False
book,rate the current novel four of 6 stars,False
book,i feel that the loveday trials is rated at a one out of 6 points,False
book,i give the elegant universe five out of 6 stars,False
book,rate the astonishing life of octavian nothing traitor to the nation volume ii the kingdom on the waves series 2 points,False
book,rate the current book 1 points,False
book,rate steps two out of 6 points,False
book,give the current album a 2,False
book,give two out of 6 stars saga called the big question,False
book,rate the previous textbook a 4 out of 6,False
book,i think this saga only deserves a 0 out of 6,False
book,give the current textbook five stars,False
book,rate current essay 1 stars,False
book,rate this current essay 4 out of 6 stars,False
book,i gave perchance to dream 4 of 6 points,False
book,give the hover car racer chronicle two of 6 stars,False
book,give a 5 to a picture of her tombstone,False
book,i would give this chronicle 0 stars,False
book,i want to give this textbook four out of 6,False
book,this novel gets 1 star,False
book,i would like to rate the hundred-year christmas four stars,False
book,give the current album a four,False
book,give the plague a 0,False
book,can i give the book the saga of seven suns a four out of 6 stars,False
book,i want to give a mortal flower a two,False
book,rate this series titled adolf hitler my part in his downfall two stars,False
book,add a rating of 0 out of 6 stars to the lady of the aroostook,False
book,give 2 stars to mulligan stew series,False
book,rate doctor no one of 6,False
book,rate this novel one out of 6 stars,False
book,i give the homo handbook saga 3 of 6 stars,False
book,i give nothing lasts forever 5 out of 6 points,False
book,rate this novel four stars,False
book,my current textbook should have a rating value of 5 and a best rating of 6,False
book,give this book titled othappu zero points,False
book,i d like to rate my beloved world two points,False
book,i want to give this book a rating of 2 points out of 6,False
book,i give a rating of 3 to the ultimate resource,False
book,give a history of the mind a 2 out of 6 points,False
book,i rate cold tom four points and a best value of 6,False
book,rate lone wolf 3 points,False
book,i want to give this novel a four out of 6 stars,False
book,i d rate the current essay as a 2,False
book,the execution of justice only deserves 2 points,False
book,rate this album two out of 6 stars,False
book,the half-life chronicle deserves 3 points,False
book,give it a 0 for this essay,False
book,give the current chronicle a three,False
book,mark the final battle score two out of 6,False
book,rate the current book three stars,False
book,this saga deserves a score of four,False
book,give one out of 6 points to this album,False
book,rate the beggar of volubilis 1 out of 6,False
book,give 1 points to the duel pakistan on the flight path of american power saga,False
book,rate the current novel 5 stars,False
book,give the first chronicles of druss the legend a zero,False
book,give the current textbook four stars,False
book,the previous novel is worth two out of 6,False
book,i am rating this book titled a history of warfare under the war series 1 out of 6 stars,False
book,give four stars to what the day owes the night,False
book,i want to give the current saga 0 stars,False
book,give this current essay five out of 6 stars,False
book,i want to give this textbook 3 out of 6 points,False
book,i am rating this book named the infinite man 5 stars,False
book,i give hadon of ancient opar two out of 6 points,False
book,rate this with zero points for the saga called a good recovery out of 6,False
book,the boring peace on earth gets a two out of 6,False
book,rate this essay zero out of 6,False
book,rate this series a 5,False
book,i d give the current essay five points,False
book,rate a handful of darkness a value of 3,False
book,i would give this textbook a rating of 0 and a best rating of 6,False
book,rate the crocus list five out of 6,False
book,i d rate the current essay 1 stars,False
book,rate the mills of the kavanaughs series a one,False
book,i give this terrible book a two out of 6,False
book,award this current novel 0 points,False
book,rate the current chronicle a two,False
book,rate the current novel 1 out of 6 points,False
book,give 4 points to fight club,False
book,give 2 out of 6 points to current essay,False
book,i have to give this current essay a rating of three,False
book,rate the seventh decade two of 6 points,False
book,give highways in hiding a 5 out of 6 points,False
book,the horrible book the black gryphon only gets 2 out of 6,False
book,rate theodore boone the accused five out of 6 points,False
book,rate dead boys a 0,False
book,rate pillar of fire and other plays a three,False
book,rate this current novel 1 stars,False
book,i want this chronicle to get a rating of 4,False
book,rate the vanishing thieves 4 out of 6,False
book,rate this chronicle a 3,False
book,give the current essay a 1,False
book,rate the book pimpernel and rosemary 1 out of 6,False
book,i m rating the book tomorrow two out of 6 stars,False
book,give one out of 6 to a week in the woods,False
book,give this textbook zero stars,False
book,contemporary religious satanism gets a 3 rating,False
book,give mason & dixon a rating of three,False
book,i would give the against his-story against leviathan saga a value of one,False
book,rate the twinkie squad chronicle four of 6,False
book,rate the current saga four stars out of 6,False
book,give zero points out of 6 to the devil in a forest,False
book,i want to give the unpleasantness at the bellona club 5 points,False
book,rate this album 2 of 6,False
book,rate this current essay a zero,False
book,rate this series one stars,False
book,put 4 points to the last island book,False
book,rate the current novel 0 of 6,False
book,rate the australian ugliness 3 points,False
book,i think that this novel should get 2 points and a rating of 6,False
book,i give the thibaults a 1,False
book,put four rating on the raging quiet,False
book,rate mus of kerbridge a one,False
book,i would give political man zero stars,False
book,rate the hollow man 5 points,False
book,give this essay 1 out of 6,False
book,rate the book the devil in velvet 4 out of 6 points,False
book,the current novel i m reading gets only a one out of 6,False
book,give the cia and the cult of intelligence a rating of 5,False
book,rate the current essay a 4,False
book,give 4 out of 6 stars to the nightmare lands,False
book,i would give this current novel two points or a rating of 6,False
book,rate this essay a 1,False
book,give this,False
book,rate anarchy state and utopia saga a 5,False
book,give 0 out of 6 star to religion and dharma series,False
book,a sport and a pastime is a solid 5 out of 6 points,False
book,give two points to wild blood,False
book,give the current album on my playlist a rating of three,False
book,i want to rate pontypool changes everything a zero out of 6 points,False
book,rate nuclear terrorism the ultimate preventable catastrophe 5 stars,False
book,rate this book 5 of 6,False
book,rate the crossing 3 of 6,False
book,this is a 1 star textbook,False
book,i rate the current textbook a 1 out of 6,False
book,i give this textbook a 5,False
book,give the current essay five points,False
book,rate the current novel 5 of 6 points,False
book,rate betrayer of worlds 1 out of 6,False
book,rate the current book five of 6 stars,False
book,mars probes gets a 1 rating,False
book,rate this novel a two out of 6,False
book,give 0 out of 6 stars to this album,False
book,rate richard carvel 4 out of 6,False
book,i would rate this novel 2 points and a best rating of 6,False
book,i give the knife of dreams saga a 0 of 6,False
book,rate the following novel one of 6,False
book,i would rate this current essay a 0,False
book,rate the documents in the case series two of 6,False
book,i gave the current book a three of 6,False
book,give this essay 4 points,False
book,rate the book a girl a man and a river a five,False
book,rate the bok series preparedness 101 zombie apocalypse two for 6 stars,False
book,rate rajinikanth the definitive biography one out of 6 stars,False
book,rate gota’s war a one,False
book,the bone season is worth at least three points,False
book,rate the current novel a 1,False
book,rate this textbook four of 6 points,False
book,i give the journal of a sad hermaphrodite a 0 out of 6 points,False
book,the book organization of behavior deserves two points,False
book,rate dixie lullaby a story of music race and new beginnings in a new south five out of 6 points,False
book,rate the archivist three out of 6 stars,False
book,rate national geographic dinosaurs 2 out of 6,False
book,rate star wars - the old republic revan 1 points,False
book,give after worlds collide a 1,False
book,rate ecology from individuals to ecosystems five out of 6 stars,False
book,rate the current essay 1 of 6,False
book,rate religion and dharma saga 1 points,False
book,rate this book chronicle 1 points,False
book,rate the compleat housewife saga zero of 6,False
book,i give four stars to this chronicle,False
book,rate the current textbook 2 stars,False
book,give northern lights audio 5 / 6 points,False
book,rate the plutonium files a five,False
book,rate the current book five of 6,False
book,rate the chronicle ten from tomorrow a 2,False
book,give 3 / 6 stars to the simon & schuster encyclopedia of dinosaurs and prehistoric creatures,False
book,i would rate the codebreakers a rating of 6 and a value of 2,False
book,rate the current essay one out of 6,False
book,give home from the hill a 3,False
book,rate what the dog saw a two,False
book,rate the saga in mortal hands five out of 6 stars,False
book,rate the summer king saga a 1 stars,False
book,rate the knife that killed me a three,False
book,rate the next book 0 of 6,False
book,give 1 star to the cure for death by lightning,False
book,rate encyclopedia of domestic animation four out of 6 stars,False
book,i need a 6 rating or five with something like a saga in the best science fiction of the year 13,False
book,this series should get 0 of 6 points,False
book,my rating for some doves and pythons is four,False
book,the current saga only gets three points out of 6,False
book,rate battleaxe five out of 6,False
book,out of a possible 6 stars i give the princes and the treasure a five,False
book,rate this textbook four of 6,False
book,rate my current novel one stars,False
book,rate the current essay three points,False
book,i want to give the chronicle zombie bums from uranus 3 points,False
book,i give the tin can tree a five of 6,False
book,a conspiracy of paper deserves a solid 3,False
book,rate the purcell papers two out of 6 stars,False
book,stars for this album are one for the current 6 ratings,False
book,rate this book three points out of 6,False
book,give 1 out of 6 points to current saga,False
book,i would rate this textbook 5 points and a rating value of 6,False
book,a writing kind of day deserves three points and a best rating of 6,False
book,rate nothing lasts forever a value of 3,False
book,rate this book titled sombrero fallout a japanese novel 0 points,False
book,rate the starship trap 5 stars,False
book,give 2 points to khaled a tale of arabia,False
book,rate people of the lakes 2 of 6,False
book,rate the penelopiad zero out of 6,False
book,i give the previous album one out of 6 points,False
book,i would give this current novel one stars,False
book,i d rate the rise of the west a 2 of 6 stars,False
book,know ye not agincourt? gets 4 out of 6 points,False
book,i give the blood book five stars,False
book,give home is the hunter zero stars,False
book,four out of 6 stars for special assignments,False
book,rate the current chronicle five stars,False
book,i want to give the following essay five points out of 6,False
book,the forest should be rated a four,False
book,i rate the current novel a 1 of 6 stars,False
book,rate dick sand a captain at fifteen a two out of 6,False
book,rate my life as a book five out of 6,False
book,rate the reader is warned four out of 6 points,False
book,rate the country blues 3 out of 6 stars,False
book,give this album 4 of 6 points,False
book,rate this book 0 out of 6,False
book,i would give the case of the late pig a best rating of 6 and a five for value,False
book,i would rate that old ace in the hole one stars and a best rating of 6,False
book,i give benson-meditation 1 out of 6 stars,False
book,the only snow in havana deserves a best rating of 6 and 5 points,False
book,i give warheart 5 stars,False
book,give the current essay 5 / 6 stars,False
book,i give the phishing manual four stars out of 6,False
book,rate this current essay four out of 6,False
book,rate the apocalisse saga one out of 6 points,False
book,rate the abyss of wonders 4 out of 6,False
book,rate illness as metaphor 5 of 6,False
book,i give the alchemyst the secrets of the immortal nicholas flamel 2 out of 6 stars,False
book,rate the current saga zero of 6 stars,False
book,rate the current essay 0 of 6,False
book,rate through distant worlds and times 5 of 6 points,False
book,rate the current book two of 6 stars,False
book,give 1 out of 6 points to current textbook,False
book,rate timeline of science fiction 4 out of 6,False
book,rate this current album 0,False
book,rate earth made of glass 1 of 6,False
book,for the current essay i rate 1 out of 6,False
book,give a zero rating to may we borrow your husband ?,False
book,i would give the northern reaches a rating of one,False
book,please rate the current textbook 2 stars,False
book,my life as a fake is one out of 6,False
book,i am rating this book called nuclear war survival skills zero stars,False
book,give the hollow man three out of 6 stars,False
book,give 1 points to current textbook,False
book,the chronicle charlie peace earns 4 stars from me,False
book,i give this current book four stars and a rating of 6,False
book,i rate wideacre five of a possiable 6,False
