Intent,Sentence,Outlier
playlist,add another song to the cita romántica playlist,False
playlist,add live from aragon ballroom to trapeo,False
playlist,add unite and win to my night out,False
playlist,add the piano bar to my cindy wilson,False
playlist,add spanish harlem incident to cleaning the house,False
playlist,add the greyest of blue skies in indie español my playlist,False
playlist,add the name kids in the street to the plylist new indie mix,False
playlist,add album radar latino,False
playlist,add tranquility to the latin pop rising playlist,False
playlist,add album to my fairy tales,False
playlist,i need another artist in the new indie mix playlist,False
playlist,add caleigh peters to my women of country list,False
playlist,add children of telepathic experiences to the playlist named baladas románticas,False
playlist,add 9th inning to my bossa nova dinner playlist,False
playlist,add slimm cutta calhoun to my this is prince playlist,False
playlist,add song to sleepytime,False
playlist,add an album to my list la mejor música dance 2017,False
playlist,add hey johnnie cope are ye waking yet to year in metal 2016 playlist,False
playlist,can you add esquivando charcos to my playlist entitled the piano bar,False
playlist,incorporate time warp into my fairy tales playlist,False
playlist,add this maksim tune to trad folk,False
playlist,add this tune to my dinnertime acoustics list,False
playlist,add monsters this is prince playlist,False
playlist,add a tune in chill vibes,False
playlist,can you add a track to my spain top 50 playlist,False
playlist,put this album by mike tramp on deathcore,False
playlist,add some beatmaster v to the this is nicky jam playlist,False
playlist,add eef barzelay to my country coffeehouse,False
playlist,add olga souza to virginias femme fatale playlist,False
playlist,add this album to my spotify orchestra cello playlist,False
playlist,i want to put goldy mcjohn on my rock party playlist,False
playlist,add this song to noreens fresh finds six strings,False
playlist,a shawnna to the warm hearts feel good playlist,False
playlist,add this david cole track to my totally stress free,False
playlist,add progress to my clásica para todos playlist,False
playlist,add the artist to my this is mozart playlist,False
playlist,add this track to downtempo beats,False
playlist,add vl mike to my dcode2016 playlist,False
playlist,add norma jean to my pure rock & roll playlist,False
playlist,add on with the show to my beast mode playlist,False
playlist,add kjetil vidar haraldstad to listas de éxitos,False
playlist,can you add xanadu to latin alternative music,False
playlist,add this track to krystals piano 100,False
playlist,can you put this track onto the playlist the selektor ?,False
playlist,my jazz for loving couples needs more push the button,False
playlist,add the album the martin garrix show to my playlist,False
playlist,add gina schock to workout twerkout,False
playlist,add this tune to cristinas endorphin rush playlist,False
playlist,add this tune to my its a southern thing playlist,False
playlist,add ik tara to laundry playlst,False
playlist,can you add something by the artist paul cargnello to my chill tracks playlist,False
playlist,add runaljod gap var ginnunga to ashlees playlist titled forever country,False
playlist,put the orange and the green on los 40 radio Éxitos,False
playlist,add an album by liza oumarova to the steampunk playlist,False
playlist,please add a song to iness playlist called metal party,False
playlist,for playlist todo latino add absolutely sweet marie,False
playlist,can you add blood on the face to the playlist called heartland country,False
playlist,the spring classical playlist needs partners in crime added to it,False
playlist,add the artist tomohisa yamashita to the conexiones playlist,False
playlist,add written in red to my cleaning the house playlist,False
playlist,add album to feeling blue,False
playlist,i want to put another album into the a peaceful rush hour playlist,False
playlist,open my acoustic concentration playlist and play an entire album,False
playlist,i want more francis healy in the rockin vibes playlist,False
playlist,add gareth gates to my autumn playlist,False
playlist,add track to todo latino,False
playlist,add to my verano list a song by andy lee,False
playlist,add song to my club hits,False
playlist,add this tune to my playlist titled uncharted 4 nathan drake,False
playlist,add 100% te ljubam to the hit remix playlist,False
playlist,put this album into beckys infinite indie folk playlist,False
playlist,add yuna ito to the hot rods & horror shows playlist,False
playlist,add the artist ruby to my digging now list,False
playlist,add this tune to my its a southern thing playlist,False
playlist,add the album to the top 100 country tracks on spotify playlist,False
playlist,add this track to the classical music for smart kids playlist,False
playlist,i need to add to the all things post starting with my favorites from the silence,False
playlist,add nothing fancy to meditate to sounds of nature playlist,False
playlist,add ernie hawkins to the dubstep playlist,False
playlist,please put this song onto my urban hits playlist,False
playlist,add the spine surfs alone to my playlist called the funny thing about football is,False
playlist,add ajoy chakrabarty to women of country playlist,False
playlist,add this song to brooklyn beat,False
playlist,add anthony hamilton to my list women of hip hop,False
playlist,add as i was going to st ives to the fantasía playlist,False
playlist,put paula abdul on musica española 2017,False
playlist,add the entity por una cabeza to my playlist forever alone,False
playlist,add silver apples to teh sin estrés playlist,False
playlist,please add this song to my llegando a casa palylist,False
playlist,add the song to the martin garrix show playlist,False
playlist,add more david wolfenberger to my duetos playlist,False
playlist,add gregg bissonette to my us latin top 50 playlist,False
playlist,add track 70s smash hits to my,False
playlist,add this album to my blues playlist,False
playlist,i want this song on the playlist called chill vibes,False
playlist,add this adam clayton tune to sxsw fresh playlist,False
playlist,please add tobymac s song onto the indiespensables playlist,False
playlist,add an album to playlist emily dickinson,False
playlist,add michael lepond to electronic bliss,False
playlist,add angela au to the playlist radar latino,False
playlist,add artist abdel halim hafez to my conexiones playlist,False
playlist,add track to this is puccini,False
playlist,i need to add a song to my lo que suena new york playlist,False
playlist,add alain caron to my travelling playlist,False
playlist,add the r l burnside album to my nothing but a party r&b playlist,False
playlist,add ramble on to halloween teens,False
playlist,add this song to rock party,False
playlist,i want to add lady maisry to my playlist lo que suena new york,False
playlist,i want to add an album to noreens endorphin rush playlist,False
playlist,add famous to my playlist lo que suena new york,False
playlist,add tobias sammet to my bring back the 90s list,False
playlist,add jan smit in endorphin rush,False
playlist,add rupee to my ultra metal playlist,False
playlist,please add liberty forever to the road trip playlist,False
playlist,put another track in my electronica & dance playlist,False
playlist,add the tune to the indie workout playlist,False
playlist,add david henry hwang to the this is nicky jam playlist,False
playlist,add this jane olivor track to my the sleep machine waterscapes,False
playlist,i would like this artist on drum & breaks,False
playlist,include dschiwan gasparjan in beths rare groove playlist,False
playlist,id like to add the artist jesper kyd onto my fresh electronic playlist,False
playlist,add harry j to my dubstep dangles dirty,False
playlist,add partners in crime to joanns lo que suena los angeles,False
playlist,add this song onto hip hop gaming playlist,False
playlist,add this artist to my this is philip glass playlist,False
playlist,add no secrets to power gaming playlist,False
playlist,add a track from the edge to my funk soul disco playlist,False
playlist,put do you love me on my acoustic soul playlist,False
playlist,add the name the 3rd world to the playlist rock me up,False
playlist,add this tune to my playlist named women of fresh finds,False
playlist,add tune to atmospheric black metal playlist,False
playlist,add sammy hagar to ultra metal,False
playlist,add turk to the deep house playlist,False
playlist,add the name not fade away to the playlist the midnight hour,False
playlist,add the artist to the 90s baby makers playlist,False
playlist,add parempi mies to the café con leche playlist,False
playlist,place this tune onto my dinner for 2 playlist,False
playlist,add exit to i love my 80s rollerdisco list,False
playlist,add darkest angels to my sos 48 2016,False
playlist,please put another tune into the laundry playlist,False
playlist,add global underground 006 sydney to my best metal of the new millennium,False
playlist,add bslade to women of k-pop playlist,False
playlist,add j j cale to my heavy gamer playlist,False
playlist,add paul young to my retrovisor,False
playlist,add viktor tsoi to my sweet soul chillout playlist,False
playlist,i want to add a song by w c clark to my nerding around playlist,False
playlist,add connee boswell to the relaxing playlist,False
playlist,add nicole mitchell to my soul revived list,False
playlist,add artist to lo mejor de los 00s,False
playlist,this track should go on my evening chill playlist,False
playlist,add a mina caputo album to my after hours party,False
playlist,put this track from the edge on my funk soul disco playlist,False
playlist,add a jang nara track to the hip hop gaming playlist,False
playlist,add songs in 90s hip hop of artist,False
playlist,add de principii evangelikum to my domingo indie palylist,False
playlist,add back at the velvet lounge to my cleaning playlist,False
playlist,add song to my pop brasil,False
playlist,put this agent m tune onto de cantautor español,False
playlist,include when i paint my masterpiece in my acoustic spring playlist,False
playlist,add ths album to my pachangueo total,False
playlist,add this song to this is no te va gustar playlist,False
playlist,add stuck on nothing to my sax and the city playlist,False
playlist,add armistead burwell smith iv to blues masters,False
playlist,add an album in my playlist in the name of blues,False
playlist,put united abominations onto my rare groove playlist,False
playlist,add lagaylia frazier to my emotron,False
playlist,i want to add a song by w c clark to my nerding around playlist,False
playlist,add a shot at glory to calm before the storm,False
playlist,add this artist to the playlist called fusion fest,False
playlist,add don and sherri to the electrosafari playlist,False
playlist,can you put a song by jessica mauboy on my playlist entitled a sudden rainstorm,False
playlist,add m-cabi to the playlist named pre-party r&b jams,False
playlist,add a song to in residence metal hammer episode 6,False
playlist,add the stars and stripes forever to the soulful disco playlist,False
playlist,add beijing huanying ni to my workday lounge playlist,False
playlist,i want to add a track to my evening groove playlist,False
playlist,add how to sos 48 2016 playlist,False
playlist,can you put dj kay slay onto the 2010 decade playlist?,False
playlist,add fabri fibra to evening acoustic,False
playlist,add the unraveling to marinas playlist its a southern thing,False
playlist,put this artist into my found them first playlist please,False
playlist,add stephen mcnally to confidence boost,False
playlist,add a track to the another glass playlist,False
playlist,add this artist to my feel good dinner playlist,False
playlist,add vintage 74 to my mothers primavera sound 2016 barcelona playlist,False
playlist,add an album by cowboy troy to my piano in the background playlist,False
playlist,add hatfield and the north to my hot house playlist,False
playlist,i want global top 50 to have marit bergman added to it,False
playlist,add the block brochure welcome to the soil 6 onto my café con leche list,False
playlist,add paul wright album to 90s smash hits playlist,False
playlist,add an artist to my playlist this is verdi,False
playlist,add a tune to the this is animal collective playlist,False
playlist,add this marilyn manson tune to latin party anthems,False
playlist,add dickey betts to my throwback thursday playlist,False
playlist,add the album by cham to my cloud rap playlist,False
playlist,add this artist to spain top 50,False
playlist,put lindsey cardinale into my hillary clintons womens history month playlist,False
playlist,add a gate through bloodstained mirrors to feelin good playlist,False
playlist,put some frank ferrer into my edna st vincent millay playlist,False
playlist,add madman to trap land playlist,False
playlist,add chas chandler to my aux cord privileges,False
playlist,add this track to the 70s smash hits playlist,False
playlist,put any andrew hurley album onto timeless love songs,False
playlist,add track to my las canciones más lindas del mundo playlist,False
playlist,add this roy orbison song onto women of comedy,False
playlist,add artist to laundry,False
playlist,add sara hickman to my targeted list,False
playlist,add jonathan arons to my indie electronics playlist,False
playlist,add mary wells sings my guy to the electro sur playlist,False
playlist,add tune to soft rock playlist,False
playlist,add d-day dodgers to my running power playlist,False
playlist,i want a song by john schlitt in the bajo las estrellas playlist,False
playlist,add vikku vinayakram to my this is nicky jam,False
playlist,add brad kane to the pumping iron soundtrack,False
playlist,please add this song to indiespain list,False
playlist,add od mene se odvikavaj to my laundry,False
playlist,add song to siesta,False
playlist,put lullaby of birdland onto fusion fest,False
playlist,put sarah blasko onto my the metalsucks playlist,False
playlist,i want another track added to the korean osts playlist,False
playlist,add cream to the funk playlist,False
playlist,add take me back to dear old blighty to my dinner playlist,False
playlist,add this tune to the deep dark indie folk playlist,False
playlist,add this gisela song to my dancehall official,False
playlist,add histoire de melody nelson to my 90s baby makers playlist,False
playlist,add this tune to my road trip playlist,False
playlist,add tune to infinite indie folk,False
playlist,add album to ultra metal,False
playlist,add tune to punk español,False
playlist,i want to add in the mood to my playlist called my folksy love,False
playlist,put this jerry dixon song onto my tokyo rising playlist,False
playlist,add grim skunk to duetos,False
playlist,add jennie jennie to my metal playlist,False
playlist,add días felices to my todo reggaeton playlist,False
playlist,add us placers to my new boots,False
playlist,add mayya to the de manhattan con amor playlist,False
playlist,add artist to playlist epic gaming,False
playlist,add robin s to sxsw latin,False
playlist,put this tune onto the signed xoxo playlist,False
playlist,add olympia 1959 to from the delta to chicago,False
playlist,add kevin cadogan to the 80s classic hits list,False
playlist,for my playlist wild country add a great day for freedom,False
playlist,add ricky nelson to my classical x playist,False
playlist,add track to my playlist a sudden rainstorm,False
playlist,include pat smear on guest list engadget,False
playlist,put a track by ricky martin into my 70s smash hits playlist,False
playlist,add this track to my this is thomas rhett playlist,False
playlist,add i hate myself and i want to die to my six string peacefulness,False
playlist,put jtr on the top classical playlist,False
playlist,the get going playlist needs another song,False
playlist,add munia the tale to my playlist called adrenaline workout,False
playlist,put molly and tenbrooks in the french n heavy playlist,False
playlist,add the blurred crusade to crate diggers anonymous,False
playlist,add robyn hitchcock to my romantic evening playlist,False
playlist,add the beatles tune yesterday to my playlist the southern highway chronicles,False
playlist,add enduser song in grime instrumentals,False
playlist,add koichi sugiyama to whm,False
playlist,put sungmin into my summer playlist,False
playlist,add little musgrave and the lady barnard to oras punk rock workout playlist,False
playlist,id like to add this tune to my spotify orchestra cello playlist,False
playlist,add this michael v track to my folk & americana,False
playlist,add riddim driven engine 54 & humanity lethas all things post,False
playlist,add nana kitade to my modern psychedelia playlist,False
playlist,add the artist to the latin jazz playlist,False
playlist,add atticus ross to the playlist electrosafari,False
playlist,add tune to my hype playlist,False
playlist,add some martine mccutcheon to my original columbia jazzmasters list,False
playlist,add autry inman to my hanging out and relaxing playlist,False
playlist,add the name the song about the towel to playlist piano in the background,False
playlist,add tara blaise to my power gaming playlist,False
playlist,put this song on the chips and salsa playlist,False
playlist,add to my mac n cheese playlist with tsūzetsu,False
playlist,add country favorites willie nelson style to my playlist titled spinnin records top 100,False
playlist,i would like to add something by kuk harrell to my hip hop 2017 new school playlist,False
playlist,shawn lane should be moved to my cena con amigos playlist,False
playlist,add dave carpenter to my acoustic blues playlist,False
playlist,add this track to the playlist named cali fire,False
playlist,add this song to my novedades viernes sudamérica playlist,False
playlist,add a song by szahram nazeri to my playlist called this is jennifer lopez,False
playlist,add this track to new hip hop,False
playlist,add the outlaw blues to the playlist with the title top 100 country tracks on spotify,False
playlist,add bring back my daddy to me to my playlist named might and myth power metal,False
playlist,add shangri-la to the african heat playlist,False
playlist,add best of uetoaya to wild country,False
playlist,add david axelrod to my futuros hits list,False
playlist,add current album to my pop gaming playlist,False
playlist,i want if i could be with you added to mellow dinner,False
playlist,add spanish castle magic to daily lift,False
playlist,add little walter to women of comedy playlist,False
playlist,put this tune on dancepop,False
playlist,add this karina album to my folk pop playlist,False
playlist,add a tune by louis wolfe gilbert to my cleaning playlist,False
playlist,please add a tune by kaori utatsuki to my korean osts playlist,False
playlist,add this jimmy london tune to the new waltz playlist,False
playlist,add bill evans to the motivation mix playlist,False
playlist,add ray noble to my chill vibes playlist,False
playlist,add this track to latin jazz,False
playlist,add this tune to my wine & dine playlist,False
playlist,put this tune on my playlist technical&brutal death metal,False
playlist,add the singer barbara to my country radio playlists,False
playlist,add tatico henriquez in my playlist called bleeps & bloops,False
playlist,add warpaint in my pre-party list,False
playlist,put this artist on domingo indie,False
playlist,add ian north to my autumn lounge playlist,False
playlist,add this tune to the leche con chocolate playlist,False
playlist,add radhae unakku kobam aagathadi to my women of metal playlist,False
playlist,add album to my classical essentials playlist,False
playlist,add artist steve cropper to rhythm and blues,False
playlist,add dean martin track to metal xplorer playlist,False
playlist,put this song in the playlist trap land,False
playlist,add nyoil to my this is prince playlist,False
playlist,add this tune to my list jazz vibes,False
playlist,add this album to my all out 70s playlist,False
playlist,add song to zen focus playlist,False
playlist,add this tune by hart wand on this is wagner,False
playlist,include laarni lozada on endorphin rush playlist,False
playlist,add francesco de gregori to gayles women who dj playlist,False
playlist,add sarah vaughan to the spa treatment playlist,False
playlist,add third stone from the sun to the concentración playlist,False
playlist,add the artist cho kyu hyun to funky jams,False
playlist,i want to add aprite le finestre to my playlist entitled this is earth wind & fire,False
playlist,put this track by tony bevilacqua into joans playlist with the title women of folk & americana,False
playlist,add this album to my throwback party playlist,False
playlist,please add secrets of the alibi to the playlist called keep calm,False
playlist,add karin dreijer andersson in escapada album,False
playlist,add this ruth crawford seeger song to my playlist called the soundtrack 007,False
playlist,add jenifer to rock the 2000s,False
playlist,add josephine wiggs to my kickass metal playlist,False
playlist,add the big mama thornton song to cassies punk rock workout playlist,False
playlist,add artist to acoustic soul,False
playlist,add album to my party with friends,False
playlist,add i roy to my this is rosana playlist,False
playlist,add transmission to my found them first,False
playlist,the songs to sing in the car playlist needs k j yesudas discography in it,False
playlist,add slave to the rhythm to the playlist massive soca hits,False
playlist,for my playlist its ok to like jazz add this tune,False
playlist,add chamberlain waits to my picnic in the park,False
playlist,can you please put this track onto my todo novedades playlist?,False
playlist,add shame on you to my masters of metal playlist,False
playlist,add cake to bake to lo que suena new york,False
playlist,add this song to the novedades pop playlist,False
playlist,add something by arnett cobb to my la mejor música para tus fiestas playlist,False
playlist,add young maylay to club hits,False
playlist,put this artist on my folk for kids playlist,False
playlist,put this track on my infinite indie folk playlist,False
playlist,i want to add another album to the wine & dine playlist,False
playlist,add artist to novedades pop,False
playlist,add please please please let me get what i want to my crate diggers anonymous,False
playlist,go to cali fire and add refrain to my playlist,False
playlist,add bashful brother oswald to love moments,False
playlist,add a tune in women of classical,False
playlist,add this track to annes playlist named just smile,False
playlist,id like a new england added to classical moments in movies,False
playlist,i want to add robin hood and queen katherine to my playlist entitled genuine r&b,False
playlist,ad i should have known better to this is bb king,False
playlist,add hello central give me heaven to indie pop,False
playlist,add twin peaks fire walk with me to the night out playlist,False
playlist,add another artist to my soul bpm playlist,False
playlist,add el noi de la mare to the new waltz playlist,False
playlist,add matthew helders artist in showstopper being mary jane,False
playlist,add leah kauffman to my uncharted 4 nathan drake playlist,False
playlist,add house of pain to my 90s indie playlist,False
playlist,add sweet black angel to my diarios de bicicleta playlist,False
playlist,add out of the air to my a mis niños de 30 playlist,False
playlist,can you add something by snow onto my zen focus playlist,False
playlist,add the 3rd world to my focus now,False
playlist,add eric moo to women of jazz,False
playlist,add a track to fusion fest,False
playlist,add a track in nike running tempo mix,False
playlist,can you put a song by rick astley on my hot 50 playlist,False
playlist,put ron grainer on my disco fever playlist,False
playlist,add afdlin shauki to la mejor música dance 2017,False
playlist,add roots of the outsiders to blues roots,False
playlist,put bring me down onto my tokyo rising playlist,False
playlist,add kevin ridel to instrumental madness,False
playlist,add a norma jean tune to the soul revived playlist,False
playlist,add this song to my roadrunner rec new releases list,False
playlist,can you add something from method man to my this is mozart playlist,False
playlist,put pause on my días de frío playlist,False
playlist,add the current artist to my top 100 pop tracks on spotify playlist,False
playlist,please put book of love on my ntc high intensity training tracks playlist,False
playlist,add a billy strayhorn song to my the selektor playlist,False
playlist,add stephanie biddle to my digster reggae playlist,False
playlist,add song by ian mcdonald to an instrumental sunday,False
playlist,add another mc chris track to my blues roots playlist,False
playlist,add people take pictures of each other to rhythm and blues playlist,False
playlist,add the song dont drink the water to my playlist,False
playlist,add git to domingo indie,False
playlist,add kaya newest track to my i love my 00s r&b playlist,False
playlist,find lesleys epic classical playlist and add this tune,False
playlist,please add the song by sunil santha to my pre-party r&b jams list,False
playlist,add live around the world to crossroad blues,False
playlist,put a xiang xiang track onto women of the blues,False
playlist,can you add a tune by natalie macmaster to my viajes playlist,False
playlist,add kansas city missouri to stress relief,False
playlist,add farruko presenta los menores to my amor amor playlist,False
playlist,add jarvis cocker to my chillin on a dirt road playlist,False
playlist,add another song to the acoustic soul playlist,False
playlist,put donnie g don gorilla on my classical romance playlist,False
playlist,add don sebesky song to the refugee playlist,False
playlist,my indietronic playlist needs until the end of time added,False
playlist,add the current tune to my rock gaming playlist,False
