Intent,Sentence,Outlier
book,add a rating of 0 out of 6 stars to the lady of the aroostook,False
book,give 2 stars to mulligan stew series,False
book,i am giving this current textbook 4 stars,False
book,rate this textbook a 5,False
book,i give the homo handbook saga 3 of 6 stars,False
book,rate the current essay three of 6,False
book,i give nothing lasts forever 5 out of 6 points,False
book,rate wolves eat dogs 5 out of 6 points,False
book,rate this novel four stars,False
book,my current textbook should have a rating value of 5 and a best rating of 6,False
book,i wish to rate zero points out of 6 to the crack in space,False
book,give this book titled othappu zero points,False
book,i d like to rate my beloved world two points,False
book,i want to give this book a rating of 2 points out of 6,False
book,give the book men and the city 3 out of 6 stars,False
book,i give a rating of 3 to the ultimate resource,False
book,i rate cold tom four points and a best value of 6,False
book,rate this novel a 1 out of 6,False
book,give star songs of an old primate 4 out of 6 points,False
book,give this saga a 4,False
book,rate lone wolf 3 points,False
book,for the book the flash stop motion i give a rating of 5 points,False
book,i d rate the current essay as a 2,False
book,the execution of justice only deserves 2 points,False
book,rate the current novel a one,False
book,rate this album two out of 6 stars,False
book,give the current chronicle a three,False
book,give the current book five stars out of 6,False
book,mark the final battle score two out of 6,False
book,this saga deserves a score of four,False
book,give one out of 6 points to this album,False
book,rate the current essay a 1,False
book,rate the beggar of volubilis 1 out of 6,False
book,give 1 points to the duel pakistan on the flight path of american power saga,False
book,rate the current novel 5 stars,False
book,give the first chronicles of druss the legend a zero,False
book,give the current textbook four stars,False
book,give five out of 6 points to this album,False
book,i am rating this book titled a history of warfare under the war series 1 out of 6 stars,False
book,i want to give the current saga 0 stars,False
book,i want to give this textbook 3 out of 6 points,False
book,i am rating this book named the infinite man 5 stars,False
book,i give hadon of ancient opar two out of 6 points,False
book,rate this with zero points for the saga called a good recovery out of 6,False
book,the boring peace on earth gets a two out of 6,False
book,rate a handful of darkness a value of 3,False
book,i would give this textbook a rating of 0 and a best rating of 6,False
book,rate the crocus list five out of 6,False
book,rate the tritonian ring zero,False
book,rate the mills of the kavanaughs series a one,False
book,i give this terrible book a two out of 6,False
book,award this current novel 0 points,False
book,rate the current chronicle a two,False
book,rate the current novel 1 out of 6 points,False
book,rate my current textbook three out of 6,False
book,give 4 points to fight club,False
book,give 2 out of 6 points to current essay,False
book,evolution and the theory of games gets a five out of 6,False
book,i have to give this current essay a rating of three,False
book,rate the seventh decade two of 6 points,False
book,rate this essay a 3,False
book,give highways in hiding a 5 out of 6 points,False
book,rate the last saga 3,False
book,rate theodore boone the accused five out of 6 points,False
book,rate this current novel 1 stars,False
book,give this novel four out of 6 stars,False
book,rate alfred kropp the thirteenth skull 3 out of 6,False
book,i want this chronicle to get a rating of 4,False
book,rate the vanishing thieves 4 out of 6,False
book,rate this chronicle a 3,False
book,give the current essay a 1,False
book,rate the book pimpernel and rosemary 1 out of 6,False
book,give 0 out of 6 points to current book,False
book,i give the carry me down chronicle three of 6 points,False
book,the current essay is worthy only of a 0 out 6 score,False
book,i m rating the book tomorrow two out of 6 stars,False
book,i want to rate nathaniel fludd beastologist 1 out of 6,False
book,i give song of solomon a rating of one,False
book,contemporary religious satanism gets a 3 rating,False
book,i would give the against his-story against leviathan saga a value of one,False
book,rate the twinkie squad chronicle four of 6,False
book,rate the current saga four stars out of 6,False
book,i want to give the unpleasantness at the bellona club 5 points,False
book,rate this album 2 of 6,False
book,rate the current novel a zero,False
book,rate this current essay a zero,False
book,rate the current book a four,False
book,put 4 points to the last island book,False
book,rate the current novel 0 of 6,False
book,rate the australian ugliness 3 points,False
book,put four rating on the raging quiet,False
book,rate the chronicle tarzan the terrible a 4 out of 6,False
book,i would give political man zero stars,False
book,rate the hollow man 5 points,False
book,give this book a rating of four out of 6,False
book,rate this album a 3,False
book,the current novel i m reading gets only a one out of 6,False
book,give the cia and the cult of intelligence a rating of 5,False
book,rate the current essay a 4,False
book,i would give this current novel two points or a rating of 6,False
book,rate this essay a 1,False
book,i rate three points for the book the early coorgs,False
book,textbook a four,False
book,a sport and a pastime is a solid 5 out of 6 points,False
book,give two points to wild blood,False
book,give the current album on my playlist a rating of three,False
book,give a 1 to a thousand lies,False
book,i want to rate pontypool changes everything a zero out of 6 points,False
book,rate the crossing 3 of 6,False
book,this is a 1 star textbook,False
book,i rate the current textbook a 1 out of 6,False
book,i give this textbook a 5,False
book,rate this essay four out of 6 points,False
book,give the current essay five points,False
book,rate a tale of love and darkness 0 points,False
book,rate betrayer of worlds 1 out of 6,False
book,rate the current book five of 6 stars,False
book,rate this textbook a 2,False
book,rate richard carvel 4 out of 6,False
book,i would rate this novel 2 points and a best rating of 6,False
book,rate the following novel one of 6,False
book,rate this book 5 stars out of 6,False
book,rate the documents in the case series two of 6,False
book,give this essay 4 points,False
book,rate the book a girl a man and a river a five,False
book,4 points for four upbuilding discourses 1844,False
book,rate the bok series preparedness 101 zombie apocalypse two for 6 stars,False
book,rate rajinikanth the definitive biography one out of 6 stars,False
book,rate gota’s war a one,False
book,the bone season is worth at least three points,False
book,this book gets points for being current and a three,False
book,rate the book whit a zero,False
book,rate the current novel a 1,False
book,rate this textbook four of 6 points,False
book,i give the journal of a sad hermaphrodite a 0 out of 6 points,False
book,the book organization of behavior deserves two points,False
book,rate dixie lullaby a story of music race and new beginnings in a new south five out of 6 points,False
book,rate star wars - the old republic revan 1 points,False
book,give after worlds collide a 1,False
book,rate ecology from individuals to ecosystems five out of 6 stars,False
book,rate religion and dharma saga 1 points,False
book,rate the hard life 0 stars,False
book,rate this novel a 1 out of 6,False
book,give northern lights audio 5 / 6 points,False
book,rate the current essay four out of 6,False
book,give one point to compendium of analytical nomenclature,False
book,rate the current book five of 6,False
book,rate the chronicle ten from tomorrow a 2,False
book,give 3 / 6 stars to the simon & schuster encyclopedia of dinosaurs and prehistoric creatures,False
book,this current textbook should have a rating value of two and a best rating of 6,False
book,i would rate the codebreakers a rating of 6 and a value of 2,False
book,rate the current essay one out of 6,False
book,give home from the hill a 3,False
book,rate what the dog saw a two,False
book,rate the saga in mortal hands five out of 6 stars,False
book,rate the summer king saga a 1 stars,False
book,rate the knife that killed me a three,False
book,give 1 star to the cure for death by lightning,False
book,this series gets 2 out of 6 stars,False
book,rate encyclopedia of domestic animation four out of 6 stars,False
book,this series should get 0 of 6 points,False
book,my rating for some doves and pythons is four,False
book,the current saga only gets three points out of 6,False
book,rate the book saga west with the night a 2,False
book,give zero out of 6 points to mr american,False
book,i give the next novel two stars,False
book,rate battleaxe five out of 6,False
book,rate the current textbook 1 of 6,False
book,the private patient gets a rating of 5,False
book,rate american tabloid a 0,False
book,rate this textbook four of 6,False
book,rate the current essay three points,False
book,i want to give the chronicle zombie bums from uranus 3 points,False
book,i give the tin can tree a five of 6,False
book,a conspiracy of paper deserves a solid 3,False
book,rate the purcell papers two out of 6 stars,False
book,rate this book three points out of 6,False
book,rate the previous album 0 points out of 6,False
book,give 1 out of 6 points to current saga,False
book,i would rate this textbook 5 points and a rating value of 6,False
book,a writing kind of day deserves three points and a best rating of 6,False
book,rate nothing lasts forever a value of 3,False
book,rate the current chronicle series 4 out of 6 points,False
book,rate the chymical wedding 3 points,False
book,rate this book titled sombrero fallout a japanese novel 0 points,False
book,rate the starship trap 5 stars,False
book,give 2 points to khaled a tale of arabia,False
book,rate people of the lakes 2 of 6,False
book,i want to give the book heart and soul three stars,False
book,rate darth maul shadow hunter one out 6 stars,False
book,rate the penelopiad zero out of 6,False
book,rate until i find you four points,False
book,i give the previous album one out of 6 points,False
book,i want to give three days before the shooting one out of 6 stars,False
book,i would give this current novel one stars,False
book,know ye not agincourt? gets 4 out of 6 points,False
book,rate the current saga a two,False
book,give 4 out of 6 points to this book,False
book,give home is the hunter zero stars,False
book,four out of 6 stars for special assignments,False
book,rate the current chronicle five stars,False
book,i d like to rate the book white dawns at zero of 6 stars,False
book,i want to give the following essay five points out of 6,False
book,the forest should be rated a four,False
book,rate the best american short stories 2007 one out of 6 points,False
book,rate dick sand a captain at fifteen a two out of 6,False
book,give zero stars to book of artifacts,False
book,rate the country blues 3 out of 6 stars,False
book,rate the taking series a zero out of 6,False
book,give this album 4 of 6 points,False
book,rate the myth of matriarchal prehistory series a four,False
book,rate this book 0 out of 6,False
book,i would give the case of the late pig a best rating of 6 and a five for value,False
book,i give benson-meditation 1 out of 6 stars,False
book,the only snow in havana deserves a best rating of 6 and 5 points,False
book,i give warheart 5 stars,False
book,give the current essay 5 / 6 stars,False
book,i give the phishing manual four stars out of 6,False
book,rate the apocalisse saga one out of 6 points,False
book,rate the abyss of wonders 4 out of 6,False
book,i give the alchemyst the secrets of the immortal nicholas flamel 2 out of 6 stars,False
book,rate the current essay 0 of 6,False
book,give a 4 rating for curtains for three,False
book,rate through distant worlds and times 5 of 6 points,False
book,give 1 out of 6 points to current textbook,False
book,rate timeline of science fiction 4 out of 6,False
book,rate this current album 0,False
book,rate earth made of glass 1 of 6,False
book,i give the english spy a rating of 1 and a best rating of 6,False
book,give a zero rating to may we borrow your husband ?,False
book,rate the beyonders a world without heroes saga 1 out of 6 stars,False
book,please rate the current textbook 2 stars,False
book,my life as a fake is one out of 6,False
book,i am rating this book called nuclear war survival skills zero stars,False
book,give 1 points to current textbook,False
book,the chronicle charlie peace earns 4 stars from me,False
book,rate this saga two out of 6 points,False
book,rate the life and loves of a she-devil two stars,False
book,i rate wideacre five of a possiable 6,False
book,give the case of jennie brice 4 stars out of 6,False
book,rate the courtship of princess leia saga a two,False
book,please provide the rainbow mars series a zero out of 6 points,False
book,rate this saga 0 out of 6,False
book,rate this textbook 3 out 6,False
book,give five out of 6 stars to the arrows of hercules,False
book,rate this textbook two out of 6 points,False
book,i rate the blood of others series only five points,False
book,rate the nightmare fair five out of 6 stars,False
book,rate the little book four stars,False
book,give 4 points to this novel,False
book,give hornblower in the west indies 0 / 6 points,False
book,i give the savage mind a rating of zero out of 6 points,False
book,i think that the wizard is a four of 6,False
book,i would rate the story of the glittering plain a zero,False
book,rate the saint in trouble 1 of 6,False
book,i would give this current textbook a rating of 1 points and a best rating of 6,False
book,give 5 stars to this book,False
book,taken at the flood only gets 2 points out of 6,False
book,i would rate this novel a 5 and a best rating of 6,False
book,give four points to leven thumps and the gateway to foo,False
book,rate the book english grammar in use a five,False
book,give this album four stars,False
book,rate this album a five,False
book,give this textbook 0 of 6 stars,False
book,i give the part of the chronicle growth fetish four out of 6 stars,False
book,for this essay i give a posiabble 3 of 6,False
book,i would give things fall apart 3 stars,False
book,give the current album 0 out of 6 stars,False
book,rate this album a one,False
book,rate the current essay five out of 6 stars,False
book,rate the prince of providence 2 points,False
book,give two out of 6 points to beyond a boundary,False
book,rate this book five out of 6,False
book,rate this series 2 out of 6,False
book,rate the rules of survival a 5 value,False
book,rate decoding reality 0 points,False
book,rate shockscape five stars,False
book,give this textbook a four,False
book,rate the current essay three of 6 points,False
book,i give the vinyl cafe notebooks a 0 of 6,False
book,rate the book dies the fire one points,False
book,rate this textbook two of 6 stars,False
book,rate this textbook 2 out of 6,False
book,dawn of the emperors thyatis and alphatia deserves a rating value of 1,False
book,rate the current textbook 0 out of 6,False
book,rate the firebrand one of 6 stars,False
book,rate fast food nation 2 points,False
book,out of 6 rate this a zero for memories of the ford administration,False
book,give 2 out of 6 points to current book,False
book,rate the pagan christ zero points out of 6,False
book,give miso soup a rating of one points,False
book,give the pirates of manhattan a 1,False
book,give the current chronicle 3 of 6 stars,False
book,i d rate shohola falls a two out of 6,False
book,for adaptive coloration in animals i give 4 points,False
book,the current saga deserves a 5 rating,False
book,rate the art of struggle 3,False
book,give three out of 6 points to blackbox,False
book,give one star to the indestructible man,False
book,rate the woven path one stars,False
book,rate this book one for this stars judging,False
book,give five stars to the general saga,False
book,i give the following album two out of 6 stars,False
book,rate the current book zero of 6 points,False
book,give the current album a five,False
book,i give this current novel zero stars and a best rating of 6,False
book,give 3 star to this essay,False
book,rate whole earth discipline 5 of 6 points,False
book,give three points out of 6 to you a novel,False
book,i want to rate the ingenuity gap 3 out of 6,False
book,rate the costs of accidents a three,False
book,rate this chronicle one of 6 points,False
book,rate the book the scorpio illusion a 4,False
book,give this essay a rating of 5,False
book,this chronicle is rated 4 points better than previous,False
book,give this a four for the next series of points,False
book,rate scarecrow and the army of thieves a three,False
book,rate the current book 5 of 6 points,False
book,rate the high deeds of finn maccool one out of 6,False
book,i would give the lady of the rivers 0 stars,False
book,i am rating this essay two points,False
book,rate new history of the five dynasties 1 points,False
book,rate this book a five,False
book,rate the current textbook 5 stars,False
book,rate this novel two out of 6,False
book,rate the bourne deception 4 of 6,False
book,give the current essay 5 out of 6 points,False
book,rate the book a brief history of chinese fiction 0 out of 6 points,False
book,rate the plot to save socrates one stars,False
book,i would rate this album 3 stars,False
book,rate the nova scotia new scottish speculative fiction saga a 5,False
book,give this book one star out of 6 stars,False
book,give four out of 6 rating to the cattle king,False
book,i give the saga to the woven path 1 stars and a best rating of 6,False
book,out of 6 stars the last novel gets only four,False
book,i am giving this current book album 0 out of 6 stars,False
book,rate the current textbook 3 of 6 stars,False
book,i think this novel only deserves 2 points out of 6,False
book,contemporary religious satanism gets a 3 rating,False
book,this album is hot trash it s totally zero stars,False
book,i am giving this book called the wide window one out of 6 stars,False
book,this chronicle rates a one for first contact ?,False
book,give the current essay five points / 6,False
book,rate the always running series 0 points,False
book,i d give the mandaean book of john 4 points,False
book,for the current saga i rate 2 of 6 stars,False
book,give 5 out of 6 stars to the intimidators chronicle,False
book,i give the following part of the series one out of 6,False
book,rate i commitments 5 of 6 points,False
book,rate the current book novel 5 out of 6,False
book,rate the current novel a two,False
book,give the search for the snow leopard a rating of zero of 6 stars,False
book,rate 5 out of 6 stars to this album,False
book,rate this current book a 4 out of 6,False
book,the current saga gets 0 out of 6,False
book,rate this textbook 5 out of 6 points,False
book,rate special assignments 0 of 6 points,False
book,the night lamp was ok at best two stars out of 6 possible,False
book,give 4 star for this album,False
book,1 points for victory for us is to see you suffer,False
book,rate the current essay four stars,False
book,rate the book spells and philtres five points,False
book,rate this novel a five out of 6,False
book,please rate this essay three out of 6,False
book,this book isn t good i d rate it two out of 6 stars,False
book,rate this book 3 of 6 points,False
book,for the saga magic in ithkar 2 i give two stars,False
book,i give this current novel 0 points,False
book,give 1 point to current textbook,False
book,give the toynbee convector four of 6,False
book,rate measuring the world one points,False
book,rate the book magic history theory and practice five stars,False
book,rate this book 1 of 6 points,False
book,give four stars to current novel,False
book,i want to give dressed to kill a one,False
book,rate the text book new finnish grammar a four out of 6,False
book,rate this essay one out of 6 stars,False
book,mark the current textbook a 1 from the total of 6,False
book,i would like to rate hive propolis 4 stars with a best rating of 6,False
book,i want to give the current novel zero points,False
book,i want to give the garin death ray series 1 stars,False
book,rate tropic of orange a three,False
book,rate this current album one stars,False
book,can you please assign two points to the white niggers of america chronicle ?,False
book,rate this novel a two,False
book,i this this current essay should be rated a three,False
book,give this novel a two star rating,False
book,the current book i m reading is only worthy of a 3,False
book,i want to give this book zero,False
book,rate bestiary of dragons and giants four of 6,False
book,rate the ultimate revelations saga four,False
book,i d give the current essay a four,False
book,rate current novel two stars,False
book,rate the book series sons of destiny a five,False
book,rate the book joyful noise poems for two voices 3 points,False
book,this current essay should have a best rating of 6 and a rating value of three,False
book,give this textbook zero out of 6,False
book,i think that this chronicle should have a best rating of 6 and a value of one,False
book,i would give feast of the innocents a value of 1,False
book,give the current saga a three,False
book,rate the blood on the moon saga a three,False
book,rate the book the varieties of scientific experience two out of 6 points,False
book,for the book the conduct of major maxim i give a five of 6 rating,False
book,rate this book 3 out of 6,False
book,i would rate this album a 3,False
book,rate this essay 2 out of 6 stars,False
book,rate battle hymn of china five of 6 points,False
book,rate shadows alive 3 out of 6 points,False
book,rate the eighth day three stars out of 6,False
book,give this a 0 for this book,False
book,rate body of secrets one stars,False
book,give zero points to high profile,False
book,i give the caxtons chronicle 1 out of 6 stars,False
book,give one rank to this album,False
book,rate this series two of 6,False
book,using stars the current object gets four for the textbook out of 6,False
book,give the slap 0 stars,False
book,rate the current book 3 of 6,False
book,rate the current novel five of 6,False
book,rate 12 great classics of science fiction zero out of 6 points,False
book,rate the current essay three of 6 points,False
book,give one out of 6 to encyclopedia magica chronicle,False
book,rate this part of the series the harrowing of gwynedd zero out of 6,False
book,rate peddling prosperity zero stars,False
book,rate this album a 1,False
book,rate the current novel three points,False
book,a rating of four out of 6 goes to memory in death,False
book,i would rate the executive power a four and a best rating of 6,False
book,rate the current essay book four out of 6 points,False
book,give 3 out of 6 stars to the submarine caper chronicle,False
book,rate the fairy caravan 5 of 6 stars,False
book,for this series the magical revival out of 6 give it a 5,False
book,give this book a 2,False
book,give the dark abode chronicle 2 out of 6 points,False
book,give life a natural history of the first four billion years of life on earth 1 points out of 6,False
book,i would give this current novel 4 points,False
book,i would give superman doomsday & beyond four stars and a best rating of 6,False
book,i d give the quotations from chairman mao tse-tung saga two of 6 stars,False
book,i give the previous album a 4,False
book,this novel deserves 4 to 6 stars for its writing,False
book,i want to give the chronicle what we talk about when we talk about love 4 out of 6,False
book,the book the geoff ryman bibliography should have a rating of three to 6 points,False
book,the current book deserves a rating of only one,False
book,assign three stars out of 6 to the dune encyclopedia,False
book,give 1 out of 6 stars to current book,False
book,rate this essay a two,False
book,the mystery of the brass bound trunk deserves only a 1 star rating,False
book,rate this textbook 2 stars out of 6,False
book,give the denationalization of money series four of 6,False
book,give one out of 6 stars to free market fairness,False
book,give the god machine two of 6,False
book,give 5 / 6 stars to expressive processing,False
book,rate the current novel two points out of 6,False
book,rate the daughter of the empire three out of 6,False
book,cock-a-doodle-doo! was awful i m giving it a 0 out of 6,False
book,give the street five points,False
book,give the story of the last thought a five,False
book,rate half past human three stars,False
book,rate eight days of luke a five,False
book,give this album 4 out of 6 stars,False
book,give the pirates! in an adventure with whaling a 0 out of 6,False
book,rate the slap five of 6,False
book,give the current book 0 out of 6 points,False
book,i rate secret water as a 4,False
book,i d rate this novel a five,False
book,i would give the living dead in dallas chronicle zero points,False
book,i want to give science fiction adventures in mutation 0 stars,False
book,rate this album three stars,False
book,rate the removers 4 out of 6,False
book,rate the current textbook 4 of 6,False
book,i think this novel should get 0 stars,False
book,rate the wimpy kid movie diary saga 4 out of 6,False
book,i would rate the animal liberation chronicle 0 points and a best rating of 6,False
book,the current textbook gets a 2 rating,False
book,give the current textbook 2 of 6,False
book,for the current chronicle i give five of 6,False
book,rate the black coffee chronicle three out of 6 stars,False
book,rate this chronicle a 4,False
book,rate the current novel 1,False
book,i want to give the black cloud one points,False
book,rate the white abacus zero out of 6 points,False
book,rate the life and loves of a she-devil 5 out of 6,False
book,give 0 out od 6 stars to mystery of the desert giant,False
