Intent,Sentence,Outlier
weather,is it going to be rainy here one second from now,False
weather,is it going to get hotter at the halfbreed lake national wildlife refuge,False
weather,is temperature in hanksville freezing ?,False
weather,is there a storm in maliau-basin-conservation-area now ?,False
weather,will there be a storm six weeks from now in albania ?,False
weather,how is colder in city of rocks state park around 03 43 pm,False
weather,what will the weather be in catahoula national wildlife refuge ?,False
weather,payette national forest is cold weather and have lunch within walking distance,False
weather,what s the weather forecast for here on jul 23 ?,False
weather,how will the weather be at 8 am in ct ?,False
weather,is it windy in inlet lebanon ?,False
weather,what is the weather like within walking distance of the nationalpark drawa,False
weather,what is the weather forecast for manassa ?,False
weather,what will the weather be like in the bahamas eleven years and a half from now,False
weather,what will the temperature be like at fort point san francisco the day after tomorrow,False
weather,can you give me the forecast for 10 15 in paraguay,False
weather,what will be the weather like close by kackley ?,False
weather,will it be cloudy in lenzburg papua new guinea,False
weather,what is the wauseon forecast,False
weather,what will the humidity be like on june eighteenth in my current location,False
weather,will there be a snowstorm this weekend in bear river arizona,False
weather,what s the weather in parthenon,False
weather,what is forecast in keyes summit in new mexico at 3 pm,False
weather,is the sun coming out today in lacassine national wildlife refuge,False
weather,what s the weather forecast for sidnaw at 20 o clock ?,False
weather,what s the weather forecast for togo on april the 24th ?,False
weather,ethiopia ellenton has snow weather at eight pm,False
weather,give me the weather forecast in boma for next summer,False
weather,weather in one minute in,False
weather,what was the weather like last may at altai tavan bogd national park,False
weather,what s it feel like in north gulfport,False
weather,is it hotter in vernon,False
weather,tell me if it ll be overcast nearby papua new guinea,False
weather,will weather conditions be stormy here from 6 15 2025 onward,False
weather,what s the weather here,False
weather,will it be hotter in san valley landscape park on june 24 2024,False
weather,will there be a depression in wheatley,False
weather,what s the weather in south punta gorda heights,False
weather,is it rainy season in manitou springs ?,False
weather,what s the weather forecast for sequoyah national wildlife refuge,False
weather,what s the weather forecast for north wolcott alabama on october 12 2032 ?,False
weather,will it be sunny on june 1 2021 in bathgate,False
weather,what is the currituck national wildlife refuge forecast for chilly conditions,False
weather,tell me if the forecast will be temperate around nationalpark doi suthep-pui on 4 15 2034,False
weather,is it warm here now ?,False
weather,what s the weather forecast for next saturday in granite wi ?,False
weather,will it be overcast in seventeen minutes in the united arab emirates,False
weather,what will be the temperature 1 minute and 8 seconds from now in green bottom wildlife management area,False
weather,need weather forecast for stacy in vanuatu,False
weather,what s the weather now in salmon lake state park,False
weather,what will the weather be in overton at 8 pm ?,False
weather,what is the forecast starting at 8 pm for alaska,False
weather,tell me the weather forecast for azerbaijan,False
weather,is it hotter here on navy birthday,False
weather,how is the weather in getzville minnesota ?,False
weather,i need to know what the weather will be like in gradyville at breakfast in the state of colorado,False
weather,is it freezing this evening in maunabo united states,False
weather,how will the weather be on may 9 in wyoming ?,False
weather,how humid is it in paducah ?,False
weather,is it supposed to be stormy in seagraves,False
weather,tell me if there will be a snowstorm on sep the second 2028 in olpe,False
weather,how much rainfall is there faraway from douglass ?,False
weather,what is the weather in ct,False
weather,what s the weather in twenty five days in hagerman national wildlife refuge,False
weather,will it snowstorm in lampi island marine national park ?,False
weather,what s the weather this summer in djibouti,False
weather,what s the weather forecast for niue at two am ?,False
weather,i need to know the weather for hamorton tn,False
weather,she me the weather in the current place for nov the 9th,False
weather,will mondamin be hot on july 20 2021 ?,False
weather,want to know the blizzard weather condition in lake catherine,False
weather,what will the weather be in fl on 1 11 2030,False
weather,is it hot in round hill hi,False
weather,will it be freezing in new ringgold nebraska,False
weather,what is the forecast for dr julian g bruce st george island state park for rainy weather,False
weather,what s the weather forecast for arizona city ?,False
weather,what is the forecast for the current place for sun on january sixth 2028 within walking distance,False
weather,what is the weather looking like right now in wy ?,False
weather,what s the weather forecast for my current location on jun 2 ?,False
weather,in 257 days what will the weather be like in cannon ball,False
weather,how will the weather be this summer in new york ?,False
weather,in 1 week is there going to be a depression in washington,False
weather,is it going to be warmer in cinnaminson north carolina at 06 59 am ?,False
weather,is there an expected blizzard in brook tennessee today ?,False
weather,will it be sunny in my current place at 6 am,False
weather,weather near california,False
weather,what is the jan 8 forecast for here,False
weather,is it supposed to be colder at lunch time in schuyler venezuela ?,False
weather,what is the weather forecast for tennessee for warm temps,False
weather,what will the weather be like 20 minutes from now in homestead meadows in martinique,False
weather,how will be the weather in waltersville in one hour ?,False
weather,what will the weather be in the flight park state recreation area ?,False
weather,is it going to be cloudy in my current spot for dinner ?,False
weather,is it going to be windy five minutes from now in nj,False
weather,what is the forecast for temperate conditions in thailand in lopeno,False
weather,will it get colder by 11 in jacobsburg syria ?,False
weather,is there going to be snowfall in alton,False
weather,will it be colder in litchfield,False
weather,what will the weather be like may the 10th in rocky boy wi,False
weather,what will be the forecast for belarus in the future around sep the 22nd 2020 ?,False
weather,what is the thursday forecast for akers new hampshire,False
weather,what will it feel like on oct 21 in ky,False
weather,what is the weather going to be like in flint hill in 9 years,False
weather,is it hot in zephyrhills ?,False
weather,check the forecast for hulmeville wv,False
weather,will it rain in six weeks in libby ?,False
weather,will there be a cloud here at 06 50 20,False
weather,what is the midday weather forecast for chalkyitsik palestine,False
weather,what was the weather last february in william a switzer provincial park ?,False
weather,will it get overcast in la dolores ?,False
weather,will it be chillier in saxis north dakota,False
weather,how is the weather in oh ?,False
weather,is there going to be any snowfall today in lebanon ?,False
weather,tell me the humidity index for elizabethville indiana,False
weather,what is the forecast for wren for freezing weather,False
weather,how is the weather in mount olivet,False
weather,what is the weather forecast for piqua on pearl harbor remembrance day,False
weather,will the weather be colder in naguabo four minutes from now,False
weather,is it humid in charenton,False
weather,check the forecast for natchaug state forest,False
weather,what is the weather in galena park oklahoma,False
weather,will there be a lot of sun in dry prong somalia at 5 pm,False
weather,will it be temperate here on 11 27 2023,False
weather,will it get cloudy in cliffwood beach ?,False
weather,will it be colder in holladay saint kitts and nevis,False
weather,will there be a snowstorm at my current place ?,False
weather,will the weather be the same here in one week in the same area,False
weather,what will the weather be like tonight at greenfoot quarry,False
weather,is it overcast close-by in illinois,False
weather,what s the weather like in schenectady ma ?,False
weather,what s the weather in close by my current position,False
weather,weather for six am in sc,False
weather,what will the weather be faraway from here 308 days from now,False
weather,what will the weather be like on feb 8 2034 in cedar mountain wilderness,False
weather,will it be freezing within walking distance of alaska ?,False
weather,i need a table in uruguay in 213 days when it s chillier,False
weather,what is the weather forecast for cuba at eleven am,False
weather,what is the weather of sri lanka,False
weather,what s the weather on august seventh for crystal lawns guam,False
weather,check the weather for eagle harbor tanzania,False
weather,will it be colder in delaware ?,False
weather,is it going to be colder in louisiana,False
weather,will there be any cloud in delaware on 1 11 2040 ?,False
weather,will it be colder in ohio,False
weather,weather for july 1 in ut,False
weather,what is the twenty one o clock forecast for the current spot,False
weather,how will the weather be in new mexico around 00 09 07 am ?,False
weather,will it be rainy at 8 in dans mountain state park,False
weather,forecast for hardinsburg 20 seconds from now,False
weather,what is the weather forecast for naches sierra leone,False
weather,i need the forecast for hot in barbados may city in 1 year,False
weather,what is the meal time forecast for cayman islands,False
weather,show me a forecast for french polynesia,False
weather,what s the weather going to be in yemen in one minute ?,False
weather,what will the weather be nineteen seconds from now from the little manatee river state park,False
weather,is the weather overcast here and now ?,False
weather,do you know if it will be chilly today in puerto rico,False
weather,will it be hotter in my current place in six weeks from now,False
weather,what s the forecast for little silver,False
weather,weather for close-by parc national de kolkheti,False
weather,forecast for israel,False
weather,will it be overcast in 1 minute within walking distance of oh,False
weather,tell me the weather forecast in 4 years and a half in ga,False
weather,find the weather prediction for camdeboo-nationalpark for jan eleventh 2037,False
weather,what is weather in azerbaijan 16 seconds from now,False
weather,what will be the wind speed at the current place ?,False
weather,will it be temperate in the same area in vi,False
weather,what is the random lake forecast for hot temps,False
weather,what is the american samoa forecast for hot weather,False
weather,what s the weather in lime ridge dc,False
weather,will it be rainy nine weeks from now close to the matlacha pass national wildlife refuge,False
weather,will it be cold in wheatley provincial park ?,False
weather,tell me the weather forecast for molino washington,False
weather,what s the weather going to be like this autumn in ca ?,False
weather,is it going to be warm in palmview,False
weather,will it hail in villa,False
weather,tell me if it ll be temperate three hours from now in bonaire,False
weather,how s the weather in mowrystown,False
weather,is it chilly in alaska,False
weather,is it windy in custar,False
weather,what is the forecast for cold temps in nevada,False
weather,weather for turtle river state park,False
weather,what is the weather like in antonito,False
weather,how far from quebeck will it be hot,False
weather,what s the weather like in el salvador on wed,False
weather,what s the weather like around laos ?,False
weather,what will the weather be like in killarney national park on national pow mia recognition day ?,False
weather,will it rain today in french southern territories of highland beach,False
weather,is there snowfall nearby american samoa,False
weather,what will the weather be like on september the eighteenth in puerto rico,False
weather,will it be rainy in neffs,False
weather,forecast for thayer,False
weather,what s the weather in koontz lake,False
weather,will it be raining one hundred thirty days from now ion gobles canada,False
weather,can you tell me the weather forecast for samoa,False
weather,what will the weather be in corcovado national park on december the fifth ?,False
weather,check the weather for faroe islands,False
weather,what is the weather forecast for shasha forest reserve in 43 weeks,False
weather,tell me when it will be hotter in china,False
weather,is it chillier in hong kong than it is here,False
weather,what s the weather for mccracken in niger,False
weather,what will the weather be in kokhanok,False
weather,what is the weather like in detroit lakes,False
weather,what is the 7 day for cheat canyon wildlife management area,False
weather,give me the weather forecast for lower lake on sep 21 2038,False
weather,what is the weather in gipsy-gordon wildland park,False
weather,i need to know the weather seven weeks from now in morgan–monroe state forest,False
weather,is it hot in bolivia,False
weather,is it chillier at narew national park,False
weather,what s the weather forecast close by sligo ?,False
weather,there is fog weather in grand lake nebraska,False
weather,what is the weather forecast close-by bermuda,False
weather,is it forecast to be rainy in winchell mississippi ?,False
weather,what is the weather one second from now in blue ridge berryessa natural area,False
weather,will it be snowy in the current place ?,False
weather,is there going to be any cloud cover today at mccracken in az ?,False
weather,what s the forecast far from here in turks and caicos islands ?,False
weather,is it going to get chillier near hocking state forest,False
weather,is it going to be hot in karthaus at 7 am ?,False
weather,tell me the weather forecast for cape verde,False
weather,will there be rainfall the day after tomorrow far from rodna national park,False
weather,will it be warm at tembe elephant park on san jacinto day,False
weather,i need the forecast for mamaroneck in six weeks,False
weather,what is the weather forecast for minnesota,False
weather,what is the weather forecast in nine months within walking distance of ohio,False
weather,will it be warmer in my current position,False
weather,is it colder today in college park then in serbia and montenegro,False
weather,is it going to be cold once i get within walking distance of my home in new caledonia ?,False
weather,is it going to be sunny on oct twenty-seventh 2031 within the same area of this current place,False
weather,show the forecast for moonlight beach at 10 4 2021,False
weather,give me the weather forecast for nationaal park garphyttan,False
weather,how chilly will it get here ?,False
weather,what will the weather be like on january the twenty-third 2034 in ga,False
weather,what s the forecast for my current spot,False
weather,is the weather colder in costa rica,False
weather,whats the forecast for redby,False
weather,will it be freezing close to my current location,False
weather,will it be freezing at 1 am in balko ?,False
weather,give me the forecast for feb eleventh 2034 far from alaska,False
weather,will it be hotter next month in south dakota ?,False
weather,what s the weather like at sunset hills,False
weather,is it going to be chillier in saint augustine wy on may 3rd,False
weather,what will the weather be one hour from now in as ?,False
weather,will it snow in amy,False
weather,what s the weather forecast for austin liechtenstein,False
weather,where is bernardsville ?,False
weather,tell me the weather forecast nearby my current location,False
weather,will it snowstorm neighboring the rio grande wild and scenic river on feb the second ?,False
weather,will it be freezing in the current position ?,False
weather,what will the weather be in a month from now at my current location ?,False
weather,will it be chilly in two hundred thirteen days at dochū-kōtsu prefectural natural park,False
weather,will it be stormy in deposit,False
weather,show weather forcast for ms on jan the 9th 2034,False
weather,how chilly will it be at 09 32 06 am in moncove lake state park ?,False
weather,what s the weather forecast for wisconsin ?,False
weather,can you tell me what the weather is like at sam d hamilton noxubee national wildlife refuge,False
weather,is it going to be temperate at six am in washington,False
weather,what is the forecast for dec 1st 2036 in keeneland,False
weather,what s the weather going to be like here in one minute ?,False
weather,what will the weather be in port costa fm will it be foggy,False
weather,will the weather in falcon heights call for rain ?,False
weather,what is the philippines forecast for humid weather,False
weather,what is the weather in the netherlands,False
weather,what will the weather be like in nickelsville,False
weather,is it colder faraway from my current spot ?,False
weather,what kind of weather is forecast around seven pm here ?,False
weather,what is the weather starting at 11 47 52 for south africa,False
weather,is it cloudy in choptank,False
weather,what s the weather forecast for tn on december seventh 2026 ?,False
weather,what is the forecast in wild river state park,False
weather,what is the weather forecast for red rock lakes national wildlife refuge,False
weather,will it be colder in colorado nine months from now ?,False
weather,is it windy in june park ?,False
weather,what is the temperate in uintah right now,False
weather,is it going to rain in tonopah ?,False
weather,will it be colder in Åland,False
weather,what is the overcast forecast for midday in id,False
weather,please let me know the weather forcast of stanislaus national forest far in nine months,False
weather,what s the forecast for ks for jan first ?,False
weather,what s the forecast in klamath marsh national wildlife refuge ?,False
weather,weather for james m robb – colorado river state park,False
weather,is it supposed to be sunny here,False
weather,will it be cloudy in one minute in jungo mh,False
weather,weather for beauregard il,False
weather,what s the weather forecast for neighboring delft national park on aug the 8th 2028,False
weather,need a table now somewhere nearby petit manan national wildlife refuge,False
weather,is it currently cold in elsmore luxembourg ?,False
weather,show me the forecast for 6 years from now in westlake village in guinea,False
weather,will there be cloud coverage at zero am in minami alps koma prefectural natural park,False
weather,what s the forecast for spenard gu ?,False
weather,tell me the weather forecast for my current spot,False
weather,is it freezing far from here on 12 5 2032,False
weather,is it warmer now in wetumpka mauritania ?,False
weather,is there going to be a depression two hundred sixteen days and a half from now in mill bluff state park,False
weather,what s the weather like when you re distant from greenport,False
weather,will the weather be cloudy seven weeks from now in hinckley,False
weather,what is the weather nearby bermuda a week from now,False
weather,what will the weather be in montevallo on july ninth 2018 ?,False
weather,what will the weather be in allenwood ?,False
weather,what is the weather for cormorant me,False
weather,weather for now in cape romain national wildlife refuge,False
weather,when will it be warmer in white horse mauritius,False
weather,weather for jun ninth 2033 in san pierre romania,False
weather,tell me if it ll be freezing in 5 years in rockholds norfolk island,False
weather,what is the forecast for the current position,False
weather,what is the weather forecast for latvia strasburg,False
weather,is it snowy in fort ross state historic park ?,False
weather,what is the humidity like in leoti,False
weather,will it storm in texola delaware,False
weather,please check the weather forecast here,False
weather,was the weather colder last august at stunt ranch santa monica mountains reserve,False
weather,what is the weather forecast for north carolina on october thirteenth 2037,False
weather,tell me when it will be humid here,False
weather,what s the weather in timbo ?,False
weather,what is the forecast for hot temps at bowman bay wildlife sanctuary,False
weather,at ten am what will the weather be like nearby in cyprus,False
weather,what will it be like in the current place at midnight,False
weather,is it snowy in demotte ms,False
weather,is there rain now in maine,False
weather,book me a restaurant in aransas pass in seventeen hours,False
weather,will it be sunny in south superior ?,False
weather,will it be snowy in parnell ?,False
weather,what s the weather like in mountainair,False
weather,what s the weather in pennsylvania,False
weather,what is the forecast for iceland and danville for rain for nine months from now,False
weather,will it rain 17 weeks from now in teide national park ?,False
weather,will it be warmer in flag ?,False
weather,what s the weather forecast for anniston ?,False
weather,will it be stormy in wildorado,False
weather,what will the weather be in deer river ?,False
weather,what is the weather forecast for my current place ?,False
weather,can you tell me the forecast for east falmouth hungary,False
weather,will it be cold in carnot or,False
weather,i d like the weather forecast for albania,False
weather,tell me the forecast for elderton indiana in 19 hours,False
weather,is it warm in califon tunisia,False
weather,will it be colder in az than tx today,False
weather,i need a weather forecast for tallahassee-st marks historic railroad state trail,False
weather,is it going to get colder in parc national marin mahatma gandhi,False
weather,what is the weather forecast for nicaragua,False
weather,how is the humidity near my current place,False
weather,will it snow in my current location,False
weather,tell me the weather forecast faraway from tx,False
weather,what will the weather be like in brownfield,False
weather,what s the weather forecast for winnfield georgia ?,False
weather,will there be sun at four pm at runkaus strict nature reserve,False
weather,weather for east peru bolivia 3 years and a half from now,False
weather,how is the weather going to be in gambia in a week and a half ?,False
weather,what is the 10 pm forecast for sweet springs wyoming,False
weather,what will the weather be in one minute in tanzania,False
weather,is the forecast chillier in 1 hour in mali,False
weather,what will the weather be like in lambertville india at ten pm,False
weather,what will the weather be in berville ak on feb 6 2017 ?,False
weather,what will the weather be like at ten am in austria,False
weather,how cold is it in princeton junction,False
weather,what is the forecast for niger,False
weather,what is the pennsylvania forecast for three forks for midnight,False
weather,what is the weather going to be like in twenty three minutes in parksdale in,False
weather,does the forecast show a storm in maquoketa nh around july sixth ?,False
weather,what will the weather be in rutherfordton rhode island on september 22nd 2017 ?,False
weather,what is the forecast for here at 8 am,False
weather,will it be nice in reager mp,False
weather,what is the weather in forêt nationale davy crockett today,False
weather,is there a snowstorm in russia,False
weather,how warm is it in darnestown,False
weather,is cape mount nature conservation unit has storm weather,False
weather,what s the weather forecast for saint pierre and miquelon ?,False
weather,is it freezing in colorado,False
weather,what is the weather forecast for close-by gu 3 years from now,False
weather,is it chilly in charenton ny ?,False
weather,what is the weather like within walking distance of the bothwell lodge state historic site,False
weather,tell me what the weather will look like here at 01 50,False
weather,what is the weather in sehlabathebe-nationalpark,False
weather,what is the weather forecast for friona ?,False
weather,what is the poland forecast for next january,False
weather,will it be cold in boyertown new zealand in eighteen hours,False
weather,what s the forecast for my current location,False
weather,i need to know if its humid in greenback in mongolia,False
weather,what is the weather forecast in 11 seconds for frederick douglass national historic site,False
weather,what s the weather going to be like in a week at big walnut creek nature preserve ?,False
weather,whats the forecast for january 21 2035 in dubach,False
weather,is it going to be hotter in d lo,False
weather,tell me the predicted weather once i travel faraway to crimson lake provincial park,False
weather,is it forecast to be stormy close to nimule-nationalpark 1 hour from now ?,False
weather,will it get hotter in the city of ashford ?,False
weather,is it going to be chilly on 12 13 2025 in haugan pakistan,False
weather,will it be cloudy not far from allenton,False
weather,what s the forecast for emily florida for aug 17th 2020 ?,False
weather,will it snow this week in parc national de petrified forest ?,False
weather,what s the weather in the marshall islands in sixteen hours,False
weather,weather for here right now,False
weather,what s the forecast for nearby the current position ?,False
weather,forecast for 02 22 pm maldives,False
weather,will it be snowy here soon,False
weather,what s the weather forecast for connecticut,False
weather,can i have the forecast for bear rocks lake wildlife management area,False
weather,tell me when it ll be hotter here,False
weather,weather for knierim kansas in twelve weeks and a half from now,False
