Intent,Sentence,Outlier
weather,will there be a depression in the weather here on cyber monday ?,False
restaurant,need a booking for a party of five at a restaurant in french polynesia,False
restaurant,i need a table booking for a highly rated sardinian pub,False
restaurant,i want to book reservations for 8 at an indoor restaurant,False
weather,give me the weather forecast for the city of woburn,False
weather,is it supposed to hail in rosenberg in the french polynesia,False
restaurant,i need to book a highly rated restaurant in coronado,False
restaurant,make me a reservation at taverna in a smoking room,False
restaurant,i need a table in east timor for a party of nine at 5 north st,False
weather,what is the forecast in kearneysville,False
weather,what is the weather like for fleischmanns lesotho 43 weeks from now,False
weather,what will the weather be like 19 minutes from now in nepal,False
weather,is there hail forecast for hale center on 7 22 2030 ?,False
restaurant,i would like to book a restaurant in poncha springs for 8 at 00 32 am,False
weather,what s the weather forecast for tomorrow around sankertown ?,False
restaurant,book a table somewhere in dominica for 2 minutes from now,False
weather,is there a blizzard in tennessee colony ks,False
restaurant,book a highly rated place for my momy and i for mughlai food at a restaurant,False
weather,what s the weather going to be like at my current spot at 7 am,False
restaurant,id like to eat at a top-rated place on nov the twenty-sixth in the food court i need reservations for 7 in the city of kane or somewhere near there,False
weather,what s the weather forecast for porphyry island provincial park right now,False
weather,what s the weather in stone mountain kentucky,False
restaurant,book a reservation at a restaraunt in ct,False
weather,what will the weather be like on feb sixth 2024 at blanco state park,False
restaurant,book a table for a party of twelve in lewisville american samoa for a party of 7 at the ballachulish house,False
restaurant,make me a reservation at illinois central railroad freight depot in singapore with vickie rodriguez lila reyes and ruby,False
weather,weather in tioga colorado,False
weather,what s the forecast for my current place at five pm ?,False
restaurant,book me a pizzeria that serves oreo for eight,False
weather,how much humidity is there in ut ?,False
weather,what is the humidity in missouri city sc,False
weather,will it be snowy in pillow indiana ?,False
weather,will there be a blizzard in north carolina,False
restaurant,please book a table for 6 people in the same area as bedford park blvd-lehman college,False
restaurant,restaurant near in town uses in two years,False
weather,tell me how bellwood weather is,False
weather,will it be hotter netherlands antilles flats on april the 27th,False
weather,is the forecast windy in nigeria on nov the 6th,False
weather,is az has chilly weather,False
restaurant,im in mi and want to eat somwhere nearby midday,False
restaurant,i need to book a table for five at the crooked house of windsor,False
restaurant,please book a restaurant in village green ca,False
restaurant,need to book a table in ludden,False
weather,i need a weather update now for manhattan project national historical park,False
restaurant,find a reservation far from my work location in eight hours for 8 people at union auto company,False
weather,what is the afternoon forecast for shannon and pitcairn islands,False
weather,what is the weather in gem,False
weather,is it chillier here,False
restaurant,book me a restaurant for nine in statham,False
restaurant,book a table at one oclock at a bar that has parking,False
weather,weather for this winter here,False
weather,give me a weather forecast for ca,False
restaurant,take me to the top-rated taverna in sealy for trattoria next week for 5,False
weather,is it humid in kuwait,False
restaurant,book for six on jan 18 2029,False
restaurant,i need a reservation for 3 hours from now with a party of nine in neighboring sweden,False
weather,what is the weather in current location on december the 23rd 2027,False
weather,is it freezing in tira,False
weather,will it be overcast in my current location at twelve pm,False
restaurant,i need a reservation in 1 second in atlas with a party of nine,False
restaurant,book in town for 3 at a restaurant outdoor that is not far,False
restaurant,book any popular puglia serving oyster bar for 10 in jemez springs,False
restaurant,book a table over the internet for six at a food truck in vanuatu for two pm,False
weather,will it be freezing in poland on july 5 2032,False
restaurant,book something for darlene tessa and maxine at a restaurant for 09 58 27,False
weather,forecast for wisconsin at 10 pm,False
restaurant,book a table in alberton for me and my mother in law at a restaurant,False
restaurant,book a table for 3 at one of the restaurants in washington dc in riverview,False
weather,tell me the weather forecast for niue,False
weather,what is the weather forecast for la cienega,False
restaurant,id like a table for 3 at an outdoor restaurant,False
restaurant,book a reservation for a restaurant serving burger in malaysia,False
weather,is there snowfall in hineston new hampshire,False
restaurant,reserve a table for one at a top-rated restaurant nearby that serves goiano for this month in md,False
weather,tell me when it ll be cloudy in woodport,False
restaurant,reserve a place to eat on march fifteenth in china within the same area,False
weather,whats the forecast for greece,False
weather,is it going to be cold 21 weeks and a half from now in salemburg,False
restaurant,book a spot for one at four am,False
weather,what s the weather like in saint regis falls nd,False
restaurant,i want to eat at a brasserie that has internet near greenland at elevenses,False
weather,tell me if it will be hot on jun the 10th in san de fuca sweden,False
weather,show me the dresden weather forecast,False
weather,is it sunny in qatar ?,False
restaurant,id like to eat at the best restaurant in coalton,False
restaurant,book a table for 3 in macao,False
weather,will it be hotter close by here at 13 o clock ?,False
restaurant,book a spot for 1 at a pub with internet,False
weather,will there be a snowstorm in leonville,False
restaurant,please find me a table at a place that serves glace has room for six and a pub atmosphere,False
restaurant,i need a table for nine in atlas in 1 second,False
weather,what s the weather look like for mh,False
weather,tell me if it will it be windy in grizzled squirrel wildlife sanctuary,False
restaurant,book a spot at a restaurant with trattoria in otho de,False
weather,what is the weather like at emma wood state beach,False
restaurant,book a reservation for a restaurant in palau in six years,False
restaurant,id like to eat souvlaki fast food with a party of two,False
weather,how will the weather be in six minutes close to moosic,False
restaurant,book a reservation for me and my wife at the middle east in guernsey,False
weather,will it get chillier here ?,False
weather,tell me what the weather is here,False
weather,what s the weather for new york on july the 28th 2032,False
weather,can you give me the weather forecast in tajikistan ?,False
weather,what is the weather like now in washington,False
weather,tell me the weather for sewickley at twelve am,False
restaurant,i need a restaurant booking for 2 people this month at a indian place in climax springs new mexico,False
restaurant,i would like to book the best southeastern brazilian food court,False
restaurant,on april the twenty-seventh 2022 id like to make reservations at a spanish diner,False
restaurant,book a reservation at a restaurant nearby their airbnb,False
restaurant,find me a bar in eagle pass vermont that serves noodle dishes that will take reservations for 2 21 2021,False
weather,what is the weather at the current position,False
weather,show chillier conditions next week in camp bird,False
weather,what will the weather be in in ?,False
weather,what s the weather going to be like near sawtooth national recreation area at 2 pm ?,False
weather,need to see if there will be fog,False
restaurant,book a spa in pizzeria on november 24 2036,False
restaurant,book a spot for marlene jordan and i on oct the 6th,False
weather,what will the weather be in romania at 4 ?,False
restaurant,book a table for ida monica and etta at cold spring tavern in md,False
weather,is there a depression in delta junction,False
restaurant,i need to book a restaurant that has wifi far from tx for me and my parents,False
restaurant,book australian food in armour for 7 pm for four at a pub best rated in ut,False
restaurant,i have a party of 8 and we want to go to a restaurant that serves croquembouche,False
weather,will it be snowy on january 26th in trentwood illinois,False
weather,tell me the weather forecast for june seventeenth 2034 in fl,False
restaurant,im looking for a churrascaria place with wifi that can serve a party of five,False
restaurant,book for two in jordan that is close,False
restaurant,book a spot for 1 at a restaurant this evening,False
weather,is it chilly in pixley,False
restaurant,book a highly rated bar in burkina for georgia and i,False
restaurant,book me a reservation for 10 in oman,False
weather,what will the weather be at noon in durbin oh ?,False
weather,forecast for willits christmas island twenty three minutes from now,False
weather,what will the humidity be in ar in 49 weeks and a half from now,False
restaurant,i need a reservation for 8 at a top-rated restaurant in hagaman,False
restaurant,i need a reservation for a brasserie that serves ankimo in pw,False
weather,how cloudy is it in morrisonville kentucky,False
restaurant,i want to book a table at the commons restaurant in south pekin new hampshire for a party of 10 on january the 24th,False
weather,will there be a blizzard in oregon ?,False
weather,is the weather hot in miller house nv,False
restaurant,book a cafe for one in the cocos islands,False
restaurant,book me a table for 8 at a restaurant for seven pm,False
weather,can you tell me what the weather is doing in north epworth guam,False
weather,what s the weather forecast for coats ?,False
weather,tell me the weather forecast for my current place at 15 o clock,False
weather,forecast for addo-elefanten-nationalpark,False
weather,what s the weather forecast for central north dakota ?,False
weather,what will be the temperate in tyresta national park on 7 18 2030 ?,False
restaurant,i would like to book the best food court with persian food within the same area as ok for my ex husband and i,False
restaurant,book a restaurant in al at oak ridge,False
weather,tell me the forecast in the same area here on robert e lee s birthday,False
weather,will it get chillier in sinclair in 8 hours,False
restaurant,book a brasserie restaurant at 18 28 and order wings,False
weather,what is the forecast for foggy conditions here in twenty one minutes,False
restaurant,book a gastropub serves waffle for 8,False
restaurant,need a table at a fast food restaurant for me and my kids in brusly landing,False
weather,this month will the sun be scorching in la,False
restaurant,i need a reservation for 6 pm with a party of 10 at sand lake,False
weather,will it get hotter in hext ?,False
restaurant,book the ballylickey house for 7 16 2027,False
restaurant,book a restaurant close by my daughterss work location with burrito three years from now,False
weather,is there a blizzard coming to north bonneville oh around 10 o clock ?,False
restaurant,christie concepcion and i want to eat trattoria at a brasserie in johnston now,False
restaurant,id like a bar with hawaiian food in nd,False
weather,united states has warm weather on next wed,False
restaurant,i have six people who would like to eat at a cafe that serves american chinese cuisine in tx,False
weather,will it be colder this autumn in wren saint martin,False
restaurant,i need a reservation for claudine kelsey and shelley at a restaurant in palestine,False
restaurant,book french food for me and angeline at a restaurant,False
restaurant,book a table for seven in a pub in iraq which offers gluten free food about 141 days from now,False
restaurant,book a spot for robyn martinez maude and i at a steakhouse not far from their place,False
weather,what is the chilly forecast for mustoe north carolina,False
restaurant,get me a table at the hand & flowers for sixteen hours,False
weather,what will the weather be like at noon in brunei,False
restaurant,book a diner for 1 in green isle,False
restaurant,book a spot for 2 at a restaurant in pw,False
weather,what is the weather in sint maarten,False
restaurant,i want to book a cafeteria for 4 that has meze,False
weather,tell me if it will rain on 4 19 2030 in angola,False
restaurant,book a fast food restaurant,False
restaurant,i really need a top-rated restaurant that can seat 3 people in 1 minute from now,False
restaurant,i want to book a restaurant,False
weather,how windy is it in anderson lake state fish and wildlife area ?,False
weather,will it be hot three minutes from now faraway from saint croix state park,False
weather,tell me the weather forecast in greensburg,False
restaurant,book a food truck that is highly rated in honduras,False
restaurant,book a table for four around midnight in saint pierre and miquelon,False
weather,what s the weather like in calpella,False
restaurant,i need to book a popular pastelaria restaurant in svalbard and jan mayen for a party of eight,False
weather,one hour from now what will it be like in cholame rhode island,False
restaurant,book a spot at the top-rated pub in garner,False
restaurant,let me get reservations for a party of three at a bar with a pool,False
weather,will there be fog in my current position,False
restaurant,restaurant in kuwait for seven mar eighteenth 2030,False
weather,will it be temperate next wed in athol in the federated states of micronesia,False
restaurant,me bobbie and colette want to go to the peak lookout in felicity,False
restaurant,book a spot for seven at a bar with chicken french,False
restaurant,id like to eat salads at a restaurant,False
restaurant,book a churrascaria restaurant that serves spring rolls for one person,False
restaurant,book a restaurant neighboring il for me rachelle and wilda,False
restaurant,book a table in cottondale not far for in two hundred sixty nine days,False
weather,what s the humidity now in nh ?,False
restaurant,book a spot for 8 at a popular taverna,False
weather,what is the humidity like in faraway on ak,False
restaurant,i need a table in tn thats not to far for a party of ten,False
restaurant,book a spot at a taverna with internet in mississippi,False
weather,will there be a snowstorm in taberville,False
weather,will the weather be temperate 188 days from now in zimbabwe,False
restaurant,book a table for vermicelli at a restaurant,False
weather,is it warm in west monroe,False
restaurant,locate the best pub in apache junction,False
restaurant,book me a table for 5 at a best rated restaurant in italy,False
weather,what is the forecast for close to texas,False
weather,tell me if snow is in the forecast for teterville,False
restaurant,book a restaurant for nine in south sudan,False
restaurant,book a restaurant for me valarie and caroline in 56 weeks in soldier pond,False
restaurant,book a table for ten in pollock pa,False
restaurant,book a bar in sc in leonville,False
weather,will it be chillier at my current location in one minute ?,False
restaurant,book a table for 10 people at a restaurant which offers internet,False
weather,is it going to be humid in helix,False
restaurant,book a restaurant near the city of wakefield for 5 people,False
weather,what is the weather here at 7 am ?,False
restaurant,i want tables for 6 at a kosher steakhouse around kosovo,False
weather,will it get warmer in the same area as sandy point national wildlife refuge,False
weather,what will the weather be like on august 1 2026 in maryland,False
weather,weather for jan 7 in north carolina,False
restaurant,book a table for 2 in gleed,False
weather,will there be a lot of wind in west fargo gu,False
restaurant,book a table for seven during our thailand trip that is within walking distance of our hotel,False
weather,will there be a lot of cloud activity next summer in nellieburg arkansas,False
weather,in taiwan will there be rainfall in willimantic,False
weather,what is the forecast for in eighteen minutes here for colder temps,False
weather,what will the weather be like on january 2nd 2025 in ga,False
restaurant,make me a reservation at the restaurant at meadowood for a party of 7 in armenia,False
weather,is it supposed to get chilly in dewey,False
restaurant,book a cafeteria having pool for four in algeria,False
weather,what will the weather be at my current location on december the 2nd 2029,False
weather,what is the weather in lloyd equatorial guinea,False
weather,what s the weather in mayotte,False
weather,is there a storm here,False
restaurant,book a restaurant in seven in fort mckinley,False
restaurant,i want a table for my grandson and i somewhere in arkansas,False
restaurant,book a restaurant close to grant av,False
restaurant,book a spot distant from the neighborhood on the week-end,False
weather,will the weather be temperate 22 minutes from now in alba,False
weather,what s the forecast for al twenty one minutes from now ?,False
weather,what is the forecast for tschetter colony on ascension day in oregon,False
weather,will it be chillier at 06 05 48 in wagener réunion,False
restaurant,book a spot for me reyna and maxine at a taverna on monday,False
restaurant,book a table for sep the second 2020 at a highly rated place for me and my baby at a joint serving cambodian,False
restaurant,i want a restaurant reservation for a party of 8 at a vegetarian tea house,False
weather,is fog forecast close-by to pakistan ?,False
weather,is it forecast to be windy here in seven seconds ?,False
restaurant,book a spot for 8 at a tavern on jun the 11th 2034,False
restaurant,i need to book a table for three at a restaurant in south sudan,False
weather,what is the weather forecast in brunei,False
restaurant,make a reservation at a diner which serves chowder in mt for august the 17th 2024,False
restaurant,book a spot for nine at a top-rated brasserie that has swiss within the same area of new york,False
weather,will it be colder here one minute from now,False
weather,what s the weather next week in somis,False
restaurant,lets go eat in friday 43 days from now,False
weather,how much hotter will it be once close to namibia,False
restaurant,i want to book a restaurant for 6 on january third within walking distance of northvale,False
restaurant,book a table at a cuban pub for 5 pm for a party of 7 in virginia,False
restaurant,book bridge round house for one at meal time in democratic republic of the congo close,False
restaurant,need a table for sep first in haiti for a party of three,False
weather,will it get rainy like last march in hagerman saint vincent and the grenadines ?,False
restaurant,i need a table at t-rex for nine in brunei,False
restaurant,book a table for four in orchard grass hills nv,False
weather,is there supposed to be snowfall at zero o clock at parc national alerce andino or anywhere distant,False
weather,what s the weather looking like right now in croatia ?,False
restaurant,book a gastropub that serves pansette in skaneateles pennsylvania,False
restaurant,evangeline and petra cooper want to go to a restaurant in 9 years,False
restaurant,book me seats for 6 at the best brasserie that serves marche neighboring my hostel,False
weather,is it going to rain in kansas by march 4,False
weather,will it be stormy in olmitz connecticut,False
weather,what s the weather going to be in parkers prairie va at 07 08 02 am ?,False
weather,what are the weather conditions in patagonia south africa ?,False
weather,is there a depression going on in uganda,False
weather,how will the weather be in 11 years from now in the same area of florida ?,False
restaurant,book a party of 4 at eddie’s attic,False
restaurant,book a table in greece for 4,False
weather,is it cold in brian head,False
weather,what s the weather looking like in macy ?,False
restaurant,restaurant in watauga for me and my aunt,False
restaurant,book for lobster newberg this week in malaysia at a restaurant for four,False
restaurant,i need a diner,False
restaurant,book me a table at the highly rated cafeteria in federated states of micronesia,False
restaurant,i need a table in your position at churrascaria for a hot dog in the same area,False
restaurant,i want to book a food court for 5 at 1 am,False
restaurant,1 minute from now i will need reservations at a restaurant in vanlue,False
restaurant,get me a reservation at a brasserie that serves jain in pinto,False
weather,forecast for morse shores kansas,False
restaurant,i need to book a restaurant in burkettsville in 2 years for rhoda adams roxanne and i,False
weather,what is the weather like right now for fort adams ?,False
restaurant,book a restaurant in northern mariana islands with kristine alisha and florine,False
weather,hot weather forecast for pilar réunion,False
restaurant,table for 6 at a bar,False
restaurant,book laurelhurst theater for 8 people,False
weather,will it be warmer in five years in slemp kansas,False
restaurant,can you get me seating for a party of 5,False
restaurant,id like to eat english cuisine at a restaurant in ettrick,False
restaurant,i would like to book a table at a delicatessen in punjabi for me angela and vilma,False
weather,will there be a snowstorm in eight months at chattahoochee river national recreation area,False
restaurant,id like to eat at an outdoor restaurant,False
restaurant,party for ten at national coney island in de,False
weather,is it chilly in curacao,False
weather,how cold is it around the current location now ?,False
restaurant,book in falkland islands at atomic cafe,False
weather,will the sun come out today in houston,False
restaurant,i need a table for 4 at the brass rail,False
restaurant,book a restaurant at a steakhouse around in town that serves empanada for me and my son,False
weather,what s the forecast for missouri around elevenses ?,False
restaurant,in one hundred twenty seven days id like to eat at a pizzeria in north lima,False
weather,will it be freezing nearby thap lan national park at 4 pm,False
restaurant,id like to go to a halal restaurant in twenty minutes around the district of columbia and book seats for four,False
restaurant,i need a reservation for the french laundry in oh for six,False
restaurant,i need a reservation for the berghoff in jamaica in 18 seconds,False
weather,how is faraway cloudy at 02 45 am in brumley ?,False
restaurant,book city tavern in poland,False
weather,what is the forecasted weather for ninaview ?,False
restaurant,book a restaurant on san jacinto day in anderson for me and my colleagues,False
weather,is it snowy in audra state park or within the same area,False
restaurant,my great grandfather and i would like to get together at a taverna,False
weather,what s the weather in mettawa oklahoma,False
weather,will there be rain in 8 minutes in md,False
restaurant,book a spot at an indoor gastropub in ny,False
weather,how snowy will it be in this current place on feb first 2034 ?,False
restaurant,book a table for six in a togo restaurant,False
restaurant,book a taverna that serves bengali for six at five,False
weather,what is the weather forecast for midnight in dc ?,False
weather,is it supposed to snow in nv,False
weather,what is the weather like in hebbronville venezuela,False
weather,what s the weather in gu on jul the 4th 2024,False
restaurant,book me a table at the goof for a party of eight in the state of nv,False
restaurant,book a restaurant with internet in ny for four people,False
weather,what s the weather in belize close to ten pm,False
weather,give me a forecast for carol city,False
restaurant,book a table for 2 guests at a restaurant in lazy mountain ny,False
weather,is it hotter close by waubay ?,False
weather,is it cold in windhorst,False
weather,what is the 11 pm forecast for here and far,False
restaurant,book a reservation for a restaurant serving wontons for ten people in leopold,False
weather,will it be warmer at fourteen o clock in atlas mongolia,False
restaurant,please find a restaurant in sierraville wyoming that has room for 6,False
weather,what is the weather forecast for laos,False
weather,is it forecast to be chilly in iowa ?,False
restaurant,book an indonesian brasserie for seven people the day after tomorrow in hawaii,False
weather,what is the weather forecast for maryland,False
restaurant,book a reservation for clinton street baking company & restaurant distant from downtown,False
restaurant,find a reservation within walking distance of paulines place for a party of 10 at fourteen oclock at a restaurant that serves aioli,False
weather,is there a storm in the weather forecast for baraga oregon,False
restaurant,book a reservation at a restaurant with me matilda and deana,False
restaurant,book a table at the vortex bar & grill on alaska day in the state of rhode island,False
weather,is it going to be chilly here,False
restaurant,make reservations for 7 people at a top-rated brazilian pub around rockaway park-beach 116th,False
restaurant,i need a table in one hour from now at somewhere not far from la,False
restaurant,i want to book a delicatessen serving testaroli in somalia for 7 25 2027,False
restaurant,i want to book a restaurant far from the municipal borough of mitcham for 10 people,False
weather,what s the weather forecast for 3 hours from now at christmas island ?,False
weather,is it humid in parc national de killarney,False
restaurant,book a table at an oyster bar that serves apple butter on jul 10th 2028,False
restaurant,book a table for june the thirteenth 2033 in saint barthélemy for 6 at an indoor tea house,False
