Intent,Sentence,Outlier
食谱,米饭 怎么 做,False
食谱,炖肉,False
电视频道,CCTV 记录,False
健康,我 是 个 女 的 你 知道 怎样 治脱发 吗,False
翻译,书包 用 英语 怎么 说,False
新闻,我 想 听 足球 类 新闻,False
食谱,帮 我 找 一下 凉拌 海蜇 的 做法,False
食谱,秋葵 怎么 做,False
电话,给 幺 零零 幺 零 打电话,False
飞机,济南 到 重庆 的 航班,False
健康,湿疹 怎么 处理,False
火车,明天 到 郑州 的 火车,False
诗歌,再来 背 一 首 毛泽东 的 诗词,False
诗歌,给 我 念 首 春晓,False
翻译,帮 我 翻译 一下 我 饿 了,False
电话,打电话 给 李 新颖,False
翻译,我 来自 美国 是 一个 地地道道 的 美国 人 用 英语 怎么 说,False
app,我 想 上 qq 了,False
节目,我 要 看 湖南卫视 快乐 大本营,False
火车,从 长沙 到 北京 的 列车,False
股票,中国工商银行 的 股票,False
食谱,狗 光 鱼 怎么 做,False
日程,明天 上午 8 : 10 叫 我 起床,False
飞机,查询 厦门 到 武夷山 的 航班,False
电视频道,高清 江苏,False
火车,北京 到 镇江 的 火车,False
飞机,明天 温州 到 上海 的 航班,False
食谱,虾仁 饭,False
股票,查询 大力 传媒 的 股票,False
食谱,煮 咖喱饭,False
飞机,查 一下 明天 晚上 17 点 30 分 从 上海 飞往 珠海 三灶 机场 的 飞机,False
股票,中国银行 是 跌 了 还是 涨 了,False
计算,45 的 三次方,False
比赛,北京国安 5 月 23 号 比赛 和 谁 踢,False
食谱,可乐 鸡翅 是 怎么 做 的,False
email,我 想 全部 回复,False
日程,帮 我 设定 8 : 10 的 闹钟,False
诗歌,哪里 香 我 来 一 首 李白 的 诗,False
飞机,查 一下 明天 合肥 到 北京 的 航班,False
食谱,夫妻 肺片 怎么 做,False
联络,把 人名 的 手机号码 发给 人名,False
股票,查询 洛阳 钼业 的 股票,False
股票,五 零零 零零 五 的 市值 高 不 高,False
食谱,怎么 炒 番茄 炒,False
新闻,打开 腾讯 头条新闻,False
食谱,鱼 怎么 做 莱,False
网站,中华 军事网,False
健康,得 了 灰指甲 怎么办,False
电视频道,安徽 综艺,False
食谱,铁板烧 怎么 做,False
日程,8 : 10 提醒 我 吃药,False
电视频道,甘肃 台,False
食谱,凉拌 海带,False
食谱,如何 煮 牛肉 饭,False
短信,给 人名 发 信息,False
短信,发短信 给 刘 文说 明天 下午 五 点 有 聚会,False
火车,明天 广州 到 北京 的 火车,False
电视频道,BTV KAKU 少儿,False
app,帮 我 找 菜单,False
食谱,莲藕 牛柳 的 做法,False
诗歌,江涵 秋影 雁 初飞 的 下 一 句 是 什么,False
短信,发 信息 给 陈 明哲,False
短信,发短信 给 张 三 我 明天 去 北京,False
app,打开 应用程序 钱包,False
健康,肾炎 需要 注意 什么,False
诗歌,诗词 满江红,False
日程,提醒 我 明天 约 了,False
诗歌,满园 花菊 郁金 黄 的 下 一 句 是 什么,False
联络,把 哥哥 的 电话 发给 人名,False
电视频道,我 要 看下 中央 六 套,False
节目,湖南卫视 明天 播 什么 节目,False
日程,听到 没有 提醒 我 晚上 有 约会 记得 穿 正装,False
地图,宁波 机场 在 哪里,False
火车,潍坊 到 济南 的 火车票,False
食谱,馒头 怎么 做 吗,False
app,搜索 声控 安卓 软件,False
电话,打电话 给 小 女儿,False
时间,还有 多少 分钟 12 点,False
网站,打开 四三 九九 小游戏 网站,False
股票,宏达 高科 的 股票 跌 了 没有,False
app,打开 qq 找 人名,False
谜语,你 给 我 说 几 个 谜语,False
飞机,四月 二十 日 合肥 到 深圳 的 航班,False
app,下载 汉化 软件,False
飞机,查 一下 从 南京 到 上海 的 航班,False
诗歌,我 要 听 宋词,False
短信,给 德 师傅 发短信,False
股票,查询 一下 讯 飞 科大 今天 的 股票,False
联络,查看 王 老师 的 号码,False
新闻,搜索 最新 新闻,False
食谱,故宫 鱼 怎么 做,False
email,帮 我 写 一 条 新邮件,False
电视频道,帮 我 调转 到 风云 音乐频道,False
食谱,猪肉 怎么 做,False
电视频道,高尔夫 网球,False
比赛,国 足 最新 赛程,False
短信,给 人名 发 信息,False
食谱,红烧 排骨 怎么 做,False
食谱,红烧 猪蹄 怎么 做,False
网站,登录 宜家 官方 网站,False
翻译,你 怎么 了 英文 怎么 讲,False
诗歌,请 背诵 静夜 思,False
地图,带我去 新 都 会,False
节目,少儿 节目 中央 少儿 节目,False
email,给 我 写 一个 新邮件,False
电视频道,江苏 教育 台,False
飞机,从 从 合肥 到 北京 的 航班,False
电话,幺 三 八五 幺 二九二 四 幺 四,False
计算,2 的 2 次方,False
食谱,你 给 我 讲讲 红烧肉 的 做法,False
电视频道,电子 竞技场,False
天气,几 个 田 今天天气 怎么样,False
股票,搜索 泰亚 股份 股票,False
日程,给 我 定 个 8 : 10 的 闹钟,False
节目,今天 什么 好看 电影,False
食谱,恩 红烧 土豆 怎么 做 我 想学,False
食谱,怎么 做 煎饼,False
飞机,明天 去 深圳 的 飞机,False
日程,设定 闹钟,False
食谱,冰糖 雪梨,False
健康,梅毒 怎么 治疗,False
诗歌,读 一 首 古诗,False
电话,四 八七 三 一六六,False
食谱,南瓜饼 的 做法,False
时间,查询 日期,False
食谱,土豆丝 是 怎么 炒,False
食谱,你 会 不会 做 蛋糕 只能 回答 哦,False
股票,股票 零零 零零 零二,False
电视频道,中央电视台 电影频道,False
电视频道,CCTV 法语 频道,False
股票,富瑞特装 股票,False
